content,username,replyto,permalink,time
"10 میں سے صرف ایک شخص ہی صحیح جواب دے پاتا ہے
,https://www.,dawnnews.tv/news/1078171/, ,pic.twitter.com/X2neQxxvFV",Dawn_News,,https://twitter.com/Dawn_News/status/993217715769954304,1525636531
اونٹوں کے ساتھ ان کے سائے بھی کیمرہ مین نے عکس بند کر لیے ہیں۔۔۔ ایک شاہکار تصویر,maleehasyed26,Dawn_News,https://twitter.com/maleehasyed26/status/993219375074349056,1525636926
صحرا میں کیچڑ۔۔ اونٹ سب ایک سمت میں نہیں جارہے۔۔۔ کوئی ہانکنے والا نہیں انکو۔۔ یہاں اب میاں صاحب نے پل بنا دیا ہے۔۔۔؟؟ ,hamzathebanker,Dawn_News,https://twitter.com/hamzathebanker/status/993218723032043522,1525636771
کیا گڑ بڑ ہے بھائی,MianHaseebAhma3,Dawn_News,https://twitter.com/MianHaseebAhma3/status/993218060692705280,1525636613
Shadow of camels ......nothing else.....,AimalChiragh,Dawn_News,https://twitter.com/AimalChiragh/status/996750589781569537,1526478833
Ye sirf aik deewar hai,wasiii_malik,Dawn_News,https://twitter.com/wasiii_malik/status/994205088636985344,1525871939
اونٹوں الللہ پاک کے نام کو ناپاک قدموں سے روندتے ہوئے چل رہے ہیں۔۔۔ قدموں کے نیچے الللہ پاک کا نام لکھا ہے۔,ShahMMahar,Dawn_News,https://twitter.com/ShahMMahar/status/994062071632457734,1525837841
Fish,JanbazBaloch,Dawn_News,https://twitter.com/JanbazBaloch/status/993918361078771712,1525803578
White are the camels n all other shadows. Optical illusion 2005 snaped picture,Rajput_Chohan,Dawn_News,https://twitter.com/Rajput_Chohan/status/993867334573084672,1525791412
Aik onth ki gardan neechy jhuki hue hai jb k bakiii sub ki uper hai!!,AyeshaA97376288,Dawn_News,https://twitter.com/AyeshaA97376288/status/993824958655721472,1525781309
Shadows,IIftikharButt,Dawn_News,https://twitter.com/IIftikharButt/status/993708867359068160,1525753630
"Tarazu ka saya hy.
Camel ka saya ni hy.",DrAbdulAleemAZ1,Dawn_News,https://twitter.com/DrAbdulAleemAZ1/status/993531405673132034,1525711320
Nothing wrong...it was taken by NAT Geo from height showing shadows of camels larger then they look like from up there,faisalsuhail,Dawn_News,https://twitter.com/faisalsuhail/status/993439332781510656,1525689368
The black is In fact the shadow zoom and see,DRMTauseefRauf,Dawn_News,https://twitter.com/DRMTauseefRauf/status/993432625145634816,1525687769
there are fishes in the desert which is a mistake.,UMERSUL09312099,Dawn_News,https://twitter.com/UMERSUL09312099/status/993402379973332992,1525680558
کالا رنگ اونٹوں کا سایہ ہے اور سفید ہیں اونٹ۔,asghar_cool,Dawn_News,https://twitter.com/asghar_cool/status/993400427352862720,1525680093
USUALLY CAMEL TRAVEL IN ONE LINE BY FALLOWING NEXT CAMEL,kamrantahawar11,Dawn_News,https://twitter.com/kamrantahawar11/status/993381959048015872,1525675689
"Shadow of camels are not synced properly.
Shadows must be connected to the feet of camels shown whereas if u concentrate the humps on the shadows are attached to the feet of camels.",GAtiqG,Dawn_News,https://twitter.com/GAtiqG/status/993347805707231232,1525667547
"Deep desert in Saudi Arabia , natgo Ariel view of camel caravans ( spot small camels) with big shadows on ground .",ladyhawkdxb,Dawn_News,https://twitter.com/ladyhawkdxb/status/993320335427633152,1525660997
اونٹ نقطے پر مشتمل ہیں جب کہ سایہ اونٹ لگ رہا,KhanZadaa3,Dawn_News,https://twitter.com/KhanZadaa3/status/993319800427483136,1525660870
شریف خاندان کی دولت منتقل ہو رہی بزریع Camel Union... اُس زمانے میں Westrn   Union نہں ہو گا نہ...ھی ھی,AdeelBillah,Dawn_News,https://twitter.com/AdeelBillah/status/993307200419516419,1525657865
گرمی کی وجہ سے اونٹو کی مںہ کالا ہواہے,ShahanShazee,Dawn_News,https://twitter.com/ShahanShazee/status/993294634574143488,1525654870
asal mn shadow hy jo nazar aarha hy.. camels bilkul saye k nechay hn.. heli se ly gai tasweer hy.. google awarded hy,DADOFPTI,Dawn_News,https://twitter.com/DADOFPTI/status/993293195785265153,1525654527
In mn ek ghora (horse) b hy...,ahsanmunir1995,Dawn_News,https://twitter.com/ahsanmunir1995/status/993287984811266048,1525653284
Allah k ag he sir jokaty hn,Shamim08116631,Dawn_News,https://twitter.com/Shamim08116631/status/993282099368091648,1525651881
Shadow is large than camels...,Sir_M_U_Khan,Dawn_News,https://twitter.com/Sir_M_U_Khan/status/993249670351769600,1525644149
Asal BT ya ha k ont hmsha 1 line mi jaty ha aur agy wly ont ko follow krty ha lakin yha pa be atefaqi ka smn ha,FayazAl28284696,Dawn_News,https://twitter.com/FayazAl28284696/status/993230784428462080,1525639647
So dawn news is upto these things now? Good going...,AsgardKaKhawaja,Dawn_News,https://twitter.com/AsgardKaKhawaja/status/993228149747011585,1525639018
in k darmiyan 1 shatar murgh b hai,nabeel_a_q,Dawn_News,https://twitter.com/nabeel_a_q/status/993222673139367936,1525637713
In this pic the bigger one is their Shadow and smaller one original ,meUchaudhry,Dawn_News,https://twitter.com/meUchaudhry/status/993219864302059525,1525637043
ounton ka aks hai yh dar haqeqat tasweer ko ulta kr k dkha jayey too safaid colour k ount hsin,irfannaeem84,Dawn_News,https://twitter.com/irfannaeem84/status/993219765471760385,1525637019
خلائ مخلوق والوں کی کوی سازش لگتی ہے۔,chaudhry_zafar,Dawn_News,https://twitter.com/chaudhry_zafar/status/993218698029694976,1525636765
کچھ کا سایہ سفید ہے,engrchadhar,Dawn_News,https://twitter.com/engrchadhar/status/993218666023018496,1525636757
ہزاروں نہی کروڑوں ۔۔۔صرف آپکو پتہ ہے ۔ جلدی بتائیں ناں ورنہ میری جان نکل جائے گی,dungerdabacha,Dawn_News,https://twitter.com/dungerdabacha/status/993218160764555265,1525636637
