username,date,retweets,favorites,text,geo,mentions,hashtags,tweetid,conversationid,replyto,permalink,imagelink
"CRC_LA","2018-07-31-14:10",0,0,"We are restocked on @1964artistseries eighths rolled into a 3-Pack pre-roll blend. We have several strains in stock: •Blue Dream •Lambs Bread •Strawberry Diesel •Super Silver Haze •OG Kush • Og Sour Diesel • Lemon Haze Get them while they last. pic.twitter.com/g0mhwRwNOe","","","","1024356659966009344","","","https://twitter.com/CRC_LA/status/1024356659966009344","https://pbs.twimg.com/media/Djc-t1XU4AA1U63.jpg"
"_ulikethischain","2018-07-31-14:04",0,4,"Użytkownik @/troyesivan sprawia że mam ochotę na truskawki i papierosy bo boze jak on tam sb śpiewa strawberries and cigarettes always taste like blue eyes black jeans lighters and candies I've been a fool but strawberries and cigarettes always taste like you to płakusiam i swear","","","","1024355255285309440","","","https://twitter.com/_ulikethischain/status/1024355255285309440",""
"gccoffeeco","2018-07-31-14:03",0,6,"All berries! | Blue raspberry, red raspberry, strawberry, blue Zero Gravity pic.twitter.com/dCjwfSvGvY","","","","1024354781521895424","","","https://twitter.com/gccoffeeco/status/1024354781521895424","https://abs.twimg.com/emoji/v2/72x72/1f30c.png"
"bluestrawberry_","2018-07-31-14:02",2,3,"Built for entertaining, # BanquetingHouse is the last surviving part of the # PalaceofWhitehall. Guests may enjoy a reception in the Undercroft before taking their seats for dinner under the awe-inspiring Rubens ceiling @ hrp_events # eventprofs # eventprofsuk # events # venuehirepic.twitter.com/4g8EEsRKQD","","@ hrp_events","# BanquetingHouse # PalaceofWhitehall # eventprofs # eventprofsuk # events # venuehirepic","1024354660486930435","","","https://twitter.com/bluestrawberry_/status/1024354660486930435","https://pbs.twimg.com/media/Djc9IUNXgAAbhfv.jpg"
"ritasofseminole","2018-07-31-13:32",0,0,"It's $2 Buck Tuesday, receive a Regular Ice for $2 & it's 2 Punch Tuesday, receive two punches on your Rita's Rewards App! Today's Flavors: Lemon, Cherry, Chocolate, Mango, Cotton Candy, Florida Orange, Green Apple, Strawberry, Blue Raspberry, Iced Coffee, Sugar Free Mango Peach pic.twitter.com/VmJ5wElgAP","","","","1024347170105958400","","","https://twitter.com/ritasofseminole/status/1024347170105958400","https://pbs.twimg.com/media/Djc2UIEVsAAfjpU.jpg"
"ClubSkyHighPDX","2018-07-31-13:07",0,0,"Today's Top Shelf Flower Specials! Strawberry C. & Cosmic C. @Blue","","","","1024340900124622850","","","https://twitter.com/ClubSkyHighPDX/status/1024340900124622850",""
"StruMatt","2018-07-31-12:54",0,0,"It's impossible but here's my stab: 1. Boxer 2. In Rainbows 3. The Crane Wife 4. The Sound of Silver 5. Graduation 6. The Reminder 7. Neon Bible 8. Wincing the Night Away 9. Strawberry Jam 10. Sky Blue Sky","","","","1024337496312692736","1024336269273227265","","https://twitter.com/StruMatt/status/1024337496312692736","https://pbs.twimg.com/profile_images/983364335991832576/SgHIsySM_normal.jpg"
"capitolgh","2018-07-31-12:50",0,0,"Get creative with our milkshake menu.. this is a blue bubblegum milkshake with strawberry syrup and sprinkles https://www.instagram.com/p/Bl50LzuBqYW/?utm_source=ig_twitter_share&igshid=1unr70epjw51i …","","","","1024336551285649410","","","https://twitter.com/capitolgh/status/1024336551285649410","https://abs.twimg.com/emoji/v2/72x72/1f60d.png"
"ashleikblue","2018-07-31-12:47",0,0,"ok so, you have to eat again. we’ve already suggested @ Bojangles1977 so thats over... idk what our vegan pizza situations are here but honestly, @ JanetJackson, you deserve one strawberry cheesecake milkshake from @ CookOut. its our secret, we wont tell your trainer.","","@ Bojangles1977 @ JanetJackson @ CookOut","","1024335843656454149","1024330235280588800","","https://twitter.com/ashleikblue/status/1024335843656454149","https://pbs.twimg.com/profile_images/877930631736553472/uUKlBjJi_normal.jpg"
"dramaIovesme","2018-07-31-12:46",0,0,"25. strawberry blonde hair, blue eyes","","","","1024335547911823361","1023700806867079168","","https://twitter.com/dramaIovesme/status/1024335547911823361","https://pbs.twimg.com/profile_images/1016742063109525504/cHHA9sRx_normal.jpg"
"RitasattheArbor","2018-07-31-12:45",0,1,"Tuesday's Ice Flavors: Banana, Blue Raspberry, Cherry, Cotton Candy, Green Apple, Island Fusion, Lemon, Mango, Rasp. Lemonade, Strawberry, Swedish Fish, Wild Black Cherry, Cheesecake, Chocolate Chip Cheesecake, and Sugar Free Tangerine — feeling hungry","","","","1024335224405147653","","","https://twitter.com/RitasattheArbor/status/1024335224405147653","https://abs.twimg.com/emoji/v2/72x72/1f917.png"
"FurnitureCityCr","2018-07-31-12:40",0,0,"Tuesday is a great day for a Sun—dae!!! Stop in and build you own with today flavors: Vegan Moon Blue, Vegan Peppermint Bark, Strawberry Chocolate Chip, Gin Cocktail, Snickers (pictured),… https://www.instagram.com/p/Bl5ycoQAH5r/?utm_source=ig_twitter_share&igshid=1qipropavfj4v …","","","","1024333937831813120","","","https://twitter.com/FurnitureCityCr/status/1024333937831813120",""
"littlegoatdiner","2018-07-31-12:39",1,5,"It's # NationalAvocadoDay and we're celebrating with today's Blue Plate - 'Fried Soft Shell Crab-Wich' with avocado, strawberries, pickled cabbage slaw, and Asian chili sauce pic.twitter.com/yAHxKz8aDa","","","# NationalAvocadoDay","1024333762967101445","","","https://twitter.com/littlegoatdiner/status/1024333762967101445","https://pbs.twimg.com/media/Djcp_2cXcAAhk85.jpg"