username,date,retweets,favorites,text,geo,mentions,hashtags,tweetid,conversationid,replyto,permalink,imagelink
"cooperchip1","2018-07-26-15:16",2,4,"2016 - Sunrise, Florida (CNN) Donald Trump on Wednesday again slammed Hillary Clinton and her campaign for allowing the father of Orlando shooter Omar Mateen to sit in the stands behind her at a recent rally. But sitting behind Trump was ex-congressman Mark Foley. # GreatSeats","","","# GreatSeats","1022561381416095745","1022538217952825345","cooperchip1 PhantomFZ RageKittyin280","https://twitter.com/cooperchip1/status/1022561381416095745",""
"cooperchip1","2018-07-26-15:13",0,0,"2016 - Sunrise, Florida (CNN) Donald Trump on Wednesday again slammed Hillary Clinton and her campaign for allowing the father of Orlando shooter Omar Mateen to sit in the stands behind her at a recent rally. But sitting behind Trump was ex-congressman Mark Foley.","","","","1022560612726071298","1022538217952825345","PhantomFZ RageKittyin280","https://twitter.com/cooperchip1/status/1022560612726071298",""
"HillaryCLI2016","2018-07-16-14:01",0,0,"Orlando shooter's father attends Hillary Clinton rally pic.twitter.com/XMkqXMWT9e","","","","1018918500352561153","","","https://twitter.com/HillaryCLI2016/status/1018918500352561153","https://pbs.twimg.com/media/DiPs-fFW0A8jL2C.jpg"
"hilary002016","2018-07-16-13:56",0,0,"Orlando shooter's father attends Hillary Clinton rally pic.twitter.com/ZVEedUdvFa","","","","1018917294842499078","","","https://twitter.com/hilary002016/status/1018917294842499078","https://pbs.twimg.com/media/DiPr4VSWkAYII9v.jpg"
"FBombah","2018-06-13-09:33",0,1,"How about we ENFORCE our existing Gun Laws first? BTW...Hillary Clinton invited the father of the Orlando shooter at her campaign stops in Florida. How's that working out for liberal gay activists?? pic.twitter.com/AkQtv3Mb6F","","","","1006892438181568512","1006883970896842752","Newsweek","https://twitter.com/FBombah/status/1006892438181568512","https://pbs.twimg.com/media/DfkzPigWAAA--yk.jpg"
"Quinterelf","2018-04-20-12:43",0,6,"Why was the Orlando shooter's father sitting in the crowd right behind Hillary Clinton at one of her rallies? To honor mass shooters to get more gun laws?","","","","987371289189998592","987356481149272064","ABC","https://twitter.com/Quinterelf/status/987371289189998592",""
"tay_she","2018-03-28-12:41",0,2,"Anyone remember this? @ POTUS ... Listen to how he starts to say 'we've been helping # FBI' AND btw were he's sitting is usually reserved for special ticket/ invite holders. # ClintonMateen # Pulse # Orlando shooter's father attends # Clinton rally in Kissimmee https://www.wptv.com/news/state/orlando-shooters-father-attends-hillary-clinton-rally-in-kissimmee?utm_content=buffer54a1c&utm_medium=social&utm_source=twitter.com&utm_campaign=buffer …","","@ POTUS","# FBI # ClintonMateen # Pulse # Orlando # Clinton","979035877958668289","","","https://twitter.com/tay_she/status/979035877958668289",""
"JeanWoj","2018-03-28-07:01",0,0,"He also was a Muslim following out Terrorist acts and Supporting Globalist and Anti American Hillary Killary Clinton, Court Reveals Orlando Shooter’s Father Worked for FBI, Allowing His Son to Carry Out Massacre https://freedomoutpost.com/court-reveals-orlando-shooters-father-worked-fbi-allowing-son-carry-massacre/ … via @ FPPTim","","@ FPPTim","","978950290039803904","","","https://twitter.com/JeanWoj/status/978950290039803904",""
"realistallway","2018-03-27-21:01",0,0,"Orlando Nightclub Shooter's Father Was FBI Informant, Say Lawyers For Gunman's Widow Father and informant was 15 ft behind the criminal Clinton during one of her speeches for president. how coincidental.","","","","978799206746992640","","","https://twitter.com/realistallway/status/978799206746992640",""
"realistallway","2018-03-27-21:00",0,0,"Orlando nightclub shooter’s father was FBI informant, court documents say HE was 15 ft behind Clinton during one of her speeches for president. Coincidence or similar company.","","","","978798826113945606","","","https://twitter.com/realistallway/status/978798826113945606",""
"realistallway","2018-03-27-20:58",0,0,"Orlando massacre shooter’s father was FBI informant for 11 years FATHER & INFORMANT was 15ft behind Clinton in one of her speeches for president. Coiincidental? I doubt it","","","","978798482088710144","","","https://twitter.com/realistallway/status/978798482088710144",""
"Tina_Strich","2018-03-26-22:31",0,0,"Orlando shooter's father wasn't just behind Clinton at her rally & an FBI informant. Local news interviewed him twice the same night - he even had a printed banner 'Hillary Clinton - Good for Gun Control' https://ift.tt/2I63f3o","","","","978459432941170688","","","https://twitter.com/Tina_Strich/status/978459432941170688",""
"InvestWatchBlog","2018-03-26-20:12",0,0,"Orlando shooter's father wasn't just behind Clinton at her rally & an FBI informant. Local news interviewed him twice the same night - he even had a printed banner 'Hillary Clinton - Good for Gun Control' - http://www.investmentwatchblog.com/orlando-shooters-father-wasnt-just-behind-clinton-at-her-rally-an-fbi-informant-local-news-interviewed-him-twice-the-same-night-he-even-had-a-printed-banner-hillary-clinton-good-for-gun-c/ …pic.twitter.com/bzAGDSG6U4","","","","978424501733031936","","","https://twitter.com/InvestWatchBlog/status/978424501733031936","https://pbs.twimg.com/media/DZQP5fLUQAADo9V.jpg"
"tammytabby","2018-03-26-19:20",0,0,"Orlando nightclub shooter’s father was FBI informant, court documents say-seen at a Hillary Clinton rally- https://www.washingtonpost.com/ pic.twitter.com/Gvfb7ZPfZ6","","","","978411441521864704","","","https://twitter.com/tammytabby/status/978411441521864704","https://pbs.twimg.com/media/DZQEAqwVAAAYEfg.jpg"
"cat25RIII2","2018-03-26-17:04",1,1,"@ CNN can’t and won’t talk about Clinton corruption or the pro Taliban Father of the Orlando shooter being a secret FBI informant! He attended Clinton campaign rally. How is that not news? Or not investigated? Yet Sixty Munutes puts in a segment with a porn star salacious gossip","","@ CNN","","978377182727868420","","","https://twitter.com/cat25RIII2/status/978377182727868420",""
"PreethiSekharan","2018-03-26-15:22",0,0,"WOW Orlando shooter's father attends Hillary Clinton rally in Kissimmee - http://wptv.com https://www.wptv.com/news/state/orlando-shooters-father-attends-hillary-clinton-rally-in-kissimmee …","","","","978351566158737408","","","https://twitter.com/PreethiSekharan/status/978351566158737408",""
"rick_farrow","2018-03-26-15:05",1,0,"Motion claims father of Pulse Nightclub shooter was FBI informant; this is the same person that showed up at a Hillary rally, sat on stage https://www.clickorlando.com/news/noor-salman-trial/motion-reveals-pulse-gunmans-father-was-fbi-informant … # SeddiqueMateen # PulseNightclubShooting # PulseNightClub # clinton # HillaryClinton # Trump # florida # orlando","","","# SeddiqueMateen # PulseNightclubShooting # PulseNightClub # clinton # HillaryClinton # Trump # florida # orlando","978347270235217922","","","https://twitter.com/rick_farrow/status/978347270235217922",""
"MsMariaT","2018-03-26-13:52",1,11,"And then you have the Orlando Shooter's dad magically placed in the front rows at HRC rally (8/9/16). He's working for Rorhabacher and/or Congressional Rs, best believe it: Father of Orlando shooter endorses Hillary Clinton after attending rally https://www.theguardian.com/us-news/2016/aug/09/seddique-mateen-hillary-clinton-rally-pulse-shooting?CMP=share_btn_tw …","","","","978328929357332480","978326330717609984","","https://twitter.com/MsMariaT/status/978328929357332480","https://pbs.twimg.com/profile_images/891996035425345537/huT9lCbH_normal.jpg"
"BryanJBerner","2018-03-26-13:50",13,14,"The father of the Orlando shooter was an FBI informant and 2 months after the shooting was onstage at a Hillary Clinton rally. she said that they just chose random people to sit behind her. What are the odds? @ JudgeJeanine @ JNc1225 @ masspoliticahttp://www.foxnews.com/us/2018/03/26/orlando-nightclub-shooters-father-was-secret-fbi-informant-officials-reveal.html …","","@ JudgeJeanine @ JNc1225 @ masspoliticahttp","","978328291298955264","","","https://twitter.com/BryanJBerner/status/978328291298955264","https://pbs.twimg.com/profile_images/878384224088272901/tNhYBa2X_normal.jpg"
"TraceyM72","2018-03-26-13:26",1,0,"Orlando Nightclub Shooter's Father Attends Clinton Rally https://youtu.be/uJtHURVql-s via @ YouTube The father of # OmarMateen @ # CrookedHillary rally.. # NothingToSeeHere!!??¿ DemWit circle jerk.!","","@ YouTube @ ","# OmarMateen # CrookedHillary # NothingToSeeHere","978322316013834242","","","https://twitter.com/TraceyM72/status/978322316013834242",""
"DakotaEFlynn","2018-03-26-12:33",0,0,"Orlando nightclub shooter's father was a secret FBI informant, officials reveal. He was also a Hillary Clinton supporter. https://fxn.ws/2pFEC5S # FoxNews","","","# FoxNews","978308855858909185","","","https://twitter.com/DakotaEFlynn/status/978308855858909185",""
"patriot101","2018-03-26-10:56",1,0,"@ RepMcCaul Orlando shooter's father attends Clinton rally https://www.politico.com/story/2016/08/orlando-shooter-father-clinton-226819 … via @ politico # Pulse So an FBI informant was for Hillary? Who leaked this information? Wife knew. Father knew. Hillary's FBI knew and ignored. # DrainTheSwamp starting upper level FBI.","","@ RepMcCaul @ politico","# Pulse # DrainTheSwamp","978284519139651584","","","https://twitter.com/patriot101/status/978284519139651584","https://pbs.twimg.com/profile_images/586702847405793280/brX1iRQO_normal.jpg"
"Kelly62u","2018-03-26-10:06",0,0,"Motion reveals Pulse gunman's father was FBI informant https://www.clickorlando.com/news/noor-salman-trial/motion-reveals-pulse-gunmans-father-was-fbi-informant?__vfz=medium%3Dsharebar … GOOGLE SEARCH Orlando shooter's father attends Hillary Clinton rally in Kissimmee and then CLICK IMAGES","","","","978272013117788162","","","https://twitter.com/Kelly62u/status/978272013117788162","https://pbs.twimg.com/profile_images/797324700049227776/yKK2Ry0Z_normal.jpg"
"Estebs1978","2018-03-08-23:55",0,9,"Bullying is as old as dirt. Why would you think this has anything to do with @ POTUS? Would you say the same about the Columbine shooters (President Clinton) or the shooter in Orlando (President Obama)? Stop politicking and see this for what is worth. A father doing his job.","","@ POTUS","","971972666188967936","971968443649003520","LLESGMOMMA FoxNews","https://twitter.com/Estebs1978/status/971972666188967936",""
"Ezemdy","2018-02-21-02:37",0,2,"Russian bots didn't make me vote for Trump. A lot of voters switched from Hillary to Trump when the Orlando shooter's father endorsed Hillary Clinton. # TuesdayThoughts # MichaelMoorepic.twitter.com/fF6aI2Rpcg","","","# TuesdayThoughts # MichaelMoorepic","966215345613795328","966212138024005633","CNN","https://twitter.com/Ezemdy/status/966215345613795328","https://pbs.twimg.com/media/DWe6PokWsAE1Yws.jpg"
"DRL707","2018-02-20-22:09",0,0,"You forgot Omar Mateen-Orlando shooter and his I’m with her T-shirt and his father’s ties to the Clintons","","","","966147842409512965","965876140668731393","REALTOR_PAM paullb14u RealJamesWoods","https://twitter.com/DRL707/status/966147842409512965",""
"TheGoodeYears","2018-02-20-07:26",0,0,"How about the association the Orlando nightclub shooter's father had with being a Hilary Clinton supporter? You want to make this about politics because we can sure go there. https://twitter.com/BlacksScreaming/status/965619884595073025 …","","","","965925626535399425","","","https://twitter.com/TheGoodeYears/status/965925626535399425",""
"cardsfann","2018-02-17-08:15",0,0,"On 14 June 2016, a photograph showed Orlando nightclub shooter Omar Mateen’s father visiting Hillary Clinton’s office WHAT'S FALSE Hillary Clinton vacated the office of Secretary of State in 2013, so Mateen couldn't have been visiting her at a State Department office in 2016.","","","","964850794783637505","964162027840245761","cardsfann Ten_inch_Trump","https://twitter.com/cardsfann/status/964850794783637505",""
"joe_benetic","2018-01-15-00:20",0,1,"Oh and Astor Hillary wants to let in the country people who would kill you, throw you off a building or shoot your ass. The father of radicalized Orlando mass shooter Omar Mateen is supporting Hillary Clinton https://amp.cnn.com/cnn/2016/08/09/politics/orlando-gunman-father-clinton/index.html …https://mobile.nytimes.com/2016/08/10/us/politics/hillary-clinton-rally-orlando-nightclub-shooters-father.amp.html …","","","","952772389875544064","952554946834116610","Aporter31471 AstorGoodwin","https://twitter.com/joe_benetic/status/952772389875544064",""
"MsLisaBaby","2017-11-01-04:08",0,0,"He was usual xneophobe self after Orlando https://www.washingtonpost.com/news/post-politics/wp/2016/08/10/trump-knocks-clintons-proximity-to-father-of-orlando-shooter-with-a-disgraced-ex-congressman-sitting-behind-him/?utm_term=.5238a37fbf9a … Trump knocks Clinton's proximity to father of Orlando shooter — with ...","","","","925635677353578497","925534445393928199","TheLeeWilliams realDonaldTrump","https://twitter.com/MsLisaBaby/status/925635677353578497",""
"ValerieNYC1","2017-10-08-15:39",0,1,"Father of Orlando shooter spotted behind Clinton at rally http://nyp.st/2aONOzn via @ nypost","","@ nypost","","917112127575543808","917066546882768897","hamybear silverado6060","https://twitter.com/ValerieNYC1/status/917112127575543808",""
"alex_canoura","2017-09-14-17:41",0,0,"The father of the Orlando Nightclub shooter was on tv at a Clinton rally","","","","908445663880413186","908112217593303040","AllKnowinMC Cowboyskenny","https://twitter.com/alex_canoura/status/908445663880413186",""
"CJS2518","2017-08-29-16:38",0,0,"The father of the mass shooter at the Orlando night club stood behind Hillary Clinton at one of her rallies.","","","","902631484925911045","902584198971699200","grandedamegria DrMalone MSNBC","https://twitter.com/CJS2518/status/902631484925911045",""
"jamesmitchem7","2017-08-24-18:22",0,0,"The father of # Orlando # Pulse shooter Omar Mateen was at a Hillary Clinton rally last year. http://www.cnn.com/2016/08/09/politics/orlando-gunman-father-clinton/index.html … This is a # NothingBurger","","","# Orlando # Pulse # NothingBurger","900845839194742784","900508365738172418","AnnCoulter","https://twitter.com/jamesmitchem7/status/900845839194742784",""
"SignRealLiberal","2017-08-24-14:08",0,0,"Clinton disavows support from Orlando shooter's father https://www.google.com/amp/thehill.com/blogs/blog-briefing-room/news/290958-clinton-disavows-support-from-orlando-shooters-father%3famp …","","","","900781966391431168","900764996757532675","SignRealLiberal tohottie1974 Alyssa_Milano","https://twitter.com/SignRealLiberal/status/900781966391431168",""
"tohottie1974","2017-08-24-13:07",0,2,"Yeah what about the Orlando shooters father behind Clinton in her rally last year. But of course that doesn't matter to liberals","","","","900766525296193536","900764996757532675","Alyssa_Milano","https://twitter.com/tohottie1974/status/900766525296193536",""
"CJS2518","2017-08-23-19:01",0,0,"The Orlando night club shooters father loves Hillary Clinton. Your point?","","","","900493282605748224","900409887078985728","Georgiaborn1 MSNBC","https://twitter.com/CJS2518/status/900493282605748224",""
"ottgolf","2017-08-23-08:51",0,1,"But the Orlando shooter's father was at a Clinton rally. And what about her emails. And Uranium! But seriously, great story. Nutty people.","","","","900339825278046208","900331366264557568","KeithBoag","https://twitter.com/ottgolf/status/900339825278046208",""
"BlueGilly","2017-08-22-23:58",0,1,"Orlando Shooter's Father Attends Clinton Rally. https://twitter.com/stephe96/status/900187137714388994 …","","","","900205618677653505","","","https://twitter.com/BlueGilly/status/900205618677653505","https://abs.twimg.com/emoji/v2/72x72/1f631.png"
"PUSHny1","2017-08-18-10:32",0,0,"The Orlando Shooter's father showed up at Hillary Clinton's rally. Does that make her a supporter of terrorism? No it doesn't","","","","898553074368876544","898313211556057089","AltNatSecAgency Thixon","https://twitter.com/PUSHny1/status/898553074368876544",""
"newsfakenews","2017-08-17-15:20",0,0,"I know. Orlando shooters father was at Clinton rally. So all Hillary supporters terrorist? What is this?","","","","898263248121843712","897560560748949504","Qball1900 dreamwrthy","https://twitter.com/newsfakenews/status/898263248121843712",""
"kcloyals","2017-08-15-17:27",0,0,"For fuck sake man the father of the Orlando shooter was at a Hillary Clinton rally. Yet we didn't hear any liberal outrage.","","","","897570570644054016","897552596789022721","jriesgo","https://twitter.com/kcloyals/status/897570570644054016",""
"CJS2518","2017-08-15-12:12",0,0,"The Orlando night club shooter's father is a huge Hillary Clinton supporter who got premium seating at one of her big rallies.","","","","897491219831508992","897488154508349440","ida_skibenes MSNBC","https://twitter.com/CJS2518/status/897491219831508992",""
"CJS2518","2017-08-15-08:23",0,0,"The Orlando night club shooter's pro Taliban father voted for Hillary Clinton.","","","","897433687134003200","897430195157782529","Mestisa7 CNN GOP","https://twitter.com/CJS2518/status/897433687134003200",""
"d_trammel9","2017-08-14-10:58",0,0,"When did trump pander to neo-nazi/kkk, liar? Did you report on the orlando shooter's father & william KKK clegg supporting hillary clinton?","","","","897110184623058947","896570826220347398","morningmika","https://twitter.com/d_trammel9/status/897110184623058947",""
"LuciHoneychurch","2017-08-13-18:58",0,0,"Orlando shooter Omar Mateen's father supported Hillary Clinton, but Clinton isn't to blame for Mateen's violence. http://www.politico.com/story/2016/08/orlando-shooter-father-clinton-226819 …","","","","896868556108845056","896492127911149568","soledadobrien","https://twitter.com/LuciHoneychurch/status/896868556108845056",""
"eigross7","2017-08-12-14:42",0,0,"When the Father of the Orlando Shooter supported Hillary and went to her Rally Clinton Denounced him. Same scenario","","","","896441901578104833","896431246032732160","_vanere","https://twitter.com/eigross7/status/896441901578104833",""
"Hashtag1USA","2017-07-26-21:07",0,0,"# TransRightsAreHumanRights Is why the pulse nightclub shooter's father was seated behind Hillary Clinton at campaign rally in Orlando","","","# TransRightsAreHumanRights","890378053574066178","","","https://twitter.com/Hashtag1USA/status/890378053574066178",""
"VincentElijahh","2017-07-24-16:36",0,1,"When democrat Obama was president, the father of the Orlando Jihadi shooter went to support Clinton at the rally. And so did wife beater JZ","","","","889585211238866944","889521381112778754","threezeezs iskandrah","https://twitter.com/VincentElijahh/status/889585211238866944",""
"TalkCritic","2017-07-11-17:30",0,0,"@ CNN @ MSNBC never covered a moral outrage, that Hillary Clinton had father of Orlando nite-club shooter at her Prez rally sitting BEHIND HER","","@ CNN @ MSNBC","","884887748825546752","","","https://twitter.com/TalkCritic/status/884887748825546752",""
"hardcorerepubl1","2017-07-06-21:26",0,0,"What's wrong with that lowlife?The Orlando shooter's father voted for Clinton and went to her rallies but Frum covered it up.","","","","883135056193126401","882922954065137664","JohnJHarwood davidfrum","https://twitter.com/hardcorerepubl1/status/883135056193126401",""
"SopanDeb","2017-06-23-18:10",20,45,"Re: Al Baldasero appearing w/ Trump. Here's what Trump said about the Orlando shooter's father sitting behind Clinton at a rally on 8/10: pic.twitter.com/B5iITjai3r","","","","878374671653101568","","","https://twitter.com/SopanDeb/status/878374671653101568","https://pbs.twimg.com/media/DDCc4TWXcAAKAhs.jpg"
"siclownage","2017-06-21-21:03",2,5,"I'll take her any day over having Orlando shooter's father standing behind Hillary Clinton.","","","","877693367039270912","877682389090226176","MetropolisGal","https://twitter.com/siclownage/status/877693367039270912",""
"jopcar115","2017-06-14-20:32",4,6,"Orlando shooter's father attends Clinton rally http://politi.co/2aZTnsf via @ politico","","@ politico","","875148897882173440","875133573753446400","davidsirota nebrgenius","https://twitter.com/jopcar115/status/875148897882173440",""
"jopcar115","2017-06-14-20:30",0,1,"They need 2 remember this Orlando shooter's father attends Clinton rally http://politi.co/2aZTnsf via @ politicohttps://twitter.com/ShaunKing/status/875072163350491136 …","","@ politicohttps","","875148527898419204","","","https://twitter.com/jopcar115/status/875148527898419204",""
"jopcar115","2017-06-14-20:23",0,0,"Blaming Bernie for the shooting? Orlando shooter's father attends Clinton rally http://politi.co/2aZTnsf via @ politico # Alexandria","","@ politico","# Alexandria","875146821638787075","","","https://twitter.com/jopcar115/status/875146821638787075",""
"jopcar115","2017-06-14-20:21",0,0,"Funny that you forgot this: Orlando shooter's father attends Clinton rally http://politi.co/2aZTnsf via @ politico That's a shooter. Big one. https://twitter.com/infolibnews/status/875010400949030912 …","","@ politico","","875146088373682177","","","https://twitter.com/jopcar115/status/875146088373682177","https://pbs.twimg.com/media/DCSpAnXXoAE52um.jpg"
"lehman_brett","2017-06-13-16:18",1,2,"The question was BS Hillary Clinton had the Orlando shooter father in the background","","","","874722769296031744","874720151479828480","FoxNews","https://twitter.com/lehman_brett/status/874722769296031744",""
"BarbieKeleigh","2017-06-13-01:54",0,0,"Instead of denouncing the endorsement of the # Orlando shooter's family, # Hillary Clinton invited his father on stage at her rally.","","","# Orlando # Hillary","874505193651679232","874500543338749954","BarbieKeleigh","https://twitter.com/BarbieKeleigh/status/874505193651679232",""
"pendozer","2017-06-12-13:08",0,0,"RT Cernovich: Orlando shooter's father, himself a radical Islamist, supports sick Hillary Clinton. She has never d… https://twitter.com/Cernovich/status/775463696478773248/photo/1pic.twitter.com/e6ad0idfOx","","","","874312524358987776","","","https://twitter.com/pendozer/status/874312524358987776",""
"RosemarieTanne","2017-06-12-11:58",0,0,"Orlando shooter's father attends Hillary Clinton rally in Kissimmee http://www.wptv.com/news/state/orlando-shooters-father-attends-hillary-clinton-rally-in-kissimmee …","","","","874294858818531328","","","https://twitter.com/RosemarieTanne/status/874294858818531328",""
"lesliemack","2017-06-12-10:52",0,0,"Orlando Pulse shooter's father spotted at Clinton rally http://wapo.st/2aZAc1H?tid=ss_tw&utm_term=.f3968e555f57 … Seddique Mateen secured a prime seat at a rally for Hillary","","","","874278181129334784","","","https://twitter.com/lesliemack/status/874278181129334784",""
"AlekseiTheWolf","2017-05-30-22:58",0,1,"The father of the Orlando Pulse shooter (who pressured and prodded his son to violence) was an avid Clinton fan We don't blame her for that pic.twitter.com/XE4eECXwrV","","","","869749815604850689","869744275491344385","SallyAlbright JasonTLouis","https://twitter.com/AlekseiTheWolf/status/869749815604850689",""
"R6Rider","2017-05-30-15:40",0,2,"The father of the Orlando nightclub shooter, the one who bullied his gay son to the point of a massacre, was a Hillary Clinton supporter. https://twitter.com/worstprezever29/status/869322793669844992 …","","","","869639671638179840","","","https://twitter.com/R6Rider/status/869639671638179840",""
"PeterPalumbo1","2017-05-29-13:28",0,0,"Clinton 'disavows' support from father of Orlando nightclub shooter | http://fxn.ws/2b2QeI7","","","","869244155540762624","","","https://twitter.com/PeterPalumbo1/status/869244155540762624",""
"PeterPalumbo1","2017-05-29-13:28",2,0,"Hillary Clinton Invited Orlando Shooter&#8217;s Father to Florida Rally? http://www.snopes.com/2016/08/09/hillary-clinton-invited-orlando-shooters-father-to-florida-rally/ …","","","","869244032391794689","","","https://twitter.com/PeterPalumbo1/status/869244032391794689",""
"cinephiletweets","2017-04-28-14:30",0,0,"Donald Trump lashes out at Hillary Clinton for allowing Orlando shooter’s father at her rally http://www.firstpost.com/world/donald-trump-lashes-out-at-hillary-clinton-for-allowing-orlando-shooters-father-at-her-rally-2949052.html …","","","","858025707989020673","","","https://twitter.com/cinephiletweets/status/858025707989020673",""
"AutoCybernetics","2017-03-30-16:16",0,0,"Orlando shooter's father spotted at Clinton rally http://fw.to/csnPzBY","","","","847543173035376640","","","https://twitter.com/AutoCybernetics/status/847543173035376640",""
"FloridaOracle","2017-03-28-01:10",0,0,"Pulse victims react to Orlando shooter's father attending Clinton campaign rally - The Florida Oracle - http://www.thefloridaoracle.com/pulse-victims-react-to-orlando-shooters-father-attending-clinton-campaign-rally/ …pic.twitter.com/CTZ82yyLNi","","","","846590300378152961","","","https://twitter.com/FloridaOracle/status/846590300378152961","https://pbs.twimg.com/media/C7-xY_yU8AQ0c-X.jpg"
"ThemeParkMagic","2017-03-28-01:10",0,0,"Pulse victims react to Orlando shooter's father attending Clinton campaign rally - The Florida Oracle -... http://fb.me/8zqjsvwjV","","","","846590231470096384","","","https://twitter.com/ThemeParkMagic/status/846590231470096384",""
"ThemeParkMagic","2017-03-23-19:13",0,0,"New post (Orlando shooter's father Seddique Mateen spotted sitting behind Hillary Clinton at campaign rally in)... http://fb.me/7qI8BRBG3","","","","845050963945676802","","","https://twitter.com/ThemeParkMagic/status/845050963945676802",""
