username,date,retweets,favorites,text,geo,mentions,hashtags,tweetid,conversationid,replyto,permalink,imagelink
"GRCLeader1","2016-09-22-00:50",0,0,"FOX News: Father of Orlando shooter attends Clinton rally, touts candidate http://ranatex.com/plurk/?p=4142","","","","778818797075521538","","","https://twitter.com/GRCLeader1/status/778818797075521538",""
"MilitaryReloPro","2016-09-21-12:52",0,0,"Orlando Shooter's Father Spotted at Hillary Clinton Rally in # militaryrelocation # pcs http://soco.space/blZKDt pic.twitter.com/pkDPaEWl3N","","","# militaryrelocation # pcs","778637945288986624","","","https://twitter.com/MilitaryReloPro/status/778637945288986624","https://pbs.twimg.com/media/Cs5HFV2WIAAA_1q.jpg"
"junkerjames68","2016-09-20-09:12",0,0,"@ HillaryClinton only Hillary Clinton has supporters that sympathizes with radical Islam Orlando Shooter's father Houma Aberdeen Barack Obama","","@ HillaryClinton","","778220262525378560","","","https://twitter.com/junkerjames68/status/778220262525378560",""
"Holko","2016-09-19-12:44",0,1,"are the parents planning to attend Clintons next speech like the father of the Orlando shooter?","","","","777911140840009728","777910552895062016","Breaking911","https://twitter.com/Holko/status/777911140840009728",""
"__UFH","2016-09-19-08:02",0,0,"Keep an eye on the first row of # Clinton 's rallies he might pop out there just like Orlando shooter's father . https://twitter.com/Always_Trump/status/777836785422315520 …","","","# Clinton","777840400698605568","","","https://twitter.com/__UFH/status/777840400698605568",""
"sayemakter2012","2016-09-19-04:57",0,0,"Father of Orlando shooter admits he was INVITED to Hillary Clinton's rally by... http://ln.is/KqPBE by @ DrMartyFox via @ c0nvey","","@ DrMartyFox @ c0nvey","","777793665108500480","","","https://twitter.com/sayemakter2012/status/777793665108500480",""
"danielgullo","2016-09-19-04:48",0,0,"RT ImAnReporter: Father of Orlando shooter admits he was INVITED to Hillary Clinton's rally by the DNC. https://youtu.be/3z3LrOj3IL0?t=1m59s …","","","","777791389308489728","","","https://twitter.com/danielgullo/status/777791389308489728",""
"raayar","2016-09-19-04:45",0,0,"Father of Orlando shooter admits he was INVITED to Hillary Clinton's rally by the... http://ln.is/WFoNx by @ Margi1959 via @ c0nvey","","@ Margi1959 @ c0nvey","","777790645964566529","","","https://twitter.com/raayar/status/777790645964566529",""
"smithtammy5021","2016-09-18-16:16",2,1,"Minnesota Why would this man involved with Muslim brotherhood # Clinton Rally.Father Orlando shooter.Controlled seat pic.twitter.com/o9dqOSfJJl","","","# Clinton","777602306569228289","","","https://twitter.com/smithtammy5021/status/777602306569228289","https://pbs.twimg.com/media/CsqZK86UMAEUiyB.jpg"
"waseeem_ali","2016-09-17-13:57",0,0,"FOX News: Clinton 'disavows' support from father of Orlando nightclub shooter http://www.meragem.com/traffics/2016/08/10/fox-news-clinton-disavows-support-from-father-of-orlando-nightclub-shooter/ … # Health","","","# Health","777204784575057921","","","https://twitter.com/waseeem_ali/status/777204784575057921",""
"TimeforTruth16","2016-09-17-09:44",20,18,"# MediaSilence ,,,Clinton Supporter Orlando shooter's father attends Hillary Clinton rally in Kissimmee https://shar.es/1xoh2q via @ wptv","","@ wptv","# MediaSilence","777141234091560960","","","https://twitter.com/TimeforTruth16/status/777141234091560960",""
"jamescapps6969","2016-09-16-21:19",0,0,"@ CNN ORLANDO SHOOTER WAS BORN AMERICAN, FATHER AT CLINTON RALLY,, SO MANY QUESTIONS","","@ CNN","","776953611607605249","","","https://twitter.com/jamescapps6969/status/776953611607605249",""
"InzlKett","2016-09-16-16:26",0,0,"Orlando Shooter's father shows up as a supporter at the Clinton Rally. Check out http://bcove.me/c0hsd3p0","","","","776880065552519168","","","https://twitter.com/InzlKett/status/776880065552519168",""
"jamescapps6969","2016-09-16-11:56",0,0,"@ foxandfriends FOLKS,,, REMINDER,,,ORLANDO SHOOTER WAS BORN HERE TO,,,HIS FATHER ALSO A CLINTON SUPPORTER","","@ foxandfriends","","776812093815136256","","","https://twitter.com/jamescapps6969/status/776812093815136256",""
"74f5c728e7d446d","2016-09-14-15:16",11,8,"Hillary Orlando Shooter's Father invited by DNC to attend Hillary Clinton Florida Rally # WTF https://evilbloggerlady.blogspot.com/2016/08/ready-for-hillary-orlando-shooters.html?m=1 …pic.twitter.com/FSjYZXYJQa","","","# WTF","776137636348063744","","","https://twitter.com/74f5c728e7d446d/status/776137636348063744","https://pbs.twimg.com/media/CsVlD7sWYAEVRqn.jpg"
"PrMediaLink","2016-09-14-09:41",0,0,"Father of Orlando shooter sighted at Hillary Clinton event # Event # New # PR http://soco.space/JLPSQE pic.twitter.com/AVJWZtdtnZ","","","# Event # New # PR","776053218497429504","","","https://twitter.com/PrMediaLink/status/776053218497429504","https://pbs.twimg.com/media/CsUYScAWAAA4r9T.jpg"
"the1firstmike","2016-09-13-18:13",3,2,"Father of Orlando shooter endorses Hillary Clinton after attending rally. http://bit.ly/2aXltDa # DeplorablesForTrump","","","# DeplorablesForTrump","775819694607437824","","","https://twitter.com/the1firstmike/status/775819694607437824",""
"Shooters_Wife","2016-09-13-14:17",0,0,"Mike Pence Reminds People That Father Of Orlando Terrorist Backs Hillary Clinton: Mateen attended a Hillary C... http://tinyurl.com/htdnlfl","","","","775760227920588800","","","https://twitter.com/Shooters_Wife/status/775760227920588800",""
"dangallo","2016-09-13-11:22",5,1,"Here it is. Mike Pence going after Clinton for Orlando shooter's father attending rally. August 9. pic.twitter.com/aMF9Rjtcgo","","","","775716208435953666","775715308787134464","dangallo","https://twitter.com/dangallo/status/775716208435953666","https://pbs.twimg.com/media/CsPlm_dWcAADdUA.jpg"
"dangallo","2016-09-13-11:18",59,57,"The interesting thing about this is...Pence indeed attacked Clinton when Orlando shooter's father attended her rally https://twitter.com/inesdlc/status/775713698648301569 …","","","","775715308787134464","","","https://twitter.com/dangallo/status/775715308787134464",""
"RodgerPayne","2016-09-13-10:56",0,0,"Also, this: Clinton Disavows Support Of Orlando Shooter’s Father https://www.buzzfeed.com/tasneemnashrulla/father-of-orlando-shooter-attends-hillary-clinton-rally?utm_term=.srn115RGq … via @ TasneemN @ buzzfeednewshttps://twitter.com/speechboy71/status/775703433093517313 …","","@ TasneemN @ buzzfeednewshttps","","775709783701786624","","","https://twitter.com/RodgerPayne/status/775709783701786624",""
"VaughnHillyard","2016-09-13-10:34",0,3,"Pence tells @ KellyO people with 'ill motives can associate' themselves how they like, compares to Orlando shooter's father at Clinton rally.","","@ KellyO","","775704237443575809","","","https://twitter.com/VaughnHillyard/status/775704237443575809",""
"speechboy71","2016-09-13-10:31",72,73,"OMG, Pence just compared David Duke's support for Trump to the fact that father of Orlando shooter showed up at Clinton rally","","","","775703433093517313","","","https://twitter.com/speechboy71/status/775703433093517313",""
"PrMediaLink","2016-09-13-08:01",0,0,"Orlando shooter's father attended Hillary Rodham Clinton event # Event # New # PR http://soco.space/BHmntG","","","# Event # New # PR","775665690607030273","","","https://twitter.com/PrMediaLink/status/775665690607030273",""
"T38_Driver","2016-09-12-18:45",0,0,"the counter- counter punch- 8/9/16 WaPost: Orlando shooter’s father spotted at Clinton rally https://www.washingtonpost.com/news/post-politics/wp/2016/08/09/orlando-shooters-father-spotted-at-clinton-rally/ …","","","","775465389430038528","775457959086284809","T38_Driver jaketapper megynkelly","https://twitter.com/T38_Driver/status/775465389430038528",""
"stlgirlinlex","2016-09-12-18:41",0,0,"Trump owns David Duke as much as Clinton owns the Orlando shooter's father.","","","","775464447506722816","775463807942479872","Cernovich","https://twitter.com/stlgirlinlex/status/775464447506722816",""
"BootStrapzOrg","2016-09-12-14:31",0,0,"Hillary Clinton Ignores Reporters Questions About Father Of Orlando Shooter Attending Her Rally http://www.govtslaves.info/?p=69372","","","","775401497374916609","","","https://twitter.com/BootStrapzOrg/status/775401497374916609",""
"waseeem_ali","2016-09-12-02:37",0,0,"Latest Videos | Mail Online: Father of Orlando shooter attends Clinton rally in Kissimmee http://www.meragem.com/traffics/2016/08/09/latest-videos-mail-online-father-of-orlando-shooter-attends-clinton-rally-in-kissimmee/ … # Health","","","# Health","775221784874409984","","","https://twitter.com/waseeem_ali/status/775221784874409984",""
"waseeem_ali","2016-09-11-14:29",0,0,"News Articles | Mail Online: Orlando night club shooter's father spotted smiling at Hillary Clinton rally i http://www.meragem.com/traffics/2016/08/09/news-articles-mail-online-orlando-night-club-shooters-father-spotted-smiling-at-hillary-clinton-rally-in-florida/ … # Health","","","# Health","775038681203605506","","","https://twitter.com/waseeem_ali/status/775038681203605506",""
"rewoodky","2016-09-11-12:57",0,1,"# basketofdeplorabes Saudi Arabia, Iran, China, William Fulbright, Bill Clinton, Clinton Foundation, Father of the Orlando Shooter, Chelsea..","","","# basketofdeplorabes","775015483238219776","","","https://twitter.com/rewoodky/status/775015483238219776",""
"CololoJohn","2016-09-10-10:30",0,0,"Father of Orlando shooter supporting Clinton # BasketOfDeplorables","","","# BasketOfDeplorables","774616020061388800","","","https://twitter.com/CololoJohn/status/774616020061388800",""
"waseeem_ali","2016-09-09-16:09",0,0,"FOX News: Father of Orlando shooter attends Clinton rally, touts candidate http://www.meragem.com/traffics/2016/08/09/fox-news-father-of-orlando-shooter-attends-clinton-rally-touts-candidate/ … # Health","","","# Health","774339022722170880","","","https://twitter.com/waseeem_ali/status/774339022722170880",""
"NotClintonBush","2016-09-09-14:00",0,0,"Orlando shooter's father attends Hillary Clinton rally in Kissimmee http://linkr.es/2cD2n # Hillary # Trump","","","# Hillary # Trump","774306464219279360","","","https://twitter.com/NotClintonBush/status/774306464219279360",""
"USAHipster","2016-09-09-08:51",4,4,"Orlando shooter's father is a long time friend of Obama and Hillary Clinton. He endorsed Clinton! https://twitter.com/dcexaminer/status/742710860582359040 …","","","","774228662035976192","","","https://twitter.com/USAHipster/status/774228662035976192","https://pbs.twimg.com/media/Ck6jlwoUUAU00c-.jpg"
"twistytheclowny","2016-09-07-22:48",0,2,"Orlando shooter's father attends Clinton rally http://www.politico.com/story/2016/08/orlando-shooter-father-clinton-226819 …","","","","773714593344434176","766180993128685568","Lagartija_Nix SharonMcCutchan","https://twitter.com/twistytheclowny/status/773714593344434176",""
"luvmeimcourtney","2016-09-07-14:49",0,0,"yet Bill Clinton stood up for a former kkk leader lol and Killary gave the orlando shooters father a prime seet at her rally","","","","773594023646859264","773592148646227969","SenorSmoove","https://twitter.com/luvmeimcourtney/status/773594023646859264",""
"CelebrityWire","2016-09-07-12:31",0,0,"Orlando Shooter's Father Lurks Behind Hillary Clinton At Florida Rally http://tinyurl.com/jywljsj","","","","773559423671435265","","","https://twitter.com/CelebrityWire/status/773559423671435265",""
"LoraLogik","2016-09-06-16:49",0,0,"Father of Orlando shooter endorses Hillary Clinton after attending rally http://fb.me/3ilJWWfsH","","","","773261828860223489","","","https://twitter.com/LoraLogik/status/773261828860223489",""
"LoraLogik","2016-09-06-16:49",0,0,"Father of Orlando shooter endorses Hillary Clinton after attending rally http://www.theguardian.com/us-news/2016/aug/09/seddique-mateen-hillary-clinton-rally-pulse-shooting?CMP=Share_iOSApp_Other …","","","","773261781812731904","","","https://twitter.com/LoraLogik/status/773261781812731904",""
"truthtroubadour","2016-09-06-05:36",0,0,"Orlando shooter's father Seddique Mateen spotted sitting behind Hillary Clinton at campaign rally in (4:03) WPTV... http://fb.me/7nobarSeG","","","","773092384330526720","","","https://twitter.com/truthtroubadour/status/773092384330526720",""
"biggerdeal99","2016-09-05-23:01",1,0,"No remorse voters:Orlando shooter's father drives 2 1/2 hours to attend Hillary Clinton rally in Kissimmee http://www.wptv.com/news/state/orlando-shooters-father-attends-hillary-clinton-rally-in-kissimmee … via @ wptv","","@ wptv","","772993126394892288","","","https://twitter.com/biggerdeal99/status/772993126394892288",""
"waseeem_ali","2016-09-05-08:07",0,0,"FOX News: Father of Orlando shooter attends Clinton rally, touts candidate http://www.meragem.com/traffics/2016/08/09/fox-news-father-of-orlando-shooter-attends-clinton-rally-touts-candidate-2/ … # Health","","","# Health","772768158281179137","","","https://twitter.com/waseeem_ali/status/772768158281179137",""
"ABQoGoing","2016-09-03-13:49",0,0,"What's going on? Father of Orlando shooter sighted at Hillary Clinton event -… http://dlvr.it/MB2TlK Get found -> http://goo.gl/GNn5iH","","","","772129421809508352","","","https://twitter.com/ABQoGoing/status/772129421809508352",""
"waseeem_ali","2016-09-02-11:33",0,0,"Latest News: Father of Orlando shooter attends Clinton event in Florida http://www.meragem.com/traffics/2016/08/09/latest-news-father-of-orlando-shooter-attends-clinton-event-in-florida/ … # Health","","","# Health","771732871656505344","","","https://twitter.com/waseeem_ali/status/771732871656505344",""
"CelebrityWire","2016-09-02-09:13",0,0,"Orlando Shooter's Father Lurks Behind Hillary Clinton At Florida Rally http://tinyurl.com/jywljsj","","","","771697487056961541","","","https://twitter.com/CelebrityWire/status/771697487056961541",""