username,date,retweets,favorites,text,geo,mentions,hashtags,tweetid,conversationid,replyto,permalink,imagelink
"TennisEnnis196","2017-02-09-16:34",0,0,"or the father of the Orlando shooter being invited to a Clinton campaign event? Remember that?","","","","829805688985616384","","","https://twitter.com/TennisEnnis196/status/829805688985616384",""
"sjellis_0220","2017-01-31-09:15",1,2,"Fact: Orlando shooter DID NOT attend Clinton rally, only his father. Post smarter! # wtf","","","# wtf","826433731875446785","826390034693623809","BlueSky2915 OfficialSPGB","https://twitter.com/sjellis_0220/status/826433731875446785",""
"NotClintonBush","2017-01-22-13:15",0,0,"Orlando shooter's father attends Hillary Clinton rally in Kissimmee http://linkr.es/71z8T # Hillary # MAGA","","","# Hillary # MAGA","823232532552425475","","","https://twitter.com/NotClintonBush/status/823232532552425475",""
"cameron_oglesby","2017-01-20-13:48",0,0,"And the Orlando shooters father went to a Hillary Clinton campaign speech https://twitter.com/deray/status/822503367620591617 …","","","","822516074201706496","","","https://twitter.com/cameron_oglesby/status/822516074201706496",""
"tykeamusprime","2017-01-16-14:40",0,4,"Hillary Clinton was endorsed by the Father of the Orlando Shooter? A bad person's opinion doesn't reflect ones character.","","","","821079633084854272","821051345268445184","RavenBoettcher","https://twitter.com/tykeamusprime/status/821079633084854272",""
"copstaff","2017-01-16-13:39",0,0,"Orlando shooter's father attends Hillary Clinton rally in Kissimmee http://dlvr.it/N79k5n","","","","821064287154151424","","","https://twitter.com/copstaff/status/821064287154151424",""
"Lynnoncole","2017-01-14-15:04",0,0,"Trump stood by the LGBTQ community after the Orlando club shooting. The shooter's father was at Clinton rally - front row. Shame on you!","","","","820360998599229440","820356688100388864","DianeTate","https://twitter.com/Lynnoncole/status/820360998599229440",""
"httprover","2017-01-03-22:58",0,0,"That reminds me of the Clinton rally attended by the Orlando nightclub shooter's father.","","","","816494046105374724","816478440253718528","AC360","https://twitter.com/httprover/status/816494046105374724",""
"Lanrewaju2014","2017-01-03-12:21",0,0,"# Oldpost Orlando Shooter's Father Attends Hillary Clinton Rally http://www.gist.ng/2016/08/orlando-shooters-father-attends-hillary-clinton-rally/?utm_source=ReviveOldPost&utm_medium=social&utm_campaign=ReviveOldPost …","","","# Oldpost","816333660483944448","","","https://twitter.com/Lanrewaju2014/status/816333660483944448",""
"DoRtChristians","2016-12-08-17:06",0,0,"Hillary Clinton https://youtu.be/L65RBwrtOeQ Not to mention father of ISIS Orlando shooter","","","","806983371209457666","806942068949979136","teh_goat RonHall46","https://twitter.com/DoRtChristians/status/806983371209457666",""
"AllPassingThing","2016-12-07-18:52",3,7,"the Orlando shooter *wait for it* had a father who was invited to Clinton's rallies after the terror attacks http://abcnews.go.com/Politics/orlando-shooters-father-attend-clinton-rally/story?id=41242838 …","","","","806647535431340033","806638718584922114","lhfang","https://twitter.com/AllPassingThing/status/806647535431340033",""
"jdoedoe101101","2016-12-07-17:16",0,0,"the father of the Orlando shooter, who was himself outspoken for Sharia law, opnely supported Clinton.","","","","806623438613938176","806620219124879360","goodoldcatchy FrankLuntz","https://twitter.com/jdoedoe101101/status/806623438613938176",""
"realnewsvideos","2016-12-05-08:20",0,0,"# Orlando # shooter's # father # attends HIllary Clinton rally Kissimmee http://wingztv.com/video/father-of-orlando-nightciub-was-at-clintons-florida-rally …","","","# Orlando # shooter # father # attends","805763666914078720","","","https://twitter.com/realnewsvideos/status/805763666914078720",""
"TheRoachMaker","2016-11-19-23:34",0,0,"The Orlando shooters father supported Hillary Clinton. Does that make you a terrorist?","","","","800195510011203584","800036241605476352","AlonzoBodden","https://twitter.com/TheRoachMaker/status/800195510011203584",""
"TechAlum05","2016-11-18-13:39",0,0,"Man who hated gays and was father of Orlando shooter supported Hillary Clinton. Need I say more...? http://www.politico.com/story/2016/08/orlando-shooter-father-clinton-226819 …","","","","799683507442176000","799647474956632064","ananavarro","https://twitter.com/TechAlum05/status/799683507442176000",""
"Vernontap","2016-11-14-17:10",0,5,"I bet the father that raised/loved the Orlando Pulse nightclub shooter voted Obama before and Hilary Clinton after shooting","","","","798286905360060416","798284790961094657","peterboghossian","https://twitter.com/Vernontap/status/798286905360060416",""
"scottmtaylor23","2016-11-09-23:44",0,0,"@ JuddApatow probably the same one the Orlando shooters father would have in a Clinton admin https://twitter.com/JuddApatow/status/796573611628736512 …","","@ JuddApatow","","796574330020855809","","","https://twitter.com/scottmtaylor23/status/796574330020855809",""
"ParkerrCarney","2016-11-09-14:25",0,0,"it's just like the father of the Orlando gay nightclub shooter endorsing and being at Hillary Clinton rallies.","","","","796433639978500103","796432641386020868","stephaniesuboch","https://twitter.com/ParkerrCarney/status/796433639978500103",""
"MetroidJunkie","2016-11-09-08:10",0,1,"The Father of the Orlando Shooter, who said Homosexuals are under Allah's Judgment, supported Hillary Clinton. Both had bad supporters. https://twitter.com/thgirwdm/status/796338923442085891 …","","","","796339192078823425","","","https://twitter.com/MetroidJunkie/status/796339192078823425","https://pbs.twimg.com/media/Cw0qBn8UsAAymDv.jpg"
"Ginnywoww","2016-11-08-23:09",0,0,"@ jessetyler and the Orlando shooters father was behind Clinton. Can't control those things. Let's not keep spreading hate","","@ jessetyler","","796202937336918020","796201018568495104","iamrashidajones","https://twitter.com/Ginnywoww/status/796202937336918020",""
"junqueiro_seth","2016-11-08-00:55",0,0,"just remember america the orlando shooter's father is voting for hillary clinton the choice is yours","","","","795867277572739072","","","https://twitter.com/junqueiro_seth/status/795867277572739072",""
"adagioforstring","2016-11-07-17:19",2,1,"Orlando shooter's father attends Hillary Clinton rally in Kissimmee - http://wptv.com https://shar.es/1IhPRS via @ wptv @ ladygagapic.twitter.com/C8GbM4ODi0","","@ wptv @ ladygagapic","","795752623727083520","795736297532899337","ladygaga","https://twitter.com/adagioforstring/status/795752623727083520","https://pbs.twimg.com/media/CwsUTzpVIAAFhIV.jpg"
"_Mermayhem","2016-11-07-17:16",0,1,"The Orlando shooter's father had a front row seat at one of Clinton's rallies pic.twitter.com/bTiJTgtvQc","","","","795751836342951936","795736297532899337","ladygaga","https://twitter.com/_Mermayhem/status/795751836342951936","https://pbs.twimg.com/media/CwsT-IaUUAA3UNy.jpg"
"angeleshoy1","2016-11-07-09:26",0,0,"@ Reince Orlando shooter's father attends Hillary Clinton rally in Kissimmee https://shar.es/1I6VPN via @ wptv. (Front rows seat)","","@ Reince @ wptv","","795633569431486464","","","https://twitter.com/angeleshoy1/status/795633569431486464",""
"angeleshoy1","2016-11-07-09:12",0,0,"Orlando shooter's father attends Hillary Clinton rally in Kissimmee https://shar.es/1I6VPN via @ wptv","","@ wptv","","795629971389747200","","","https://twitter.com/angeleshoy1/status/795629971389747200",""
"angeleshoy1","2016-11-07-08:46",1,0,"Orlando shooter's father attends Hillary Clinton rally in Kissimmee https://shar.es/1I6Btt via @ wptv","","@ wptv","","795623413016629248","","","https://twitter.com/angeleshoy1/status/795623413016629248",""
"angeleshoy1","2016-11-07-08:45",0,0,"Orlando shooter's father attends Hillary Clinton rally in Kissimmee https://shar.es/1I6BoC via @ wptv","","@ wptv","","795623227649310720","","","https://twitter.com/angeleshoy1/status/795623227649310720",""
"bama_flora","2016-11-06-00:30",0,0,"Orlando shooter's father attends Hillary Clinton rally in Kissimmee https://shar.es/1I5eof via @ wptv","","@ wptv","","795121085008244736","","","https://twitter.com/bama_flora/status/795121085008244736",""
"JamieQueen2","2016-11-04-09:54",1,0,"and the father of the Orlando nightclub shooter supports Clinton. Your point is??? @ Humans_vs_Trump","","@ Humans_vs_Trump","","794538416700465152","794510881551945728","Humans_vs_Trump","https://twitter.com/JamieQueen2/status/794538416700465152",""
"cobi_ryals","2016-11-03-09:02",0,0,"So, the father of the Orlando shooter went to a Clinton rally. I rather fight the infective KKK in America than ISIS. https://twitter.com/neeratanden/status/793846074947563520 …","","","","794162880815964160","","","https://twitter.com/cobi_ryals/status/794162880815964160",""
"trump_democrat","2016-11-02-16:40",2,3,". @ jaketapper Hillary Clinton has not disavowed the support of Orlando shooter Omar Mateen's father. Will you ask her supporters why not??","","@ jaketapper","","793915735097675776","","","https://twitter.com/trump_democrat/status/793915735097675776",""
"RolandSShapiro","2016-11-02-16:26",0,0,"I'll make it simple. @ FoxNews has pointed out 347 times that the father of the Orlando shooter was at a Clinton rally.","","@ FoxNews","","793912199903211520","793832954975793152","JasonFutrell84","https://twitter.com/RolandSShapiro/status/793912199903211520",""
"815wrldtrvlr","2016-11-02-12:57",0,0,"Father of Orlando Nightclub Shooter Attends Clinton Rally https://www.google.com/amp/abcnews.go.com/amp/Politics/father-orlando-nightclub-shooter-attends-hillary-clinton-rally/story%3Fid%3D41231649?client=safari …","","","","793859691541659648","","","https://twitter.com/815wrldtrvlr/status/793859691541659648",""
"yeswecan124","2016-10-31-19:15",1,0,"Orlando shooter's father attends Hillary Clinton rally in Kissimmee # pulse why is hillary so in love with them? But they're bombing uspic.twitter.com/K4TucCaEja","","","# pulse","793230047318577152","","","https://twitter.com/yeswecan124/status/793230047318577152","https://pbs.twimg.com/media/CwIehcDXYAAqjUq.jpg"
"HowManyDaysEU","2016-10-30-14:18",0,1,"Is the father of the Orlando shooter at the Clinton rally in gay friendly club? pic.twitter.com/Ke6xhlDPKn","","","","792792769077075968","792788506187816960","BecketAdams","https://twitter.com/HowManyDaysEU/status/792792769077075968","https://pbs.twimg.com/media/CwCQy9PWgAAsufz.jpg"
"poliphilosophy","2016-10-28-16:10",0,0,"Hit and a miss. While we are on the topic, any statements of the father of Orlando shooter endorsing Hillary Clinton? # fail","","","# fail","792096123645075458","792094647338299392","jeneps","https://twitter.com/poliphilosophy/status/792096123645075458",""
"tennisjunkie14","2016-10-28-12:58",0,1,"Orlando's Shooters Father Endorses Clinton https://www.reddit.com/r/The_Donald/comments/59trwv/orlandos_shooters_father_endorses_clinton/?st=IUU0VZGX&sh=f97c6b0e …","","","","792047894027051013","","","https://twitter.com/tennisjunkie14/status/792047894027051013",""
"SavetheUSNation","2016-10-28-07:23",0,0,"http://ift.tt/2e3VKxy Orlando's Shooters Father Endorses Clinton # Trump","","","# Trump","791963473223626756","","","https://twitter.com/SavetheUSNation/status/791963473223626756",""
"DeplorableBBall","2016-10-26-20:26",0,0,"@ dennisrodman @ realDonaldTrump Is the father of the Orlando Shooter's support suppose to somehow be helpful to Clinton?","","@ dennisrodman @ realDonaldTrump","","791435937662308352","791415913769672704","RyPBD","https://twitter.com/DeplorableBBall/status/791435937662308352",""
"Monifer11","2016-10-26-07:42",1,0,"Orlando shooter's father attends Hillary Clinton rally in Kissimmee https://shar.es/1EV4F5 来自 @ wptv","","@ wptv","","791243671198769152","","","https://twitter.com/Monifer11/status/791243671198769152",""
"trump_democrat","2016-10-25-12:44",2,4,"Will the Orlando shooter's father campaign for Clinton too? Will you ask her to disavow him? # TerroristsWithHer # MediaWithHer","","","# TerroristsWithHer # MediaWithHer","790957321539162113","790919428158451712","albamonica","https://twitter.com/trump_democrat/status/790957321539162113",""
"brewokr","2016-10-21-04:03",0,0,"Father of Orlando shooter attends Clinton rally, touts candidate'","","","","789376521513213952","","","https://twitter.com/brewokr/status/789376521513213952",""
"growingaway","2016-10-20-00:03",0,1,"Watch Orlando shooter's father listen to Clinton at rally # debatenight # GaysForTrump http://wapo.st/2aJn9Ch","","","# debatenight # GaysForTrump","788953757669175297","","","https://twitter.com/growingaway/status/788953757669175297",""
"laurieWr","2016-10-19-22:27",0,0,"Hillary Clinton dodges reporters asking ‘why Orlando shooter’s father was seated behind her’ # debatenight # debate http://theduran.com/hllary-clinton-dodges-reporters-asking-why-orlando-shooter-father-seated-behind-her-during-campaign-speech/ …","","","# debatenight # debate","788929510259331072","","","https://twitter.com/laurieWr/status/788929510259331072",""
"jknoxville","2016-10-19-22:24",2,7,"Orlando shooters father loves Hillary Clinton # debatenight","","","# debatenight","788928881424162821","","","https://twitter.com/jknoxville/status/788928881424162821","https://abs.twimg.com/emoji/v2/72x72/1f602.png"
"souljahsingh","2016-10-19-22:24",0,0,"The father of the Orlando nightclub shooter is a Hillary Clinton supporter and even attended her rallies. # debatenight","","","# debatenight","788928844220735489","","","https://twitter.com/souljahsingh/status/788928844220735489",""
"Sklein19Klein","2016-10-19-13:22",0,1,"This will be just like Clinton who had that Taliban supporter (father of the Orlando shooter) behind her.","","","","788792419424800768","788787182253305858","Ike19777 JewsChooseTrump","https://twitter.com/Sklein19Klein/status/788792419424800768",""
"Sklein19Klein","2016-10-19-13:21",0,0,"This will be just like Clinton who had that Taliban supporter (father of the Orlando shooter) behind her in Kissimmee.","","","","788792310700081152","788781379941113856","Sklein19Klein RedneckForTrump","https://twitter.com/Sklein19Klein/status/788792310700081152",""
"Sklein19Klein","2016-10-19-13:21",0,0,"This will be just like Clinton who had that Taliban supporter (father of the Orlando shooter) behind her in Kissimmee.","","","","788792143439597569","788789518291898368","McAllisterDen","https://twitter.com/Sklein19Klein/status/788792143439597569",""
"Bloviate_Barbie","2016-10-17-20:06",0,2,"The Orlando shooter was an islamofascist registered democrat. His father attended a Clinton rally. # FLSenDebate # FixYourConstituentshttps://twitter.com/patrickmurphyfl/status/788157725100433409 …","","","# FLSenDebate # FixYourConstituentshttps","788169435806703616","","","https://twitter.com/Bloviate_Barbie/status/788169435806703616","https://abs.twimg.com/emoji/v2/72x72/1f644.png"
"ldhancock1","2016-10-16-10:57",0,0,"I always thought it strange the Orlando shooters father met with Dems 1/2 weeks before shooting. Rec'd $. Showed up at Clinton rally.","","","","787668773327237120","","","https://twitter.com/ldhancock1/status/787668773327237120",""
"ClergyCare2015","2016-10-15-06:42",0,0,"True and sad for the families. But the Father of # Orlando shooter goes to a # Clinton rally and its a free country. Or is it?? # KansasPlothttps://twitter.com/MiltonWolfMD/status/787107721812193280 …","","","# Orlando # Clinton # KansasPlothttps","787242321469382656","","","https://twitter.com/ClergyCare2015/status/787242321469382656",""
"waseeem_ali","2016-10-08-12:45",0,0,"Articles | Mail Online: The Latest: Father of Orlando shooter attends Clinton rally http://www.meragem.com/traffics/2016/08/09/articles-mail-online-the-latest-father-of-orlando-shooter-attends-clinton-rally/ … # Health","","","# Health","784796963942182914","","","https://twitter.com/waseeem_ali/status/784796963942182914",""
"GodforTrump","2016-10-08-03:33",0,0,"Limbaugh: Hillary Clinton Setting 'Trap' For Trump With Orlando Shooters Father at Rally | Video RealClearPolitics http://ln.is/com/1FDJm !","","","","784657842867404800","","","https://twitter.com/GodforTrump/status/784657842867404800",""
"USAHipster","2016-10-07-12:19",7,2,"Orlando shooter's father is a long time friend of Obama and Hillary Clinton. He attend her Rally in Orlando and endorsed her! VOTE 4 TRUMP https://twitter.com/dcexaminer/status/742710860582359040 …","","","","784428056991588352","","","https://twitter.com/USAHipster/status/784428056991588352","https://pbs.twimg.com/media/Ck6jlwoUUAU00c-.jpg"
"USAHipster","2016-10-07-12:17",10,4,"What kind of a crazy person invites Orlando # LGBT Shooters Muslim Father to her Rally? Hillary Clinton! VOTE 4 TRUMP! # AZ # PA # FL # OH # COpic.twitter.com/7kgOVXTXeb","","","# LGBT # AZ # PA # FL # OH # COpic","784427399496757249","","","https://twitter.com/USAHipster/status/784427399496757249","https://pbs.twimg.com/media/CuLYaE1VIAEOi_t.jpg"
"Michael_D_Coe","2016-10-06-11:43",0,0,"Trending Now: Father of Orlando shooter attends Clinton rally, touts candidate | Fox News http://fb.me/4vcGa7HMN","","","","784056582095015936","","","https://twitter.com/Michael_D_Coe/status/784056582095015936",""
"AMillionaireNow","2016-10-06-11:41",0,0,"# TheCoeReport: Father of Orlando shooter attends Clinton rally, touts candidate | Fox News http://ift.tt/2dNPwiu","","","# TheCoeReport","784056000777248768","","","https://twitter.com/AMillionaireNow/status/784056000777248768",""
"BeingNRX","2016-10-05-16:11",0,0,"@ huffpostqueer hillary clinton had the Orlando shooter's father campaigning with her, why the fuck do you think # homonationalism exists?","","@ huffpostqueer","# homonationalism","783761659911344128","","","https://twitter.com/BeingNRX/status/783761659911344128",""
"beckwith_ebooks","2016-10-02-20:21",0,0,"New Hillary Clinton Campaign Says It Didn’t Know Orlando Shooter’s Father Was at Rally.","","","","782737410509705216","","","https://twitter.com/beckwith_ebooks/status/782737410509705216",""
"cid1776","2016-10-01-14:07",0,0,"'prime seat' 4 'Orlando shooter’s father spotted at Hillary Clinton rally'- http://www.bostonglobe.com/news/politics/2016/08/09/orlando-shooter-father-spotted-hillary-clinton-rally/0xEwLrEU80HfNdM64EAh3N/story.html … # democrats # latinos # blacks # LGBT # GOP","","","# democrats # latinos # blacks # LGBT # GOP","782280866194010113","","","https://twitter.com/cid1776/status/782280866194010113",""
"NowCID","2016-10-01-14:07",0,0,"'prime seat' 4 'Orlando shooter’s father spotted at Hillary Clinton rally'- http://www.bostonglobe.com/news/politics/2016/08/09/orlando-shooter-father-spotted-hillary-clinton-rally/0xEwLrEU80HfNdM64EAh3N/story.html … # democrats # latinos # blacks # LGBT # GOP","","","# democrats # latinos # blacks # LGBT # GOP","782280864029749252","","","https://twitter.com/NowCID/status/782280864029749252",""
"bugalubaby2011","2016-10-01-14:07",0,0,"'prime seat' 4 'Orlando shooter’s father spotted at Hillary Clinton rally'- http://www.bostonglobe.com/news/politics/2016/08/09/orlando-shooter-father-spotted-hillary-clinton-rally/0xEwLrEU80HfNdM64EAh3N/story.html … # democrats # latinos # blacks # LGBT # GOP","","","# democrats # latinos # blacks # LGBT # GOP","782280862188437504","","","https://twitter.com/bugalubaby2011/status/782280862188437504",""
"scottcped","2016-09-30-06:50",0,0,"Trump is doing something right! Clinton has support of Taliban supporting father of the Orlando night club shooter. There IS a choice here. https://twitter.com/AIIAmericanGirI/status/781807095687487488 …","","","","781808398652305408","","","https://twitter.com/scottcped/status/781808398652305408",""
"oneil_alen","2016-09-29-15:51",0,0,"Father of # Orlando shooter at a prior # Clinton event with sign saying he's voting for her? That's class? # blind","","","# Orlando # Clinton # blind","781582297527033857","","","https://twitter.com/oneil_alen/status/781582297527033857",""
"USAHipster","2016-09-28-22:09",8,1,"Transcripts of Orlando shooter's conversation with police reveal ISIS influence. His father is Hillary Clinton Donor http://www.foxnews.com/us/2016/09/28/transcripts-orlando-shooters-conversation-with-police-reveal-isis-influence.html …","","","","781314897468502016","","","https://twitter.com/USAHipster/status/781314897468502016",""
"uk_rants","2016-09-28-17:17",6,4,"What is it with the Clintons & their choice of 'friends'? Orlando shooters father, VIP at rally. Now this 'lady'... https://twitter.com/TheLastRefuge2/status/781058148643643392 …","","","","781241407801532416","","","https://twitter.com/uk_rants/status/781241407801532416","https://pbs.twimg.com/media/CtbgPsnUsAAMg4B.jpg"
"ktvquoctoan","2016-09-28-01:20",0,0,"818 Orlando Nightclub Shooter's Father Attends Clinton Rally: http://youtu.be/0fO-c-Hsv0Y?a via @ YouTube","","@ YouTube","","781000525097668609","","","https://twitter.com/ktvquoctoan/status/781000525097668609",""
"NotClintonBush","2016-09-27-10:59",0,0,"Orlando shooter's father attends Hillary Clinton rally in Kissimmee http://linkr.es/BynYBD # Hillary # Trump","","","# Hillary # Trump","780783991913709568","","","https://twitter.com/NotClintonBush/status/780783991913709568",""
"Domceleste","2016-09-27-08:32",0,0,"misleading Spec. You make it look like Trump supported him. Why not report in Orlando shooters father invite to rally by Clinton","","","","780746974278590464","780512788896710656","TheSpec","https://twitter.com/Domceleste/status/780746974278590464",""
"USDeptOfHonesty","2016-09-26-22:22",0,0,"Orlando shooter's father attends Hillary Clinton rally in Kissimmee https://shar.es/1xJ0Rk via @ wptv","","@ wptv","","780593468796264448","","","https://twitter.com/USDeptOfHonesty/status/780593468796264448",""
"UrbiEtCivitas","2016-09-26-14:17",0,0,"The Clintons passed Don't ask, Don't Tell, DOMA, Hillary for decades didn't support gay marriage & had the father of the Orlando shooter. https://twitter.com/TheAdvocateMag/status/780468153197309952 …","","","","780471261554016256","","","https://twitter.com/UrbiEtCivitas/status/780471261554016256","https://pbs.twimg.com/tweet_video_thumb/CtTHnF8UIAEn_zO.jpg"
"Nancymkq","2016-09-25-16:47",0,0,"Father of Orlando shooter at Clinton Rally, # CascadeMall shooter Hillary supporter- coincidence ? # DebateSideEffectspic.twitter.com/Y3WYwuzcVq","","","# CascadeMall # DebateSideEffectspic","780146647489798152","","","https://twitter.com/Nancymkq/status/780146647489798152","https://pbs.twimg.com/media/CtOjPJNXEAA9PH_.jpg"
"AwakelN","2016-09-25-16:02",0,0,"I guess you missed the time when the Orlando shooter's father was invited to a Clinton rally. http://www.washingtontimes.com/news/2016/aug/9/omar-mateens-father-attends-hillary-clinton-rally/ …","","","","780135311045038080","762016426102296576","IvanJoyederpuss","https://twitter.com/AwakelN/status/780135311045038080",""
"USAHipster","2016-09-25-11:54",3,0,"Will the Orlando shooter's father appear at the Trump Clinton debate too? # Debates2016https://twitter.com/WeNeedTrump/status/780060581013311488 …","","","# Debates2016https","780072917526720512","","","https://twitter.com/USAHipster/status/780072917526720512","https://pbs.twimg.com/media/CtLYF_rWYAA0Q3P.jpg"
"DancrDave","2016-09-25-09:01",2,1,"So did the Cascade Mall shooter; no apparent pattern: Orlando Shooter’s Terror-Tied Father Endorses Hillary Clinton http://goo.gl/O7YwyX","","","","780029530220138496","","","https://twitter.com/DancrDave/status/780029530220138496",""
"HilClin4WOPriso","2016-09-25-07:09",4,2,"Tweeted by the Seattle shooter! Don't forget when the Orlando shooters' father sat front row at a Hillary Clinton Rally. https://twitter.com/arcancetin/status/556955812896444416 …","","","","780001259977859072","","","https://twitter.com/HilClin4WOPriso/status/780001259977859072",""
"Pthorn6A","2016-09-25-01:59",0,0,"Well, repubs said that the Orlando shooter's father's attending Clinton's rally made her a sympathizer. https://twitter.com/Eviljohna/status/779912565828747264 …","","","","779923138087903233","","","https://twitter.com/Pthorn6A/status/779923138087903233",""
"TweetBrettMac","2016-09-24-23:27",27,47,"Let's all keep an eye out for Arcan Cetin's father at the next Hillary Clinton rally. She invited the Orlando shooters father so why not?","","","","779884925164130304","","","https://twitter.com/TweetBrettMac/status/779884925164130304",""
"carpet_bomber","2016-09-24-15:31",3,1,"Orlando shooter's terrorist father Seddique Mateen -> 'Hillary Clinton For President' https://youtu.be/3z3LrOj3IL0","","","","779765319627714560","","","https://twitter.com/carpet_bomber/status/779765319627714560",""
"D_Plorable","2016-09-24-15:25",0,0,"Don King endorsed Obama, Clinton years past. OK then, bad guy now? Father of Orlando Gay club shooter held Clinton rally sign, OK?","","","","779763686097326080","779744945083129860","CNN","https://twitter.com/D_Plorable/status/779763686097326080",""
"kxMusic","2016-09-24-05:47",1,0,"Yeah & heartless BITCH invited the Orlando shooter's FUCKED FATHER! Hillary Rotten Clinton! Fall On Ur Face Mon Nite https://twitter.com/Ceromancyvisio1/status/779614681811988480 …","","","","779618301789908992","","","https://twitter.com/kxMusic/status/779618301789908992","https://pbs.twimg.com/media/CtG_awaUkAAt55r.jpg"
"mannysarmiento","2016-09-22-17:48",0,1,"Father Of Orlando Shooter Attended Hillary Clinton Rally:... http://fb.me/6K6Y7x7kL","","","","779074801663152128","","","https://twitter.com/mannysarmiento/status/779074801663152128",""
"GRCLeader1","2016-09-22-03:54",0,0,"Articles | Mail Online: The Latest: Father of Orlando shooter attends Clinton rally http://ranatex.com/plurk/?p=3253","","","","778864997250269184","","","https://twitter.com/GRCLeader1/status/778864997250269184",""
