username,date,retweets,favorites,text,geo,mentions,hashtags,tweetid,conversationid,replyto,permalink,imagelink
"omearan","2018-07-29-14:39",0,0,"Obama was exactly the same and he beat her. As a biracial man with middle name Hussein. The oppo research the Rs have on Bernie didn’t even begin to be used in 2016. Bernie will hand 2020 to Trump if he isn’t given the nomination on a silver platter. https://www.motherjones.com/politics/2015/07/bernie-sanders-vermont-freeman-sexual-freedom-fluoride/ …","","","","1023639241069342720","1022445693494063104","nataliathebug GlenGanaway","https://twitter.com/omearan/status/1023639241069342720",""
"Consensuslife","2018-07-29-12:52",0,1,"That along with a hefty dose of low turnout (voter suppression was rampant in 2016 for Indies), 9 mil Obama voters going for 45 (nice job, Cambridge Analytica!) and arousing the rage between HRC & Bernie supporters and you have a win. They are doing it again right now.","","","","1023612224261111808","1023598754597888002","TheJoker_really","https://twitter.com/Consensuslife/status/1023612224261111808",""
"AKADonaldTrump","2018-07-29-12:08",9,22,"I still cannot believe people are still using the 'what if Hillary or Democrats or Obama' rationale and still argue about Hillary and Bernie 2016 election. Focus on Trump people and the corruption. you lose me when you use these analogies for your argument.","","","","1023601200627961856","","","https://twitter.com/AKADonaldTrump/status/1023601200627961856",""
"DennisLeeuwenbu","2018-07-28-23:23",0,0,"Leading up to 2016 election, collection of political protests, by people of Obama coalition. Even of political rallies of Clinton protestors against Bernie Sanders, blacks and/or Mexicans--burning U.S. flags and such. White America--appease these groups, they'll get aggressive.","","","","1023408715578396672","","","https://twitter.com/DennisLeeuwenbu/status/1023408715578396672",""
"Don_TheCon","2018-07-28-15:06",0,0,"A must read thread&view video of 2016 election- Remember, it was head to head between Obama & McCain&NO 3rd party or Bernie around in 2008-Who supported 2016 shitshow of helpers from libertarians to Green Party, J.Stein? @ HillaryClinton @ FullFrontalSamB @ SenSchumer @ NancyPelosihttps://twitter.com/riotwomennn/status/1023201927272779780 …","","@ HillaryClinton @ FullFrontalSamB @ SenSchumer @ NancyPelosihttps","","1023283561602985984","","","https://twitter.com/Don_TheCon/status/1023283561602985984","https://pbs.twimg.com/ext_tw_video_thumb/1023201640763940864/pu/img/ZjojcD1od13_cL8t.jpg"
"edsingerrealty","2018-07-28-13:04",0,1,"I love Joe Biden, but can we find the 50 or 60 year old version. My biggest beef with 2016 is we were reverting generationally. Obama is my age. Both Trump and Hillary are older than my parents. (Bernie is even older).","","","","1023252909557829632","1022979870186385408","MsDayTwo","https://twitter.com/edsingerrealty/status/1023252909557829632",""
"pat_walsh54","2018-07-28-05:51",0,1,"Yeah and 90,000 less people voting in Detroit in 2016 then 2008 is all these bernie bros fault, not the fact that obama didn’t do anything rather than force people to pay for lack luster healthcare","","","","1023143844324540417","1022503451274694656","amargadaxo BethLynch2020","https://twitter.com/pat_walsh54/status/1023143844324540417",""
"WesHagerman","2018-07-28-02:05",0,0,"In 2008, more Clinton supporters refused to vote for Obama in the primary than Sanders supporters refused to vote for Clinton 2016. The Bernie or Bust scapegoat is a bad narrative that has many holes.","","","","1023087140639391750","1022982891175915520","jkirkok josejuanguy","https://twitter.com/WesHagerman/status/1023087140639391750",""
"Tristanshouts","2018-07-27-20:10",0,2,"And Bernie Sanders refused President Obama's request to concede the same day, 6/9/2016, that his campaign strategist's colleague in Ukraine Manafort was meeting to get 'dirt' meant to tank HRC's candidacy. Bonus: BS surrogate Michael Moore visited Assange the same day.","","","","1022997687853957120","1022996904936914945","Rteefact","https://twitter.com/Tristanshouts/status/1022997687853957120",""
"BethGoldHux","2018-07-27-13:42",0,4,"1. If Bernie had gotten the nom I would have worked for, donated to & voted Bernie 2. There’s enough blame for everyone, Bernie deserves his share 3. If Bernie had done for Hillary in 2016 what Hillary did for Obama in 2008 we would have won — even w/ Russia, Comey & misogyny","","","","1022899928438329345","964570074517528577","MicheleStruck MichelV69 Shakestweetz","https://twitter.com/BethGoldHux/status/1022899928438329345",""
"ClarenceMack3","2018-07-27-12:59",3,5,"So you missed Bernie's 2016 opportunity to fight Citizen United, secure gun control & abortion rights, with the SCOTUS vacancy ? As You know, scared Bernie ran underground as GOP McConnell snatched his advise & consent role on Obama pick Merick Garland.","","","","1022889289825378304","1019689063530614785","mark777day Larkspot","https://twitter.com/ClarenceMack3/status/1022889289825378304",""
"PatrickRuffini","2018-07-27-11:27",1,4,"The Fresh Face is someone people usually don't expect to run or who wasn't well-defined prior to the cycle whose entry generates a surge of media interest & attention that lets them leapfrog the mid-tier. High risk, high reward. Trump 2016, Bernie 2016, Obama 2008.","","","","1022866108175540225","1022693616328814593","","https://twitter.com/PatrickRuffini/status/1022866108175540225","https://pbs.twimg.com/profile_images/940683138006691842/n-29Nwdq_normal.jpg"
"GOTProSC","2018-07-27-11:20",0,0,"More Bernie people bit the bullet and voted for Hill in 2016, then Hill people did Obama in 2012 or 2008. If you say Jill stole Hill votes, Gary stole more from Trump then Jill did Hill. That's fact, however, can't steal what doesn't belong to you, she didn't earn the vote.","","","","1022864296332730368","1021463630259343360","ModernRetroRad1 PaulDeCristofo4 KyleKulinski","https://twitter.com/GOTProSC/status/1022864296332730368",""
"NickTheRampello","2018-07-27-09:38",0,0,"Also more Bernie voters voted for Hillary in 2016 than Hillary voters voted for Obama in 2008. 6-12% voted for Trump, compared to 24% that voted for McCain. https://www.washingtonpost.com/news/monkey-cage/wp/2017/08/24/did-enough-bernie-sanders-supporters-vote-for-trump-to-cost-clinton-the-election/?utm_term=.37509b1c0c25 …","","","","1022838698444959745","964570074517528577","NickTheRampello MichelV69 Shakestweetz","https://twitter.com/NickTheRampello/status/1022838698444959745",""
"HalMarshall2309","2018-07-27-09:38",0,0,"Absolutely. The disconnect between the broad economy & workers fueled a lot of the Trump & Bernie support in 2016. Workers' concerns haven't gone away. In fact, Trump sold them out with tax breaks for the wealthy & corps, & by undermining unions & reversing Obama overtime rules. https://twitter.com/econjared/status/1022833623635030016 …","","","","1022838570262953985","","","https://twitter.com/HalMarshall2309/status/1022838570262953985",""
"Aprile61446091","2018-07-27-09:11",0,4,"2012 Bernie also tried to primary President Obama. No use for 2012 Bernie, 2016 Bernie or 2020 Bernie.","","","","1022831831216017408","1022651679404158976","riotwomennn","https://twitter.com/Aprile61446091/status/1022831831216017408",""
"Tangueray41","2018-07-26-23:37",0,0,"Bernie supporters (affected by RU propaganda) were more likely to support Clinton in 2016 than Clinton Supporters (unaffected by RU propaganda) were to support Obama in 08 Might not go with your narrative but Bernie and Clinton supporters by and large liked each candidate","","","","1022687336927244288","1022631476674719745","worldout_42 gainesm","https://twitter.com/Tangueray41/status/1022687336927244288",""
"BeauInMaryland","2018-07-26-20:55",1,2,"Holy shit -- Eric Church is a Bernie guy! (Explaining the 'what if' reference -- he didn't vote in 2016. Bush '04, Obama '08, still backed Obama '12 but also did not vote then.) https://www.rollingstone.com/music/music-features/eric-church-desperate-man-nashville-country-700750/ …pic.twitter.com/Bf8Sr5tcjd","","","","1022646572071440384","1022645142329720832","","https://twitter.com/BeauInMaryland/status/1022646572071440384","https://pbs.twimg.com/media/DjErn4gU0AEw4B_.jpg"
"ScottNGibbs","2018-07-26-19:17",0,5,"It's about the numbers. The number of Bernie voters Hillary lost in 2016 was well within/below normal limits. Just look at how many of her supporters defected the Dems in 2008, but because Obama still won nobody talks about it. Blaming Bernie is just petty nonsense.","","","","1022621927599493120","1022611747998322692","susiemcdonnell","https://twitter.com/ScottNGibbs/status/1022621927599493120",""
"GretaHa70769949","2018-07-26-15:42",0,1,"4 April 2016: Bernie Sanders protests family separation under Obama. https://berniesanders.com/press-release/sanders-stop-separation-immigrant-children-families/ …","","","","1022567900178042885","","","https://twitter.com/GretaHa70769949/status/1022567900178042885",""
"KnowYourObama","2018-07-26-14:15",1,0,"It was my experience during the 2016 election on twitter that trump supporters KNEW russia was helping trump and that they were OK with that - esp cernovich, mek, prosobiec and that creepy bernie fan (I forgot his name). they also played up the dem divide","","","","1022546035204411392","","","https://twitter.com/KnowYourObama/status/1022546035204411392",""
"srm457","2018-07-26-12:55",0,0,"What the hell are you talking about? Remember when Obama won in 2008 with super delegates and HRC didn't fuss about it like a petulant child and then Bernie lost in 2016 and is continuing to fuss about it like a petulant child","","","","1022525716758450176","1022187288883879936","Wreck_A_Center rolandspaghetti","https://twitter.com/srm457/status/1022525716758450176",""
"SailingCarol","2018-07-26-12:32",0,0,"Obama/HIllary/NeverAgain Voters will NEVER vote 4 Sore Loser, Dem Back Stabber NRA Bernie Sanders! Dems LOATHE NRA Bernie! In 2016, Country REJECTED Bernie by 3,708.294 MILLION Votes. Bernie had 1 Endorsement from Own Colleagues. NOT 1 Former OR Present Governor Endorsed Bernie pic.twitter.com/vFI1wyahsc","","","","1022520007903899649","1022490345534357504","veggie64_leslie","https://twitter.com/SailingCarol/status/1022520007903899649","https://pbs.twimg.com/media/DjC4hfvX4AIaA2c.jpg"
"3cmc2010","2018-07-26-12:08",0,0,"For example obama using irs to target republicans? Fact.. u mean like obama lying about aca? Fact. U mean like dems deceiving dems and forcing Bernie out? Fact. U mean dems and possibly obama crating fake Russia story to spy on republicans and influence 2016 election???","","","","1022514014977449984","1018192269109755907","aliciaczechowsk ChrisVanHollen","https://twitter.com/3cmc2010/status/1022514014977449984",""
"rolandspaghetti","2018-07-26-10:42",0,2,"Huh??? I'm saying more people who voted Bernie, then went on to vote for Hillary in 2016, than did Hillary voters go on to vote Obama in 2008. Which is a fact.","","","","1022492345806278656","1022187288883879936","srm457 Wreck_A_Center","https://twitter.com/rolandspaghetti/status/1022492345806278656",""
"MikeHersh","2018-07-26-07:44",0,2,"Increasingly nasty scapegoating of innocents including # voters. That’s the problem with those who can’t blame those who are really responsible for Trump. Hint: campaigns can be no better than their candidate. HRC’s was not as good as Obama’s in 2008 or Bernie’s in 2016 either.","","","# voters","1022447672073043968","987348488567455745","PoliticsCourage OWS_ellie","https://twitter.com/MikeHersh/status/1022447672073043968",""
"WillHarahan","2018-07-25-23:35",0,1,"What I’m curious about? Places that went for Obama in 08/12, went for bernie in primary 2016, then went for trump in general, or turnout way down in general.","","","","1022324580860477446","1022319879519657984","WillHarahan DavidKlion","https://twitter.com/WillHarahan/status/1022324580860477446",""
"Eviljohna","2018-07-25-19:55",0,4,"Stop spreading Russian propaganda! They had MORE debates in 2016 than in any past primary, practically twice as many as she had with Obama. Bernie AGREED to the debate schedule. She even agreed to MORE when he later threw a fit. There is zero behind this ridiculous conspiracy","","","","1022269144882929665","1021979628410470406","tripleeee1682 powernicholas","https://twitter.com/Eviljohna/status/1022269144882929665",""
"Sup_Nukka","2018-07-25-18:33",11,97,"Bernie was an unknown in 2016 against perhaps the best known pol in the nation behind Obama. Now Bernie is consistently the most popular pol in America. You're in the minority. pic.twitter.com/FLjLEAnotY","","","","1022248585360945152","1021979628410470406","TinaMarie88888 Newsweek","https://twitter.com/Sup_Nukka/status/1022248585360945152","https://pbs.twimg.com/media/Di_BkXrVsAAvKHB.jpg"
"cgar40","2018-07-25-18:29",0,0,"Russia also attempted to aid Bernie Sanders and Jill Stein. Obama knew in September 2016 and ordered his administration to stand down, you moron. Trump was not yet President at that time.","","","","1022247566472359936","1020449753371496448","JacksonLeeTX18 POTUS","https://twitter.com/cgar40/status/1022247566472359936",""
"Helo1World4Ever","2018-07-25-17:08",1,1,"@ BobSMueller @ FBI @ CIA @ DNC @ SenSchumer @ SenWarren @ HillaryClinton @ RepMaxineWaters @ JacksonLeeTX18 Democrats believe, 'Without Barrack+Michell Obama+Bernie Sanders' Secret Helps, To Russia+KGB+Putin+GOP', (Putin+Trump+Sessions), would Not Win over Democrats+Hillary, in 2016. https://twitter.com/Helo1World4Ever/status/1022220562360422400 …","","@ BobSMueller @ FBI @ CIA @ DNC @ SenSchumer @ SenWarren @ HillaryClinton @ RepMaxineWaters @ JacksonLeeTX18","","1022227130653061120","","","https://twitter.com/Helo1World4Ever/status/1022227130653061120","https://abs.twimg.com/sticky/default_profile_images/default_profile_normal.png"
"Aither_Hyle","2018-07-25-14:26",0,0,"Tired argument. More Bernie supporters voted Hillary than Hillary PUMAs supported Obama. She was the second most racist candidate in 2016 behind trump.","","","","1022186280354869248","1021825263611588608","BerniedOut","https://twitter.com/Aither_Hyle/status/1022186280354869248",""
"EthanObama","2018-07-25-13:48",1,3,"Here is a lengthy 2016 article from @ JStein_WaPo aka JStein_Vox. In it, he cast aspersions on Hillary even though NOTHING she and the DNC did was illegal or improper. Bernie Sanders's accusation that Clinton is running a 'money laundering scheme, https://www.vox.com/2016/5/5/11581024/bernie-sanders-money-laundering-clinton?utm_campaign=vox&utm_content=entry&utm_medium=social&utm_source=twitter …","","@ JStein_WaPo","","1022176677655392256","","","https://twitter.com/EthanObama/status/1022176677655392256",""
"_William_Blake","2018-07-25-13:16",0,2,"Totally agree it damages his credibility. And of course the irony of 2016 is that the % of Bernie voters who ended up supporting HRC was higher than the % of her 2008 voters that voted for Obama - but naturally he still got blamed for her loss. Can't appease the unappeasable!","","","","1022168847351144448","1022146688000176129","WorldHistTess PaulSorrentino3","https://twitter.com/_William_Blake/status/1022168847351144448",""
"skipwiley11","2018-07-25-11:24",0,0,"Again...far more bernie people voted For clinton in 2016 then Clinton supporters voted Obama in 2008.","","","","1022140559086039040","1021992242406416386","katestarbird","https://twitter.com/skipwiley11/status/1022140559086039040",""
"DrinkLibertea","2018-07-25-02:33",0,0,"Dems will be sorely disappointed with Bernie. They should run Biden before Sanders, but he's not great either. Sounds like they're just cycling through the the rejects. That's all Hillary was in 2016. When she couldn't beat Obama for the nomination, she should have been finished.","","","","1022006982407086081","1021979628410470406","Newsweek","https://twitter.com/DrinkLibertea/status/1022006982407086081",""
"SemprePhi","2018-07-24-21:42",1,2,"They started with the narrative before November 2016 with 'poor Bernie' and the rigged primaries. This kept Obama on his heels and dependent on McConnell to out # TrumpRussia.https://twitter.com/Amy_Siskind/status/1021825747101659138 …","","","# TrumpRussia","1021933786681016321","","","https://twitter.com/SemprePhi/status/1021933786681016321",""
"outlazymedia","2018-07-24-20:47",0,0,"Saw you on @ chrislhayes. Appreciated your analysis. You probably know Clinton beat Obama in 2008 in the WV primary. Bernie beat Hillary in 2016 as you discussed. Vox explains why. WV was an anomaly and younger voters were enthused by Bernie's message. https://www.vox.com/2016/5/11/11652234/hillary-clinton-west-virginia …","","@ chrislhayes","","1021919873230888960","1020695285348085760","briebriejoy Ocasio2018 SenSanders","https://twitter.com/outlazymedia/status/1021919873230888960",""
"i314159265","2018-07-24-16:41",0,0,"October 15, 1991 I decided to leave the Democratic Party when Democrats put Clarence Thomas on the US Supreme Court. Dennis Kucinich brought me back in 2004. Barack Obama caused me not to vote in 2012. Bernie brought me back in 2016. https://twitter.com/Collins_Resist/status/1021563360498929674 …","","","","1021857998883512321","","","https://twitter.com/i314159265/status/1021857998883512321","https://pbs.twimg.com/media/Di1SXfMU0AADSUh.jpg"
"BackFromDeadRed","2018-07-24-15:57",0,1,"I didn't last time, won't again. Things have to change, before they can change... One thing, I think, is Bernie TV. He won't be dependent on the MSM. I think Bernie was told of Russian election interference June 2016 in that meeting with Obama and McConnell.","","","","1021846920375889920","1021845109413834752","JaytonThaMac cenkuygur SenSanders","https://twitter.com/BackFromDeadRed/status/1021846920375889920",""
"ChuxRaymond","2018-07-24-15:48",0,0,"I also feel that 2016 was the WRONGEST of times to invite Bernie on to the bandwagon. The signs were there that the most crucial election year I've ever seen would be a backlash vote against the progressive social gains made under Obama, and Herr Hair was the megaphone.","","","","1021844685600501760","1021715688250126337","OfficialSPGB marc_lotter","https://twitter.com/ChuxRaymond/status/1021844685600501760",""
"elva_morris","2018-07-24-15:05",1,9,"“1. Hillary Clinton 200 campaign stops for Pres Obama 2. Hillary Clinton endorsed President Obama on June 7th, 3 days after the primary ended 3. 18M voted for Hillary Clinton in 2008, 13M voted for Bernie in 2016, numbers matters, 20% of BS supporters went to Trump & 3rd party”","","","","1021833709929091072","1021479724856631298","lotta_niko wecreatedhim","https://twitter.com/elva_morris/status/1021833709929091072",""
"MrDane1982","2018-07-24-15:01",5,32,"1. Hillary Clinton 200 campaign stops for Pres Obama 2. Hillary Clinton endorsed President Obama on June 7th, 3 days after the primary ended 3. 18M voted for Hillary Clinton in 2008, 13M voted for Bernie in 2016, numbers matters, 20% of BS supporters went to Trump & 3rd party https://twitter.com/lotta_niko/status/1021546996451172352 …","","","","1021832824280829953","","","https://twitter.com/MrDane1982/status/1021832824280829953",""
"DianaFinch","2018-07-24-14:28",1,0,"Yes. And so many of those under-40 voters registered as Democrats 1) to vote for Obama in 2008 2) to vote for Obama in 2012 and 3) to vote for Bernie in 2016. Check out their voter registration dates. https://twitter.com/hodgesmr/status/1019025216364638209 …","","","","1021824419096875008","","","https://twitter.com/DianaFinch/status/1021824419096875008","https://pbs.twimg.com/media/DiRN0faU8AE2wUc.jpg"
"KayWarr14490694","2018-07-24-11:57",0,0,"But Obama was the 1 meddling in the 2016 election! He got what he wanted. He hates Hillary & put Bernie in place thinking he'd win the dem nod & got close. He never dreamed you'd win. He underestimated you & US! We knew from day 1 you'd win. You're a winner!","","","","1021786405700358156","1021784726217142273","realDonaldTrump","https://twitter.com/KayWarr14490694/status/1021786405700358156","https://abs.twimg.com/emoji/v2/72x72/1f1fa-1f1f8.png"
"joyce_tyler","2018-07-24-11:45",0,1,"Warren distancing herself from socialism&sounding more like HRC 2016,because she's realized that Bernie hardliners won't vote for her even if she wins the primary because (all together now): 'She's-not-Bernie.' And she needs Obama-Clinton coalition &repub women defectors to win.","","","","1021783419800281088","1021779836006748162","notcapnamerica","https://twitter.com/joyce_tyler/status/1021783419800281088",""
"JohnLockesKnife","2018-07-24-09:40",0,46,"Ellison was the best candidate, the one who shares most of Bernie's values, it's why he had endorsed him & why Bernie wanted him as DNC Chair. Ellison declared on Nov 11, 2016 and then, weeks later, Perez declared, and LOL at the idea Obama made 'a weird blunder' endorsing Tom","","","","1021751971781521408","1021551609195782149","mattyglesias","https://twitter.com/JohnLockesKnife/status/1021751971781521408",""
"steakhousegirl","2018-07-24-06:30",0,3,"Back in 2016 4 top economists (former Clinton & Obama advisors) wrote a letter stating how unrealistic, dangerous & undemocratic Bernie’s plans were. That hasn’t changed.","","","","1021704048846798848","1021637519883096069","Ange_Amene marcushjohnson","https://twitter.com/steakhousegirl/status/1021704048846798848",""
"BRGooley","2018-07-24-03:43",0,0,"Yup. He endorsed Obama in 2008, and Bernie in 2016, and stumped for both in Iowa too: Muslim Voters Detect a Snub From Obama https://nyti.ms/2mFL5wN","","","","1021662052165791745","1021649175816167424","MitchellCares CarlBeijer","https://twitter.com/BRGooley/status/1021662052165791745",""
"JamesDubhthaigh","2018-07-24-00:46",0,2,"President Obama won two landslides. Bernie lost by 4M votes, his 2016 campaign manager is tied to Paul Manafort, and he refuses to release his tax returns.","","","","1021617707714834432","1021095243918315520","Pernellius HoarseWisperer BernieSanders","https://twitter.com/JamesDubhthaigh/status/1021617707714834432",""
"ScottNGibbs","2018-07-23-20:11",0,18,"Fact: More Bernie supporters voted for Hillary in 2016 than Hillary supporters voted for Obama in 2008. But no one talks about that because Obama ran a competent campaign and won (against a much more popular opponent, btw). Take your phony calls for unity and shove 'em.","","","","1021548285356589056","1021479724856631298","wecreatedhim KateAlex1984","https://twitter.com/ScottNGibbs/status/1021548285356589056",""
"lotta_niko","2018-07-23-20:05",2,42,"Fact: Bernie campaigned more for Hillary than she did for Barack. Fact: More Sanders voters went for Clinton in November 2016 than Clinton voters went for Obama in 2008.","","","","1021546996451172352","1021479724856631298","wecreatedhim KateAlex1984","https://twitter.com/lotta_niko/status/1021546996451172352",""
"legal4all2016","2018-07-23-17:20",0,0,"Mmmm no just because Obama’s closed his eyes doesn’t mean anything improved Bernie. And if all your sudden interest means another run for POTUS, don’t you think you should check with Hillary first? I mean it’ll save you a lot of embarrassment unlike last time","","","","1021505313068015616","1021487980450643968","SenSanders","https://twitter.com/legal4all2016/status/1021505313068015616",""
"JustinYantis","2018-07-23-16:20",0,1,"I really hope someone catches a wave like Obama did. I’m just afraid of seeing 2016 battle lines form with Bernie and Biden on either side. With the winner eventually losing because his party is deflated while Trump’s is energized.","","","","1021490190945271814","1021406995331665920","SACarrow GothamGirlBlue","https://twitter.com/JustinYantis/status/1021490190945271814",""
"mystomachhertz","2018-07-23-10:17",0,2,"Everybody did the second one last time if they voted, it just didn't matter because 'the dem' didn't campaign in specific states that lost them the election. Bernie supporters voted for Hillary in 2016 more than Hillary supporters voted for Obama in '08.","","","","1021398808486240261","1021268247046262784","RheaButcher","https://twitter.com/mystomachhertz/status/1021398808486240261",""
"AmyDouglasSings","2018-07-23-09:33",0,0,"I'd vote for Biden, but...I wouldn't be thrilled about it for the same reasons re Bernie and 'new blood.' Biden is also a gaffe machine and he lost momentum when he didn't run in 2016 right after Obama and two incumbencies.","","","","1021387936921804800","1021383302027055104","blackmadonnachi","https://twitter.com/AmyDouglasSings/status/1021387936921804800",""
"pdxusr","2018-07-23-02:11",0,0,"People got upset in 2008 when Hillary stayed in the race after Obama had clearly pulled ahead, and I was among them. People also got upset in 2016 when Bernie stayed in the race after Hillary had an insurmountable lead for months, and I was among them.","","","","1021276597406461952","1020751279843246081","Queeroolant AnnRCY","https://twitter.com/pdxusr/status/1021276597406461952",""
"Viscous_cree","2018-07-23-01:39",0,1,"Obama lost the popular vote in the 2008 primary. Popular vote in primaries are meaningless due to the widely variable voting methods in each state Nobody brought up popular vote totals for primaries until Hillary stans in 2016-present wanted to shout down Bernie supporters","","","","1021268666350854144","1021080180628992000","TerriakiSan nataliathebug","https://twitter.com/Viscous_cree/status/1021268666350854144",""
"tacp38_david","2018-07-22-21:26",0,0,"Bernie Sanders press release dated 4th April 2016 - A message to Obama to stop the forced separation of children from their families......Oh the silence back then was deafening.....","","","","1021204912078708736","1021007110719410177","piersmorgan","https://twitter.com/tacp38_david/status/1021204912078708736",""
