username,date,retweets,favorites,text,geo,mentions,hashtags,tweetid,conversationid,replyto,permalink,imagelink
"worldout_42","2018-07-19-15:05",0,1,"Conflating 2008 when Hillary got 48% of the vote to Obama’s 48.1% of vote to 2016 when Bernie lost by >12% nationally and refused to concede for month is dishonest. And link to Bernie conceding before convention? His campaign manager said they’d try to steal w delegates at conv.","","","","1020021809591115776","1019970082812940289","eyeofthephantom HoarseWisperer rd_demeny","https://twitter.com/worldout_42/status/1020021809591115776",""
"RanLearns","2018-07-19-14:38",0,0,"Also, many of the Democrat voters we lost were Obama supporters. Obama's voters didn't come out to vote for Hillary in nearly the same numbers. A higher percentage of Bernie primary voters went on to vote for Hillary in 2016 than the percentage of Obama voters which voted for her","","","","1020014959353311234","1016736896595177474","RanLearns fabiansociety","https://twitter.com/RanLearns/status/1020014959353311234",""
"funkomavintage","2018-07-19-14:00",0,0,"Let's Remember that Obama Did Not think Russia was a huge threat in 2012. Said so in v Romney debate. Explaining Bernie, Politico article from Jan 2016: https://www.politico.eu/article/5-things-europeans-must-know-about-bernie-sanders-us-2016-clinton/ …","","","","1020005394498838529","1019995658311233537","","https://twitter.com/funkomavintage/status/1020005394498838529","https://pbs.twimg.com/profile_images/510224346032263168/Jrv5fymz_normal.jpeg"
"jokinandtokin","2018-07-19-10:57",0,2,"So where would one go to get stuff to poison ex-spies...let me guess....Hillary killed those russian spies? Obama did? No wait...it was probably bernie, or China.","","","","1019959465649561600","999376320411955200","ACarpentersLife InflationF","https://twitter.com/jokinandtokin/status/1019959465649561600",""
"landonjordan19","2018-07-19-09:01",0,1,"Breaking News: President Putin releases identity of Russian spies who influenced & rigged the 2016 election... Barack Hussein Obama Hillary Rodham Clinton Debbie Wassaman Schultz Donna 'Burn Bernie' Brazile John 'Pedo' Podesta Susan Rice Valerie Jarrett Main Lame Stream Media","","","","1019930136987172864","1019929906455642113","CNNPolitics","https://twitter.com/landonjordan19/status/1019930136987172864",""
"NoFortunate","2018-07-19-09:00",0,5,"@ matthewt_ny I’m pretty sure Obama voted for Hillary in 2016. How many in the @ VICE newsroom voted for @ DrJillStein or wrote in Bernie?","","@ matthewt_ny @ VICE @ DrJillStein","","1019929983165386753","1019653418258968578","matthewt_ny","https://twitter.com/NoFortunate/status/1019929983165386753",""
"MichaelHargrov1","2018-07-19-06:26",4,11,"Newest stupid meme from Bernie's Left is that Pres. Obama should have canceled the 2016 election. Really. How was he supposed to do that, declare martial law? You people will do anything not to accept responsibility for your screwups and gullibility.","","","","1019891262621708293","","","https://twitter.com/MichaelHargrov1/status/1019891262621708293",""
"AbsurdWeb","2018-07-19-05:58",0,0,"Obama knew about it in March 2016. The @ DNC sandbagged Bernie to get Hillary in...talk about election interference! Russians have always tried to interfere. # hypocrites","","@ DNC","# hypocrites","1019884070594076673","1019739331437703168","TheDemocrats","https://twitter.com/AbsurdWeb/status/1019884070594076673",""
"mzkillakim1","2018-07-19-00:40",0,0,"Russian spies who influenced & rigged the 2016 election... Barack Hussein Obama Hillary Rodham Clinton Debbie Wassaman Schultz Donna 'Burn Bernie' Brazile John 'Pedo' Podesta Susan Rice Valerie Jarrett Main Lame Stream Media # WalkAway","","","# WalkAway","1019804136064233472","","","https://twitter.com/mzkillakim1/status/1019804136064233472",""
"ben_geier","2018-07-19-00:14",2,5,"I know relitigating the 2016 primary is dumb, but the thread is dope in that it shows HRC’s 2008 campaign against Obama was EXACTLY the racist dog whistle of a campaign some accuse Bernie of running. https://twitter.com/unabanned/status/1019339684156190721 …","","","","1019797670129487873","","","https://twitter.com/ben_geier/status/1019797670129487873","https://pbs.twimg.com/media/DiVryH3U8AAYa66.jpg"
"LRFalstad","2018-07-18-22:32",0,0,"It almost sounds like Obama is running for office again. Would he prefer that woman being Hillary. You know, the gal who rigged the 2016 presidential primaries against Bernie Sanders. Obama knew about that and didn't do anything .","","","","1019771942801268736","1019713461142671361","thehill","https://twitter.com/LRFalstad/status/1019771942801268736",""
"LRFalstad","2018-07-18-21:13",0,0,"Where was U.S. democracy when the DNC & Hillary camp rigged the 2016 presidential primaries against Bernie Sanders? Where was Obama?","","","","1019752146743390210","1019572996783132672","ABC","https://twitter.com/LRFalstad/status/1019752146743390210",""
"mopinkodu","2018-07-18-18:55",0,1,"ftr, tho, many on the left are assholes. today it's russia, but ya shoulda seen the hillary/bernie wars. and before that the hillary/obama wars. always trolls there to stoke the fires, tho. always. btw, we were hacked hard on election day 2016. we are a target.","","","","1019717233268883456","1019715427952414728","Stonekettle","https://twitter.com/mopinkodu/status/1019717233268883456",""
"the_bernie_bro","2018-07-18-15:57",0,0,"More people that voted for Hillary in the 2008 primary ended up voting for McCain than did Bernie Voters in 2016 go to anyone but Hillary. Yet Obama still won? Stop blaming me for how I vote. Blame the candidate for failing to earn my vote.","","","","1019672411862577152","1019251128410599425","shoreboy1961 1mfd","https://twitter.com/the_bernie_bro/status/1019672411862577152",""
"CarmWolfe","2018-07-18-14:31",0,0,"Nationalism & Patriotism in action is the only thing that matters & Obama & Hillary didn’t understand this which is indeed y they were crushed in 2016. 63 Million “US Citizens” spoke including Bernie supporters. 18 and older 10 to 12k a yr 0-75k US Citizens. # news # truth","","","# news # truth","1019650769169993728","","","https://twitter.com/CarmWolfe/status/1019650769169993728",""
"Vegetar_Ian","2018-07-18-14:09",0,0,"This is an incredibly lazy and stupid narrative. Black voter turnout dropped over 5% in 2016 from 2012. But that’s definitely the fault of the Bernie Bros, not the candidate who ran a primary campaign to suggest she was more American than Barack Obama in 2008. https://twitter.com/zerlinamaxwell/status/1019240101958873088 …","","","","1019645394291232768","","","https://twitter.com/Vegetar_Ian/status/1019645394291232768","https://pbs.twimg.com/profile_images/904892589475815424/mIKzn_wD_normal.jpg"
"rawideasinc","2018-07-18-13:11",0,0,"That money followed Bill Clinton Obama 2008 and Yes Bernie 2016 average 27 $ private money. Libertarians are cannabis loving isolationists Occupy supporters but none of that was in HRC message and 2008 is the root of the case David. 3 trillion lost in Leman 401ks ect is bcz of","","","","1019630799635836930","1019365346027769856","davidhogg111 Hezzah","https://twitter.com/rawideasinc/status/1019630799635836930",""
"LRFalstad","2018-07-18-01:39",0,0,"'elections & some pretense of democracy are maintained'. Where was Obama when the DNC & Hillary camp rigged the 2016 presidential election primaries against Bernie Sanders? He also said 'those in power seek to undermine every institution or norm that gives democracy meaning.'.","","","","1019456614221340672","1019451671078887424","ABC","https://twitter.com/LRFalstad/status/1019456614221340672",""
"BlueiisChris","2018-07-17-21:47",0,0,"Of all the meddling in 2016 from Bill and Lynch on the tarmac, DNC freezing Bernie out, Comey Strzok Page and McCabe’s Operation “Insurance Policy”, Obama ignoring Russian meddling .. the actual Russian interference was probably the least meddling... @ POTUS is right!","","@ POTUS","","1019398312657588224","1019391101940224002","brithume","https://twitter.com/BlueiisChris/status/1019398312657588224",""
"JohnDoe46686384","2018-07-17-21:26",0,0,"@ POTUS @ realDonaldTrump @ IngrahamAngle @ TuckerCarlson @ seanhannity @ LouDobbs @ TeamCavuto @ RealJamesWoods @ MariaWallStreet DNC and Obama had no problem with the fixing democratic primaries against Bernie or Russian interference in 2016. DNC and Obama were FAR more effective..","","@ POTUS @ realDonaldTrump @ IngrahamAngle @ TuckerCarlson @ seanhannity @ LouDobbs @ TeamCavuto @ RealJamesWoods @ MariaWallStreet","","1019392849593454593","","","https://twitter.com/JohnDoe46686384/status/1019392849593454593","https://abs.twimg.com/sticky/default_profile_images/default_profile_normal.png"
"john_becker","2018-07-17-20:07",0,0,"You know who else meddled in 2016. Obama - gave stand down order to cyber security even though he knew Russians were meddling. HRC - meddled in democratic primaries, screwing over Bernie.. and then the fake dossier","","","","1019372974598598656","1018955906690584576","john_becker JodhiSharke","https://twitter.com/john_becker/status/1019372974598598656",""