username,date,retweets,favorites,text,geo,mentions,hashtags,tweetid,conversationid,replyto,permalink,imagelink
"Sweet_Trade_Dug","2018-07-22-20:23",0,2,"By far more Bernie supporters voted for Hillary than Hillary supporters voted for Obama in 2008, and yet Obama got over 4 million more votes in 2008 than Hillary got in 2016. He did that while being painted as a muslim/communist and with 20 million fewer eligible voters in the US","","","","1021188988277874695","1021137286086340609","revmackd10 banditelli ShaunKing","https://twitter.com/Sweet_Trade_Dug/status/1021188988277874695",""
"WinningWordsPro","2018-07-22-19:19",1,7,"My God, these people are stupid. @ JeffDanielson 'represents an area that saw one of the biggest swings from Barack Obama to Trump' but can't figure out WHY! They both ran on health care , Fair Trade, and better-paying jobs! Everyone else but BERNIE ran on the opposite in 2016! https://twitter.com/ryangrim/status/1021063505959669760 …","","@ JeffDanielson","","1021172899623796736","","","https://twitter.com/WinningWordsPro/status/1021172899623796736",""
"Aravine","2018-07-22-18:55",0,5,"Stop repeating the Russian disinformation about misogynist Bernie Bros. More Bernie supporters voted for Hillary in 2016 than Hillary supporters did for Obama in 2008.","","","","1021166829274738688","1021139079335895040","388shark Ocasio2018","https://twitter.com/Aravine/status/1021166829274738688",""
"politicsluo","2018-07-22-18:34",0,2,"A significantly higher % of Bernie Sanders voters voted for Hillary Clinton in 2016 than the % of Hillary Clinton voters that voted for Obama in 2012. Add on top of that a lot of people don’t even know what the term “liberal” means","","","","1021161535039778816","1021144283611475968","Polit_eur","https://twitter.com/politicsluo/status/1021161535039778816",""
"1040joyce","2018-07-22-18:10",0,0,"Corrupt like how? The DNC doesn’t even take care of their own. They screwed Bernie 6 ways to Sunday. The Russia meddling happened in 2016 under Obama who did nothing","","","","1021155466607407105","1021118123213287432","HelenArmstrong5 FoxNews AlanDersh","https://twitter.com/1040joyce/status/1021155466607407105",""
"jwlewis4262","2018-07-22-17:30",0,0,"ALD, I think Hillary's messaging was right on point in 2016 both domestically and on foreign policy. If it was Obama, he would have won by 10 mil instead of 3, but won landslide in EC, and yes, Bernie would have lost both. We need a reasonable voice in a sea of chaos now. # FWIW","","","# FWIW","1021145584730718210","1021140565147226113","ashleyfeinberg","https://twitter.com/jwlewis4262/status/1021145584730718210",""
"dasukocho","2018-07-22-17:19",0,0,"RNC cheated Ron Paul in 2008 (he had the best chance to beat Obama that election of the Rep candidates) and DNC cheated Bernie Sanders in 2016 (best chance to beat Trump of the Dem candidates). Cheaters never win and we all pay for their games.","","","","1021142635153539074","1021124892329201665","dasukocho addamschloe","https://twitter.com/dasukocho/status/1021142635153539074",""
"ExGOPer","2018-07-22-17:09",0,2,"Fact: a higher percentage of Bernie voters voted for Hillary in 2016 than Hillary voters voted for Obama in 2008.","","","","1021140233730052098","1021132108381683712","PuestoLoco Comey","https://twitter.com/ExGOPer/status/1021140233730052098",""
"isaacbyrne","2018-07-22-17:00",0,0,"Yeah I know all that. I know. But they backed off the government option under obama. Hillary didn’t go full after it in 2016 till bernie surged forward.","","","","1021137818561761280","1021075930989703169","TerencePlumb Ocasio2018","https://twitter.com/isaacbyrne/status/1021137818561761280",""
"davidschraer","2018-07-22-14:49",0,0,"Clinton's policies in 2016 did not reflect this list. Walmart? Clinton and Obama caved. Medical/pharmaceutical industries? Clinton and Obama caved. Financiers that caused the Great recession? Clinton and Obama caved. The list is all Bernie, not Dem Party.","","","","1021104864623906816","1021074150935457799","Yascha_Mounk","https://twitter.com/davidschraer/status/1021104864623906816",""
"GyariSan1138","2018-07-22-13:18",0,0,"One of the things I think about in the 2016 election is that both Hillary & Bernie tried way too hard wanting to be 08 Obama. It's really difficult to try to recapture the same kind of lightning in a bottle his campaign was back then. Even Obama in 2012 couldn't do it completely.","","","","1021082079767953408","1021055833147260933","the_moviebob","https://twitter.com/GyariSan1138/status/1021082079767953408",""
"tchayes27","2018-07-22-10:50",1,9,"I was beyond pissed when Hillary was literally shoved aside for Obama but being a good Dem, I voted for him in 08 and again in 12. In 2016 I expected Dems to vote for HRC and even with being berated & attacked by Bernie backers, the media & the GOP, she still won our district.","","","","1021044943920431104","1020455619977990144","BryanLowry3","https://twitter.com/tchayes27/status/1021044943920431104",""
"sandrasandraphd","2018-07-22-10:24",0,0,"I agree, but imo the circular firing squads are a product of the 2016 campaign. Obama ran twice there wasn't much discord among Dems, at least at the national level. We need another charasmatic person like him who can speak to all Dems. Bernie & HRC were too differnent.","","","","1021038345529561089","1020875269626908673","JWadeTaylor","https://twitter.com/sandrasandraphd/status/1021038345529561089",""
"DrewFrogger","2018-07-22-09:11",0,1,"Hey man there’s no point in discussing this at all but way way more Hillary voters flipped to McCain in08 than Bernie voters did in 2016. Like there was a whole movement to do so. Hillary said McCain was more qualified than Obama. She was really bad for America for a long time","","","","1021019844311994369","1020761778794450944","toddpharris","https://twitter.com/DrewFrogger/status/1021019844311994369",""
"EdInTheTropics","2018-07-22-08:32",0,0,"Obama also lost to Hillary in the popular vote in 2008. But Hillary had to cheat in 2016 against Bernie otherwise she would never get the nomination. And Obama helped her doing so. Fact: Democratic leadership is a bunch of scum, lying crooks who will do anything to stay in power.","","","","1021010077904523265","1020984152357777408","Milvio_Diaz realDonaldTrump","https://twitter.com/EdInTheTropics/status/1021010077904523265",""
"kumportho","2018-07-22-06:42",0,0,"Where was his parties strength when we needed it in 2016? Obama, Brennan , Clapper, and Comey were in charge and failed the American ppl. Nice try and shut up Bernie!","","","","1020982516394622978","1020698666280112131","FoxNews BernieSanders","https://twitter.com/kumportho/status/1020982516394622978",""
"TB12forLife","2018-07-22-02:35",0,0,"Bernie never raised a single finger before the 2016 election when Russia was trying to meddle and Obama administration did absolutely ZERO about it. He didn’t even really complain about Hillary screwing him in the Dem primary. Why do you think that is?","","","","1020920298638585856","1020722754956472320","FaceTheNation SenSanders margbrennan","https://twitter.com/TB12forLife/status/1020920298638585856",""
"jodienewman93","2018-07-21-23:36",0,0,"Bernie is the most popular politician in the country. Everyone you listed is part of the establishment, will be another Obama, which is what led to Trump. And Bernie would of won the nom 2016 if the DNC didn’t rig the elections so that the most unpopular candidate ever could win.","","","","1020875232582815744","1020511297555910658","Goss30Goss","https://twitter.com/jodienewman93/status/1020875232582815744",""
"DonaldMBraden","2018-07-21-20:13",0,0,"What scenario is that? 2016 when at most 12% of the Bernie voters did not vote Clinton or 2008 when about 25% of the Clinton voters did not vote Obama? 2016 saw a surprisingly high percentage of voters for a losing primary candidate vote for the person that beat them actually.","","","","1020824162942832640","1019957935550681088","jwmcapesbklyn Folon15","https://twitter.com/DonaldMBraden/status/1020824162942832640",""
"Philolaus1","2018-07-21-20:00",0,0,"Putin has nothing to do with the Votes that Americans casted in 2016. Trump is president because Obama was a tremendous let down, and NO ONE likes Hillary, not to mention the DNC piedpiperd Trump into office and threw Bernie under the bus.","","","","1020820934989697025","1020809161775362048","emuirhead NPR","https://twitter.com/Philolaus1/status/1020820934989697025",""
"NathanDThorp","2018-07-21-19:40",0,1,"1. Lost in primary to a relatively unknown # Obama in 2008 2. 2016 - Rigged primaries against Bernie. Then cheated in the presidential debates 3. Still managed to lose the election to Donald fucking Trump 4. Blamed everyone else for the loss. @ HillaryClinton you are amazing","","@ HillaryClinton","# Obama","1020815855385395202","","","https://twitter.com/NathanDThorp/status/1020815855385395202",""
"KenJones707","2018-07-21-18:58",0,7,"Uh, the split long predated 2016...it’s just that Hillary supporters are so clueless that they weren’t even aware of the split UNTIL 2016. Also, Bernie’s supporters voted for HRC in overwhelming numbers. Much more so than HRC supporters in 2008 voted for Obama.","","","","1020805341020401666","1020764655671824384","rainyjoan tobyrust jfreewright","https://twitter.com/KenJones707/status/1020805341020401666",""
"mikestill","2018-07-21-18:43",0,0,"This is such a garbage tweet. Bernie supporters supported Hillary at 94% in 2016 in contrast to Hillary supporters who supported Obama at 75% in 2008.","","","","1020801491299315712","1020765126968786944","doc_next latchkeykidd deray","https://twitter.com/mikestill/status/1020801491299315712",""
"abogadozac","2018-07-21-18:08",0,42,"Pathetic that so many ppl can’t get passed 2016 elections. More Bernie primary voters voted for HRC in the gen election than HRC supporters voted for Obama in previous fight. Get over yourselves there is no cult of Bernie personality — he has always been about the issues","","","","1020792735031341057","1020765531052429312","jfreewright","https://twitter.com/abogadozac/status/1020792735031341057",""
"BlueSteelDC","2018-07-21-17:08",4,10,"Bernie had a higher percentage of less voters. Overall in 2016 less young voters - voted in general to produce the results we had. Obama w/ 6 million more voters had a higher raw vote total","","","","1020777468548952064","1020528270394167297","BravenakBlog","https://twitter.com/BlueSteelDC/status/1020777468548952064",""
"flugennock","2018-07-21-16:27",0,0,"My thoughts are JEEzus H.W. Christ, am I glad I'm not the only person thinking this. In fact, I think Bernie's been dead since at least June 2016. Hillary's working the mouth, and Obama's doing the voice: http://sinkers.org/stage/?p=1979 pic.twitter.com/iLyogP7M0Y","","","","1020767309999366144","1020737616235278341","ghionjournal","https://twitter.com/flugennock/status/1020767309999366144","https://pbs.twimg.com/media/Dip-XnYX0AAkV71.jpg"
"RobertKleinsch8","2018-07-21-13:27",0,0,"That question would have been better asked to Obama with his economy & how his inept Intel handled the Russian intrusion the 2016 election. Little late to ask that question now Bernie","","","","1020721936693956608","1020698666280112131","FoxNews BernieSanders","https://twitter.com/RobertKleinsch8/status/1020721936693956608",""
"SailingCarol","2018-07-21-11:51",1,1,"NRA Bernie Sanders was REJECTED by 3,708.294 MILLION VOTES in 2016. Even Trump as R beat Bernie by over 809 K votes.Bernie can’t win Primary. Bernie will NEVER get votes of Obama/Clinton/NeverAgain/POC Votes in 2020. We will BURY Bernie in 2020 Primary! We know U Sabotaged HC pic.twitter.com/HPzMFy9qlC","","","","1020697807051804672","1020389346795499525","deathandraven OneWhoAddsLight","https://twitter.com/SailingCarol/status/1020697807051804672","https://pbs.twimg.com/media/Dio_PbzU0AAiX7i.jpg"
"hiddenmesulo","2018-07-21-11:35",0,1,"Yeah. I was there in 2008 when Obama shouted 'CHANGE IS HERE!' & I saw Trump say 'AMERICA IS GREAT AGAIN' in 2016. Wonder if both of those things happened while we were getting screwed because it's hard to see any effect of those 'changes' right now.","","","","1020693639918366722","1020609573563060224","the_bernie_bro ejtwister","https://twitter.com/hiddenmesulo/status/1020693639918366722",""
"SailingCarol","2018-07-21-11:31",0,0,"Bernie Sanders will never get the votes of Clinton/Obama/NeverAgain/POC Voters! Ocasio-Cortez-Cortez (Bartender) is a Democratic Socialist who worked for the Deceitful Bernie Sanders Campaign in 2016! pic.twitter.com/OwRzV3lgty","","","","1020692719407108096","1020389346795499525","deathandraven Sarah_Smarsh","https://twitter.com/SailingCarol/status/1020692719407108096","https://pbs.twimg.com/media/Dio6nEeX4AAx-n8.jpg"
"MandDsMomSONJ","2018-07-21-11:29",0,0,"When HRC lost the nomination to Obama, she supported and campaigned for him much more effectively compared to how Bernie supported her in 2016.","","","","1020692193428766720","1020478098494672896","drogon_dracarys","https://twitter.com/MandDsMomSONJ/status/1020692193428766720",""
"Dave_Attewell","2018-07-21-10:32",0,0,"There's been this re-imagining of history that the 2016 primary was particularly nasty. Obama vs. Hillary was worse, led to more vote splitting. Hillary literally said she was proud of the primary campaign her and Bernie had run, that it had been policy-based and not personal.","","","","1020677948700061696","1020411440308645888","elva_morris tomwatson","https://twitter.com/Dave_Attewell/status/1020677948700061696",""
"SugarDishFairy","2018-07-21-10:28",0,0,"You forget that Hillary supporters came out in droves for Obama in 2008. Fact. People don’t want Bernie Sanders to be president. He didn’t have the votes in 2016 and he won’t have them in 2020.","","","","1020676794662424581","1020387483836706817","kavl ShaunKing MichelleDealZim","https://twitter.com/SugarDishFairy/status/1020676794662424581",""
"_brohan_","2018-07-21-08:49",0,0,"It's a primary race, there's always attacks. Clinton attacked Sanders & vice versa. But 2016 was a lot tamer than 2008. In 2008, Clinton ran a racist campaign against Obama, & justified staying in the race by saying he might get assassinated, worse than anything Bernie did.","","","","1020651997199028224","1020447912487280648","RussRay1 PuppyCatFan BrentWelder","https://twitter.com/_brohan_/status/1020651997199028224",""
"FelixKnowsNFL","2018-07-21-03:59",0,0,"He should’ve beat him in 2016. I want to know what Obama told him in that meeting right before Bernie dropped out of the race.","","","","1020578907735511042","1020387483836706817","ShaunKing","https://twitter.com/FelixKnowsNFL/status/1020578907735511042",""
"BravenakBlog","2018-07-21-00:40",18,193,"I refuse to look it up because I am waiting for these claimants to show some evidence of increased youth voting the the 2016 primary versus the 2008 primary. If they are incorrect, then that means we do not need Bernie to bring them out. We need Obama.","","","","1020529027700920320","1020528270394167297","","https://twitter.com/BravenakBlog/status/1020529027700920320","https://pbs.twimg.com/profile_images/965951298540519424/6Q2qhBLH_normal.jpg"
"BravenakBlog","2018-07-21-00:37",117,858,"Hi. I need some evidence that Bernie brings out more young voters. I am told that this is his magic power. For some reason I thought Obama brought more young voters out in a 2008 than Bernie did in 2016. I mean, Obama did fucking win the nom.","","","","1020528270394167297","","","https://twitter.com/BravenakBlog/status/1020528270394167297","https://pbs.twimg.com/profile_images/965951298540519424/6Q2qhBLH_normal.jpg"
"Hesiod2k11","2018-07-21-00:03",0,0,"Sharice Davids. No. She’s the exciting Native American,Lesbuan, Cornell law grad who was an Obama White House fellow. Bernie & @ Ocasio2018 are supporting the pasty white guy who is a Bernie 2016 crony.","","@ Ocasio2018","","1020519499890651136","1020431045303431171","JasonLangendorf Ocasio2018 WilliamDettloff","https://twitter.com/Hesiod2k11/status/1020519499890651136",""
"joe_progressive","2018-07-20-23:07",0,1,"He was an obama supporter in 2008 and 2012 and supported bernie in 2016. Brent welder is more progressive than davids. Our revolution isn’t dark money it’s small individual contributions by normal people like u and me. Hillary Clinton has a super pac that is dark money.","","","","1020505429040824320","1020348370618060800","bowiegrrl11 JanelleMonae","https://twitter.com/joe_progressive/status/1020505429040824320",""
"SailingCarol","2018-07-20-22:43",0,1,"NO, Bernie does not have the Obama/Clinton/NeverAgain/POC Voters! We LOATHE Bernie Sanders! Trump Had 809 THOUSAND more votes than Bernie in 2016 Primary. Bernie has ZERO chance to win 2020 Primary. 2016 Primary was CASH COW to Bernie, Devine, Jane, pic.twitter.com/TOzjv4NdFJ","","","","1020499386558746624","1020387483836706817","ShaunKing","https://twitter.com/SailingCarol/status/1020499386558746624","https://pbs.twimg.com/media/DimKxzJXsAAS-TD.jpg"
"BetsyRubin","2018-07-20-22:14",0,2,"No to Bernie. No to Hillary. No to Biden. We need younger candidates and candidates who'll unite not divide. (FTR, I voted Bernie in primary & Hillary in general in 2016, and Obama/Biden in 2008/12.)","","","","1020492213518852097","1020387483836706817","ShaunKing","https://twitter.com/BetsyRubin/status/1020492213518852097",""
"TBestig","2018-07-20-21:57",0,1,"More Bernie fans voted for Hillary in 2016 than Hillary fans voted for Obama in 2008. Hillary won the popular vote. Direct your anger at the Russians, the nonvoters, and the electoral college. Not at the man who told his voters trump would be a disaster","","","","1020487784337993729","1020466126961168390","TruthsMinister BernieSanders","https://twitter.com/TBestig/status/1020487784337993729",""
"MelissaSantos1","2018-07-20-20:41",0,0,"I think people tend to recall endorsements they disagree w/ and ignore others. The Times: 1) endorsed @ JayInslee for re-election in 2016 2) Endorsed Hillary for president (after picking Bernie in primary) 3) Endorsed Patty Murray over Dino Rossi in 2010 4) Obama in 2008 etc","","@ JayInslee","","1020468688053415936","1020171256287543298","PaulMWest SeaTimesOpinion","https://twitter.com/MelissaSantos1/status/1020468688053415936",""
"WillShetterly","2018-07-20-20:05",0,1,"Yes, a higher percentage of Bernie supporters in 2016 voted for Clinton than Clinton supporters in 2008 voted for Obama, and yes, the populist vote is split. That doesn’t affect the numbers that say Sanders would’ve won.","","","","1020459712146563072","1020342161680863232","davestagner","https://twitter.com/WillShetterly/status/1020459712146563072",""
"tdfeininger","2018-07-20-18:04",1,0,"As I recall the 2016 elections occurred during the Obama administration. They interfered with the Israeli election and they tried to interfere with ours. Cheating Bernie supporters in the end.","","","","1020429360782880770","1020420681882849281","FoxNews MZHemingway realDonaldTrump","https://twitter.com/tdfeininger/status/1020429360782880770",""
"RapBastardz","2018-07-20-17:45",0,0,"Don't feel bad. I voted for Obama twice, Bernie in the primary and Hillary in the 2016 election... and right now I would with open arms welcome GWB back into the White House. pic.twitter.com/ygssGJ4VJ7","","","","1020424573370560512","1020375736736247808","MaxBoot PostOpinions","https://twitter.com/RapBastardz/status/1020424573370560512",""
"ringlikefire","2018-07-20-15:07",0,3,"In 1992 I voted Jerry Brown in primary and Clinton in General. In 2008 I voted HRC in primary and Obama in General In 2016 I voted Bernie in primary and HRC in the general. The pattern here is that a vote from me in a primary is the kiss of death.","","","","1020384805148659714","1020366938676088837","KaceCrawford","https://twitter.com/ringlikefire/status/1020384805148659714",""
"SUPERMAN954","2018-07-20-13:28",0,0,"Obviously that didn’t work for Hillary Clinton. If anyone got the youth excited in 2016 it was Bernie Sanders. Michelle Obama did nothing in 2016 primaries when Bernie was being cheated she can go","","","","1020359838000467968","1020073241312759808","RizingAshRen Alyssa_Milano JoaniSparkles","https://twitter.com/SUPERMAN954/status/1020359838000467968","https://abs.twimg.com/emoji/v2/72x72/1f92c.png"
"doggiedaysms","2018-07-20-13:05",0,0,"After HRC won the primary Bernie went out and stumped for her - how much did Hillary stump for Obama after he won the Primary? More ppl who wanted Bernie voted for HRC in 2016 Then the ppl who wanted HRC and then voted for Obama You people are blaming the wrong voters","","","","1020353918369329153","1020037639746048000","KrownCityKing the_kablammy","https://twitter.com/doggiedaysms/status/1020353918369329153",""
"El_Plato","2018-07-20-12:43",0,0,"Bernie Bros voted for Hillary in 2016 at a higher rate than Hillary voters for Obama in 2008. Why did Obama still win? Because he campaigned incredibly hard until the very last minute in every state. There were massive disinformation campaigns to take his down, but he kept at it.","","","","1020348375386894336","1020296460972195840","amfhTX E_A_Swearengen","https://twitter.com/El_Plato/status/1020348375386894336",""
"doggiedaysms","2018-07-20-12:34",0,1,"More people who supported Bernie voted for Hillary in 2016 than in 2008 the number of people who supported HRC and then voted for Obama You guys keep blaming the wrong people Hillary lost because she didn't motivate people to get out and vote That was her job","","","","1020346162941865984","1020037639746048000","the_kablammy ActualHistorian","https://twitter.com/doggiedaysms/status/1020346162941865984",""
"gnxry99091","2018-07-20-08:10",0,0,"What can you and the do-nothing Congress do to stop the meddling? Why have you not acted before? This was known in 2016 and you have done nothing yet? Why did Obama not act? Stop bringing this crap up, Bernie! @ RealJamesWoods @ Rossputin @ MichaelBrownUSA","","@ RealJamesWoods @ Rossputin @ MichaelBrownUSA","","1020279851570229249","1019634560391352322","SenSanders","https://twitter.com/gnxry99091/status/1020279851570229249",""
"RonKes","2018-07-20-02:36",0,0,"Bernie, c’mon, Obama knew about and allowed the hacking back in 2016!","","","","1020195695742078976","1019634560391352322","SenSanders","https://twitter.com/RonKes/status/1020195695742078976",""
"doggiedaysms","2018-07-20-01:22",0,3,"Unlike 2008 when a good portion of HRC supporters refused to vote for Obama The progressive policies that Bernie Sanders was proposing in 2016 or the progressive policies that the DNC is now starting to embrace The progressive policies or the ones people actually want","","","","1020177045458841600","1020037639746048000","doggiedaysms MarciaBunney","https://twitter.com/doggiedaysms/status/1020177045458841600",""
"T_Murf","2018-07-20-00:44",0,0,"It doesnt matter. Obama won the election by a massive margin. Bernie supporters tipped the 2016 election to Trump. Let me repeat that...BERNIE SUPPORTERS TIPPED THE ELECTION TO TRUMP!","","","","1020167426418388998","1015571975283007488","BreakBreadLines","https://twitter.com/T_Murf/status/1020167426418388998",""
"BreakBreadLines","2018-07-19-23:59",0,0,"*whispers* more Bernie supporters voted for Hillary in 2016 than Hillary supporters voted for Obama in 2008","","","","1020156313064517632","1015571975283007488","T_Murf","https://twitter.com/BreakBreadLines/status/1020156313064517632",""
"McTic1","2018-07-19-22:30",0,1,"This is why I love following, you always keep it ! I got it quick and so did you in 2016! Putin hates America and democracy he just found that the @ GOP is easier to infiltrate with their mutual hatred of Obama. And Bernie passed the test too! pic.twitter.com/6UhwpZXzfj","","@ GOP","","1020133898456510464","1019979519707492353","MrDane1982","https://twitter.com/McTic1/status/1020133898456510464","https://abs.twimg.com/emoji/v2/72x72/1f4af.png"
"MulcahyOran","2018-07-19-21:27",1,10,"More Clinton supporters back in 2008 ended up voting for McCain than Obama, than Bernie voters voting for Trump or Stein in 2016. Infact if we gave all Gary Johnson voters to Trump and all Stein voters to Clinton, Trump wins the popular vote by 500,000. Rethink your logic.","","","","1020118013775892483","1020064613344391168","pennsylbama2705 SenSanders","https://twitter.com/MulcahyOran/status/1020118013775892483",""
"Bernie_Gilbert","2018-07-19-19:38",0,0,"Our election infrastructure is too decentralized for anyone to realistically attack it. You know who said that? Guy named Obama, before the 2016 election. /1","","","","1020090407315820544","1019958317005901831","RepMikeQuigley","https://twitter.com/Bernie_Gilbert/status/1020090407315820544",""
"n8sweb","2018-07-19-18:52",0,1,"As a Bernie supporter, all of this explains to me, why he abruptly folded up his campaign in 2016. It’s not that he was compromised, his campaign was. He was being used as an unwitting weapon in a corrupted election. Once he met with Obama and Clinton he was quiet.","","","","1020078904894091264","1020074051761594368","cmclymer","https://twitter.com/n8sweb/status/1020078904894091264",""
"tweet31843189","2018-07-19-15:59",0,0,"Why didn't u reply to my link of Bernie Sanders calling out Obama in 2016 for separating children and their families at the border ?!?? U liberal hypocrite . Didn't all u people promise to move to Canada https://berniesanders.com/press-release/sanders-stop-separation-immigrant-children-families/ …","","","","1020035296174444546","1019069299032457217","atty13 WalshFreedom CNNfakes","https://twitter.com/tweet31843189/status/1020035296174444546","https://abs.twimg.com/emoji/v2/72x72/1f602.png"
