username,date,retweets,favorites,text,geo,mentions,hashtags,tweetid,conversationid,replyto,permalink,imagelink
"cwatson34","2016-04-22-05:13",2,1,"Harriet Tubman: Republican, Gun Owner, Outlaw, Badass # pjnet # tcot # gop http://www.thefederalistpapers.org/us/harriet-tubman-republican-gun-owner-outlaw-badass …","","","# pjnet # tcot # gop","723439591785529344","","","https://twitter.com/cwatson34/status/723439591785529344",""
"DerekRFaircloth","2016-04-22-02:35",0,0,"I wonder if Obama and the other liberals realize Harriet Tubman was a conservative, Republican, gun toting, God... http://fb.me/44MluHbkI","","","","723399914479194112","","","https://twitter.com/DerekRFaircloth/status/723399914479194112",""
"TechHelp","2016-04-22-01:35",0,0,"@ THErealDVORAK BTW Harriet Tubman was a gun toting Republican http://www.guns.com/2016/04/20/obama-administration-says-pro-gun-republican-harriet-tubman-to-grace-the-20-bill/ …","","@ THErealDVORAK","","723384782285991939","","","https://twitter.com/TechHelp/status/723384782285991939",""
"Guitar_heroSTH","2016-04-22-01:03",0,0,"What's funny is Harriet Tubman was a pro gun republican.","","","","723376715741822976","","","https://twitter.com/Guitar_heroSTH/status/723376715741822976",""
"Sam_A_vito","2016-04-21-23:57",0,1,"Harriet Tubman? Why not? She was a religious, gun packing Republican who freed slaves. Good call. pic.twitter.com/PcMpzt5FTm","","","","723359943479316480","","","https://twitter.com/Sam_A_vito/status/723359943479316480","https://pbs.twimg.com/media/CgnkCKBU8AEed5E.jpg"
"gijemi","2016-04-21-23:49",0,0,"Harriet Tubman was a gun toting, black female, Republican. I approve. # GOP # USA # TUBMAN","","","# GOP # USA # TUBMAN","723358055463673856","","","https://twitter.com/gijemi/status/723358055463673856",""
"WittyHendrix","2016-04-21-22:52",0,2,"You can tell who's a piece of shit by how quick they are to call Harriet Tubman a republican gun owner.","","","","723343644187566080","","","https://twitter.com/WittyHendrix/status/723343644187566080",""
"BonzerWolf","2016-04-21-22:46",1,2,"Me either. Harriet Tubman was a gun toting Republican & life member of the NRA, America's oldest civil rights org https://twitter.com/berniesanders/status/722851924375166977 …","","","","723342208699523072","","","https://twitter.com/BonzerWolf/status/723342208699523072","https://abs.twimg.com/emoji/v2/72x72/1f44d.png"
"BonzerWolf","2016-04-21-22:44",0,0,"$20 Bill should remind # p2 that Harriet Tubman was gun toting Republican,member of NRA, 's oldest civil rights org http://www.americas1stfreedom.org/articles/2016/1/28/freedom-fighters/ …","","","# p2","723341601578217472","","","https://twitter.com/BonzerWolf/status/723341601578217472","https://abs.twimg.com/emoji/v2/72x72/1f1fa-1f1f8.png"
"AmmaKate","2016-04-21-22:37",0,0,"Harriet Tubman: Republican, Gun Owner, Outlaw, Badass http://fb.me/7X5hRWakK","","","","723339978357526528","","","https://twitter.com/AmmaKate/status/723339978357526528",""
"IowaWizards","2016-04-21-22:27",2,2,"Harriet Tubman: Republican, Gun Owner, Outlaw, Badass http://fb.me/13CSg5zsf","","","","723337510978375681","","","https://twitter.com/IowaWizards/status/723337510978375681",""
"bryancrabtree","2016-04-21-22:26",52,63,"The new $20 bill w/Harriet Tubman who was Christian, Republican and carried a gun. Now that's some symbolism. pic.twitter.com/mYjSrRBqtd","","","","723337042260697089","","","https://twitter.com/bryancrabtree/status/723337042260697089","https://pbs.twimg.com/media/CgnPLkAU0AACyFM.jpg"
"Timmer_3","2016-04-21-22:08",1,8,"Harriet Tubman was a republican and a gun owner. Replacing Jackson, basically the founder of the Democratic Party is a good move in my book","","","","723332554628046848","","","https://twitter.com/Timmer_3/status/723332554628046848",""
"GretchenInOK","2016-04-21-22:05",17,14,"Whatta ya bet Obama had NO idea Harriet Tubman was PRO GUN & PRO REPUBLICAN? pic.twitter.com/B9J8swCJHD","","","","723331811217039361","","","https://twitter.com/GretchenInOK/status/723331811217039361","https://pbs.twimg.com/media/CgnKcyJUoAAke3Q.jpg"
"USMC_Trumplican","2016-04-21-21:44",4,3,"@ AlanColmes Harriet Tubman, Right-Wing REPUBLICAN needed a gun to protect herself from @ LibDems # LaughingatLiberalspic.twitter.com/cbRclJIUnj","","@ AlanColmes @ LibDems","# LaughingatLiberalspic","723326566785114112","","","https://twitter.com/USMC_Trumplican/status/723326566785114112","https://pbs.twimg.com/media/CgnFrR7UkAExcdY.jpg"
"ExSubSpy","2016-04-21-21:31",1,0,"Harriet Tubman: Republican, Gun Owner, Outlaw, Badass http://is.gd/yuYMVP She hated # Democrats","","","# Democrats","723323398881828864","","","https://twitter.com/ExSubSpy/status/723323398881828864","https://abs.twimg.com/emoji/v2/72x72/1f61c.png"
"Guns_com","2016-04-21-21:28",18,21,"Obama adminstraton says pro-gun Republican Harriet Tubman to grace the $20 bill http://bit.ly/26i3wrv pic.twitter.com/e1nxkJGfw1","","","","723322431293759488","","","https://twitter.com/Guns_com/status/723322431293759488","https://pbs.twimg.com/media/CgnB6zFW0AEOmKl.jpg"
"pennypc3","2016-04-21-21:27",0,0,"Harriet Tubman: Republican, Gun Owner, Outlaw, Badass http://www.thefederalistpapers.org/us/harriet-tubman-republican-gun-owner-outlaw-badass …","","","","723322378164514817","","","https://twitter.com/pennypc3/status/723322378164514817",""
"Raggmuffx3","2016-04-21-21:16",0,0,"Harriet Tubman: Republican, Gun Owner, Outlaw, Badass http://www.thefederalistpapers.org/us/harriet-tubman-republican-gun-owner-outlaw-badass …","","","","723319577166270464","","","https://twitter.com/Raggmuffx3/status/723319577166270464",""
"PCastnc","2016-04-21-20:43",0,0,"@ ShannonBream I am too, but don't tell the Libs that Harriet Tubman was a gun toting Republican. It would crush them!","","@ ShannonBream","","723311133344538624","723111727659884544","ShannonBream","https://twitter.com/PCastnc/status/723311133344538624",""
"HarrietBaldwin","2016-04-21-20:39",6,10,"Actually, no. Harriet Tubman was a gun toting Republican. The KKK was the Democrats. https://twitter.com/dcexaminer/status/723289568192114688 …","","","","723310248568610820","","","https://twitter.com/HarrietBaldwin/status/723310248568610820",""
"Atlanta962","2016-04-21-20:17",0,0,"I'll admit it, the right wingers bragging about Harriet Tubman being a 'Republican gun owner' are pretty entertaining.","","","","723304715174445056","","","https://twitter.com/Atlanta962/status/723304715174445056",""
"dfink4432","2016-04-21-19:58",0,0,"Harriet Tubman: Republican, Gun Owner, Outlaw, Badass http://www.thefederalistpapers.org/us/harriet-tubman-republican-gun-owner-outlaw-badass …","","","","723300029520289795","","","https://twitter.com/dfink4432/status/723300029520289795",""
"AntonioAngelo21","2016-04-21-19:38",0,0,"I cant believe they decided to put a gun toting republican on the twenty. Here is too a real american hero Harriet Tubman!","","","","723294982119911425","","","https://twitter.com/AntonioAngelo21/status/723294982119911425",""
"eyebleedblue77","2016-04-21-19:33",0,0,"@ iamSAR @ Rachel__Nichols @ NPR Harriet Tubman was a gun toting republican also. Another fact. Grown man using emojis, hilarious. Another fact","","@ iamSAR @ Rachel__Nichols @ NPR","","723293499148374016","722910074176282624","iamSAR","https://twitter.com/eyebleedblue77/status/723293499148374016",""
"lisabella68","2016-04-21-19:26",0,3,"On board with Harriet Tubman. She was a gun toting Republican. Andrew Jackson was a slave owning Dem.","","","","723291915484037126","","","https://twitter.com/lisabella68/status/723291915484037126",""
"FredomFiter76","2016-04-21-19:12",0,0,"I am certainly happy we replaced the Democrat Andrew Jackson with the gun toting Christian abolitionist Republican Harriet Tubman on $20!","","","","723288349931237376","","","https://twitter.com/FredomFiter76/status/723288349931237376",""
"NMHunter","2016-04-21-19:02",0,0,"Harriet Tubman: Republican, Gun Owner, Outlaw, Badass http://www.thefederalistpapers.org/us/harriet-tubman-republican-gun-owner-outlaw-badass …","","","","723285832942018560","","","https://twitter.com/NMHunter/status/723285832942018560",""
"LynnD_P","2016-04-21-18:50",2,1,"Harriet Tubman was a Republican and staunch gun advocate. AJackson co-founded the Democratic Party. It's an EXCELLENT choice. @ YoungBLKRepub","","@ YoungBLKRepub","","723282751298887681","","","https://twitter.com/LynnD_P/status/723282751298887681",""
"WonderMan1971","2016-04-21-18:39",0,0,"Harriet Tubman was a gun toting Republican, as were all of the people who helped with the Underground railroad.","","","","723279938296516608","","","https://twitter.com/WonderMan1971/status/723279938296516608",""