username,date,retweets,favorites,text,geo,mentions,hashtags,tweetid,conversationid,replyto,permalink,imagelink
"MyPraphan","2016-07-29-16:59",0,0,"I added a video to a @ YouTube playlist http://youtu.be/3R9e7ndsdds?a kenny tiger : kenny tiger with down syndrome","","@ YouTube","","759131207615574016","","","https://twitter.com/MyPraphan/status/759131207615574016",""
"rustygrayboy","2016-07-20-18:25",0,10,"Great day with Darryl and Tiger at # sinkoneforjake supporting Have a Heart for Down Syndrome! pic.twitter.com/MeWhg3Msak – bei Royal Ontario Golf Club","","","# sinkoneforjake","755891302038855680","","","https://twitter.com/rustygrayboy/status/755891302038855680","https://pbs.twimg.com/media/Cn13HaRWYAAdYFM.jpg"
"grainneheather","2016-07-19-16:59",0,1,"A boy around my age with Down syndrome who lives just down from me just stopped me for chats and introduced himself as 'tiger candy' and","","","","755507313742667776","","","https://twitter.com/grainneheather/status/755507313742667776",""
"MITCHELLBIZZAY","2016-07-17-13:58",0,1,"Dicks out for that one White Tiger with down syndrome due to zoo inbreeding of rare animal coat colours who passed away RIP","","","","754737121043197952","754719108961218560","dixonwing","https://twitter.com/MITCHELLBIZZAY/status/754737121043197952",""
"MeetTheTaskFast","2016-07-08-01:17",0,0,"Meet Kenny, An Inbred White Tiger With Down Syndrome https://youtu.be/bxUYEtBf2Mg via @ YouTube","","@ YouTube","","751283960450260992","","","https://twitter.com/MeetTheTaskFast/status/751283960450260992",""
"But_Scratcher","2016-07-04-02:21",1,0,"This is Kenny. The white inbred tiger with Down syndrome pic.twitter.com/O7PbXlNwSv","","","","749850709797908481","","","https://twitter.com/But_Scratcher/status/749850709797908481","https://pbs.twimg.com/media/CmgBPi0VIAEbx4c.jpg"
"zarrykush","2016-07-02-15:58",0,0,"does anyone remember kenny the white tiger with down syndrome? never let him go away he's too precious for us to forget","","","","749331552073617408","","","https://twitter.com/zarrykush/status/749331552073617408",""
"shelikesgirlss","2016-06-28-21:27",0,1,"Currently wishing I could own a tiger with Down syndrome!","","","","747964629322629121","","","https://twitter.com/shelikesgirlss/status/747964629322629121",""
"crystvlsolano","2016-06-23-17:09",0,1,"I guess I'm a tiger with Down syndrome","","","","746087887989440512","","","https://twitter.com/crystvlsolano/status/746087887989440512",""
"lexilovsdogs","2016-06-23-12:47",0,3,"All I'm going to say is this tiger with Down syndrome looks like Josh as a baby pic.twitter.com/gKVMQrDVDD","","","","746021954730205185","","","https://twitter.com/lexilovsdogs/status/746021954730205185","https://pbs.twimg.com/media/ClpnAhMWkAAw5xP.jpg"
"kellsndudz","2016-06-21-12:23",0,0,"'Sorry your uterus is such a derp. May you see it as flawed but still majestic, like a white tiger with Down syndrome.' - my friend","","","","745291148915204096","","","https://twitter.com/kellsndudz/status/745291148915204096",""
"NicoSZN","2016-06-17-01:17",0,0,"that's why you look like this tiger with Down syndrome pic.twitter.com/I4WAFYH5PS","","","","743673985993318401","743671573903613956","bsmalik_ Money_Myles_","https://twitter.com/NicoSZN/status/743673985993318401","https://abs.twimg.com/emoji/v2/72x72/1f602.png"
"ih8vbx","2016-06-15-22:42",0,0,"whatever. Telling me I look like a tiger with Down syndrome . Bitch.","","","","743272464407420928","743262291299340292","Impatient98 femaies","https://twitter.com/ih8vbx/status/743272464407420928","https://abs.twimg.com/emoji/v2/72x72/1f610.png"
"Beige_Dewhow","2016-06-13-15:00",0,0,"I liked a @ YouTube video from @cerberus0395 http://youtu.be/bxUYEtBf2Mg?a Meet Kenny, An Inbred White Tiger With Down Syndrome","","@ YouTube","","742431513774596096","","","https://twitter.com/Beige_Dewhow/status/742431513774596096",""
"savvagebryy","2016-06-10-08:57",0,3,"you look like a tiger with down syndrome. @ AyeeRodney","","@ AyeeRodney","","741253070563205120","","","https://twitter.com/savvagebryy/status/741253070563205120",""
"hunnyjvne","2016-06-07-21:21",0,1,"'He looks like a white tiger with Down syndrome'","","","","740353045611962369","","","https://twitter.com/hunnyjvne/status/740353045611962369",""
"AmazinggTay","2016-06-05-19:27",0,1,"My brother just told me his spirit animal is a tiger with down syndrome....","","","","739599502525509632","","","https://twitter.com/AmazinggTay/status/739599502525509632",""
"maggieatsbabies","2016-06-04-23:48",0,2,"drying blood with a purple undertone and a bengal tiger with down syndrome LMAO CLOSE THO","","","","739302741697171457","739297303631040512","ArmstrongAlexx","https://twitter.com/maggieatsbabies/status/739302741697171457",""
"frenchA0k","2016-06-03-10:20",0,0,"This after I just saw Kenny, the tiger with Down syndrome. What sweet little babies. https://twitter.com/plaidiris139h/status/738614318548164609 …","","","","738737072769400832","","","https://twitter.com/frenchA0k/status/738737072769400832",""