content,username,replyto,permalink,time
"""I'm sure people are gonna be less likely to bring their kids to America if they get separated,"" Sen. Lindsey Graham says, adding he's disappointed that President Trump said he won't support the immigration compromise in the House ,https://,cnn.it/2LRSzap, ,https://,cnn.it/2t027JA, ",CNN,,https://twitter.com/CNN/status/1007648442225750017,1529077084
"@,LindseyGrahamSC, has no soul.",pudgedyfudgedy,CNN,https://twitter.com/pudgedyfudgedy/status/1007648737462767617,1529077154
So disappointed in &LindseyGrahamSC,BethHylton1,"pudgedyfudgedy,CNN,LindseyGrahamSC",https://twitter.com/BethHylton1/status/1007651645944147969,1529077848
"The ""parents go to jail"" argument is bull, and the reporter should have harped on that abandoned Walmart response because that's the whole thing — their kids are in detention centers, not — as prisoners' kids are — in homes.",mattrett,CNN,https://twitter.com/mattrett/status/1007649674570944515,1529077378
pic.twitter.com/gorGIC6TtL,usa_latinos,CNN,https://twitter.com/usa_latinos/status/1007652771569504256,1529078116
pic.twitter.com/lGMNJS9xC6,AnwarAlsaid1,CNN,https://twitter.com/AnwarAlsaid1/status/1007649019584114688,1529077222
"After the many, many times this has been debunked, I’m surprised morons still post it.",x_KillShot_x,"AnwarAlsaid1,CNN",https://twitter.com/x_KillShot_x/status/1007649535898935296,1529077345
"I'm suprised you morons don't believe it,that was the ,@,POTUS, own words,pic.twitter.com/qWoMYoOhNp",ajtorres71,"x_KillShot_x,AnwarAlsaid1,CNN",https://twitter.com/ajtorres71/status/1007650477478203393,1529077569
"Again, it was debunked. Do you know what that means?
He never said that ",x_KillShot_x,"ajtorres71,AnwarAlsaid1",https://twitter.com/x_KillShot_x/status/1007650723121819648,1529077628
"CNN falsely blames Trump for everything.   CNN wants a nuclear war.,pic.twitter.com/DsaJLVUyD9",geareddev,CNN,https://twitter.com/geareddev/status/1007648766843908096,1529077161
So his administration didn't start this draconian policy of separation.......,SteveLo510,"geareddev,CNN",https://twitter.com/SteveLo510/status/1007652527330824192,1529078058
"Nope, it's just finally going to put those laws into effect.",geareddev,"SteveLo510,CNN",https://twitter.com/geareddev/status/1007656373105123328,1529078975
What? Separation isn't a law it's a policy Sessions started.,SteveLo510,"geareddev,CNN",https://twitter.com/SteveLo510/status/1007657607010476032,1529079269
"Why do they run? ,pic.twitter.com/htoUiV6EH3",SteveLo510,"SteveLo510,geareddev,CNN",https://twitter.com/SteveLo510/status/1007674434658885633,1529083281
Aren't we at the point where we can assume everything he says is a lie and only have BREAKING NEWS when he tells the truth? That way we will get such news only once every six weeks or so.,John_DePetro,CNN,https://twitter.com/John_DePetro/status/1007649655713386496,1529077373
People fleeing for their lives will go where they think they can stay alive particularly where they think their kids wont be killed. I suspect they will take their chances heading to the US instead of the alternative,TorbayToday,CNN,https://twitter.com/TorbayToday/status/1007649134399107073,1529077249
"How is this different than what Hitler did to families? ,@,jaredkushner, ,@,IvankaTrump, ,@,realDonaldTrump",JudyCheesey,CNN,https://twitter.com/JudyCheesey/status/1007649292134371328,1529077287
Because one is being taken into custody for their beliefs or heritage and the other for their actions.  Those are two totally different things.,BeenaroundHere,"JudyCheesey,CNN",https://twitter.com/BeenaroundHere/status/1007651312866127873,1529077768
Wrong. Have a nice day!,JudyCheesey,"BeenaroundHere,CNN",https://twitter.com/JudyCheesey/status/1007653541677359104,1529078300
And there is a response from someone that can’t defend their ideas,BeenaroundHere,"JudyCheesey,CNN",https://twitter.com/BeenaroundHere/status/1007654579893342208,1529078547
"If a human being needs to debate that ripping children away from their parents makes no sense, probably a Russian bot or KKK. Not worth it. Happy Father’s Day!",JudyCheesey,"BeenaroundHere,CNN",https://twitter.com/JudyCheesey/status/1007655518326984705,1529078771
So a parent should never e taken from a parent?  That happens to American citizens every day when they are arrested.,BeenaroundHere,"JudyCheesey,CNN",https://twitter.com/BeenaroundHere/status/1007655808820228096,1529078840
"@,LindseyGrahamSC, exactly how many of the people fleeing rape, murder, etc have tv to see you say “ if you come to the US we’ll tear your baby from your arms while you’re nursing and lock you up?” Are you ,@,realDonaldTrump, sycophants really that stupid? Answer apparently is YES!",write2bheard1,CNN,https://twitter.com/write2bheard1/status/1007654937679912960,1529078633
Come clean Lindsey and help these children.,Allen11Cynthia,"write2bheard1,CNN",https://twitter.com/Allen11Cynthia/status/1007655614900850689,1529078794
LINDSEY GRAHAM IS THE REASON THAT DUMB FUCK TRUMP GETS AWAY WITH ALL THE STUPID SHIT HES DOING! IF HE HAD BALLS HE WOULD STEP UP TO THAT DUMB ASS AND PUT HIM IN CHECK! TILL THEN KIDS WILL BE RIPPED FROM THERE PARENTS HE'LL SOLUTE DICTATORS MAKING HIM SELFRICH,ajsinn_aj,CNN,https://twitter.com/ajsinn_aj/status/1007651817692381184,1529077889
"and I'm sure this grotesque policy of trump & the republican party will guarantee that the children and grandchildren of ,@,LindseyGrahamSC, will be met with similar, inhumane treatment abroad if they ever need to flee this country for their lives. congrats on your legacy, senator",15colleen,CNN,https://twitter.com/15colleen/status/1007650965774852097,1529077686
I honestly believe that they enjoy the cruelty.,mattlogical,"15colleen,CNN,LindseyGrahamSC",https://twitter.com/mattlogical/status/1007655329549594624,1529078726
"The end doesn't justify the means.  We all want immigration policies and procedures that work.  Trump and evidently you, Lindsey, feel that cruelty and inhumanity towards immigrants will deter them from seeking asylum.",SusanEvelynHE,CNN,https://twitter.com/SusanEvelynHE/status/1007664795443593218,1529080983
"#,SHAME, on Graham and ALL ,#,GOPComplicit, heartless ,#,Traitors,!!, ,#,SaveTheChildren, ,#,FamiliesBelongTogther, ,#,VoteThemOUT, ,#,BlueWave, ,#,Resist",lovetogive2,CNN,https://twitter.com/lovetogive2/status/1007664533773488128,1529080921
He’s a frequent member of the Blow Donny club!,KenOBrien4,"vinvali,CNN",https://twitter.com/KenOBrien4/status/1007660294703865856,1529079910
The policy before was to allow the children to enter the country and stay with relatives… that has been a disaster !  The children disappear and then claim to be dreamers (more amnesty),MarkAuger3,CNN,https://twitter.com/MarkAuger3/status/1007651453186396161,1529077802
"@,LindseyGrahamSC, is underneath it all is a southern racist. You can’t take the South out of the boy!",joeiavovella,CNN,https://twitter.com/joeiavovella/status/1007650310691663872,1529077529
most of them do not have a choice...they are seeking asylum,mazzonepat,CNN,https://twitter.com/mazzonepat/status/1007650011063242752,1529077458
This piece of sh*t sitting so smug justifying throwing children in cages.,JJHobbs12,CNN,https://twitter.com/JJHobbs12/status/1007649278133559296,1529077283
Lol they’re not in cages. Don’t be so stupid.,x_KillShot_x,"JJHobbs12,CNN",https://twitter.com/x_KillShot_x/status/1007649805961781249,1529077409
Imagine if Democrats cared more about our homeless US citizens instead of illegals.,CoachHalejr,CNN,https://twitter.com/CoachHalejr/status/1007649925042266113,1529077438
pic.twitter.com/LVZfbYoXHC,ajtorres71,"CoachHalejr,CNN",https://twitter.com/ajtorres71/status/1007652170089590784,1529077973
,CoachHalejr,"ajtorres71,CNN",https://twitter.com/CoachHalejr/status/1007652360582287360,1529078018
"It happened under Obama 

,#,WhereWasTheOutRage",FallingdownAl,CNN,https://twitter.com/FallingdownAl/status/1007649354465927169,1529077301
"There would have been outrage if they did the same. This isn't partisan, asshole, it's human rights abuses.",SalladDoer,"FallingdownAl,CNN",https://twitter.com/SalladDoer/status/1007650715962171392,1529077626
"It sure as hell is partisan. Not a peep was made when Obama was doing the same damn thing.

They broke the law. White and African-American children are separated from their parents every day when their parents break a law.

,#,WhereIsTheOutrage, for them.",FallingdownAl,"SalladDoer,CNN",https://twitter.com/FallingdownAl/status/1007651879751471106,1529077904
They go before an immigration judge before they're are held in custody. In case you don't know what that's called due process.,FallingdownAl,"SalladDoer,CNN",https://twitter.com/FallingdownAl/status/1007655387804438528,1529078740
"What a gem. Why don’t we just allow open executions of anyone trying to cross the border? By common citizen s, you know like the Purge. That would be a deterrent and I’m sure all those good GOP Christians would find a verse or two to make it all fine and dandy in god’ eyes.",SolisNita,CNN,https://twitter.com/SolisNita/status/1007670245434232832,1529082282
"Laws are written to be followed, otherwise they have no meaning at all. Follow proper protocol, come here legally or go back to your country. Don't come here and DEMAND anything!
God Bless America!!!",ellenreese21,CNN,https://twitter.com/ellenreese21/status/1007658512888029184,1529079485
Have a heart. Keep those families together. We need Chain Deportation Now!,gun4hyr,CNN,https://twitter.com/gun4hyr/status/1007650155368247296,1529077492
pic.twitter.com/pIQqeLeve2,ajtorres71,"gun4hyr,CNN",https://twitter.com/ajtorres71/status/1007651554357383169,1529077826
"@,LindseyGrahamSC, 
,#,terrorism,
NOUN
the unlawful use of violence and intimidation, especially against civilians, in the pursuit of political aims

RIPPING children from their parents is state sponsored terrorism",MsSparky58,CNN,https://twitter.com/MsSparky58/status/1007649568627068934,1529077353
It is disgusting not to mention heart wrenching,CindyJohnston,"MsSparky58,CNN,LindseyGrahamSC",https://twitter.com/CindyJohnston/status/1007655851535011840,1529078851
When Obama ripped babies from Mama's it was amazing but now it's bad.,Chuggy2017,CNN,https://twitter.com/Chuggy2017/status/1007649463979200512,1529077328
It was handled as a civil matter for years. Even she’s buying into it being a crime.,modmikey,CNN,https://twitter.com/modmikey/status/1007649372853727232,1529077306
"And how are these people coming to this country with their children ever going to know that is happening before they get here? Most of them are coming from places that don’t even have clean water. So what, they are going to find out on their TV’s and cell phones? Get a clue.",CaraStiff,CNN,https://twitter.com/CaraStiff/status/1007650690481737730,1529077620
"They didn’t have clean water or air conditioning. At least these kids have a place to sleep that is safe and has clean water and meals now. More than they had formerly. Sounds like an upgrade. Do illegal things, pay the price. It’s simple, really.",ChurchBackrow,"CaraStiff,CNN",https://twitter.com/ChurchBackrow/status/1007652060974772224,1529077947
"You’re a despicable human being -also, educate yourself and understand they are not coming here illegally you fucking ass",CaraStiff,"ChurchBackrow,CNN",https://twitter.com/CaraStiff/status/1007999840415092736,1529160864
"from this day, prepare the data to slash on his face. people come to US is because US is good. the only thing can make sure people with kids will not come to US is to make US worse. does this guy want make US worse compared with other countries. Hardly believe, he hate US so much",weedmanisu,CNN,https://twitter.com/weedmanisu/status/1007650688325816320,1529077619
"People come to US is simple because US is good. this is the no 1 thinking in their mind. Those politician want no immigrates, essentially, is trying to make US unworthy for the migration. How can a politician hate US so much and still be elected?",weedmanisu,"weedmanisu,CNN",https://twitter.com/weedmanisu/status/1007651228053057536,1529077748
"illegal immigration only can be reduced to zero when US is the worse county, if u dont want US become worse, the practice policies should be make illegal immigration under check, an equilibrium.",weedmanisu,"weedmanisu,CNN",https://twitter.com/weedmanisu/status/1007652034164744192,1529077940
The compromise is not any kind of compromise at all. It’s another attempt to encourage more illegal immigrants to flood the border.,Robbobalooey,CNN,https://twitter.com/Robbobalooey/status/1007650710148743168,1529077625
Your ancestors were illegal immigrants,dltheone,"Robbobalooey,hecks_bar_kinde,CNN",https://twitter.com/dltheone/status/1007659744180531200,1529079779
"My great grandparents came from Germany in the 1860’s. They entered LEGALLY through an unspecified port and immigration center on the east coast. They didn’t jump a fence, swim a river, avoid authorities, run when they saw law enforcement. You truly are a special type of stupid.",Robbobalooey,"dltheone,CNN",https://twitter.com/Robbobalooey/status/1007680531390173184,1529084735
My point the people who took the country get to close the door when the feel enough is enough we did not hear this when all these Russian criminals were making their way into America during and after the Cold War,dltheone,"Robbobalooey,hecks_bar_kinde,CNN",https://twitter.com/dltheone/status/1007692399823507458,1529087564
Did not take much to push your buttons now imagine if your child was ripped from your arms and all you were looking for was a better life like your ancestors... German people and their descendants should be more understanding having had so little respect for Borders in the past,dltheone,"Robbobalooey,hecks_bar_kinde,CNN",https://twitter.com/dltheone/status/1007762180987637760,1529104201
WTF are you talking about. A 23 y.o. woman in my area was arrested for delivery of heroin and her 3 y.o. was in the car with her. Do you think they put her child in the cell with her?,Robbobalooey,"dltheone,CNN",https://twitter.com/Robbobalooey/status/1007794560553181184,1529111921
If you commit a crime then you should be expected to accept the consequences. One of the consequences is you are separated from your family during incarceration.,Robbobalooey,"Robbobalooey,dltheone,CNN",https://twitter.com/Robbobalooey/status/1007795236595294208,1529112082
Stop spamming your garbage--bot. No one loves MS13 but we do hate when ICE persecutes everyone of Latino heritage and makes people feel threatened in this country for no reason. You're the problem.,Hexsin,"mikezocchi123,CNN",https://twitter.com/Hexsin/status/1007705651563384832,1529090724
Yeah I'm spamming falsehoods when innocent people are being profiled and harassed because of their new extreme objectives. Stop lying with this garbage that they're only doing their jobs. There's plenty of them crossing lines and going overboard--abusing their positions too.,Hexsin,"mikezocchi123,CNN",https://twitter.com/Hexsin/status/1007707295395012608,1529091116
You all chant the same stupid mantras. I'm not a Lib. I just think Trump is a monster and the way Sessions is treating human beings is immoral and unforgivable. Do what you want with the gang members but don't give me this shit that kids need to be imprisoned in Walmart's.,Hexsin,"mikezocchi123,CNN",https://twitter.com/Hexsin/status/1007709073989611521,1529091540
"You need to stop just being disappointed ,@,LindseyGrahamSC, and do something to help these families",Sandria_1,CNN,https://twitter.com/Sandria_1/status/1007685844491165696,1529086001
He will do nothing .,2ALWAYSBFREE,"Sandria_1,CNN,LindseyGrahamSC",https://twitter.com/2ALWAYSBFREE/status/1007767246305923073,1529105409
Honestly the kids are probably better off.,TrueRonSwanson,CNN,https://twitter.com/TrueRonSwanson/status/1007667618013237250,1529081656
Good ? That would be human and they are not..,Dawn18292249,"TrueRonSwanson,CNN",https://twitter.com/Dawn18292249/status/1007676807020150784,1529083847
"@,LindseyGrahamSC, -History will forget what you & ,@,SenateGOP, accomplished in your careers BEFORE ,#,Trump,. You will be remembered for the way that you stand by ,@,realDonaldTrump, as he tries to dismantle our democracy!
Your oath is to our constitution, NOT Trump. ,#,ComplicitGOP, 
,#,VOTE",KatherineKaldis,CNN,https://twitter.com/KatherineKaldis/status/1007658208482115585,1529079412
Get out and vote. Get your families and friends out to vote. Make sure DEMS take over the house and senate and impeach this $%#@ person. Anyone who makes war on small children is beyond redemption,CindyJohnston,"KatherineKaldis,CNN",https://twitter.com/CindyJohnston/status/1007662603185868801,1529080460
"@,LindseyGrahamSC, speaks w/ forked tongue. He’s kissing Trump’s ass yesterday & today he’s trying to be critical. He won’t do squat.",mfuhrman1,CNN,https://twitter.com/mfuhrman1/status/1007650671552802816,1529077615
Donald Trump bent over and Graham went bobbing for Big Mac's on live television. I could barely watch.,RegBarclay2017,CNN,https://twitter.com/RegBarclay2017/status/1007648941821739008,1529077203
"Trump lacks intellect.  People are constantly saying, ""this is what I think he meant by that..""",arthur_bernard,CNN,https://twitter.com/arthur_bernard/status/1007649298945847296,1529077288
Someone is drinking the trump juice . Lindsey I knew it all the time,jimmyalfred500,CNN,https://twitter.com/jimmyalfred500/status/1007649810684489728,1529077410
Congressional majority “leadership” needs to be leaders & gather the minority representatives & get on the right side of history with an historic   bi-partisan immigration bill. Forget the base & look to the future!,hgraham457,CNN,https://twitter.com/hgraham457/status/1007841411042029568,1529123091
"It’s politics when you blame it on the other party and that’s what the president is doing instead of producing moral, ethical immigration law.",1948kdh,CNN,https://twitter.com/1948kdh/status/1007745278391267328,1529100172
"@,LindseyGrahamSC, If you thought that the only chance for you and your children to survive was to attempt a border crossing, would the possibility of being separated deter you or would you risk everything? Would you want to be treated this way in a desperate situation?",AmandaS16562876,CNN,https://twitter.com/AmandaS16562876/status/1007684913146089472,1529085779
"Why can’t they at least incarcerate the families together in one ,#,Walmart,?",DannyDechi,CNN,https://twitter.com/DannyDechi/status/1007669474965774337,1529082099
"Can we pls start calling these ppl out for what they r? They r the reincarnation of Hitler’s Nazis. Seriously, look how comfortable ,@,LindseyGrahamSC, is acting like these children & parents deserve this inhuman treatment. He’s so into it it’s sickening. He truly believes in it.",roxannelwright,CNN,https://twitter.com/roxannelwright/status/1007657809201147904,1529079317
"It is time for intelligent, patriotic Republicans to stand with intelligent, patriotic Democrats. Honor this still great, once greater nation, and find an American solution.",WilliamRBell1,CNN,https://twitter.com/WilliamRBell1/status/1007654456744398849,1529078518
Another pre-war Germany tactic. It worked for them. For a while.,canadav8r,CNN,https://twitter.com/canadav8r/status/1007650117468352512,1529077483
"Well,  ,@,LindseyGrahamSC, is a spineless asskisser, soooooo...",amyjo2301,CNN,https://twitter.com/amyjo2301/status/1007649955966840835,1529077445
"Larry Elder
Any American citizen who is arrested is separated from his kids. If there's no family to take them, they go into foster care.",RVJLCGOLF,CNN,https://twitter.com/RVJLCGOLF/status/1007649826677370880,1529077414
I’m disappointed these Senators do t seem to think Trump is dangerous.,NealLangendorf,CNN,https://twitter.com/NealLangendorf/status/1007649577590091776,1529077355
"#,Trump, is saving the kids from this,pic.twitter.com/F358zJKYE0",Qanye_West,CNN,https://twitter.com/Qanye_West/status/1007649533130518529,1529077344
Why don't we just shoot women and children applying for asylum at the border if we want to discourage them? Unbelievable! These people call themselves Christians?,davidfinnerty,CNN,https://twitter.com/davidfinnerty/status/1007649212274806789,1529077268
"What an ignorant view. They are coming here to escape violence, and death. There are refugees across the planet escaping brutality,and extreme oppression. It will never stop. In fact it will increase with every natural disaster,and societal breakdown. It’s a result of corruption.",khndnky,CNN,https://twitter.com/khndnky/status/1008100006581211136,1529184745
"America is the home of the Native American, caucasian, African American,Asian American but these cowards think they own the country ,@,CNN,.",armandohammond,CNN,https://twitter.com/armandohammond/status/1007831738855247874,1529120785
Hey liberals! Your so worried now? Really? Didn’t you know that you have been killing babies in mother’s wombs for years! I don’t see you shedding any tears for all those dead babies!!! You liberal hypocrites!,okcitynews,CNN,https://twitter.com/okcitynews/status/1007787212216393728,1529110169
"Shame on you! Shame on Trump! Shame on the Republicans! This is not a solution! Not torture? How would you have felt if you were taken from your Mom or Dad and kept in detention at age 10, or 12 or 16? They have no choice as minors & the US is showing a very sad solution!",connie_j2,CNN,https://twitter.com/connie_j2/status/1007687117990842368,1529086305
Damn. Villain.,david_hourin,CNN,https://twitter.com/david_hourin/status/1007674407513288706,1529083275
"Another NAZI is trying to defend Human Rights violations, which makes him a criminal too-that is not free speech to advocate  treaty violations.",AlonzoHudkinsiv,CNN,https://twitter.com/AlonzoHudkinsiv/status/1007673415573164032,1529083038
I’ll never bring my 8 year old daughter to the States as long as that disgusting Administration is running things.,RarifiedAlien,CNN,https://twitter.com/RarifiedAlien/status/1007671239886999552,1529082519
LET'S ALL REMEMBER THE DEMS PASSED THIS LAW! LET'S REMEMBER THE PICTURES OF CAGED CHILDREN DURING THE OBAMA PRESIDENCY! IT WAS NOT PRESTRUMP IT WAS OBAMA.,Thought94583793,CNN,https://twitter.com/Thought94583793/status/1007664968815333376,1529081024
"Gee, because they are coming here illegally. That's kinda the point, they are not allowed to simply walk right in. 
If knowing that your children will be seperated from you keeps you in your own country, I'll call that a win. 

Go home ,#,RINO",J3ff800,CNN,https://twitter.com/J3ff800/status/1007660187711180800,1529079884
"Parents that commit crimes get separated from their children everyday in America.  Where's the outrage. 
,#,waitinlineliketherest",67Sr,CNN,https://twitter.com/67Sr/status/1007657974259703810,1529079357
"How come every time I go to the grocery store, in the parking lot American Kids are living with their families out of a van? Take care of our own FIRST!!!",Get64,CNN,https://twitter.com/Get64/status/1007657778662346752,1529079310
Or. Other countries see that America is no longer the country that it was and see it for what it really is. This is just wrong. Why are this cowards that are afraid of the yellow Cheeto in power?,xona230,CNN,https://twitter.com/xona230/status/1007656378335465472,1529078976
"No they won’t, because it’s still a better and safer life for those children than where they come from. Parents give up their children all the time to give them a better life, this is just morally incomprehensible on the part of the US government",richardleard,CNN,https://twitter.com/richardleard/status/1007654034176729092,1529078417
Lindsey is admitting that the Trump policy to separate children from their parents is a deliberate attempt to discourage people seeking refuge by punishing their children.,MarvinDigeorgio,CNN,https://twitter.com/MarvinDigeorgio/status/1007653988777390080,1529078406
"#,Why, wasn’t Obama, George W. being crucified for mommy’s being separated from their babies",TheresaWiniars1,CNN,https://twitter.com/TheresaWiniars1/status/1007653719985541120,1529078342
Securing the border is the priority.,Night_Rider2017,CNN,https://twitter.com/Night_Rider2017/status/1007653424962396160,1529078272
"We should not be surprised at such callousness.  We Americans seem not to have changed all that much since World War II. These polls are revealing. The one in 1939 speaks to our willingness to allow Jewish children in after Kristallnacht. Credit to ,@,HistOpinion,pic.twitter.com/KJKMsBYcYI",InMedioSitu,CNN,https://twitter.com/InMedioSitu/status/1007652892411494405,1529078145
"I demand immigration stop separating these families. Instead, deport them all immediately upon capture and let them return on their appointed court date. The tens of billions we save in not housing them can be steered into hiring more court staff to reduce that wait time.",rednek_scholar,CNN,https://twitter.com/rednek_scholar/status/1007652322384793600,1529078009
"Horrible interview. Ran from questions. Talked in circles. Trump is a liar. If you can not admit, recognize, & call out this 'bad' type of person...you are not a legitimate role model for anyone.",grapejuize,CNN,https://twitter.com/grapejuize/status/1007651656362807300,1529077850
"So, disregarding both morals and ethics (because, let's be real, that's not the world we live in), don't go to a country's border, expecting an open arm welcome. Start a revolution at home, and fix your country. Ah, what happened to the strength of the people?",TruthTastesBad,CNN,https://twitter.com/TruthTastesBad/status/1007651428725243904,1529077796
"We all understand that trump is mentally ill, but Graham should know better. Disappointing.",craig58,CNN,https://twitter.com/craig58/status/1007651401705680896,1529077790
