content,username,replyto,permalink,time
Oh don’t worry. I think you would be banned entry anyway. And you need to be a little more intelligent to understand her satire. Stay home in your little hate filled cocoon!,RedMo65canada1,"ACTBrigitte,kathygriffin",https://twitter.com/RedMo65canada1/status/1015564658348994561,1530964457
"Hard as your flaky, dried out foundation or just regular hard?",sawozny,"ACTBrigitte,kathygriffin",https://twitter.com/sawozny/status/1015399437932421120,1530925065
Must be a laugh riot.,thomdipaola,ACTBrigitte,https://twitter.com/thomdipaola/status/1015095413555322882,1530852580
pic.twitter.com/zLfppZmP29,DatBeerGeekBS,ACTBrigitte,https://twitter.com/DatBeerGeekBS/status/1015173822780239872,1530871275
"RSVP:,@,kathygriffin,, That's a No, Not even on a BAD Day!,pic.twitter.com/UzSInmegvL",trumptastic2018,ACTBrigitte,https://twitter.com/trumptastic2018/status/1015113864910909440,1530856979
,kevinvanduser,ACTBrigitte,https://twitter.com/kevinvanduser/status/1015188723703734272,1530874827
Your presence will not be missed,Andreia28908932,"ACTBrigitte,kathygriffin",https://twitter.com/Andreia28908932/status/1015284369999609856,1530897631
pic.twitter.com/YFevQm7Tz6,ScruffPost,"ACTBrigitte,kathygriffin",https://twitter.com/ScruffPost/status/1015443682483318784,1530935614
You’re only doing KG a favor. The only thing hard here is your face. ,RobertinLALA,"ACTBrigitte,kathygriffin",https://twitter.com/RobertinLALA/status/1015482980712660993,1530944984
"@,kathygriffin, ""act"" lost her the freedom to fearlessly travel America, just desserts",1oneirishman,ACTBrigitte,https://twitter.com/1oneirishman/status/1016056167263547397,1531081642
Love Kathy.,MarilynFuscia,"ACTBrigitte,kathygriffin",https://twitter.com/MarilynFuscia/status/1015670029768015872,1530989579
Who's Kathy Griffin? Some washed up old has-been? Some things are best left in the realm of obscurity.,UnofficialPolit,ACTBrigitte,https://twitter.com/UnofficialPolit/status/1015095905844891653,1530852698
Who the F is Bridget Gabriel?,jstorm60,"ACTBrigitte,kathygriffin",https://twitter.com/jstorm60/status/1015587175075753984,1530969825
So she’s only playing in unhinged and cockroach infested areas. Sounds about right.,flaix100,ACTBrigitte,https://twitter.com/flaix100/status/1015110120186015745,1530856087
pic.twitter.com/YrmH8oHvJI,tgain83,"ACTBrigitte,kathygriffin",https://twitter.com/tgain83/status/1015374992442380288,1530919237
KKK cult members not interested in that kind of comedy. They love kids in cages running over people in cars that kinda comedy!,harlowyates,"ACTBrigitte,kathygriffin",https://twitter.com/harlowyates/status/1015282583725314049,1530897205
"Forget about it. Only in LaLa Land would she even have a chance, and she knows it. She’ll not sell in North Dakota and Wisconsin.",DavidBa97345256,ACTBrigitte,https://twitter.com/DavidBa97345256/status/1015291634861260801,1530899363
"Will this be in Kathy Griffin's show, her anti-Muslim stand up routine?,https://www.,youtube.com/watch?v=Sgp7Hg,PMrew, ,…",SoCalValleyGal,ACTBrigitte,https://twitter.com/SoCalValleyGal/status/1015107307556954113,1530855416
Brigitte you seem to have a huge boner for Kathy. Not doing a very good job hiding your crush.,nairbgnilrebog,"ACTBrigitte,kathygriffin",https://twitter.com/nairbgnilrebog/status/1015618171582255104,1530977216
"@,kathygriffin, thanks for the heads up, make sure to avoid those places.",5dallas345,ACTBrigitte,https://twitter.com/5dallas345/status/1015132558722560001,1530861436
If you stick it up your butt then of course is hard pass.,RckyRR,"ACTBrigitte,kathygriffin",https://twitter.com/RckyRR/status/1015282445032177665,1530897172
"The LA traffic must be really bad. She needs 8 days to travel between LA and SAN. Or maybe...she is just getting old and needs long naps, nasty tweets and naps",vdbluv,ACTBrigitte,https://twitter.com/vdbluv/status/1015098940121743360,1530853421
Kathy makes you hard?!,StephenSterrit1,"ACTBrigitte,kathygriffin",https://twitter.com/StephenSterrit1/status/1015375621671677952,1530919387
"#,BoycottKathyGriffin",RedFoxXDiaries,ACTBrigitte,https://twitter.com/RedFoxXDiaries/status/1015347869966991360,1530912771
Lol. You're not invited. How utterly self-fawning of you.,RokinRobin,"ACTBrigitte,kathygriffin",https://twitter.com/RokinRobin/status/1015283298095042560,1530897375
Brigitte who?,StopOtteringMe,"ACTBrigitte,kathygriffin",https://twitter.com/StopOtteringMe/status/1015299721798266880,1530901291
"Have a laugh, lighten up.",jchang1024,"ACTBrigitte,kathygriffin",https://twitter.com/jchang1024/status/1015282898021244929,1530897280
Her comedy isn’t for everyone. It’s only for intelligent people.,r123brown,"ACTBrigitte,kathygriffin",https://twitter.com/r123brown/status/1015308931021922306,1530903487
"Thank god! A downer like you in the audience just ruins a GREAT show. ,#,buhbye",mattydean,"ACTBrigitte,kathygriffin",https://twitter.com/mattydean/status/1015364542090620929,1530916746
Are you STILL trying to be relevant? Stay frosty Snowflake!! ,Jusmckee,"ACTBrigitte,kathygriffin",https://twitter.com/Jusmckee/status/1015315321681477632,1530905010
Good. No one wants u there,andreah97530617,"ACTBrigitte,kathygriffin",https://twitter.com/andreah97530617/status/1015308788151341063,1530903453
i pray its a flop...,RaceAll,ACTBrigitte,https://twitter.com/RaceAll/status/1015189481635418112,1530875008
Honestly had no idea she was trying to be a comedian.,veronica0ronnie,ACTBrigitte,https://twitter.com/veronica0ronnie/status/1015241085910646784,1530887311
"Liberal territory ,.",Tyra4Trump,ACTBrigitte,https://twitter.com/Tyra4Trump/status/1015268053712621568,1530893741
Definitely a “must miss“!,johnnyfrantz,ACTBrigitte,https://twitter.com/johnnyfrantz/status/1015218215088205825,1530881858
"Awww you're not gonna go? Kathy will be heartbroken!!!, Get over yourself, Fool!!!  .... Knock em dead Kathy!!!!",ChristinedeLaD,"ACTBrigitte,kathygriffin",https://twitter.com/ChristinedeLaD/status/1015374020236042241,1530919005
I suppose this poster represents decapitating the world? She needs to be tested for witzelsucht.,TexCorker,ACTBrigitte,https://twitter.com/TexCorker/status/1015200796412203008,1530877706
"Amen ,#,garbage",JimmyAdamsPGA,ACTBrigitte,https://twitter.com/JimmyAdamsPGA/status/1015193490437955585,1530875964
"Correct.  Speaking of hard pass, a kidney stone is more funny then that troll.",FreeMarketMilt,"ACTBrigitte,kathygriffin",https://twitter.com/FreeMarketMilt/status/1015298438882381824,1530900985
"Gee, sure hope nobody drops in & beheads her!",SCamster2544,ACTBrigitte,https://twitter.com/SCamster2544/status/1015292435319017472,1530899554
Who asked?,ihategetting,"ACTBrigitte,kathygriffin",https://twitter.com/ihategetting/status/1015415881554251777,1530928986
No way,andrefisher5931,ACTBrigitte,https://twitter.com/andrefisher5931/status/1015101923593195520,1530854132
Didn’t know she did show for crickets .,jkc158,ACTBrigitte,https://twitter.com/jkc158/status/1015191024396853248,1530875376
Barfarama ,AnnLemieux2,ACTBrigitte,https://twitter.com/AnnLemieux2/status/1015130907693350912,1530861043
I bet you hear that a lot from men,CarmenCote75,"ACTBrigitte,kathygriffin",https://twitter.com/CarmenCote75/status/1015459138338525185,1530939299
"But you do want to ""preserve"" freedom, so that she is able to say these things, right? Rhetorical.  It's on your profile banner",Agiftoftongues,"ACTBrigitte,kathygriffin",https://twitter.com/Agiftoftongues/status/1015491824692154368,1530947092
"There is a special place in hell for you ,@,actbrigitte, turning your back on all other women, all other immigrants just to support a racist child rapist like ,@,realDonaldTrump",LV_Devotee,"ACTBrigitte,kathygriffin",https://twitter.com/LV_Devotee/status/1015317174141906944,1530905452
No thanks...,ChuckStrong54,ACTBrigitte,https://twitter.com/ChuckStrong54/status/1015426233478340609,1530931454
Your loss!,KennyMcDowell,"ACTBrigitte,kathygriffin",https://twitter.com/KennyMcDowell/status/1015315458105532417,1530905043
Because she isn’t welcomed anywhere out of the California shithole?,lesleyrosem,ACTBrigitte,https://twitter.com/lesleyrosem/status/1015251260759425024,1530889737
Keep her in California,GotOneEyeOnYou,ACTBrigitte,https://twitter.com/GotOneEyeOnYou/status/1015269866536886272,1530894173
She is a complete waste of space! Would NEVER give her the time of day.,rushrogers,ACTBrigitte,https://twitter.com/rushrogers/status/1015100890187948033,1530853886
She'd roast your ass if you were there.,tkwolfe1,"ACTBrigitte,kathygriffin",https://twitter.com/tkwolfe1/status/1015284630822506497,1530897693
"I would rather go watch ice form for hockey season in july, or have a root canal. Or be stuck in gridlock listening to Tim Conway Jr on KFI. Than go to her show.",youneedaclue,ACTBrigitte,https://twitter.com/youneedaclue/status/1015100841185775616,1530853874
"Kathy Griffin and Nancy Pelosi are competing for The National Association of Plastic Surgeons’ , “ Tighter than a SNARE DRUM , Face Lift Award ,. The winner gets to chop off the head of the loser and hold it up for a , selfie,  , oops, too late Griffin already did  that.",StahlerScott,ACTBrigitte,https://twitter.com/StahlerScott/status/1015285890015346689,1530897993
Who the fuck is this? Some bitch who couldn’t get tickets?,aja_ajaprice51,"ACTBrigitte,kathygriffin",https://twitter.com/aja_ajaprice51/status/1015413205403947008,1530928348
Poking myself in the eye with a fork would be more enjoyable and fun.,jennyp_876,ACTBrigitte,https://twitter.com/jennyp_876/status/1015192448061100032,1530875715
