content,username,replyto,permalink,time
He gets up early he ain’t sleeping when Benghazi calls !!!,hholly44,"FoxNews,HillaryClinton",https://twitter.com/hholly44/status/932364473251368961,1511127987
"#,TheStorm, is upon her. Marines MEU Unit (2,200)has arrived at CIA HQ last night and I don’t believe they were invited.",April1Shark,"FoxNews,HillaryClinton",https://twitter.com/April1Shark/status/932345848280813568,1511123547
"Remember Haiti , 

,#,RememberHaiti,pic.twitter.com/wUotc8c1p4",NCal530,"FoxNews,HillaryClinton",https://twitter.com/NCal530/status/932345967759650816,1511123575
"back then the tweet was a cigar, and golfing was a dress.... ,#,MAGA, ,@,realDonaldTrump, ,@,helenaguirrefer, ,@,PressSec, ,@,SHSanders45",Flux_Capacitor1,"FoxNews,HillaryClinton",https://twitter.com/Flux_Capacitor1/status/932350282423554054,1511124604
Same could be asked of your husband while he was having affairs with female interns.,TayCot88,"FoxNews,HillaryClinton",https://twitter.com/TayCot88/status/932379506190544902,1511131571
Crooked Hillary is classless!,GREGWITT1,"FoxNews,HillaryClinton",https://twitter.com/GREGWITT1/status/932369821056012290,1511129262
"Hey ,@,HillaryClinton, , how did Bill get anything done with all that screwing he was doing while Governor & President?!",bibeydoll11,"FoxNews,HillaryClinton",https://twitter.com/bibeydoll11/status/932345829079375872,1511123542
"Unlike you Mrs. Bill Clinton, he knows how to organize his time effectively.",canamfirecop,"FoxNews,HillaryClinton",https://twitter.com/canamfirecop/status/932364895802265603,1511128088
He gets much more done than your husband ever did while preoccupied in the Oval Office w his cigars.,melanieusn1979,"FoxNews,HillaryClinton",https://twitter.com/melanieusn1979/status/932359240496369665,1511126739
"@,HillaryClinton, ,@,realDonaldTrump, accomplishes a lot. It's easy when you stay sober and focus on our country instead of lining your pockets!",gkilti,"FoxNews,HillaryClinton",https://twitter.com/gkilti/status/932382011444121600,1511132169
"Obama was golfing every day!  That added with the celebrity hobnobbing , gee no wonder things are such a mess",LuciLu516,"FoxNews,HillaryClinton",https://twitter.com/LuciLu516/status/932367894062567424,1511128803
pic.twitter.com/qrMiJyl7rz,T_Bone1964,"FoxNews,HillaryClinton",https://twitter.com/T_Bone1964/status/932346306261008384,1511123656
Why do you just keep stepping into it? Too easy: It's easy to get so much done & tweet when you're not wasting tax $ on chasing women & paying Secret Service to sneak them in & out. You two disrespected OUR White House!,corennacornwell,"FoxNews,HillaryClinton",https://twitter.com/corennacornwell/status/932363878125703170,1511127845
"#,Meanwhile,pic.twitter.com/y9QNZ9kQOJ",NCal530,"FoxNews,HillaryClinton",https://twitter.com/NCal530/status/932345952626601984,1511123571
"Impressive isn’t it? That’s why he is our president, maybe one day she will learn how to multitask, that is a must for a president.",Sanluciferr,"FoxNews,HillaryClinton",https://twitter.com/Sanluciferr/status/932353173410516997,1511125293
"Hey, Billary! The open mic nite at The Funny Bone is holding auditions!",CiraVO,"FoxNews,HillaryClinton",https://twitter.com/CiraVO/status/932349735020658688,1511124473
You mean like cutting illegal uranium deals with enemies of the US or looking the other way while your husband assaults countless numbers of women?,TallyJazz,"FoxNews,HillaryClinton",https://twitter.com/TallyJazz/status/932363512877379592,1511127758
Do you really have no NEWS to report?  Is it really so bad over there that all you can do is post bland tweets?,Info4ThePeople,"FoxNews,HillaryClinton",https://twitter.com/Info4ThePeople/status/932345262768578560,1511123407
"STOOGES STOP COVERING THIS WITCH, BECAUSE WHEN SHE TELLS THE TRUTH 'IN THIS CASE"" IT HURTS YOUR CROOKED DOTARD BOSS VERY BADLY ,pic.twitter.com/xDefOgjIeO",bakerlarry84,"FoxNews,HillaryClinton",https://twitter.com/bakerlarry84/status/932359368896544768,1511126770
"Why do you even bother with what this old hag has to say! Her time has passed, her next stop is hopefully jail",DolfanGary,"FoxNews,HillaryClinton",https://twitter.com/DolfanGary/status/932393748436152320,1511134967
Well he does get his daily briefing from watching Fox News...,MEEggert,"FoxNews,williamlegate,HillaryClinton",https://twitter.com/MEEggert/status/932349270036025345,1511124362
Bye bye now Clinton's,sis78,"FoxNews,HillaryClinton",https://twitter.com/sis78/status/932359519308582918,1511126806
And between all your lies and your husbands fun times how do you get anything done Killery..,sherry30582452,"FoxNews,HillaryClinton",https://twitter.com/sherry30582452/status/932380317880668162,1511131765
She's not wrong.,rja_360,"FoxNews,williamlegate,HillaryClinton",https://twitter.com/rja_360/status/932351610885427200,1511124920
pic.twitter.com/GLpIHEtZB2,BKmelo70,"FoxNews,HillaryClinton",https://twitter.com/BKmelo70/status/932349435140599808,1511124402
"@,HillaryClinton, ,@,BillClinton, It is impressive how much he's able to accomplish when we look at the numbers of jobs, market level, trade agreements, border security. About like how Bill fit in so much time for Monica's 140+ private meetings among the others.",mikemosack,"FoxNews,HillaryClinton",https://twitter.com/mikemosack/status/932366388714340352,1511128444
It’s called multitasking and Trump is doing great MAGA!,dj95206,"FoxNews,HillaryClinton",https://twitter.com/dj95206/status/932362101326090240,1511127422
The Clinton criminal enterprise!,Stevieray2013,"FoxNews,HillaryClinton",https://twitter.com/Stevieray2013/status/932359268442963968,1511126746
Between sex lies corruption & murder how do you live with yourselves ,100Trump45,"FoxNews,HillaryClinton",https://twitter.com/100Trump45/status/932345277930864640,1511123411
"Well... Just a little reminder, dear:

, ISIS Nearly Obliterated
, Wall Prototypes In Motion
, Stock Market=Stratosphere
, SC Justice x 2 (soon!)
, Awesome Asian Adventure

, Somehow, I'm okay if President ,@,realDonaldTrump, wants to play a round of golf every now and again.",RobinTweets247,"FoxNews,HillaryClinton",https://twitter.com/RobinTweets247/status/932386075980455937,1511133138
it doesn't.....Hillary forgot the hours of television watching......,GusTheTerror,"FoxNews,williamlegate,HillaryClinton",https://twitter.com/GusTheTerror/status/932345947077730314,1511123570
"Between Uranium one scandal and the criminal Clinton foundation, how did she have time to write a fictional book?",coprun,"FoxNews,HillaryClinton",https://twitter.com/coprun/status/932374206817472512,1511130308
. Hillary in denial...still,jerrymikestorie,FoxNews,https://twitter.com/jerrymikestorie/status/932458992063991808,1511150522
"Hillary, after you being lost, what did you do except for writing bum and crummy book?",321Brownbear,"FoxNews,HillaryClinton",https://twitter.com/321Brownbear/status/932373693350719488,1511130185
"@,HillaryClinton,pic.twitter.com/sF1zR1zq2D",BrownieKimber,"FoxNews,HillaryClinton",https://twitter.com/BrownieKimber/status/932422553087479809,1511141834
"Between hookers, interns, cigars and lining the Clinton pockets, how did Slick Willy ever get anything done???",bryanp1967,"FoxNews,HillaryClinton",https://twitter.com/bryanp1967/status/933035214544211968,1511287904
This from a woman who was supposed to be the first woman President USA who was just  pimping her whiny book at Costco. Pathetic.,TrumplicanPA,"FoxNews,HillaryClinton",https://twitter.com/TrumplicanPA/status/932349413674102784,1511124397
Hillary cannot except the fact that she is not our POTUS. She really needs to retire and become a grandmother. I am humiliated for her at her behaviors,fturner06144,"FoxNews,HillaryClinton",https://twitter.com/fturner06144/status/932349545723367424,1511124428
"Between cheating and stealing, how do you stay out of jail?",wendyno36080419,"FoxNews,HillaryClinton",https://twitter.com/wendyno36080419/status/932362695604625409,1511127563
"Hillary please ""go to pasture""!",Merlot_Irene,"FoxNews,HillaryClinton",https://twitter.com/Merlot_Irene/status/932468374675906560,1511152759
He’s not getting anything done. He’s an embarrassment to our country and humankind.,kdgoforth,"FoxNews,HillaryClinton",https://twitter.com/kdgoforth/status/932364644550717440,1511128028
Decades of criminal activities by these two criminals! Decades! The Clintons made Bonnie and Clyde look like amateurs!   Prison time is coming!!,carrera911targa,"FoxNews,HillaryClinton",https://twitter.com/carrera911targa/status/932358730246651904,1511126618
"The Clintons family crime spree continues to crumble!! Bye , Hillary criminal Clinton and impeached, pervert husband Bill Clinton!!!!!!! Bye ",carrera911targa,"FoxNews,HillaryClinton",https://twitter.com/carrera911targa/status/932357536195469312,1511126333
Prison! Prison! Prison! Prison!,carrera911targa,"FoxNews,HillaryClinton",https://twitter.com/carrera911targa/status/932358849629126656,1511126646
HE IS HONEST AND DOES NOT SELL THE USA!!!!!!!!!,thom_kelley2,"FoxNews,HillaryClinton",https://twitter.com/thom_kelley2/status/932416901250256896,1511140487
"That's because that's all he does.  He thinks the president of the United States is supposed to let other people do their job and he just sits back and collects the accolades. ,#,TrumpRussia,  ,#,resignnow",delsangron,"FoxNews,HillaryClinton",https://twitter.com/delsangron/status/932348967505072128,1511124290
pic.twitter.com/pY3hhXwuoC,ivanyerkingoff,"FoxNews,HillaryClinton",https://twitter.com/ivanyerkingoff/status/932773166669185024,1511225427
Can we please arrest her already ,Scannon146,"FoxNews,HillaryClinton",https://twitter.com/Scannon146/status/932833103319531520,1511239717
"He doesn't.,pic.twitter.com/KLdDuYEkCB",seagal_lori,"FoxNews,52fairway,HillaryClinton",https://twitter.com/seagal_lori/status/932354184212398080,1511125534
He doesn’t!!!   Haven’t you been paying attention?,keatonc33,"FoxNews,HillaryClinton",https://twitter.com/keatonc33/status/932344807166480384,1511123298
"All the wacky liberal left keep saying why does Fox keep bringing up the criminal Clintons!! Really idiots,  Hillary criminal Clinton keeps bringing up the Clintons!!!!",carrera911targa,"FoxNews,HillaryClinton",https://twitter.com/carrera911targa/status/932356544943067136,1511126097
"Easy ANY MORON can do it,pic.twitter.com/cJLOmqeD4M",JohnPennell11,"FoxNews,HillaryClinton",https://twitter.com/JohnPennell11/status/932345065472655365,1511123360
No one cares what you think. Go get a life...,ConservUSA38,"FoxNews,HillaryClinton",https://twitter.com/ConservUSA38/status/932387659326124037,1511133515
"Dunno, how did sodding Obama do it?  ,#,LockHerUp",TheTortorian,"FoxNews,HillaryClinton",https://twitter.com/TheTortorian/status/932346393263472641,1511123676
Fox is obsessed with Hillary. She's not President.,mic857,"FoxNews,HillaryClinton",https://twitter.com/mic857/status/932356852054155267,1511126170
pic.twitter.com/e3ualyXz8U,BKmelo70,"FoxNews,HillaryClinton",https://twitter.com/BKmelo70/status/932349491365244928,1511124415
