content,username,replyto,permalink,time
"Question: if the Dotard murdered someone in cold blood in front of witnesses, how would you help him “clarify” his behavior and get beyond it? Is there no “mistake” you all can’t redeem?",LisaLptalk,newtgingrich,https://twitter.com/LisaLptalk/status/1019565726200451072,1531918386
"Newt, you are usually so on point, but you and others like you totally got snookered by the Dems on this. You want Trump to say that Putin DID screw with our election process?  So basically you want Trump to say, hey maybe my presidency was HELPED by Putin and his cronies? Think!",amos_barash,newtgingrich,https://twitter.com/amos_barash/status/1019421724746579969,1531884053
pic.twitter.com/aPqLp9URXF,Red_White__Blue,newtgingrich,https://twitter.com/Red_White__Blue/status/1019355562457403394,1531868279
I think his statements were very clear.,RBerg08674810,newtgingrich,https://twitter.com/RBerg08674810/status/1019333739715809281,1531863076
"Whatever you say, Comrade Gingrich. ,#,TreasonWeasel",js_edit,newtgingrich,https://twitter.com/js_edit/status/1019359036209131520,1531869107
"Newt
I was a supporter of yours back on the 80s with POTUS Reagan.
I understand that ,@,realDonaldTrump, may speak different than typical politicians. But in the end he is a lover of America and the Constitution.
So give my ,@,POTUS, a benefit of the doubt an move on
,#,silentmajority",schmittydogg,newtgingrich,https://twitter.com/schmittydogg/status/1019433650046324736,1531886896
"You mean, he must hurry back and gaslight us with more lies? We heard him loud and clear. He's a disgrace and a traitor. Putin has him in his pocket and everyone knows it. Trump needs to resign. ,#,TreasonSummit",PsyKellygy,newtgingrich,https://twitter.com/PsyKellygy/status/1019354682886578176,1531868069
"This is your monster, Dr Frankenstein",mlinares210,newtgingrich,https://twitter.com/mlinares210/status/1018996688382496768,1531782717
It wasn't a mistake to true supporters. Shocked at you.,MotherofOodles,newtgingrich,https://twitter.com/MotherofOodles/status/1019576292973441024,1531920905
"If you are looking for a cookie cutter President, HE IS NOT! Who are the one saying action speak louder than words???",korodragon,newtgingrich,https://twitter.com/korodragon/status/1019348764362854401,1531866658
"U R old enough to remember Vietnam.....as I am so let's set aside
the spooks are great argument okay?
I read classified msg traffic during those years and attended intel briefs
Their sticky fingers were all over it.........
STOP defending them.........they don't deserve it",RosaleeAdams,newtgingrich,https://twitter.com/RosaleeAdams/status/1019411278790455296,1531881563
Newt - shut up!  Your as bad as the far left.,walknmydog,newtgingrich,https://twitter.com/walknmydog/status/1019340699081363456,1531864735
Shut up Newt the only reason I ever watched you was because you spoke favorably about our president. He doesn’t need advyfrom you.,DeePSw31,newtgingrich,https://twitter.com/DeePSw31/status/1019421557536579585,1531884013
This is the best you've got?,EmceeReads,newtgingrich,https://twitter.com/EmceeReads/status/1019421896238960640,1531884094
"Love Newt but. I think he is dead wrong on this one and I also don't think Trump should've "" Corrected"" anything!",MagaKirk,newtgingrich,https://twitter.com/MagaKirk/status/1019441002988253184,1531888650
What’s a clarification that you’d be happy with. What’s a clarification you’d believe? What’s a clarification that wouldn’t be insulting to the millions of Americans who saw their president commit treason on Monday? Clarification? Go clarifuck yourself. You’re part of the problem,m_niller,newtgingrich,https://twitter.com/m_niller/status/1019392612023853057,1531877112
C’mon Newt. You already know what he thinks and said. How many chances do other traitors get?,LiveNLearnin,newtgingrich,https://twitter.com/LiveNLearnin/status/1019352687589011456,1531867594
"you cannot correct the truth and turn it into a lie .you are clown puppet, your words is like dog ,.",Rocyourmind,newtgingrich,https://twitter.com/Rocyourmind/status/1020054052795604992,1532034812
"Well coach, he did it. He grudgingly read a statement but crossed out bringing Russians to justice, added the “no collusion” mantra and “it could have been anyone”. He’s a mentally unstable traitor owned by Putin.",everywheregary,newtgingrich,https://twitter.com/everywheregary/status/1019418790893969408,1531883354
"@,realDonaldTrump,  how’d he do newt? ;) hahahahahaha; I think it’s time to hop off the Trump train, don’t ya think? You got your tax cut, but you’re not getting another Supreme ,#,resist,  !!!!!!",pmboocock,newtgingrich,https://twitter.com/pmboocock/status/1019353907263352835,1531867884
You’re a little late to the game.,ThomasBuonomo,newtgingrich,https://twitter.com/ThomasBuonomo/status/1019375453847605248,1531873021
"But wait! There’s more to come!

,#,Impeach45, 

,@,realDonaldTrump, is going to start flying around the White House like a deflating balloon as the pressure continues to constrict his world . This will continue to be the greatest show on earth, no matter where you stand",BurkhanKhaldoom,newtgingrich,https://twitter.com/BurkhanKhaldoom/status/1019397537046908928,1531878286
"I guess ""IMMEDIATELY"" means 24 hours to ,#,TraitorTrump",jessdewet,newtgingrich,https://twitter.com/jessdewet/status/1019665994543980547,1531942292
No clarifying he s reed up believes Putin Thur American our agencies under the bus ,Patrici61172453,newtgingrich,https://twitter.com/Patrici61172453/status/1019401867380396032,1531879319
Mr Gingrich I have noticed you’ve been oozing out of existence lately. Please don’t tell me you’ve joined the swamp creatures... please!,jjaniselaine,newtgingrich,https://twitter.com/jjaniselaine/status/1019469390029508609,1531895418
No worries! He meant wouldn’t. Joint Cyber Force with Putin is still a go. Also.... United States agencies debased on foreign soil. Was there supposed to be more in the “correction”?,lauramhartman,newtgingrich,https://twitter.com/lauramhartman/status/1019601886931013632,1531927007
"Was his wink  at Putin, followed by a smirk, a mistake also? How about his continued delegitimizing our press in the way all fascists do?",JuLindMom,newtgingrich,https://twitter.com/JuLindMom/status/1019380568247689217,1531874241
"You are just another bloviating rhino if this is your response. I didn’t expect this from YOU, of all people. Just another beltway pile on. Have some integrity & point out his victories which msm ignored, and leave our viciously attacked POTUS alone. You sided with vicious dogs.",DeborahRogan,newtgingrich,https://twitter.com/DeborahRogan/status/1019927565258063872,1532004655
Was this direct from ROME? BS.,karencbeal1,newtgingrich,https://twitter.com/karencbeal1/status/1019371360022392832,1531872045
Mistake??? Nonsense; it's treason! Our representatives need to stop enabling this traitor and impeach him NOW!,terry_burch,newtgingrich,https://twitter.com/terry_burch/status/1019338570023104512,1531864228
"Satisfied that he meant “wouldn’t” instead of “would”? Yeah, me neither. Lame excuse.",gdekhayser,newtgingrich,https://twitter.com/gdekhayser/status/1019396426323906560,1531878022
I think he was pretty clear.  He believes an ex-kgb agent over our own intelligence agencies. He sold the USA to Russia. Now.... wtf are you gonna DO about it???!!!,tigerfly96,newtgingrich,https://twitter.com/tigerfly96/status/1019914308053094400,1532001494
It was purposeful.  No mistake,jedbettman,newtgingrich,https://twitter.com/jedbettman/status/1019031785324384258,1531791084
The biggest mistake was the Republican Party letting Trump bamboozle their nomination in ‘16.,jpblix,newtgingrich,https://twitter.com/jpblix/status/1020093565588918272,1532044233
You can have whatever you want — just please don’t write another book.,Politicabbie,newtgingrich,https://twitter.com/Politicabbie/status/1019401168177516544,1531879152
"Either of Newt's first two wives: ""You vowed to be faithful ...""

Newt: ""Well, let me clarify that, because it was a serious mistake and must be corrected immediately.""",AwfulJournalism,newtgingrich,https://twitter.com/AwfulJournalism/status/1018971490920927238,1531776709
Newt the “fair weather friend!”,Bill67568045,newtgingrich,https://twitter.com/Bill67568045/status/1019410247168020481,1531881317
"Neuter Gingrich.... no spine, no balls, Trump's biggest fan.",DaveManGB,newtgingrich,https://twitter.com/DaveManGB/status/1019387914940309508,1531875992
"How about ""I was talking about Brennan and Clapper and Rhodes and Rice and Jarrett and their leader Obama""",robtdfischl,"newtgingrich,marthamaccallum",https://twitter.com/robtdfischl/status/1020313007560306688,1532096552
"Newt = , Real Americans are standing with our President Trump ",MyersSC,newtgingrich,https://twitter.com/MyersSC/status/1019397521192443904,1531878283
Not corrected - so what are you and GOP going to do about it?,stevemacfarlane,newtgingrich,https://twitter.com/stevemacfarlane/status/1019642545025019904,1531936701
When Newt makes a statement like this I get worried. Don’t pay attention to what others say.,Linda810,newtgingrich,https://twitter.com/Linda810/status/1019359533229998080,1531869226
newt your just wrong.  Like back in the day when u talked the talk. Thene betrayed patriots for.           Bad trade deals     u rember putting.     Global trade initiative before the interest of ur base voters .newt. Ended badly. More Neon con treachery? Newt,jetbird1776,newtgingrich,https://twitter.com/jetbird1776/status/1019350819844608002,1531867148
"Oh, Newt, you know as well as I do that Trump is a Russian asset.  Don't tell him to ""clarify"" (read: lie). Just shut the fck up.",MeridyM,newtgingrich,https://twitter.com/MeridyM/status/1019381584862932994,1531874483
"Yeah, clarify...that’s what he needs to do. Clarify. 

It was crystal clear, Newt.",mrobmsu,newtgingrich,https://twitter.com/mrobmsu/status/1019415998435340289,1531882688
"It CAN'T simply be corrected. ,#,TraitorTrump, committed ,#,Treason, on a world stage, siding with a hostile foreign adversary over U.S. Intelligence",jessdewet,newtgingrich,https://twitter.com/jessdewet/status/1019665202562961409,1531942103
"Wrong.
You couldn't be any more wrong on this one.
Thanks for the support when we needed it though.",aMarcPearson,newtgingrich,https://twitter.com/aMarcPearson/status/1019944019969769472,1532008578
He meant every word. You are a clown and he is Putin's puppet. Kindly f-off.,Lola_Resistance,newtgingrich,https://twitter.com/Lola_Resistance/status/1019377471089729536,1531873502
