content,username,replyto,permalink,time
"In other words, your core audience. Congratulations on reaping what you sow, ,#,FauxNews, ,#,TreasonChannel, ,#,StateTV",DegenerateParad,FoxNews,https://twitter.com/DegenerateParad/status/1020518396461383680,1532145520
"In this, Republicans differ from Democrats who celebrate their antisemites and other race haters.",Bookwormroom,FoxNews,https://twitter.com/Bookwormroom/status/1020509303982075905,1532143352
These are your people,Wipeout2020,FoxNews,https://twitter.com/Wipeout2020/status/1020508658436780033,1532143198
pic.twitter.com/kPa1N9bUk1,mark_montinola,FoxNews,https://twitter.com/mark_montinola/status/1020508629470867456,1532143192
"""Slip through""",yeschrisyes,FoxNews,https://twitter.com/yeschrisyes/status/1020742569016287233,1532198967
"This is a feature, not a bug.  They didn't slip through.  They won support from the Republican Party and Republicans.",kpronn,FoxNews,https://twitter.com/kpronn/status/1020707798013829120,1532190677
They’re just saying the quiet part of the GOP platform out loud.,sarahoc,FoxNews,https://twitter.com/sarahoc/status/1020705017274273794,1532190014
They didn’t “slip through” it’s what the party wants - lower level Trumps,305Pirate,"FoxNews,GranmisiTafleur",https://twitter.com/305Pirate/status/1020641846287052800,1532174953
"https://,m.youtube.com/watch?v=uNV2eo,sLceI, ,…",Vini_dray,FoxNews,https://twitter.com/Vini_dray/status/1020564720221327360,1532156565
"https://www.,fiverr.com/s2/062464f749?,utm_source=Twitter_Mobile, ,…",uniquejhora,FoxNews,https://twitter.com/uniquejhora/status/1020551202159775744,1532153342
Thanks FOX. Look at what your propaganda created? Hacks!,ALICECAROLTENE,"FoxNews,twoswirly1",https://twitter.com/ALICECAROLTENE/status/1020537117913493506,1532149984
Womp womp,jussiewow,FoxNews,https://twitter.com/jussiewow/status/1020526353886662656,1532147417
"You meant ""were chosen by a plurality of Republican voters, revealing the deeply ingrained bigotry that has infected the party down to it's soul.""",TristanCallan,FoxNews,https://twitter.com/TristanCallan/status/1020525057498632193,1532147108
The GOP Party is no more,PPhayer,FoxNews,https://twitter.com/PPhayer/status/1020520049898139649,1532145914
"A strategy that Republicans and Trump should use...
To choose woman for the Senate, is it fashionable in the US...",LevyMendonca,FoxNews,https://twitter.com/LevyMendonca/status/1020517402369560576,1532145283
"Where's the problem?   That's the ,@,GOP,'s base these days. ,#,FakeNewsMedia",POCuts,FoxNews,https://twitter.com/POCuts/status/1020517056649629696,1532145201
Headache? These are the kind of Trump and the GOPutin people.,BeastSlayer88,FoxNews,https://twitter.com/BeastSlayer88/status/1020516221966356481,1532145002
"What does the leader of the party have to say about these ""very fine people"", Mr. ,@,realDonaldTrump,?",KeyserSwayze,FoxNews,https://twitter.com/KeyserSwayze/status/1020516133949132801,1532144981
"Oopsies My Ass! ,#,Monsters",yesimpeachnow,FoxNews,https://twitter.com/yesimpeachnow/status/1020516027312975873,1532144955
"""Fitzgerald Falsely asserts that Jews played a “prominent role” in the African slave trade."" ,
,https://,rense.com/general69/invo,.htm, ,…,pic.twitter.com/dZJKYi0pPR",Emperor_Albus,FoxNews,https://twitter.com/Emperor_Albus/status/1020514096620474369,1532144495
"Slip?,pic.twitter.com/ytT3Ii4KnK",izzjarq,FoxNews,https://twitter.com/izzjarq/status/1020513105837809664,1532144259
"From now on i shall NEVER AGAIN try to defend a satanic sadist such as ,@,realDonaldTrump, who wakes up every moring with a plan to show off his power by hurting us all. HELL AWAITS HIM.  
Trump administration eyes changing Endangered Species Act ,https://www.,reuters.com/video/2018/07/,20/trump-administration-eyes-changing-endan?videoId=447189544&videoChannel=118261, ,…, via ,@,Reuters",patchouliDoll,FoxNews,https://twitter.com/patchouliDoll/status/1020512038517288960,1532144004
Because it’s the party of The Racists now! Thanks Trump!!,Kimryn,FoxNews,https://twitter.com/Kimryn/status/1020511607812689921,1532143902
Please tell me more about these “headaches” ?! Interesting analogy but of course very expected from FOX,manzeeno81,FoxNews,https://twitter.com/manzeeno81/status/1020511451713294336,1532143864
Slip trough or feel welcomed by the party of Traitors!,pulse1966,FoxNews,https://twitter.com/pulse1966/status/1020511043888533510,1532143767
"Slip through? Sorry. They are you now, bros. Keep up.",CrcsfNotme,FoxNews,https://twitter.com/CrcsfNotme/status/1020510857439084548,1532143723
Slip? Is that what you guys are calling it?,Thereapper69,FoxNews,https://twitter.com/Thereapper69/status/1020510016758042625,1532143522
