content,username,replyto,permalink,time
"Alabama hate group launches Russian-language page to promote ""Southern nationalism"" ,http://,hill.cm/W6V5Ps8, ,pic.twitter.com/9zqfu6a518",thehill,,https://twitter.com/thehill/status/1020755557362348036,1532202064
"They can't master the English language, how are they going to master Russian?",sloyoroll01973,thehill,https://twitter.com/sloyoroll01973/status/1020756630915502082,1532202320
That should keep them busy.  They will be scratching their hoods.,dkallenborn26,"sloyoroll01973,thehill",https://twitter.com/dkallenborn26/status/1020832206514778112,1532220338
,sloyoroll01973,"dkallenborn26,thehill",https://twitter.com/sloyoroll01973/status/1020832485238853633,1532220405
Who wants to tell them that there is no 2nd amendment in Russia?,DebraHirsch1,thehill,https://twitter.com/DebraHirsch1/status/1020764795916734464,1532204266
And no 1st,magnussvan,"DebraHirsch1,thehill",https://twitter.com/magnussvan/status/1020769119048806401,1532205297
At this very moment someone is trying to translate Git-R-Done,LeAkis2,thehill,https://twitter.com/LeAkis2/status/1020761038889934854,1532203371
Гйт-Р-Дон,LoverOfShrimp,"LeAkis2,thehill",https://twitter.com/LoverOfShrimp/status/1020774929103376384,1532206682
Are they confused by the Georgia thing?,MarkMurosky,thehill,https://twitter.com/MarkMurosky/status/1020756068601925632,1532202186
"When I see a MAGA hat...,pic.twitter.com/RnTCzuziZF",heyana2003,thehill,https://twitter.com/heyana2003/status/1020757226011553792,1532202462
Good God. The blatant ignorance on display in this country is astounding. Russia is not a friend to anyone in America.,nneTancy,thehill,https://twitter.com/nneTancy/status/1020756883639078912,1532202380
"GOP: The party of the KKK, Confederacy, White Nationalists, and Russians.",Rightsof_Man,thehill,https://twitter.com/Rightsof_Man/status/1020756468612698115,1532202281
"Someone slept through 5th grade history.  Was back when Southern Dems were cons & northern Reps were libs.  Now those Dems are the GOIP's strongest support. 

And your racism is well noted. """"Forced blacks into welfare"". The welfare states helps out RW cons the most.",Rightsof_Man,"1no_censorship,thehill",https://twitter.com/Rightsof_Man/status/1020761378083213313,1532203452
"Your racism is showing again. The fact that cons think blacks cannot be successful and are slaves to welfare make you a racist. 

And Republicans benefit from the welfare state the most. Cons are the slaves to gov't and could not make it on their own.,https://www.,theatlantic.com/politics/archi,ve/2017/02/gop-base-poverty-snap-social-security/516861/, ,…",Rightsof_Man,"1no_censorship,thehill",https://twitter.com/Rightsof_Man/status/1020777979000041476,1532207409
"When you have to use alt-right comics to make you point, you lost the argument. 

Plus, we already went over this. Con were the Confederates, Northern liberals were R's. 

GOP is the party of Jefferson Davis & Confederacy, not Lincoln. Learn a little history, little one.",Rightsof_Man,"1no_censorship,thehill",https://twitter.com/Rightsof_Man/status/1020779190705164288,1532207698
Well from reading tweets they can’t speak English,EL44766671,thehill,https://twitter.com/EL44766671/status/1020756814969954304,1532202364
pic.twitter.com/GPt4IOVVU5,spankythedotard,thehill,https://twitter.com/spankythedotard/status/1020756010817007616,1532202172
exsqueeze me?,solidarityvta,thehill,https://twitter.com/solidarityvta/status/1020755737771880448,1532202107
"Can we just send all of them to some lovely Russian city like Grozny? With one-way tickets? I'm sure they'll love it there! Even if it's majority Muslim. . .,pic.twitter.com/1mQymLrR5r",trilingual1946,thehill,https://twitter.com/trilingual1946/status/1020762025759334400,1532203606
I was thinking chummed shark infested waters... Seems more efficient.,soulbrotha215,"trilingual1946,thehill",https://twitter.com/soulbrotha215/status/1020762388696576006,1532203692
pic.twitter.com/BUjgmk0b5d,DroBama40,thehill,https://twitter.com/DroBama40/status/1020757868948217856,1532202615
"Dumber than a box of rocks. Don't even give them attention.  Fuck them, and also? Give them a map. Russia isn't anything close to being part of the south. I swear to God.",MoLo_MLB,thehill,https://twitter.com/MoLo_MLB/status/1020756389281583104,1532202262
. Same here. How is there a Russian language page when they can barely speak English? ,DabbsAWD,"ScienceNerdGirl,thehill",https://twitter.com/DabbsAWD/status/1020979747717861377,1532255515
The question I have is: Who is funding these groups internationally and domestically per country?,mrggibson,"thehill,HildaMercado16",https://twitter.com/mrggibson/status/1020758240026480640,1532202703
"Um, yeah, the Russian Orthodox Church is kinda a big deal over there.",Soldier_Cynic,"ibarra_baltazar,thehill",https://twitter.com/Soldier_Cynic/status/1020783110605111297,1532208633
"Um, yeah, the Orthodox doctrine isn’t Christian and much less the Jesus doctrine, an less you’re from Alabama you wouldn’t know that, but anything that suits those Animals;as long as is not Jewish black or brown.",ibarra_baltazar,"Soldier_Cynic,thehill",https://twitter.com/ibarra_baltazar/status/1020859699070201856,1532226893
LMAO.  REAL Nazis hate Communists.,GaryMil26845169,thehill,https://twitter.com/GaryMil26845169/status/1020794062067183617,1532211244
I believe Trump is the Sub-Human.,GaryMil26845169,"GaryMil26845169,thehill",https://twitter.com/GaryMil26845169/status/1020794851875610624,1532211432
"Stellar humans right there true ,#,knowledge, master’s. ,#,desperation",Sdberry4983,thehill,https://twitter.com/Sdberry4983/status/1020756747105939456,1532202347
,Sdberry4983,"Sdberry4983,thehill",https://twitter.com/Sdberry4983/status/1020756787887157248,1532202357
"Coming soon to schools near you!

Deviant Betsy DeVos will remove Spanish from school languages and replace it with Russian, stating it is a 'merit based' decision",hsmath,thehill,https://twitter.com/hsmath/status/1020759511081148419,1532203006
"Trump’s “very fine people” at work

,#,TrumpIsAWhiteSupremecist",bobpi31415,thehill,https://twitter.com/bobpi31415/status/1020757601729097728,1532202551
"Well, Well....What do we have here?....This coming from people that hate anything to do with Communists and they are promoting the Russian Language?....You just cannot make this bull shit up. And they still think that they are superior to other ""races"". Now that's ass backwards.",CarlosCastro071,thehill,https://twitter.com/CarlosCastro071/status/1020767513552932864,1532204914
pic.twitter.com/nfzidIiCkj,Romli490,"thehill,ColMorrisDavis",https://twitter.com/Romli490/status/1020766140899954690,1532204587
"Republicans are ,’s New Communist party",MyP_Chicago,thehill,https://twitter.com/MyP_Chicago/status/1020761097555660802,1532203385
"I love the South, I've Always felt comfortable in the South; not so much anymore.",LyndaDo10119189,thehill,https://twitter.com/LyndaDo10119189/status/1020757939563483136,1532202632
Is Roy Moore thier mascot?,ENVPamela,thehill,https://twitter.com/ENVPamela/status/1020757251957579776,1532202468
"I thought the Nazis saw the Slavs as subhuman? So what you're telling me is that your race ""science"" is malleable and based entirely on whatever fits your idiocy at the moment? That's good to know.",PaulWuster,thehill,https://twitter.com/PaulWuster/status/1020756332125642754,1532202248
"This should tie in very well with their other pages, Tinder for Family Members & ,http://,CousinMatch.com, ",Claymorecomic,thehill,https://twitter.com/Claymorecomic/status/1020758892035428352,1532202859
"They're just trolling. They know Russia's on MSM radar, they want exposure so they launch Russian page for controversy. Don't fall for the scam. 

Don't ignore them b/c bigotry is dangerous but don't help them in their propaganda efforts.",No_BS_Dem,thehill,https://twitter.com/No_BS_Dem/status/1020757163550158848,1532202447
"Sounds about right.  Yet another thing to thank trump for - another hate group in the good ole USA. ,@,realDonaldTrump, you must be so proud.",StoreyrlStorey,thehill,https://twitter.com/StoreyrlStorey/status/1020756918879612929,1532202388
Probably *not* an Alabama hate group. Probably Russian effort to look like locals.,Cheryl91728172,thehill,https://twitter.com/Cheryl91728172/status/1020756268951089152,1532202233
WTF? Southern Russian Pride has hit the good old USA. Give me a Bud and a shot of vodka boys.,outlazymedia,thehill,https://twitter.com/outlazymedia/status/1020756029779345408,1532202176
"So, the south and Russia think they've got something in common. Looks like it's time to kick some Confederate ass again.",kpmel,"thehill,solusnan1",https://twitter.com/kpmel/status/1020797809400926213,1532212137
"This is something of concern since this is an implicit invitation to invade us, they are eager to do an ethnic cleansing. I saw their page.",HildaMercado16,thehill,https://twitter.com/HildaMercado16/status/1020757625712119808,1532202557
"I know this phrase is about worn out during the era of *45, but you can't even make this stuff up.",SallyDeal4,thehill,https://twitter.com/SallyDeal4/status/1020884390073602049,1532232780
"Is it not amazing that this doesn't seem weird anymore? You read it, and ""yeah, I guess this is just where we are, makes sense."" Unbelievable, this doesn't even seem like a fringe thing anymore. It is a wild time to be alive.",HenryVLancaster,thehill,https://twitter.com/HenryVLancaster/status/1020825239486386176,1532218677
Look a Trump rally.,AaronLTalley,thehill,https://twitter.com/AaronLTalley/status/1020768410043670529,1532205128
Seems legit. After all it's not KNEELING for the National Anthem.,gooner4evr,thehill,https://twitter.com/gooner4evr/status/1020759868981030915,1532203092
Russian psych ops at its best,JPERGELRWE,thehill,https://twitter.com/JPERGELRWE/status/1020757559173697536,1532202541
And the LIKE button is lighting up like crazy ,tasheba_simpson,thehill,https://twitter.com/tasheba_simpson/status/1020756732438634496,1532202344
"Yeah, that is going to work.  Having studied Russian history, literature, and language I can assure you that no white supremist has the intelligence to master the Cyrillic alphabet.  They can barely speak proper English.",LindaBishopSLP,"thehill,ColMorrisDavis",https://twitter.com/LindaBishopSLP/status/1020850382141100033,1532224672
"Gross. Hell no. “Dracarys!”,pic.twitter.com/kPeEerYG7O",fuckingyasbatch,thehill,https://twitter.com/fuckingyasbatch/status/1020771105038974976,1532205771
"So, they're traitors. Can we just agree that that's the correct term here? Not ""patriots?""",phidippides26,"thehill,ColMorrisDavis",https://twitter.com/phidippides26/status/1020769084827406336,1532205289
"These morons can’t even speak English.... How can they speak Russian? Thank god for ,@,Google, translate, I guess.",rnmay,"thehill,ColMorrisDavis",https://twitter.com/rnmay/status/1020767208471871489,1532204842
"THIS IS ON YOU ,@,POTUS45, ,@,USCongress, ,@,USSenate, ,@,GOP,
, ALL ON YOU!  
,#,VoteThemOut, ALL OUT! ,@,GOP,
,#,VoteBlue, ",RRRRMMMMM14,thehill,https://twitter.com/RRRRMMMMM14/status/1020758619791462402,1532202794
""" The South of Russia will rise again ! """,KiloCharlie237,thehill,https://twitter.com/KiloCharlie237/status/1020759621345206272,1532203033
"I normally wouldn't have any words for this. BUT...
Alabama...Again.....",Odysseus93,thehill,https://twitter.com/Odysseus93/status/1020758471275417601,1532202758
"When do we start to hear how the RW calls them Democrats? So we can continue to laugh at the GOP and the ,#,MAGAts",kdevil66,thehill,https://twitter.com/kdevil66/status/1020757481667158023,1532202523
I guess they prefer Russian to Spanish.,MamaBojangles,thehill,https://twitter.com/MamaBojangles/status/1021031659544752128,1532267892
Stable geniuses at work,IceIce718,thehill,https://twitter.com/IceIce718/status/1020846995211259905,1532223864
I must be obvious to everyone now that Trump is working for Putin!,Radar_Funk,thehill,https://twitter.com/Radar_Funk/status/1020830515262353408,1532219935
"People who celebrate treason against the United States and fly the traitors' flag conspire to commit more treason against the United States. Who'd have guessed? ,#,Treason, ,#,GOPTraitors",Fava,thehill,https://twitter.com/Fava/status/1020817505995157504,1532216833
KKK=KremlinKremlinKremlin,oldawnie,thehill,https://twitter.com/oldawnie/status/1020792616298995713,1532210899
How Patriotic of them,mgonz1999,thehill,https://twitter.com/mgonz1999/status/1020782624329981952,1532208517
"Of course they did.  Let guess it's funded by the ,@,NRA,.",Mark738eis,thehill,https://twitter.com/Mark738eis/status/1020772025210671107,1532205990
"That sounds reasonable.  After Trump surrender in Helsinki and Russian Tzar visiting his subjects soon English will be replaced with Russian.  That is what the Victor's have done. ,#,TrumpKnew, ,#,TreasonSummit, ,#,TrumpTapes",jimyyek,thehill,https://twitter.com/jimyyek/status/1020771210488045568,1532205796
I not surprised the white supremacist “League of the South” would want to link itself to right-wing fascist-like groups in Russia. Both seem to view the world through a very similar lens.,earthlight68,thehill,https://twitter.com/earthlight68/status/1020769295184416768,1532205339
I think that puts them beyond free speech directly into aiding and abetting...,102samurai,"thehill,ColMorrisDavis",https://twitter.com/102samurai/status/1020766885724540928,1532204765
"They cannot even speak English correctly, now they want to learn Russian too?! Really!",SuzieThompson57,thehill,https://twitter.com/SuzieThompson57/status/1020762015894319104,1532203604
"Let the deportations commence! ""Oh, you speak Russian? You'll *love* your new home.""",JackMcQuack2,thehill,https://twitter.com/JackMcQuack2/status/1020759826140475393,1532203082
"can it become even more ridiculous I seriously think u should reconsider yr education, if they cnt see tht Russi s not there to hang out with them. They are not looking for friendship but total degradation of America and position Russia on its ashes. No bless in this stupidity",ManitouStultus,thehill,https://twitter.com/ManitouStultus/status/1020758686057357312,1532202810
Puke...,Cold_Filtered,thehill,https://twitter.com/Cold_Filtered/status/1020758672270557184,1532202806
This is something the FBI will be interested in. Betray your country much????,ahystrygrl,thehill,https://twitter.com/ahystrygrl/status/1020758661726199809,1532202804
"Duh, they've always seen Putin as an important part of exporting global white supremacy",WillieEverstop,thehill,https://twitter.com/WillieEverstop/status/1020756503421243392,1532202289
there ya go- let's mix in some KKK with the Russian BS to really get the loons fired up- muckrakers,TheLightReports,thehill,https://twitter.com/TheLightReports/status/1020755974540484613,1532202163
What in the actual...... Why is this a thing in2018.... Why??? Ignorance,sinner_tammy,thehill,https://twitter.com/sinner_tammy/status/1021187151621382144,1532304964
Russia owns republicans and KKK,GermanT61734220,"thehill,NUPEsupreme",https://twitter.com/GermanT61734220/status/1021093341965012997,1532282598
"Trumps good people doing his work. ,#,RacistInChief, ,#,TrumpConspired",1865JUNE19,thehill,https://twitter.com/1865JUNE19/status/1021080004841607168,1532279418
We need to march to the sea again,black_attack_1,thehill,https://twitter.com/black_attack_1/status/1021040880466235393,1532270090
"https://,twitter.com/StevenBeschlos,s/status/1020465857812500480, ,…",_Carja,thehill,https://twitter.com/_Carja/status/1021033121356156928,1532268240
Stop it...you do not represent all of Alabama.,rcfairley07peop,"thehill,gonzalezderwin",https://twitter.com/rcfairley07peop/status/1021029931910942721,1532267480
pic.twitter.com/7a1RSts3lr,PTalkingraven,thehill,https://twitter.com/PTalkingraven/status/1021025179751755776,1532266347
So watch out for these hooligans at your World Cup America/Canada/Mexico!!,mammacia,thehill,https://twitter.com/mammacia/status/1020921577960017921,1532241646
Idiots? Definitely. Useful? Probably not so much.,malvolioUVa,thehill,https://twitter.com/malvolioUVa/status/1020899613023326208,1532236409
These people are Silly AF. They wait until Dump is in office to Put Russia and Putin over their own Country?talk about a Cult,Omegassualt,thehill,https://twitter.com/Omegassualt/status/1020895760735506432,1532235491
"Never thought I'd see the day when these assholes, who traditionally were the blindly-patriotic ""America love it or leave it"" dickwads, would embrace Russia. Russia! Russia, of all places!! We are truly in the Upside Down. Curiouser and curiouser.",jacknorth,thehill,https://twitter.com/jacknorth/status/1020868566256635908,1532229007
.,LindaBishopSLP,"thehill,ColMorrisDavis",https://twitter.com/LindaBishopSLP/status/1020850460910071809,1532224691
pic.twitter.com/ogNE5Iax63,BlkbyDesign,thehill,https://twitter.com/BlkbyDesign/status/1020847403744874496,1532223962
Trump and his fine fellows want to turn the country over to Russia.,PantanoJones,thehill,https://twitter.com/PantanoJones/status/1020845032713146373,1532223396
"Hey, if Russia is paying the bills, then you need to make Russia happy.",johnquackenbush,"thehill,ColMorrisDavis",https://twitter.com/johnquackenbush/status/1020842990649118726,1532222909
"#,heritage, MY ASS",Splatzloki,thehill,https://twitter.com/Splatzloki/status/1020842916628099072,1532222892
Only the best people,CooterLlibnagoh,thehill,https://twitter.com/CooterLlibnagoh/status/1020835863629041665,1532221210
Read it three times. Don’t get it.,Chigalow,thehill,https://twitter.com/Chigalow/status/1020832717406199808,1532220460
"Send them to Russia, they will love it.",OneSardine,thehill,https://twitter.com/OneSardine/status/1020829260297187330,1532219636
This must be a joke.,EricJRacy,"thehill,ColMorrisDavis",https://twitter.com/EricJRacy/status/1020826870957334528,1532219066
I’m gonna guess it’s a Russian lead southern hate group.,Tobogigio,"thehill,robertpjones",https://twitter.com/Tobogigio/status/1020823746444054528,1532218321
Nice work Donald,jasonwott,thehill,https://twitter.com/jasonwott/status/1020815574803206145,1532216373
pic.twitter.com/F42A6o93E7,jakoppel,thehill,https://twitter.com/jakoppel/status/1020814692468645889,1532216163
I can't even read this its so ridiculous.,ShowMeGoodNews,thehill,https://twitter.com/ShowMeGoodNews/status/1020811994100838406,1532215519
Fake news leave the South out of your phony hate,TimChap45336298,thehill,https://twitter.com/TimChap45336298/status/1020809456999960576,1532214914
"I wonder if anybody told these ignint peckerwoods that Russian nationalists want to take back Northern California and Alaska.......

Oh yeah, and mandatory provocative picture posted......,pic.twitter.com/bH82a10u4U",Real_TDurden,thehill,https://twitter.com/Real_TDurden/status/1020807877605306368,1532214538
Please tell me this is The Onion!,notputinupwidis,"thehill,pianotinkler",https://twitter.com/notputinupwidis/status/1020806342989307904,1532214172
This is absolute Insanity.  Not too long ago we were a united America.,CAPNYC1,thehill,https://twitter.com/CAPNYC1/status/1020805664287920129,1532214010
They are all gonna be shocked when they learn that Jesus was Black...,VyzionEnt,thehill,https://twitter.com/VyzionEnt/status/1020804516160163842,1532213736
WTH,hotchef9,thehill,https://twitter.com/hotchef9/status/1020798397337559040,1532212278
Thanks for exposing these lunatics. The FBI surely must be aware of them too given their traitorous goals.,LoranHayden,"thehill,ColMorrisDavis",https://twitter.com/LoranHayden/status/1020795763230740480,1532211650
Treason flag.,dfa_etcetera,thehill,https://twitter.com/dfa_etcetera/status/1020789896510824448,1532210251
Antifa in drag.,allan_ange,thehill,https://twitter.com/allan_ange/status/1020789024892465152,1532210043
"Paedophilia 
Is ok then?,pic.twitter.com/YHisTXkhDA",SJSCardiff,thehill,https://twitter.com/SJSCardiff/status/1020788665222680576,1532209957
And THIS is patriotism?,dbnupefromdp,thehill,https://twitter.com/dbnupefromdp/status/1020786940864618497,1532209546
How many members? 12?,Steve_Loeb,thehill,https://twitter.com/Steve_Loeb/status/1020786577398804481,1532209460
"Not to worry, majority of them can’t read",rumchata5757,thehill,https://twitter.com/rumchata5757/status/1020784580838731776,1532208983
"Again... out and proud in trump’s America. Plus, they love them some putin.",saraptalaga,thehill,https://twitter.com/saraptalaga/status/1020782439835291648,1532208473
Omg,debbie_dease,"thehill,ColMorrisDavis",https://twitter.com/debbie_dease/status/1020782010493632513,1532208371
pic.twitter.com/EuH0Wgs4SC,info_co_creator,thehill,https://twitter.com/info_co_creator/status/1020781014514307073,1532208133
"@,realDonaldTrump, ,@,PressSec, ,@,GovMikeHuckabee, ,@,SecNielsen, ,@,USAGSessions, the WH is full of racist ,#,WhiteSurpremacist, ,https://www.,google.com/search?q=charl,ottesville+protest&prmd=niv&source=lnms&tbm=isch&sa=X&ved=0ahUKEwiqwfXJjbHcAhWuct8KHdXHDaMQ_AUIEigC&biw=360&bih=560#imgrc=BZx7umTgCC4T6M, ,…,:",WoodlandNative,thehill,https://twitter.com/WoodlandNative/status/1020778492118564864,1532207532
"Well, of course they did...",EboneezerG,thehill,https://twitter.com/EboneezerG/status/1020778289110003712,1532207483
Told you we should have let them win the civil war....,patoo5191,thehill,https://twitter.com/patoo5191/status/1020777521800007680,1532207300
Hey Republicans.  Is this what you had in mind.  Wow.,ChuckWagon645,thehill,https://twitter.com/ChuckWagon645/status/1020776319293050880,1532207014
Ridiculous Behavior! Smh ,QueenHoneyBee50,thehill,https://twitter.com/QueenHoneyBee50/status/1020775281718521856,1532206766
The guy in white has some colored blood. He must hate himself.,TAGRIX,thehill,https://twitter.com/TAGRIX/status/1020772789144473600,1532206172
Traitors every single one of them. If this was 1942 they would have sided with the Japanese and Nazis. Useless treasonous quislings and 5th Column. Strip them of citizenship for treason.,lovcen1900,thehill,https://twitter.com/lovcen1900/status/1020772735218221058,1532206159
What the shit??? These ppl are sheep. Can't they realize what is going on with Russia? My god!,Calderon08,thehill,https://twitter.com/Calderon08/status/1020772185483481089,1532206028
"Cool they found their white ethno-state, let them all move to Russia.",gonzalezderwin,"thehill,stockguy61",https://twitter.com/gonzalezderwin/status/1020770669578129408,1532205667
"We have never seen this much hate, even in the Obama’s years.",wenwar69,thehill,https://twitter.com/wenwar69/status/1020769532636303360,1532205396
Russian KKK in Alabama WTF?,moogie59,thehill,https://twitter.com/moogie59/status/1020768987217526784,1532205266
Could any one of them point out Russia on a world map???? I doubt that very seriously.,WStewar43717828,thehill,https://twitter.com/WStewar43717828/status/1020768046414270464,1532205041
Lol,awesomebill3,"thehill,ColMorrisDavis",https://twitter.com/awesomebill3/status/1020767524672229378,1532204917
Difficult to believe this is happening in 2018..the world seems to be going backwards..scary the hate and intolerance that exists to this day..scarier even more when the Subhuman in charge feeds the unrest.,Ann68Carol,thehill,https://twitter.com/Ann68Carol/status/1020767379670745088,1532204882
TяUMP’s AMEяICA,Chuck23507,thehill,https://twitter.com/Chuck23507/status/1020767214016827392,1532204843
What? They are moving to southern RU? They need any help packing?,HausOfEse,thehill,https://twitter.com/HausOfEse/status/1020766729209774080,1532204727
"What the f...

THE RIGHT-WINGERS ARE FREAKING TERRORISTS....   If they could, they would use guns.. push their religions... Oh wait, they already do exactly that.

Tell me the difference between an Al-Qaeda soldier and a right-wing extremist...",JohnMolsonEX,thehill,https://twitter.com/JohnMolsonEX/status/1020766711396610048,1532204723
Classic stuff.,skynet8291997,"thehill,ColMorrisDavis",https://twitter.com/skynet8291997/status/1020766365936996352,1532204641
"""Russia is our friend!"" ,#,Charlottesville, (2017)",AndrewOnSeeAIR,"thehill,ColMorrisDavis",https://twitter.com/AndrewOnSeeAIR/status/1020766226270781441,1532204607
Dumb and dangerous,meanwhilemenace,thehill,https://twitter.com/meanwhilemenace/status/1020764715180593152,1532204247
Why go through all the hassle of building a website when they could just use Facebook?,CConnyers,thehill,https://twitter.com/CConnyers/status/1020764506484559874,1532204197
I wonder who’s financing that inclusive and generous organization.,wchase232,thehill,https://twitter.com/wchase232/status/1020763930753454080,1532204060
Nothing a WMD couldn’t end,psciao,thehill,https://twitter.com/psciao/status/1020762296971407361,1532203671
You can’t spell “Alabama” without ☭,CastleTechDev,thehill,https://twitter.com/CastleTechDev/status/1020760756546043905,1532203303
Nazis deserve being hang for destroying democracy.,TrumpFick,thehill,https://twitter.com/TrumpFick/status/1020760129145319424,1532203154
"Jerkers of the World Unite!
You've nothing to lose but your marbles!",BonzoDog1,thehill,https://twitter.com/BonzoDog1/status/1020760012744929280,1532203126
"@,SpeakerRyan, & ,@,SenateMajLdr, you are allowing all things",GBeganovic,thehill,https://twitter.com/GBeganovic/status/1020759640148271105,1532203037
They suffer from the *real* meaning of Trump Derangement Syndrome.,WearsFactyPants,thehill,https://twitter.com/WearsFactyPants/status/1020759417547964416,1532202984
"

That ain’t proper.",TwitchedAtBirth,thehill,https://twitter.com/TwitchedAtBirth/status/1020757724836114432,1532202581
pic.twitter.com/qkL7upW6js,LuciiasLife,thehill,https://twitter.com/LuciiasLife/status/1020757230876909568,1532202463
