content,username,replyto,permalink,time
"Hope you're proud of yourself Libby.  You are responsible for this.  Those attacked were not part of our group.  You had a big part in this.  You are responsible. Your incompetence has led to violence and the assault of innocent people. I hope they sue you and the city.,https://,twitter.com/LibbySchaaf/st,atus/1021168411945054208, ,…",ProudBoysUSA,,https://twitter.com/ProudBoysUSA/status/1021884104780984320,1532471130
"Oakland Commifornia is being destroyed by a Marxist Mayor,Libby Schaff",jimlibertarian,ProudBoysUSA,https://twitter.com/jimlibertarian/status/1021888165273952256,1532472099
Wait a minute!! That idiot is the mayor?,SchaveChad,"jimlibertarian,ProudBoysUSA",https://twitter.com/SchaveChad/status/1021928692308738048,1532481761
Yes,ProudBoysUSA,"SchaveChad,jimlibertarian",https://twitter.com/ProudBoysUSA/status/1021932980653228033,1532482783
That is just...the worst,SchaveChad,"ProudBoysUSA,jimlibertarian",https://twitter.com/SchaveChad/status/1021939576452075520,1532484356
"Liberals are literally beating people up like a psychotic mob now. Swinging for anything they can point at. I don't even LIKE the Proud Boys, personally, but this is complete BS.",TraditionalCeo,ProudBoysUSA,https://twitter.com/TraditionalCeo/status/1021884690645495808,1532471270
The Proud boys deny it was them they just assumed and attacked innocent people. She is a horrible person and I hope karma is a bitch.,jennfox515,"TraditionalCeo,ProudBoysUSA",https://twitter.com/jennfox515/status/1021887785043734530,1532472008
"Liberals are RABID dogs now. In groups especially. You either are forced to stay away, out of public, or challenge them head on. Or you're entirely innocent and almost get lynched because someone POINTED at you and yelled ""Nazi"".",TraditionalCeo,"jennfox515,ProudBoysUSA",https://twitter.com/TraditionalCeo/status/1021890300610932736,1532472608
"@,ProudBoysUSA, Your group is a direct connection to the nazi party! Don’t lie",ton_loc503,ProudBoysUSA,https://twitter.com/ton_loc503/status/1021941196854161408,1532484742
"What is the direct connection? I remember the grand wizard of the kkk is a close friend and supporter of the Clinton cult, Robert Byrd",freeAmerica96,"ton_loc503,ProudBoysUSA",https://twitter.com/freeAmerica96/status/1021972475242983424,1532492200
"C’mon Biehl, seriously RT’ing the fucking proud boys? This group is deranged and violent. Regardless of your political POV. Proud Boys sent members TO THE HOME of ,@,VicBergerIV, b/c he made a video edit they didn’t agree with. They threatened him and his family if he didn’t stop.",LRonChubbles,"ProudBoysUSA,ShaquilleOBiehl",https://twitter.com/LRonChubbles/status/1022091020434059264,1532520463
Learn something everyday!,ShaquilleOBiehl,"LRonChubbles,ProudBoysUSA,VicBergerIV",https://twitter.com/ShaquilleOBiehl/status/1022097774228238336,1532522073
"I really do hope these innocents that were brutally beaten do sue ,@,LibbySchaaf, for everything she’s got. That corrupt piece of shit has no business in politics",AdamDugan2,ProudBoysUSA,https://twitter.com/AdamDugan2/status/1021925270494879746,1532480945
Oakland again!!!! Let me guess police just hung back because they didn’t have enough manpower to handle the situation. Mayor Schiff you are poor politician and horrible human being for what you’ve done to a once proud city. From bad management to sanctuary policies your a joke!!!,sabresfan70,ProudBoysUSA,https://twitter.com/sabresfan70/status/1021885418592239616,1532471444
"Wasn’t she the elected official who warned criminals to hide from law enforcement?  Ironic how today’s Anne Franks are murderers, rapists and other criminals whom Libby would hide.",TommyJo33624688,ProudBoysUSA,https://twitter.com/TommyJo33624688/status/1021888378873278466,1532472149
"Oh, ,@,LibbySchaaf, is, like ,@,RepMaxineWaters, ,@,iamfonda, ,@,PatDussault, & other distinguished lunatics, delighted to incite ,#,Violence,. On top of that, Elizabeth is a well known enemy of freedom of assembly and law enforcement.",Pablo_Chihuahua,"ProudBoysUSA,invisimono",https://twitter.com/Pablo_Chihuahua/status/1022198346155479040,1532546051
GTFO Libby Shat!,KPikklefield,ProudBoysUSA,https://twitter.com/KPikklefield/status/1021891192361869312,1532472820
She's a moron. The corruption in Oakland and its elected officials has lost them their NFL team. She then warns illegals of ICE movements and now this.,raiderjim40,ProudBoysUSA,https://twitter.com/raiderjim40/status/1021887954275495937,1532472048
"Yea? Come see us at our Philly HQ if you think you're hard enough Proud Boys. Name the date. ,#,LetsEndThis, ,pic.twitter.com/XDLnzn3SfY",PGdadTV,"ProudBoysUSA,AmesOfThrones99",https://twitter.com/PGdadTV/status/1022180690421538816,1532541842
"Schaaf...? Man, those crazy Germans are at it again lol.

Every. Single. Time.",horstwriter,ProudBoysUSA,https://twitter.com/horstwriter/status/1021944681612148736,1532485573
POYB,bkbobby29,ProudBoysUSA,https://twitter.com/bkbobby29/status/1021943149072199681,1532485208
Who wants to bet on whether or not there will be a gang related shooting at that event? Sad but typical,Sheepdogwatch,ProudBoysUSA,https://twitter.com/Sheepdogwatch/status/1021902242088214528,1532475455
Can’t trust anyone who runs on a dying battery.,_MyFathersSon_,ProudBoysUSA,https://twitter.com/_MyFathersSon_/status/1022212930488565760,1532549529
"Boy, they’re gonna cling to that Charlottesville forever. Is there any other examples of “right wing” violence? I can think of a bunch of left wing violence.",DerekromTexas,ProudBoysUSA,https://twitter.com/DerekromTexas/status/1022185147322359808,1532542905
"I don't know who you guys are, but Real Men need to Step the Honk Up and Protect Our Union! Proud Boys seem to be Good Men. Correct me if I'm wrong ,#,WWG1WGA, ,#,TheStorm, ,@,realDonaldTrump",Multiplesof7,ProudBoysUSA,https://twitter.com/Multiplesof7/status/1022129010938142720,1532529521
  I’m surrounded by idiots. I hope California isn’t beyond saving.,w3th3p3eople,ProudBoysUSA,https://twitter.com/w3th3p3eople/status/1021919853681102848,1532479654
Withholding all federal monies to Oakland would be a great start.,GregorySWheeler,ProudBoysUSA,https://twitter.com/GregorySWheeler/status/1021900047280091137,1532474931
Apparently Libby feels they can supply their own hate,Buckeyeinohio,ProudBoysUSA,https://twitter.com/Buckeyeinohio/status/1021896092512870400,1532473989
Some people just don’t get it.,Jonathansteev14,ProudBoysUSA,https://twitter.com/Jonathansteev14/status/1021886957012451328,1532471810
"#,please, ,#,help, ,#,veteran, or ,#,share, ,#,payitforward,https://www.,gofundme.com/HelpVeteranDur,ingHolidayseason, ,…",N2Mdesigns,ProudBoysUSA,https://twitter.com/N2Mdesigns/status/1021885707730731008,1532471513
