content,username,replyto,permalink,time
"Is Canada even real? And how soon can I move there.,pic.twitter.com/yO0OGWga8T",tazpants,,https://twitter.com/tazpants/status/743057685499633664,1465993732
maybe baby moose is carrying a birthday rainbow flag for you! :),blablue88,tazpants,https://twitter.com/blablue88/status/743061356845367296,1465994607
can it carry me to canada instead? XP,tazpants,blablue88,https://twitter.com/tazpants/status/743061616632025088,1465994669
mhhh... might be a bit too small yet? Maybe wait for next years birthday? ;),blablue88,tazpants,https://twitter.com/blablue88/status/743061847377641472,1465994724
i assume all Canadian moose are like magical rainbow beings and can fly and stuff so it might work. I will wait.,tazpants,blablue88,https://twitter.com/tazpants/status/743062193315270656,1465994806
Yass. It will! Unicorn moose... they just wait for the right moment! :D,blablue88,tazpants,https://twitter.com/blablue88/status/743062489039024128,1465994877
just come here on a vacation that lasts indefinitely then we'll get hitched babe,Androktona,tazpants,https://twitter.com/Androktona/status/743092554539933696,1466002045
a real life image of me in Toronto this august,amesIRL,tazpants,https://twitter.com/amesIRL/status/743072469666254850,1465997257
My thoughts everyday.,RuthAnrep,tazpants,https://twitter.com/RuthAnrep/status/743057995207081984,1465993806
