content,username,replyto,permalink,time
"if you were wondering what prompted my tweets about what the hell are americans' deal with canada yesterday ......,https://,twitter.com/ClintFalin/sta,tus/742768118901145600, ,…",francoshrug,,https://twitter.com/francoshrug/status/743263424596033536,1466042784
"ok je sais j'ai vu ça j'étais genre ""fuck off""",louloutre420,francoshrug,https://twitter.com/louloutre420/status/743263881989136384,1466042893
like idk how this makes any sense genre je suis juste .... jsais même pas quoi dire à ce type de commentaires,francoshrug,louloutre420,https://twitter.com/francoshrug/status/743264879679803392,1466043131
c'est tellement genre... wow la barre est basse si ça c'est impressionnant lol,louloutre420,francoshrug,https://twitter.com/louloutre420/status/743265440835710977,1466043264
genre meese (?) have no thoughts about lgbt people. how is a moose holding a rainbow flag proving anything?,francoshrug,louloutre420,https://twitter.com/francoshrug/status/743265860765294594,1466043365
j'aime qu'on ait tweeté la même chose en même temps lol nice,louloutre420,francoshrug,https://twitter.com/louloutre420/status/743265968965693441,1466043390
