content,username,replyto,permalink,time
"How many glasses of champagne do I have to drink to be able to see ,#,Nessie,?",AnneBrittK,,https://twitter.com/AnneBrittK/status/1024356444429340673,1533060582
Maybe 50? ,palaceeagle1,AnneBrittK,https://twitter.com/palaceeagle1/status/1024358128601784322,1533060984
"Blimey, I’d expect to see a Benteke goal after that many glasses, never mind the Loch Ness monster! ,#,cpfc",AnneBrittK,palaceeagle1,https://twitter.com/AnneBrittK/status/1024362964336496641,1533062137
Could have seen that today ,palaceeagle1,AnneBrittK,https://twitter.com/palaceeagle1/status/1025803153185402880,1533405504
Ah but as I didn’t see it with my own eyes it remains a thing of myths!,AnneBrittK,palaceeagle1,https://twitter.com/AnneBrittK/status/1025803370236395521,1533405556
