content,username,replyto,permalink,time
"Dear twitter, today I saw a cloud!",ScarfaceSFFB,,https://twitter.com/ScarfaceSFFB/status/1024626892144619520,1533125062
Ah happy or a sad cloud?,noxious8_,ScarfaceSFFB,https://twitter.com/noxious8_/status/1024736503942053888,1533151195
"I'd like to think it was happy. it was big white and fluffy, like a sheep",ScarfaceSFFB,noxious8_,https://twitter.com/ScarfaceSFFB/status/1024767899486052355,1533158681
Whats the next thing you say you saw the Loch Ness Monster? Kappa,alibadihutchut,ScarfaceSFFB,https://twitter.com/alibadihutchut/status/1024712498396778497,1533145472
aka leif? Kappa,ScarfaceSFFB,alibadihutchut,https://twitter.com/ScarfaceSFFB/status/1024712852219863040,1533145556
A real one? PogChamp,DickOctagonal,ScarfaceSFFB,https://twitter.com/DickOctagonal/status/1024635140562010112,1533127028
Yes! I should had taken a picture I realize now but I swear it was real!,ScarfaceSFFB,DickOctagonal,https://twitter.com/ScarfaceSFFB/status/1024638315599933441,1533127785
"24, just another claim then FeelsBadMan",DickOctagonal,ScarfaceSFFB,https://twitter.com/DickOctagonal/status/1024639939307220992,1533128173
snapesLove,HyunAOP,ScarfaceSFFB,https://twitter.com/HyunAOP/status/1025145903223648257,1533248804
