content,username,replyto,permalink,time
"The Apple , doesn’t fall far from it’s tree ,.",PaulBogosian2,"MichaelCohen212,DonaldJTrumpJr",https://twitter.com/PaulBogosian2/status/1023557664540962816,1532870138
"Getting closer,pic.twitter.com/tPssTwQwd9",RonaldT82169541,"MichaelCohen212,DonaldJTrumpJr",https://twitter.com/RonaldT82169541/status/1023620562587975681,1532885134
"

how did this tweet age??",lasersmama,"MichaelCohen212,DonaldJTrumpJr",https://twitter.com/lasersmama/status/1023598513924521984,1532879877
"Do you really mean it, ,@,MichaelCohen212, ?
Why are you selling out now?",innaroz,"MichaelCohen212,DonaldJTrumpJr",https://twitter.com/innaroz/status/1024072743875235840,1532992943
"How about this one!?? 
,#,MoronInChief,pic.twitter.com/o2ELjTJ1Vh",SilDePax,"MichaelCohen212,DonaldJTrumpJr",https://twitter.com/SilDePax/status/1023578073797517312,1532875004
From truth to lies. He is a garbage dweller and should be disbarred and convicted. Any chance those recorded calls were done while Trump was in FL? Would Love to see Cohen charged for secretly recording,mpbw,"MichaelCohen212,stringfellowfr4,DonaldJTrumpJr",https://twitter.com/mpbw/status/1023643227843452928,1532890538
"Seriously? That was in 2017, trying to fake out the news with old tweets?",Linda3717,"MichaelCohen212,DonaldJTrumpJr",https://twitter.com/Linda3717/status/1023745194905296896,1532914849
pic.twitter.com/XBVWozLFLV,NancyWa75316416,"MichaelCohen212,DonaldJTrumpJr",https://twitter.com/NancyWa75316416/status/1023549917174870016,1532868291
"@,DonaldTrumpAsia, was caught in over 3,600 lies already & this month, he has been caught in hundreds more. He is up to now lying almost 9 times a day & the media simply can't keep up. The least transparent & honest president in history. Wow, he has done something historic!",GrantDevereaux,"MichaelCohen212,DonaldJTrumpJr",https://twitter.com/GrantDevereaux/status/1023591705369608192,1532878254
Tapeing a client without there knowledge the courts  should take away your license#1 Will see how honest you are time now using Clinton’s attorney.  Oh sure real honest. Double standard in our American government so sad. This is all about the keys to the treasury and taxes.,GalanteF,"MichaelCohen212,BioExcel_Philly,DonaldJTrumpJr",https://twitter.com/GalanteF/status/1023614180769722368,1532883613
"A lot has changed since this tweet, Buttercup. ,#,BuckleUpButtercup",mistymeadow22,"MichaelCohen212,DonaldJTrumpJr",https://twitter.com/mistymeadow22/status/1023569839024037888,1532873041
pic.twitter.com/atc4mp2Dl8,CorpsmanRetired,"MichaelCohen212,RightTexasMom,DonaldJTrumpJr",https://twitter.com/CorpsmanRetired/status/1023762494026866689,1532918973
"Tape ruled privaledged, ruled no crime. The media is taking this country down rabbit hole after rabbit hole,making up crimes. Ignoring the Mortgage Crisis,Interest rates have almost doubled in last yr. New Housing Starts-Down, Sales Down, 75% of all home owners-Variable Int. Rate",Carlos_Monsoor,"MichaelCohen212,DonaldJTrumpJr",https://twitter.com/Carlos_Monsoor/status/1023579800881922048,1532875416
But I thought you said Cohen was now a lying liar?,DPetagrew,"MichaelCohen212,DonaldJTrumpJr",https://twitter.com/DPetagrew/status/1023550709952929792,1532868480
"You and your family are grifters, pathological liars. Give it a rest, no one who pays attention believes you.",yepthatsalie,"MichaelCohen212,DonaldJTrumpJr",https://twitter.com/yepthatsalie/status/1023539026081529857,1532865694
"https://,twitter.com/Daver2956/stat,us/885065652632997890, ,…",LoneEagal21,"MichaelCohen212,DonaldJTrumpJr",https://twitter.com/LoneEagal21/status/885079294753550339,1499854322
"@,MichaelCohen212, you are a shameful excuse for a lawyer! Who does this? You really did choose the dark side...to bad for you! Thank God we know now what a snake you are!",NeelySchwab,"MichaelCohen212,LavelleGerald,DonaldJTrumpJr",https://twitter.com/NeelySchwab/status/1023897760964243456,1532951223
This tweet has not aged well.,JusticeLeagFan,"MichaelCohen212,DonaldJTrumpJr",https://twitter.com/JusticeLeagFan/status/1023643587072819205,1532890624
"As Crooked as the father.
,#,Crimefamily",jemakatz,"MichaelCohen212,DonaldJTrumpJr",https://twitter.com/jemakatz/status/1023596846978088960,1532879480
"The New World Order people do not own ,@,realDonaldTrump, so he makes his own decisions!",LeahJHouston,"MichaelCohen212,DonaldJTrumpJr",https://twitter.com/LeahJHouston/status/1023571380737114112,1532873408
"Guess what djt? Cohen was lying. Shocker, I know. , ,#,IllegitimatePresident",jacqijj,"MichaelCohen212,DonaldJTrumpJr",https://twitter.com/jacqijj/status/1023621044911919107,1532885249
,DeniseSims,"MichaelCohen212,DonaldJTrumpJr",https://twitter.com/DeniseSims/status/1023641037166628864,1532890016
What BS,kevinmo91205068,"MichaelCohen212,DonaldJTrumpJr",https://twitter.com/kevinmo91205068/status/1023562462065512448,1532871282
"Mikey, can I call you that? Mikey..ya need to quit playing Russian Roulette with this.",joanblondell4,"MichaelCohen212,DonaldJTrumpJr",https://twitter.com/joanblondell4/status/1023566576342028288,1532872263
Shutting down the Mexican Government for failing to pay for your Wall? GREAT IDEA !!,AledWil83959532,"MichaelCohen212,DonaldJTrumpJr",https://twitter.com/AledWil83959532/status/1023679699984240640,1532899234
Then he woke up,sheila_turri,"MichaelCohen212,DonaldJTrumpJr",https://twitter.com/sheila_turri/status/1023558359256125447,1532870304
What a difference a year make donald!,sanfralol2,"MichaelCohen212,DonaldJTrumpJr",https://twitter.com/sanfralol2/status/1023648242008043522,1532891734
"Just like the Trump family and everything they do, this didn't age well. Please spill all the details and take these pieces of shit down already. You'll be remembered more as a hero than the scumbag you've always been.",RyanPupils,"MichaelCohen212,DonaldJTrumpJr",https://twitter.com/RyanPupils/status/1023595606894370816,1532879184
And then Micheal was bribed with blackmail...,TaraPollard99,"MichaelCohen212,DonaldJTrumpJr",https://twitter.com/TaraPollard99/status/1023630422335401984,1532887485
,SYeninas,"MichaelCohen212,DonaldJTrumpJr",https://twitter.com/SYeninas/status/1023744890751078401,1532914776
pic.twitter.com/ypFm2I7SFZ,michaelwild2198,"MichaelCohen212,DonaldJTrumpJr",https://twitter.com/michaelwild2198/status/1023628670315900929,1532887067
HA HA HA...TOO LATE FREDO!! THE SHIP HAS SAILED!,Barbara12689822,"MichaelCohen212,DonaldJTrumpJr",https://twitter.com/Barbara12689822/status/1023753209322655745,1532916760
This was over a year ago when he was still being paid to lie for you and your evil spawn. Now that he got caught and you threw him under the bus you put out this crap. Here’s a clue: Not everyone is blind and stupid enough to believe your crazy shit!,gofro524,"MichaelCohen212,DonaldJTrumpJr",https://twitter.com/gofro524/status/1023555109601595392,1532869529
Takes after his dad I guess. The man who couldn't tell a lie.......,hopeful_still,"MichaelCohen212,DonaldJTrumpJr",https://twitter.com/hopeful_still/status/1023553186806808578,1532869071
Hmmm.  Which is it Michael ?,RyanWalis,"MichaelCohen212,DonaldJTrumpJr",https://twitter.com/RyanWalis/status/1023553963864588289,1532869256
"DNC and HRC colluded with Podesta Group, Perkins Coie Fusion GPS, Christopher Steele who collided with Russians for the Fake Dossier!",kegrecht,"MichaelCohen212,DonaldJTrumpJr",https://twitter.com/kegrecht/status/1023713715999391745,1532907344
"Hope you like Orange Junior because you and your family will be wearing that beautiful ""orange"" suit/s.",BobS902,"MichaelCohen212,DonaldJTrumpJr",https://twitter.com/BobS902/status/1023606434246873088,1532881766
"REMEMBER WHEN HE SAID THAT, I DO IT WILL COME BACK TO BITE HIM IN THE ASS.,1ST.",PeterHi32200905,"MichaelCohen212,BeckwithArvo,DonaldJTrumpJr",https://twitter.com/PeterHi32200905/status/1023748146923544581,1532915553
"#,MAGA, ,#,TRUMP, ,#,VoteDemsOutNov, ,#,DemsAreFleecingThisCountry, ,#,LIBERALSCANTHANDLETHETRUTH,pic.twitter.com/4UnnFBGjAW",InspireFaith,"MichaelCohen212,DonaldJTrumpJr",https://twitter.com/InspireFaith/status/1023620638890754049,1532885152
Your tongue must be pretty dry licking Trump's boots for that pardon.,Abq01,"MichaelCohen212,DonaldJTrumpJr",https://twitter.com/Abq01/status/1023564002738106369,1532871649
