content,username,replyto,permalink,time
"White dude in his 40s with pics of him in a MAGA hat.

We're all thinking it, c'mon.,https://,twitter.com/BravenakBlog/s,tatus/975943016123781120, ,…",onstat_z,,https://twitter.com/onstat_z/status/975947637559001089,1521519023
Either LE or Iraq veteran. ,EaterofSoles,"onstat_z,BravenakBlog",https://twitter.com/EaterofSoles/status/975948258378952704,1521519171
Somethin' like that.,onstat_z,"EaterofSoles,BravenakBlog",https://twitter.com/onstat_z/status/975948547576168448,1521519240
"i believe younger for the packages on the porch.

the tripwire one though, thats old school.

in my untrained opinion.",conjja,"onstat_z,BravenakBlog",https://twitter.com/conjja/status/975953977379573761,1521520535
"Yep! The serial bomber is a white trump supporter i.e., white nationalist kkk alt-right racist! I’ve also heard they won’t admit it to the public! And the bombings have been in Black community and killed 1 black teen & injured 4 black/brown ppl! & he’s leaving the bombs on porch!",pamrichmond1,"onstat_z,BravenakBlog",https://twitter.com/pamrichmond1/status/975951916143382529,1521520043
