content,username,replyto,permalink,time
"@,michelleobama",stpete0314,charliekirk11,https://twitter.com/stpete0314/status/1024000937315258368,1532975823
So you're saying she decreased the number of jobs available to hard working Americans?,DonovanWrites,charliekirk11,https://twitter.com/DonovanWrites/status/1024757970280665088,1533156313
"I am not an American, but you are a horrible excuse of a man. Anyone that would vote for you needs their head tested.",RupertJCahill,charliekirk11,https://twitter.com/RupertJCahill/status/1025448215909486593,1533320881
Did it really take all those people to hide Michelle's penis? ,Traceyc8888,"charliekirk11,jackie_mill",https://twitter.com/Traceyc8888/status/1023951252835786752,1532963977
"The reason Melania has so few staffers is because she doesn’t do anything. Michelle Obama had many interests, projects and speaking engagements. What Melania saves taxpayers Trump spends on his weekend golf vacations. Why don’t you add up those costs and compare.",nonna2405,charliekirk11,https://twitter.com/nonna2405/status/1025491359682187272,1533331167
"Because Mrs. Obama actually, uh, did stuff?  You only need so many staff when all you do is get dressed and put on make-up.  Oh and maybe the squint coach?",luckynum13,charliekirk11,https://twitter.com/luckynum13/status/1025253715475869696,1533274508
"Maybe because Mrs Obama took her position seriously!  actually ACCOMPLISHING things, unlike our current “Be Best” OR THE IRONIC AND HYPOCRITICAL ANTI CYBER BULLYING nonsense from FLOTUS!",JpJanice,charliekirk11,https://twitter.com/JpJanice/status/1024262053773692928,1533038078
All on the taxpayers dime. Worst “First Lady “ in history!!Now hobnobbing with the 1% she so hates.,samlawr45601489,charliekirk11,https://twitter.com/samlawr45601489/status/1024251338014842881,1533035523
There's the gender gap,Leonard21266253,charliekirk11,https://twitter.com/Leonard21266253/status/1024107899113615360,1533001324
".

She really doesn't care. 
DO U?",lilyoval,charliekirk11,https://twitter.com/lilyoval/status/1024048048052293633,1532987055
that's because Melania doesn't do anything that requires a larger staff,lenaj21,charliekirk11,https://twitter.com/lenaj21/status/1024847256728424448,1533177601
"She does absolutely nothing....of course she has fewer staff,pic.twitter.com/aYnfz3L3hR",jean_b1975,charliekirk11,https://twitter.com/jean_b1975/status/1025031147884093441,1533221444
,lisakitter,charliekirk11,https://twitter.com/lisakitter/status/1024823538174242817,1533171946
Thank you for reminding us!  most Dont find it important but I do!  VERY!,ginajiree,charliekirk11,https://twitter.com/ginajiree/status/1024769166157463552,1533158983
Okay?,KeeenAAn_,charliekirk11,https://twitter.com/KeeenAAn_/status/1025785668327403521,1533401336
They need all those people to try to conceal that penis!!,RLPuckett,"charliekirk11,ipock_paula",https://twitter.com/RLPuckett/status/1024859181764014080,1533180444
Turning the tables I daresay.,pcPHAGE,charliekirk11,https://twitter.com/pcPHAGE/status/1024100500029882368,1532999560
Because Melania isn't doing anything.,healthpolicymav,charliekirk11,https://twitter.com/healthpolicymav/status/1024848189600325632,1533177823
Michelle needs all the help she can get as trans takes 5 times longer to get ready than a real woman! I know I have transexual friends! Me I take half hour max. ,smldesv,charliekirk11,https://twitter.com/smldesv/status/1025391627639119875,1533307389
"Yep ,",andikharper,"charliekirk11,jaforrest1369",https://twitter.com/andikharper/status/1024757040965672961,1533156092
very hard to talk sense to libs Charles....its just not real to try and make them see they are not always right...but mark has issues. I predict he gets landslided. this guy is a turkey...that never looks in mirrior.,capizm0824,charliekirk11,https://twitter.com/capizm0824/status/1024936748974055424,1533198938
"Charlie is just like his idol, Trump - misconstruing or completely ignoring the facts altogether. I'll be honest though, I'm not sure if he was actually blaming Melania and Trump for less staffers, though? Not sure who else except the deep state of course,http://www.,foxnews.com/politics/2017/,10/20/melania-trump-cuts-bloated-first-lady-payroll-from-michelle-obama-days.html, ,…",goat_guy_05,charliekirk11,https://twitter.com/goat_guy_05/status/1024917330021818369,1533194308
Cool,hoot4fruit,"charliekirk11,JohnTrumpFanKJV",https://twitter.com/hoot4fruit/status/1024869472295956480,1533182898
Lol..she thought she was queen of the world.. Forcing perception change is gross tactic ill never forget how she truly feels about herself..what an inflated ego,PozCobb,"charliekirk11,est_1964",https://twitter.com/PozCobb/status/1024825952818188288,1533172522
"Did you know Michelle Obama actually worked and  DID THINGS, unlike Melania?",gusnlea,charliekirk11,https://twitter.com/gusnlea/status/1024814350052286465,1533169755
"Does Melania even live at the WH more than 5% of the time? Somehow, I doubt it.",PizzaPie1018,charliekirk11,https://twitter.com/PizzaPie1018/status/1024864020711596034,1533181598
"Is this your way of detracting from the despicable act of Trump separating children from their parents? Tweet that out. And if Mellie did some work she'd require more staffers. ,#,DouchebagTweeter",blkgrl_1,charliekirk11,https://twitter.com/blkgrl_1/status/1024887431374356480,1533187179
Melania shouldnt even need 5. What are her accomplishments as first lady?,Lauremari2,charliekirk11,https://twitter.com/Lauremari2/status/1025834086823161856,1533412880
"Wow, 44 staffers!!! Michael is a Queen? ",njatlarch,charliekirk11,https://twitter.com/njatlarch/status/1024823081322172416,1533171837
Wow,swstargal1,charliekirk11,https://twitter.com/swstargal1/status/1023923996658561025,1532957479
Wish I was one. She's got great taste in clothes. I'd love to nib in her closet. Lol,RitaParent1,"charliekirk11,Marckymarc40",https://twitter.com/RitaParent1/status/1025156019901620225,1533251216
I think Moochelle had a staffer to pick up her fork and hand it to her.,fernologist,charliekirk11,https://twitter.com/fernologist/status/1024047734335201280,1532986980
Explains be best,605savage,charliekirk11,https://twitter.com/605savage/status/1025233185477672962,1533269613
Melania needed 39 just to do her make up. Melania don't need em,GWilkins53,"charliekirk11,kshood",https://twitter.com/GWilkins53/status/1025552490908082176,1533345742
Is Twitter overwhelmed with Conservative tweets? LOL,Pattonwashere,charliekirk11,https://twitter.com/Pattonwashere/status/1024725074832543744,1533148470
"I guess Mrs. Trump needs fewer staff to straighten her hair than Mrs. Obama.
,#,CulturalAppropriation",DieEditrix,"charliekirk11,Ruebenhorst",https://twitter.com/DieEditrix/status/1024726892342067200,1533148904
"Our ,@,FLOTUS, is humble and kind and hard working, she does not need the extra help for she is highly capable of doing things on her own.",Nicky_towels33,charliekirk11,https://twitter.com/Nicky_towels33/status/1023952192338706433,1532964201
