content,username,replyto,permalink,time
"Susan Sarandon: Hillary Is More Dangerous Than Trump ,http://,bb4sp.com/susan-sarandon,-hillary-more-dangerous-than-trump/, ,…,pic.twitter.com/znEne1TyxA",BarracudaMama,,https://twitter.com/BarracudaMama/status/739287589933305857,1465094871
"Seriously ,@,SusanSarandon, said ,@,realDonaldTrump,  said he would get rid of every Muslin in America.  OMG not even close, Idiot",GypsyOooo,BarracudaMama,https://twitter.com/GypsyOooo/status/739289398123057153,1465095302
I would bet my mortgage that she notes for HRC.,FCHSBandAlumni,BarracudaMama,https://twitter.com/FCHSBandAlumni/status/739296119595749376,1465096905
FIANLY......WORD..,Apples90210,BarracudaMama,https://twitter.com/Apples90210/status/739295928612474880,1465096859
I never thought I see this!,redcat0827,BarracudaMama,https://twitter.com/redcat0827/status/739290574323257344,1465095582
I have to agree.Im still waiting for the FBI to do the correct thing and put her and husband behind bars.FBI R puppets now!,carol563,BarracudaMama,https://twitter.com/carol563/status/739289421195837441,1465095308
"Hillary ""The ""Incontinent"" Clinton.,@,BarracudaMama",KraftyWurker,BarracudaMama,https://twitter.com/KraftyWurker/status/739287962240884737,1465094960
