content,username,replyto,permalink,time
"it was a year ago. times change, people change...you should know that.",lolo_dizzle,realDonaldTrump,https://twitter.com/lolo_dizzle/status/1023629375390986240,1532887235
"""Why can't I force the media to just constantly report on nice things people have said about me???""

The ""leader of the free world"" folks.",GasCanSquirrel,realDonaldTrump,https://twitter.com/GasCanSquirrel/status/1023943448276156416,1532962116
PFFFFFFT!,CELTICMOM19,realDonaldTrump,https://twitter.com/CELTICMOM19/status/1024141351024091136,1533009300
Nope. And Twitter is discouraging people from seeing it!,EricHed7,"realDonaldTrump,powerglobalus",https://twitter.com/EricHed7/status/1024853181963100160,1533179014
"LOL. ,#,MAGA,pic.twitter.com/PmGlzEI3SY",rob11563,realDonaldTrump,https://twitter.com/rob11563/status/1023987796653076480,1532972690
"They did report on it. It’s such old news by now. 
You need to listen to real media to be up-to-date. If you keep relying on Fox News, you won’t find out about your indictment until you are behind bars.",bantyranny,realDonaldTrump,https://twitter.com/bantyranny/status/1023750730459623424,1532916169
"As your lawyer ,@,RudyGiuliani, says, Michael Cohen lies a lot",_Blerk_,realDonaldTrump,https://twitter.com/_Blerk_/status/1023820351074181121,1532932768
Why don’t you try shutting up for one single day,terileemcclain,realDonaldTrump,https://twitter.com/terileemcclain/status/1023898399144210433,1532951376
No! They are too busy worrying about Pres. Trump’s sex life before he was a candidate for the presidency. Personally I don’t care who he was with nor how many times. I also do not care to hear the fake news repeat matters that only interest the snowflakes and gossipers.,brossh777,"realDonaldTrump,EricTrump",https://twitter.com/brossh777/status/1023687558897618944,1532901107
"So just admit that YOU not only knew about don jr's meeting with the russians but ORGANIZED it. They weren't there talking about adoptions they were there to talk about COLLUSION, weren't they? ,#,trumpColluded",BeachCat0201,realDonaldTrump,https://twitter.com/BeachCat0201/status/1023890363738726400,1532949460
You mean the tweet from the guy your man Giuliani told the entire country you knew for years was a pathological liar? While maintaining him as your personal attorney?,duelingdogma,realDonaldTrump,https://twitter.com/duelingdogma/status/1023719928539402241,1532908825
No because Rudy says Michael is a liar and has lied all his life,mikeyavo,realDonaldTrump,https://twitter.com/mikeyavo/status/1023923910323126272,1532957458
"No, because he's a liar, you're a liar, Cohen is a liar, your kids are liars, everyone around you are liars. It barely matters what you say. If the MSM stopped covering your lies, they would have nothing to say about you. 
,#,IllegitimatePresident, 
,#,TrumpConspired",gnacan2,realDonaldTrump,https://twitter.com/gnacan2/status/1024358053519323136,1533060966
It’s from a year ago before all the dirty laundry came out.,murphykk2,realDonaldTrump,https://twitter.com/murphykk2/status/1024060077332938759,1532989923
Worst president in history of USA.  Worst First family in history of USA.,AttualmenteRob,realDonaldTrump,https://twitter.com/AttualmenteRob/status/1023669916027645952,1532896901
"This tweet is from LAST YEAR, Donnie. Last year. You know, back when Mikey still had his tongue fully imbedded in your rusty sheriff’s badge? He would have gone one record saying Tiffany doesn’t have a weak jawline back then. And we ALL know that’s a lie.",girlhenryrollns,realDonaldTrump,https://twitter.com/girlhenryrollns/status/1023772009791139842,1532921242
How did you find that dinosaur tweet? You must have nothing but time on your hands.,Lessafetoday08,realDonaldTrump,https://twitter.com/Lessafetoday08/status/1023929705429258241,1532958840
"Do you suppose ,#,FakeNews, ,@,FoxNews, will broadcast your ,#,impeachment, and jail sentence  ??",Baggerazzi,realDonaldTrump,https://twitter.com/Baggerazzi/status/1023998348439773184,1532975205
"@,realDonaldTrump, does this: 
1. Tells u to be scared of everything,
2. Points to someone to blame,
3. Cares nothing about u,
4. Takes responsibility for nothing

His 15 minutes are up.  
,@,MSNBC, ,@,maddow, ,@,lawrence, ,@,USSenate, ,@,USHouse, ,#,ImpeachTrump, ,@,SRuhle",pm_citizen,realDonaldTrump,https://twitter.com/pm_citizen/status/1023931465862717441,1532959259
"I guess Rudy was right,  ,@,MichaelCohen212, is a liar with no credibility.",HuskerSteve2,realDonaldTrump,https://twitter.com/HuskerSteve2/status/1023794073629609984,1532926502
"President Whiner, When Michael Cohen says something favorable about you or your Family...it’s the truth, but When he says something unfavorable about you or your family...it’s a Lie. You have No Shame!",TonyBonilla4,realDonaldTrump,https://twitter.com/TonyBonilla4/status/1023704874528251906,1532905236
I hope they do. Just another time he lied for you and shows why he is cutting his ties now that yall are screwed.,peytonhooten,realDonaldTrump,https://twitter.com/peytonhooten/status/1023787158644174848,1532924854
Well he had no choice you were his boss! Not anymore!!!,Rachjr1,realDonaldTrump,https://twitter.com/Rachjr1/status/1023749678611853313,1532915918
"I thought Cohen was a liar that has lied for years and can’t be trusted. At least that’s what your newest lawyer, Giuliani, said.",slhumph,realDonaldTrump,https://twitter.com/slhumph/status/1023874299629895680,1532945630
Your base is shrinking... your rallies have fewer and fewer people.,sandhillshrink,realDonaldTrump,https://twitter.com/sandhillshrink/status/1023883139167539201,1532947737
yes..,JamesJForbes,realDonaldTrump,https://twitter.com/JamesJForbes/status/1023754010422124544,1532916951
"But Rudy says Cohen is a liar, so he must have been lying here v",dmbryals,realDonaldTrump,https://twitter.com/dmbryals/status/1023754928630706178,1532917170
You are going to go to prison.,dubpixel,realDonaldTrump,https://twitter.com/dubpixel/status/1023696654116052994,1532903276
