content,username,replyto,permalink,time
I think he wants to be done and nobody will let him.,BintnerPamela,CNN,https://twitter.com/BintnerPamela/status/1024876446492360706,1533184560
"#,activism",Ivancalkins,CNN,https://twitter.com/Ivancalkins/status/1024873517425336320,1533183862
"@,realDonaldTrump, will continue to get away with any crime under the sun as long as you allow him to address a group of morons who thinks someone being on tv is a sign of success. Even the ,#,GOP, will attempt to save him to save their party. Classic example of party over country!",ejeh,CNN,https://twitter.com/ejeh/status/1024873478011281408,1533183853
pic.twitter.com/iHpNH0J4hP,JohnDav86173274,CNN,https://twitter.com/JohnDav86173274/status/1024871098221912065,1533183285
OK so I done a back ground check on this Michael dude he is an oppertunist in my book .,usstexas,CNN,https://twitter.com/usstexas/status/1024870903077851136,1533183239
"WOW!

First CNN Headline That Makes Sense!

You're fucking right he ain't doing whats considered normal in Politics.

Politics, and the infected media that supports it, feeds it, and sells it...has got to go.

Adios muchachos!",QsentMe4You,CNN,https://twitter.com/QsentMe4You/status/1024870624618004482,1533183172
No shit Sherlock,Thermoxin,CNN,https://twitter.com/Thermoxin/status/1024869746016235520,1533182963
Why be normal,ToddHar42708868,CNN,https://twitter.com/ToddHar42708868/status/1024869113456467969,1533182812
Another expert trying to explain how Trump is dangerous to America (liberal ideology),LibertyDrunk,CNN,https://twitter.com/LibertyDrunk/status/1024868854206484480,1533182750
"Exactly, President Trump is putting AMERICA first!",jon_knepper,CNN,https://twitter.com/jon_knepper/status/1024868269688115200,1533182611
Normal is politicians. Success is business. Two together the future. Trust the next generation to see the light.,peterdavidscot2,CNN,https://twitter.com/peterdavidscot2/status/1024866981906919426,1533182304
"https://,twitter.com/DykstraDame/st,atus/1024835262176813056, ,…",USAPatr59954276,"CNN,freedom_moates",https://twitter.com/USAPatr59954276/status/1024866598157312001,1533182212
But you have no way to refute him,ada80987992,CNN,https://twitter.com/ada80987992/status/1024866238059569157,1533182126
He is totally demolishing America!! And they are letting him!!! You believe him because he was on the apprentice wow. He's not for you he's for himself he's a joke!! Wake up!!!!,smith_dma,CNN,https://twitter.com/smith_dma/status/1024863256266125314,1533181415
