content,username,replyto,permalink,time
"@,Dizneydreamer, ,@,pookisama, KuBu has damage too! ,#,yay",Minnie_Moose,,https://twitter.com/Minnie_Moose/status/260121199256956928,1350852701
"@,Minnie_Moose, ,@,Dizneydreamer, crashier than bristol",pookisama,Minnie_Moose,https://twitter.com/pookisama/status/260122246251675648,1350852951
"@,pookisama, ,@,Dizneydreamer, Closing laps should be fun!!",Minnie_Moose,pookisama,https://twitter.com/Minnie_Moose/status/260122422634758144,1350852993
"@,Minnie_Moose, ,@,Dizneydreamer, good update on Jr, I'm glad they are taking precautions",pookisama,Minnie_Moose,https://twitter.com/pookisama/status/260122645440364544,1350853046
"@,pookisama, ,@,Dizneydreamer, As they should be. :)",Minnie_Moose,pookisama,https://twitter.com/Minnie_Moose/status/260122847828131840,1350853094
"@,Minnie_Moose, ,@,Dizneydreamer, did KyBu just threaten Newman?",pookisama,Minnie_Moose,https://twitter.com/pookisama/status/260123202267787264,1350853178
"@,pookisama, ,@,Dizneydreamer, Yep- while still getting in a plug for his sponsors.",Minnie_Moose,pookisama,https://twitter.com/Minnie_Moose/status/260123342558867456,1350853212
"@,Minnie_Moose, ,@,Dizneydreamer, he's going to kill someone one day, he's looking really bloated too, didn't think he could get more gross",pookisama,Minnie_Moose,https://twitter.com/pookisama/status/260123900741042176,1350853345
"@,pookisama, ,@,Dizneydreamer, he's a shrub, it's always possible ;)",Minnie_Moose,pookisama,https://twitter.com/Minnie_Moose/status/260124077056991232,1350853387
