content,username,replyto,permalink,time
"@,Nahkapukki, good rice brands?",glottis8,,https://twitter.com/glottis8/status/902556334998134784,1504021173
I use Risella risotto rice for all my rice needs. Uncle Ben's is OK too.,Nahkapukki,glottis8,https://twitter.com/Nahkapukki/status/902556524106657792,1504021218
Cool. Found it ,glottis8,Nahkapukki,https://twitter.com/glottis8/status/902556697897644033,1504021260
Is there such a thing as sour cream here?,glottis8,"glottis8,Nahkapukki",https://twitter.com/glottis8/status/902556973438304256,1504021325
Yes. Hmm... Kermaviili perhaps?,Nahkapukki,glottis8,https://twitter.com/Nahkapukki/status/902557169207447552,1504021372
I wonder where that would be,glottis8,Nahkapukki,https://twitter.com/glottis8/status/902557307678199809,1504021405
At the milk products. In the cooler. Small round containers. Kermaviili.,Nahkapukki,glottis8,https://twitter.com/Nahkapukki/status/902557510699188224,1504021453
Velveeta shells & cheese,MikePDaTruth,"glottis8,Nahkapukki",https://twitter.com/MikePDaTruth/status/902557896986284032,1504021546
