content,username,replyto,permalink,time
Add New York City to the scratch list.,sh_irredeemable,"USANEWS007,stevwgn7",https://twitter.com/sh_irredeemable/status/942121242185883649,1513454182
A sad day for England!,Nora4America,USANEWS007,https://twitter.com/Nora4America/status/942102780944306177,1513449781
What are they marching about?,PrestonWhite12,USANEWS007,https://twitter.com/PrestonWhite12/status/942102671942615040,1513449755
"my sister in law was at the towers at 9/11 i remember keep telling my brother ""Shes Okay dont worry"" she is BTW. i said the same thing to one of my friends when he asked about London but it had the same feeling to it except you know your lying",DanielGreigg,"USANEWS007,DianneBarr8",https://twitter.com/DanielGreigg/status/942075164740726785,1513443196
Most annoying sound EVER  !!!,daisyangelman57,USANEWS007,https://twitter.com/daisyangelman57/status/942053164425072641,1513437951
I'll be dead by the time UK has fallen. I fear for my grandkids especially the girls our govt has betrayed us . So weak,Spynxlove,USANEWS007,https://twitter.com/Spynxlove/status/942039277071929345,1513434640
They may take our lives but they will not take our freedom!!!!,craff756,USANEWS007,https://twitter.com/craff756/status/941970039250477056,1513418132
pic.twitter.com/hiQrMEhjeM,BeeZired,USANEWS007,https://twitter.com/BeeZired/status/941944073946050560,1513411942
Must not have Home Depot's there or they would all be driving trucks,swashbucklerrr,"USANEWS007,high_rollerx",https://twitter.com/swashbucklerrr/status/942649988659556352,1513580245
"Nobody speaks English in London. Filthy, overcrowded, dangerous place. Avoid.",grumpy_fred,"USANEWS007,erikak58",https://twitter.com/grumpy_fred/status/942546720734498816,1513555624
"What were they marching for? Was it London? Was there violence? Is 5,000 really all that much? 

Where is the news article attached to this?",Kev1ninLA,USANEWS007,https://twitter.com/Kev1ninLA/status/942420338243018752,1513525492
"How abSouth,West,East?Each of them lot kids withBRpassport,warm jobs.BRgot quilt for white slaves EU immigrants with broken fates&slave them",SableIrina,"USANEWS007,wfarfus",https://twitter.com/SableIrina/status/942368318761177088,1513513090
"Wtf??? England better catch a grip, they are done!!",Deekka14,USANEWS007,https://twitter.com/Deekka14/status/942290375707910144,1513494507
The royals better start packing! Uk is disappearing culture...,Cabrini24,USANEWS007,https://twitter.com/Cabrini24/status/942287983780143104,1513493936
"How damn sad.
From Braveheart to open armed invitation of invasion.
Charles Martel would be so disgusted and ashamed of what has happened.
People need to realize this has been going on for Millennia and WILL NOT STOP
till all are converted or subsumed.,http://www.,meforum.org/3182/history-m,uslim-conquests, ,…",TechQn,"USANEWS007,CynthiaRunnels1",https://twitter.com/TechQn/status/942257823118901248,1513486745
"My mom is broken hearted about what’s happening in her homeland of England. ,#,NoIslam",DaveOfPrescott,"USANEWS007,michaelbeatty3",https://twitter.com/DaveOfPrescott/status/942209332438900736,1513475184
Good job England! You let your Ancestors and Children for eternity down!,Oatrick562,USANEWS007,https://twitter.com/Oatrick562/status/942174622153347074,1513466909
These reminds me------- ( I need more AMMO).,Carl06967,USANEWS007,https://twitter.com/Carl06967/status/942172345858510849,1513466366
Looks like a missed opportunity,Advisor3John,"USANEWS007,brettPowerline",https://twitter.com/Advisor3John/status/942170733047943168,1513465982
All in one place. Nice bomb there would be nice.,M25thHour,USANEWS007,https://twitter.com/M25thHour/status/942169501864427521,1513465688
Do you realize what these Muslims have in store for England???  I would strafe them with bombs and take the offensive position.  Any day now you’ll be asking the US to come in and stop the madness.,Tortass,USANEWS007,https://twitter.com/Tortass/status/942163059849793538,1513464152
Where is a suicide bomber when we need one?,Tribe1954,USANEWS007,https://twitter.com/Tribe1954/status/942161167170113536,1513463701
England is done. They did what their leader Hitler could not do with without guns.,JaytheTrader,USANEWS007,https://twitter.com/JaytheTrader/status/942155957827702784,1513462459
"When you keep letting them do what they want, it will never end...",coxcom12,USANEWS007,https://twitter.com/coxcom12/status/942150748585984001,1513461217
They are trying to take over the whole world. Bad for everybody.,NswensonNancy,USANEWS007,https://twitter.com/NswensonNancy/status/942141205378412544,1513458942
"This is the United States under ,#,Obama, ,#,Democrats, ,#,Liberals, ,#,Socialist, plan.",HoracePetty,USANEWS007,https://twitter.com/HoracePetty/status/942131889669836800,1513456721
"A recent liberal Twitter acquaintance told me these videos and information like this are just 'fear tactics' ;) I think he believes all this change we are seeing isn't real and its a good thing. Let these ppl do this in their own land. Please ppl, spay and neuter your liberals.",brettPowerline,USANEWS007,https://twitter.com/brettPowerline/status/942127119814889472,1513455583
"Savages!,!,!",FatuosF,"USANEWS007,PatVPeters",https://twitter.com/FatuosF/status/942121495299489792,1513454242
This the result of liberal compromising leadership. The US is following suit. I wouldn't be surprised if we see the same here. Liberals are blind to their own ruin and they NEVER learn from their mistakes or the mistakes of others.,msttimg,USANEWS007,https://twitter.com/msttimg/status/942102568792150022,1513449730
"Big League Mega Kudos to you Stock Monster.
Thanks for the info, much appreciated.  I agree with you on the bucket list.  It's a shame too.  They need to get serious about cleaning those troublemakers out of their country.

We better be waking up over here in America. ",Ocala_MattMan,USANEWS007,https://twitter.com/Ocala_MattMan/status/942097523241562112,1513448527
pic.twitter.com/Lz8bMZ1DTi,L2_3T,USANEWS007,https://twitter.com/L2_3T/status/942091050859995136,1513446984
Immigration without assimilation is INVASION...,LottaFaChina,USANEWS007,https://twitter.com/LottaFaChina/status/942091013165740032,1513446975
This outta scare the hell out of all Americans. These folks are not going to conform! They plan on destroying our way of life. They want us to become animals like them.,adamson_eddie,USANEWS007,https://twitter.com/adamson_eddie/status/942015979302813696,1513429085
pic.twitter.com/7IiJzsAF09,AnnamariaEastTN,USANEWS007,https://twitter.com/AnnamariaEastTN/status/941982523701235712,1513421109
Jeez..... I have to be careful with this one as something seemingly innocuous could be flagged as hate speech. So let's just say there are places that are not too far gone (if at all). Mostly historical. Definitely expensive. Worth a look during the summer weeks.,JonasOlssen_,USANEWS007,https://twitter.com/JonasOlssen_/status/941973096650739713,1513418861
"HORRIFIC. What the freak is going on over there?!?!?! ,#,ISLAMICVERMIN, SPREADING
DUE TO WEAK LAWS, BLIND EYES, 
IDIOT POLITICIANS AND NO BIRTH CONTROL !! ,#,WAKEUPAMERICA,
,#,MAGA, ",gmt0220,"USANEWS007,VetApologist",https://twitter.com/gmt0220/status/942694960872255488,1513590967
They look peaceful to me,pookerella,USANEWS007,https://twitter.com/pookerella/status/942613383102259200,1513571518
"Why doesn't antifa worry more about them if they want to go after hate groups instead of cops, conservatives, military, and anyone that isn't liberal.",unlv1986,"USANEWS007,dalecanfixit",https://twitter.com/unlv1986/status/942593452105121792,1513566766
This should have been banned! Christians or UKIP would not have been allowed to do this !,LaraineWaring,USANEWS007,https://twitter.com/LaraineWaring/status/942436746888994816,1513529404
Looks like London is officially conquered.,CMHGuenther,USANEWS007,https://twitter.com/CMHGuenther/status/942432932907532288,1513528495
Never going back! Sad!!,KeithWAmyRoy,USANEWS007,https://twitter.com/KeithWAmyRoy/status/942421971920347137,1513525882
There is no peace in their march ,liberty2949,USANEWS007,https://twitter.com/liberty2949/status/942399898087055360,1513520619
Perfect time to drop some napalm,ChefTyNelson,USANEWS007,https://twitter.com/ChefTyNelson/status/942398847946551296,1513520368
Yea really- don’t blame you,DEEplorableinWV,"USANEWS007,MerleSmithJr",https://twitter.com/DEEplorableinWV/status/942363486579036160,1513511938
"It's an invasion, they better fight back.",deliveryguy6980,USANEWS007,https://twitter.com/deliveryguy6980/status/942263134462423040,1513488012
I cancelled two trips to Europe in 2017 & 2018 because of this mess!,Wonder_Chick_,USANEWS007,https://twitter.com/Wonder_Chick_/status/942260277072093184,1513487331
You got em all in one place round them up and ship them out!,MAGAtikibob,"USANEWS007,Jamierodr10",https://twitter.com/MAGAtikibob/status/942241542302863360,1513482864
The brits have a mental problem.,FloydZoglman,USANEWS007,https://twitter.com/FloydZoglman/status/942239220873166848,1513482310
"Oh there aren't that many. They look peaceful and law abiding. There should be no problems.

 Besides if there is any trouble it's to be tolerated, because the Mayor of London said terrorist attacks were just a part of modern London lifestyle, and to except it.",JimSilence,USANEWS007,https://twitter.com/JimSilence/status/942226280853983232,1513479225
It's off my list.,shirley_650,USANEWS007,https://twitter.com/shirley_650/status/942223727240065024,1513478616
"http://www.,dailymail.co.uk/news/article-4,938984/Thousands-Muslims-march-against-ISIS-London.html, ,…",eileenvn,USANEWS007,https://twitter.com/eileenvn/status/942219581216776194,1513477628
Who ordered the BLT???,Troy75801,USANEWS007,https://twitter.com/Troy75801/status/942217066723119104,1513477028
"More than likely they are celebrating another country that's about to fall. This won't stop until they achieve world domination. AMERICA would be on this direct path if Hillary had not been defeated. OBAMA had already laid the groundwork for America's destruction. MAGA,pic.twitter.com/JfuRlRFlA5",SodomMizer,"USANEWS007,mrtweeterverse",https://twitter.com/SodomMizer/status/942209775013650434,1513475290
"Scratched that off my list two years ago.  They just leave to door open to the wrong people.  Once a great country, now a shit hole.",huggableyeti,USANEWS007,https://twitter.com/huggableyeti/status/942185180395180032,1513469426
"Goodbye England, it was nice knowing you!
You let your Government get corrupted by Globalists!",TuckFwitter6,USANEWS007,https://twitter.com/TuckFwitter6/status/942180462709166080,1513468301
Too bad the UK doesn't have a another great leader in the mold of Churchill.  He would have these sharia death cult savages chewed up and spit out.  End of story.,dknightco69,USANEWS007,https://twitter.com/dknightco69/status/942178528530874369,1513467840
Roaches do this,NewzGuru,USANEWS007,https://twitter.com/NewzGuru/status/942177200194940928,1513467523
"The world needs to wake up. With over 1400 yrs. Of killing & slaughtering innocents & taking control of your countries what more proof do you need? Return of the Knights Templar before you loose your countries
What will it take before you stand up. Prison is better then slavery",don85375,USANEWS007,https://twitter.com/don85375/status/942177156414578688,1513467513
Idiots letting that happen over there!!,stormishere18,USANEWS007,https://twitter.com/stormishere18/status/942176802541318144,1513467429
& in NY & MN & MI...  I think they tried in CO but still not there... matter of time... ??,girlcombatvet,USANEWS007,https://twitter.com/girlcombatvet/status/942176531287339008,1513467364
