content,username,replyto,permalink,time
"VIDEO: 5,000 Muslims march through Northern England. Officially scratching London/England of my bucket list.
,https://,twitter.com/TemplarKTI/sta,tus/941911001141776384/video/1, ,…",USANEWS007,,https://twitter.com/USANEWS007/status/941943675403190272,1513411847
That’s what Obama  was planning for the United States. Only thing Hillary lost! What concerns me is all the undocumented folks who came in during his 8 years.,swestlady65,"USANEWS007,STSTWO",https://twitter.com/swestlady65/status/942151306940157952,1513461350
Obama is a traitor to this country and still bad talking it around the world! Go away Odummy!,Orljm333,"swestlady65,STSTWO",https://twitter.com/Orljm333/status/942173885415424002,1513466733
"Please God, not in America!!! ",ElizaLynnArroyo,USANEWS007,https://twitter.com/ElizaLynnArroyo/status/941945683183046656,1513412326
This happens in America we have no other choice but to fight them.,darby_bartley,ElizaLynnArroyo,https://twitter.com/darby_bartley/status/941980474414641153,1513420620
When did the usa end it's religious  freedom? Land if the free right? But only if your Christian?,kvn128,darby_bartley,https://twitter.com/kvn128/status/942023283855249409,1513430827
Babring a religion is against the constitution so good luck,kvn128,"noticerofThings,darby_bartley",https://twitter.com/kvn128/status/942335137026584577,1513505179
That's my point. duh.,darby_bartley,kvn128,https://twitter.com/darby_bartley/status/942336801892683777,1513505575
I hope you keep fighting for religeus freedoms for all,kvn128,darby_bartley,https://twitter.com/kvn128/status/942337461249855488,1513505733
"Yeah but not for,pic.twitter.com/V1pVZfPmRQ",darby_bartley,kvn128,https://twitter.com/darby_bartley/status/942337847058714625,1513505825
"To think May scoffed at our ,@,potus, for his extreme vetting policy....too funny !",CoVrhlt,USANEWS007,https://twitter.com/CoVrhlt/status/942002495932395522,1513425871
"@,kvn128,,
Pay attention 2minute 1:10, this is what ,#,Obama, & his cousins want.The ,#,Democrats, know it but they don't care about our safety,they just want 2 get the votes of the misinformed,the ones who watch ,#,cnn,, ,#,msnbc, &other ,#,corrutpmedia,.
,#,America, u better ,#,getinformed,!!
,#,MASA,pic.twitter.com/dFEzaQfB7X",_ShowMeTheFacts,"CoVrhlt,POTUS",https://twitter.com/_ShowMeTheFacts/status/942190463129411584,1513470686
My millennial/libtard daughter gets daily mind poisoning from her college professors and believes Islam is peaceful.  I need to show her this BS.,melodyindenver,USANEWS007,https://twitter.com/melodyindenver/status/942143452468219904,1513459477
sadly welcome to the club......once they start paying taxes they come around,Alpina_7,melodyindenver,https://twitter.com/Alpina_7/status/942143685793218560,1513459533
Horrors .....,JOEROWE409,"USANEWS007,mglessman",https://twitter.com/JOEROWE409/status/942238054865088513,1513482032
"As predicted ....,pic.twitter.com/pzJUc8UZij",JOEROWE409,"JOEROWE409,mglessman",https://twitter.com/JOEROWE409/status/942238739744608256,1513482196
This proves libtards are stupid paying for deviants to stay in ur own country-better for USA to cull out liberals than bring deviants here n put them on welfare,M7Mnation,USANEWS007,https://twitter.com/M7Mnation/status/941945766918078464,1513412345
"They are,http://www.,dailymail.co.uk/news/article-3,899540/Go-away-shouldn-t-Don-t-come-corner-Yorkshire-no-white-residents.html, ,…",CunoWeiss,M7Mnation,https://twitter.com/CunoWeiss/status/941958019679772672,1513415267
The only choice u have is the people have to take their country back by force--,M7Mnation,CunoWeiss,https://twitter.com/M7Mnation/status/941965351276896256,1513417015
Well said....I’m NEVER leaving USA. It’s not safe if your an American. U have a red X on your back. Plus I can’t carry my weapon on me if I leave. So...nope not gonna do it,bobshell1968,"ogcoffeethatpay,Orljm333",https://twitter.com/bobshell1968/status/942087099498590208,1513446042
"Sadly we have our govt to blame, largely, for that red X. If our govts had left them alone in their countries, maybe they wouldn't hate us so much and leave us alone too...",brettPowerline,"bobshell1968,ogcoffeethatpay,Orljm333",https://twitter.com/brettPowerline/status/942127765213474816,1513455737
"No for centuries this has been going on but I have to agree some, Bush’s stirred the hornets nest!",Orljm333,"brettPowerline,bobshell1968,ogcoffeethatpay",https://twitter.com/Orljm333/status/942157014737784833,1513462711
"Sure, I agree with you... Since we are only ~200 years old I was thinking relatively short term. I think every administration, or Congress/House change, probably has done their fair share of damage.  Sanctions, unofficial war, weaponizing ppl (Ukraine?), etc.",brettPowerline,"Orljm333,bobshell1968,ogcoffeethatpay",https://twitter.com/brettPowerline/status/942182684775784448,1513468831
Where’s the women? Oh that’s right second class citizens with no voice!,StarsStripesGal,USANEWS007,https://twitter.com/StarsStripesGal/status/942033948376535040,1513433370
"England you need to heed this warning, if you don’t remove these people very soon you will be overtaken just like Sweden has been. Your Fearless leader has screwed you. VIDEO: 5,000 Muslims march through Northern England. Officially scratching London/England of my bucket list.",ConspicuosC,USANEWS007,https://twitter.com/ConspicuosC/status/941950711364976641,1513413524
"England is overtaken already,http://www.,dailymail.co.uk/news/article-3,899540/Go-away-shouldn-t-Don-t-come-corner-Yorkshire-no-white-residents.html, ,…",CunoWeiss,ConspicuosC,https://twitter.com/CunoWeiss/status/941959242357133312,1513415558
Are we Next?,CharlesHincy,USANEWS007,https://twitter.com/CharlesHincy/status/942158391677513728,1513463039
There are enough in the USA to do this. Demonrats want more to come.,grayisnewblk,CharlesHincy,https://twitter.com/grayisnewblk/status/942167419065335809,1513465191
"Oh Europe you are in so much trouble! The World has lost you as we knew it! So sad, so many before u have died for their countries and now you let it be invaded! The Middle East spreading fast!",Orljm333,USANEWS007,https://twitter.com/Orljm333/status/942050935060205571,1513437420
The Roaches have infested Europe.,irispraytan,USANEWS007,https://twitter.com/irispraytan/status/941946388480487425,1513412494
pic.twitter.com/LG3ycPSvEL,WalterHorsting,irispraytan,https://twitter.com/WalterHorsting/status/941976894869684226,1513419767
You know theirs something mentally wrong when the women walk around like Black ghosts and men wear diapers on their heads. Not in our America!!!,irispraytan,WalterHorsting,https://twitter.com/irispraytan/status/941984637269798914,1513421613
"This will be NYC soon thanks to ,@,NYCMayor, .....it’s the first Christmas I have no desire to go there",AngelicDeby,"USANEWS007,CJHanselman",https://twitter.com/AngelicDeby/status/943274690201706496,1513729185
Forget the bucketlist. Only bucket would be the one you kick.,Nuclear_jelly47,"USANEWS007,SL_OKC",https://twitter.com/Nuclear_jelly47/status/942508688056741889,1513546556
.  ,SL_OKC,Nuclear_jelly47,https://twitter.com/SL_OKC/status/942782047017492480,1513611730
"Why does their music sound so demonic? It literally creeps me out & makes the hair on my neck stand up. My intuition & instincts are telling me: , warning.",RainInfidel,"USANEWS007,auminer",https://twitter.com/RainInfidel/status/989238746900938752,1524687871
Heed your Godly instincts!,auminer,"RainInfidel,USANEWS007",https://twitter.com/auminer/status/989239502341160960,1524688051
Amen to that! ,RainInfidel,"auminer,USANEWS007",https://twitter.com/RainInfidel/status/989240311149879296,1524688244
Me too forever,VicCervantes3,"USANEWS007,Gratefully_Free",https://twitter.com/VicCervantes3/status/942659298831638528,1513582465
"Me too. No desire to travel anywhere other than within America..unless it was ,#,Israel,. Have always wanted to go there. Sigh.",Gratefully_Free,VicCervantes3,https://twitter.com/Gratefully_Free/status/942662633546805249,1513583260
"Yup, please delete Marseilles France, was just there, shxthole, usual suspects...maybe add Budapest Hungary and Bled Slovenia.",CirceCenter,USANEWS007,https://twitter.com/CirceCenter/status/941945570213560320,1513412299
"This ignorant violent cult will keep it up until killed. Enough, is enough",HappyinazLyn,USANEWS007,https://twitter.com/HappyinazLyn/status/942173181187571712,1513466565
This world is a massive goddamn f-ckin headache.,humnun2017,HappyinazLyn,https://twitter.com/humnun2017/status/942175363001667586,1513467085
Couldn’t agree more!,HappyinazLyn,humnun2017,https://twitter.com/HappyinazLyn/status/942183368090722305,1513468994
"This is what this evil minded belief system is all about. It must not be tolerated, or accepted. It must be extinguished!",JamesCa77615592,"USANEWS007,JoCastiglione",https://twitter.com/JamesCa77615592/status/942147936074510336,1513460546
"It's not my cup of tea.,  Why is this march so orderly, w/day-glo security-type, than the typical London mess w/Khan?  Edu levels?",JoCastiglione,JamesCa77615592,https://twitter.com/JoCastiglione/status/942210168296701952,1513475384
I personally believe hell will freeze over before a rational reply=if there is even one=to a well put question you are asking. Bravo!,JamesCa77615592,JoCastiglione,https://twitter.com/JamesCa77615592/status/942253173124812801,1513485637
Looks like an invasion!,rockinrobyn59,USANEWS007,https://twitter.com/rockinrobyn59/status/942070912177856512,1513442182
It is an invasion.,Rvndave,rockinrobyn59,https://twitter.com/Rvndave/status/942197364147871745,1513472331
England is lost. ,rockinrobyn59,Rvndave,https://twitter.com/rockinrobyn59/status/942198411415228417,1513472581
Sad to see that there are no more actual Englishmen left in England.,Patrici58838757,USANEWS007,https://twitter.com/Patrici58838757/status/942176901388558337,1513467452
Start worrying it's coming to America,david_standing,"USANEWS007,HuwGruffydd",https://twitter.com/david_standing/status/942130429582282752,1513456373
Oh lordy! God help England!,LoriMillerTX1,USANEWS007,https://twitter.com/LoriMillerTX1/status/942093777396781057,1513447634
Surprised all the animals aren’t keeling over for the lack of deodorant,EmDBizzle,USANEWS007,https://twitter.com/EmDBizzle/status/942060466188283904,1513439692
This is what the liberals/democrats want the USA to become.,_Never_Hillary,USANEWS007,https://twitter.com/_Never_Hillary/status/941944212370722816,1513411975
and little prince bitch doesn't like trump? really prince pos u r irrelevant! Trump is a Great Man! Something u will never be just entitled,redtruck601,USANEWS007,https://twitter.com/redtruck601/status/942203351260893184,1513473758
Ariel bacon grease drop.,moekaye1,USANEWS007,https://twitter.com/moekaye1/status/942022110297382912,1513430547
Hahas ,JustWinTigerDJT,moekaye1,https://twitter.com/JustWinTigerDJT/status/942071013642088448,1513442207
I have met some people from England on my RV adventures and every one have said they wished Trump was their president,lanieand,"USANEWS007,Framus4",https://twitter.com/lanieand/status/942387580926033920,1513517682
"Looks like Middle East, feel sorry for ,#,England, 's people.",1BLKNITE,USANEWS007,https://twitter.com/1BLKNITE/status/941948933680521216,1513413101
"Think of all the poroblems that could be solved at that moment....5,000 of them.",chandler3000,USANEWS007,https://twitter.com/chandler3000/status/942164513276747776,1513464499
Why would a country willingly allow themselves to be occupied?  I don't get this at all.,aintwesomething,"USANEWS007,scott_kuecher",https://twitter.com/aintwesomething/status/943177167093096449,1513705934
1000 + years of history flushed down the toilet.,aintwesomething,scott_kuecher,https://twitter.com/aintwesomething/status/943190058210922501,1513709008
"These people have fled nations 'the West' has purposely fucked up with long planned regime-change, 'humanitarian intervention', brutal, horrific coups and every other miserable thing possible.  Britain helped with most of it and is still supplying arms to kill babies in Yemen.",phoenx7,USANEWS007,https://twitter.com/phoenx7/status/941983218579865600,1513421275
No one cares about you or your fake profile,L2_3T,phoenx7,https://twitter.com/L2_3T/status/942092128208875521,1513447241
Who the fuck are you talking to.,memosRfunz,"L2_3T,phoenx7",https://twitter.com/memosRfunz/status/942096745755967489,1513448342
That’s just the 2nd phase of Jihad. The 3rd phase is when they start choppin heads. smh@N.England ,SuniaAkaveka6,"USANEWS007,ConspicuosC",https://twitter.com/SuniaAkaveka6/status/942023772478914560,1513430943
pic.twitter.com/NSa4CCNoWY,GolfiaoTx,USANEWS007,https://twitter.com/GolfiaoTx/status/941957156970123264,1513415061
"USA is watching and learning. That’s why we chose ,@,realDonaldTrump, we’re not having this.",normagenie,"USANEWS007,5945USARTR",https://twitter.com/normagenie/status/942256713620746240,1513486481
"UK stood up to fascists once .,@,AP, ,@,PBS, ,@,nprpolitics, ,@,CBSNews, ,@,latimes, ,@,nytimes, ,@,BostonGlobe, ,@,sacbee_news, ,@,WSJopinion, ,@,ABC, ,@,CBSNews, ,@,CNN, ,@,WashPost,pic.twitter.com/YXKhmgToYV",WalterHorsting,USANEWS007,https://twitter.com/WalterHorsting/status/941976629361836037,1513419704
I’ve already scratched entire Europe off my list a long time ago!,NewRepvblican,USANEWS007,https://twitter.com/NewRepvblican/status/942160033185275904,1513463431
"So many happy and friendly people... promoting peace and love for people of all faiths... collecting subsidies... implementing ,#,ShariaLaw,... integrating into their generous host country... it’s so wonderful and positive. ,#,CreepingSharia, ,#,STOPislam, ,#,BanSharia",magnus_maldini,USANEWS007,https://twitter.com/magnus_maldini/status/942073299063803905,1513442752
And the unarmed police look like school crossing guards,RealRebTevye,USANEWS007,https://twitter.com/RealRebTevye/status/942021723284738048,1513430455
"@,theresa_may, ‘s peeps",JustaGuy1225,USANEWS007,https://twitter.com/JustaGuy1225/status/941945837810204672,1513412362
It's too late because Europe has become too pussified,mimimayes13,DeplorableTedT,https://twitter.com/mimimayes13/status/942100235869933568,1513449174
Shameful,bev_60,davet107,https://twitter.com/bev_60/status/942028972740751360,1513432183
"I keep re-running the clip and for the life of me, I don't see any of those women and children CNN always shows wanting to escape oppression. Where are they??",TNbabyboomer,"USANEWS007,jcoralpark",https://twitter.com/TNbabyboomer/status/942163859917430785,1513464343
Where are the drones when you need them?,MartaRo92972407,"USANEWS007,PatriotElwood",https://twitter.com/MartaRo92972407/status/942086987967741954,1513446015
"I find myself feeling more and more that Islam is a religion of ignorance, violence, and thuggery. I look to ,@,Kaepernick7, as a prime example.",fwt1776,"USANEWS007,DonnaHa05992211",https://twitter.com/fwt1776/status/942071996388651008,1513442441
Please never let that be a reality in the USA ,JudiCook11,USANEWS007,https://twitter.com/JudiCook11/status/942071734920007680,1513442379
March them into the channel,SteveBarnett24,"USANEWS007,tweeetgreen",https://twitter.com/SteveBarnett24/status/942052695182942208,1513437839
SEE WHAT AN UNARMED SOCIETY GETS YOU?,AaronGuyWiley,USANEWS007,https://twitter.com/AaronGuyWiley/status/942052173239562240,1513437715
What have they done! Churchill warned of this. Sad.,KimHawk18755218,"USANEWS007,JimRobinson3rd",https://twitter.com/KimHawk18755218/status/941995938666745856,1513424307
"Nothing like watching a ""PARADE"" from the middle ages...HOW ""PROGRESSIVE""...",1111DDM1111,USANEWS007,https://twitter.com/1111DDM1111/status/941950032361660416,1513413362
This is a major problem! They are achieving their goal of turning our civilised country into the shithole that they have “fled” from! Pieces of shit! Annialate  the dros,FatuosF,"USANEWS007,PatVPeters",https://twitter.com/FatuosF/status/942121043191312385,1513454135
If you look closely Chuck Schumer and Deblasio are in the crowd.,AllRiseAmerica,"USANEWS007,TimOKeefe15",https://twitter.com/AllRiseAmerica/status/942087335075827713,1513446098
On shot fired and the Muslims would scatter like the roaches they are.,MartaRo92972407,"USANEWS007,PatriotElwood",https://twitter.com/MartaRo92972407/status/942087151826624514,1513446054
"What should have happened was the pide piper leading all the rats out of town to the cliffs edge ....that is what needs to happen. England better get her shit together. Or it’s gonna be ugly ..,#,GodBlessAmerica, ,#,Godsavethequeen",bobshell1968,"USANEWS007,PatriotElwood",https://twitter.com/bobshell1968/status/942086545342951424,1513445910
Off my to do list.,Me27228077,USANEWS007,https://twitter.com/Me27228077/status/942025630220275712,1513431386
"Europe has imported its own invasion force, thanks to all the liberal apologists for being civilized. Muslims/Islam is quite frank about their intentions to conquer others. The majority are literally malignant, violent, vicious animals. They hate women, gays, and are pedophiles.,pic.twitter.com/RispyC2hI1",SimonT1020,USANEWS007,https://twitter.com/SimonT1020/status/942017010782867456,1513429331
"Coming to a town near you... ,#,BuildTheDamnWall",auminer,USANEWS007,https://twitter.com/auminer/status/989237488114794496,1524687570
I can't believe this is in England...,debclay5153,"USANEWS007,CynthiaRunnels1",https://twitter.com/debclay5153/status/942255322101698560,1513486149
"I guess their ,#,Marching, against Violence ..,pic.twitter.com/aCaZ5Dtwme",RCs_ACMan,USANEWS007,https://twitter.com/RCs_ACMan/status/942186941742710784,1513469846
"The Brits and French have nukes, We must start thinking about when these Nations fall",BoilingCrude,USANEWS007,https://twitter.com/BoilingCrude/status/942160779083579393,1513463608
".
      Looks like they won the toss !
.
.
.,pic.twitter.com/quNRX5zPj5",allanlaidman,USANEWS007,https://twitter.com/allanlaidman/status/942159181481697283,1513463227
"When I lived there it was beautiful. Now it’s just decay, disease and destruction. Very sad...",DARgirl92,USANEWS007,https://twitter.com/DARgirl92/status/942144345406291968,1513459690
"Yes along with France , Italy, Germany, Sweden and any other nation with a policy of open borders!! They eventually will end up as enemies of the United States!  Sad but true! And to my Fellow Americans ""Happy Holidays and Merry Christmas!!,MAGA",RickModularone,USANEWS007,https://twitter.com/RickModularone/status/942120751594967040,1513454065
If it was Union Jacks the place would be Positively Alive with Batons Wielding Police xx ,Hag_Scotland,USANEWS007,https://twitter.com/Hag_Scotland/status/942116554069692416,1513453064
Civil War is required,OurUSRepublic,USANEWS007,https://twitter.com/OurUSRepublic/status/942109223709798401,1513451317
pic.twitter.com/mWr0eqpLzj,Jaynewalkup1,USANEWS007,https://twitter.com/Jaynewalkup1/status/942106669558968320,1513450708
"Hey America still hate ,@,realDonaldTrump, ????",L2_3T,USANEWS007,https://twitter.com/L2_3T/status/942089238367019008,1513446552
pic.twitter.com/6HLUAxzWcX,PeterJa37918909,USANEWS007,https://twitter.com/PeterJa37918909/status/942043671339335681,1513435688
"#,Islam, ,#,evil, ,#,Muslim, ,#,Muslims, ,#,London, they are run by a traitor muslim.....so glad I went there years ago before they were taken over.,pic.twitter.com/Zne4jOyBJo",MssArguelles,USANEWS007,https://twitter.com/MssArguelles/status/942017349095444480,1513429412
Its an infestation. You were so naive to just welcome everyone and anyone with open arms that you had no idea who you were letting in. Now you can't get rid of them. Sucks to be you.,Rob_AT54,USANEWS007,https://twitter.com/Rob_AT54/status/941978308907974656,1513420104
Two books people need to read is Islam's Anti Christ by Joel Richardson and The Truth about Muhammed by Robert Spencer. People need to wake up!,Hotaugustknigh1,USANEWS007,https://twitter.com/Hotaugustknigh1/status/941970932914044928,1513418346
England survived 60 million lbs of bombs by Nazis in WW2 only to be taken over by invited invasion of 5000 muslims,red_hankelrod,DonnaLCoutchavl,https://twitter.com/red_hankelrod/status/942007549808738304,1513427076
"Thís is what happens with  ' just ' 10% ( average percentage in EU) Muslims.

Can you imagine what will happen when the percentage Muslims is 30%???",Turandot19,"USANEWS007,jannyzeeland",https://twitter.com/Turandot19/status/942396719655997441,1513519861
RIP England,mandymendez90,"USANEWS007,RickyBobby_USA",https://twitter.com/mandymendez90/status/942181081029148672,1513468449
So much for tourism in England.,wdaaron_freedom,USANEWS007,https://twitter.com/wdaaron_freedom/status/942171380510052353,1513466136
"Dogs will be banned ~ ""Offensive""
Castles & statues will be torn down ~ ""Offensive""
Crosses are being taken down ~ ""Offensive""
Bikini ads prohibited ~ ""Offensive""
Islam criticism outlawed ~ ""Offensive""
Thot Police locking up people for ""Offensive"" opinions ~ right now!",LoversWin,USANEWS007,https://twitter.com/LoversWin/status/942167119491301376,1513465120
They've lost their country,danrconrad,USANEWS007,https://twitter.com/danrconrad/status/942154763994402816,1513462174
UK IS GONE / THE MUSLIM MAYOR MUST BE VERY HAPPY,CatsofVelvet,"USANEWS007,donaldbroom",https://twitter.com/CatsofVelvet/status/942153427789914112,1513461856
"Ominous. The call 2 prayer is in US cities & colleges, the growing Muslim pop was 3.3 mil in 2016. Libs r pushing 2 end travel ban want 2 bring in more. It’s “peaceful” Jihad. ,https://,tinyurl.com/yd5c58fl, , ‘Islam must dominate it cannot assimilate.’,pic.twitter.com/ZnPby69jqs",ShineTeller,"USANEWS007,LeftyCrusher",https://twitter.com/ShineTeller/status/942148633708806144,1513460713
Darn. I wanted to plan a family vacation to experience European culture. What country is left?,GalatianPark,"USANEWS007,PatVPeters",https://twitter.com/GalatianPark/status/942123811863855104,1513454795
No risk of a massive truck hitting that crowd...,LoyalAmerican24,USANEWS007,https://twitter.com/LoyalAmerican24/status/942121763416272896,1513454306
"Looks like a good time for an AC-130 gun run. Drop napalm too. ,#,bringbacknapalm",johnarmysf1,"USANEWS007,LoriMillerTX1",https://twitter.com/johnarmysf1/status/942094176585383936,1513447729
"I wanted to go back to London and see Scotland, Ireland and Wales, but I guess that I'll skip London.",danalind1953,USANEWS007,https://twitter.com/danalind1953/status/942087771631554561,1513446202
It’s time for the extraction teams to intervene there pronto!!,ScottVanderson6,USANEWS007,https://twitter.com/ScottVanderson6/status/942031438106394626,1513432771
Not all Muslims are bad. I have been to London so many times. I love Muslims ! Don’t hate ! Just love ,alexisy95,USANEWS007,https://twitter.com/alexisy95/status/950213266864852992,1515383471
I'm so lucky that I spent my twenties and most of my thirties traveling through Europe ...I never have to go back and my memories are full of the beautiful countries that they once were...,mybiffmonster,USANEWS007,https://twitter.com/mybiffmonster/status/942450941139267589,1513532788
This can't be good for tourism no matter how you look at it.,ConcrndCitizen3,"USANEWS007,2000heynow",https://twitter.com/ConcrndCitizen3/status/942383706433605632,1513516758
pic.twitter.com/7Iv7yXmyyd,Irishbillyclub,"USANEWS007,leapingknown",https://twitter.com/Irishbillyclub/status/942376536484786176,1513515049
"Wow! English people better wise up, Muslims will never simulate into your collective or western society. ",MarioMa08918331,USANEWS007,https://twitter.com/MarioMa08918331/status/942299722483716096,1513496735
We need to arm our British brothers and sisters poor Brits whoes bright idea was that,Get_real17,"USANEWS007,CynthiaRunnels1",https://twitter.com/Get_real17/status/942259334729420800,1513487106
Where are the women?,normagenie,"USANEWS007,5945USARTR",https://twitter.com/normagenie/status/942256816540536832,1513486506
"http://www.,lancashiretelegraph.co.uk/news/10931509.,5000_Muslims_march_for_prophet_s_birthday_in_Nelson/, ,…,
They were joined by the local MP and councillors and other bigwigs. This is an annual march and a perfectly peaceful celebration.",eileenvn,USANEWS007,https://twitter.com/eileenvn/status/942221163203387392,1513478005
"THAT SHIT HOLE IS GONE ,,GOVERNMENT IS DONE ,,",Gumball55668882,"USANEWS007,KerseyTony",https://twitter.com/Gumball55668882/status/942191292481753088,1513470883
Open borders can’t Vett this is what happens when you put a liberal in charge. But she has security detail,CedricZMendez,USANEWS007,https://twitter.com/CedricZMendez/status/942182686482993152,1513468832
Visited my buddy in Beverly Hills dude stops car pulls out magic carpet & prays in street,davi_926,USANEWS007,https://twitter.com/davi_926/status/942181128852594688,1513468460
Is that a demonstration or a private army?,wjappe,USANEWS007,https://twitter.com/wjappe/status/942177705356865537,1513467644
Just terrible,ccahart,USANEWS007,https://twitter.com/ccahart/status/942167954829008896,1513465319
How soon before the Brits seek asylum in the US!,4mediaequality,USANEWS007,https://twitter.com/4mediaequality/status/942167853586935808,1513465295
They trying to drowned out the sounds of Christmas?,chliberty,USANEWS007,https://twitter.com/chliberty/status/942160524661334016,1513463548
No travel there for sure.,Gr82bMAGA,USANEWS007,https://twitter.com/Gr82bMAGA/status/942159054146748416,1513463197
"“LIFE, LIBERTY, and the PURSUIT of ANYONE WHO THREATENS IT! “, Ooh-Rah!",RoccoSirico,USANEWS007,https://twitter.com/RoccoSirico/status/942144146504142849,1513459643
England is my country-in-law.  I will never visit again.,CynthiaArtis4,USANEWS007,https://twitter.com/CynthiaArtis4/status/942141139272060929,1513458926
