content,username,replyto,permalink,time
"Sean Hannity, gets no privacy on social media, and I’m sure TMZ will be watching him ",lady10314,battletested5,https://twitter.com/lady10314/status/986095627082887168,1523938492
"Ban Fox Media like France and Britain did!  Save our democracy!  And yes, we have a democracy so don’t even say it!",bluemeuninck,"battletested5,Fythia",https://twitter.com/bluemeuninck/status/986087354107617285,1523936520
pic.twitter.com/Zw1NdAPma4,sonicendeavor,"battletested5,TrefaultPaulina",https://twitter.com/sonicendeavor/status/986079194437206017,1523934575
"Exactly. Drag ,#,hannity, thru the streets. He lose his privilege to privacy years ago with those same points of what he did.",justinharewood1,battletested5,https://twitter.com/justinharewood1/status/986074767114539008,1523933519
"@,seanhannity, ...
Things to consider
From your cell.",sojo_soulschool,battletested5,https://twitter.com/sojo_soulschool/status/986074123284701184,1523933366
I pray for Seth family,viphires,"battletested5,brianjman",https://twitter.com/viphires/status/986069377861562368,1523932234
YYYYYYAAAAASSSS!!!!,Kimzree,battletested5,https://twitter.com/Kimzree/status/986057340167258118,1523929364
"@,seanhannity, is asking for privacy? 
You gotta be kidding me.
Like the kind of privacy he gave the victims of the Parkland H.S. shooting whom he didn't like what they were rallying for?

Sean Hannity is a DEPLORABLE HYPOCRITICAL DOUBLE-STANDARD-HOLDING PURVEYOR OF THE ANTI-TRUTH",nickjordanJMJ,battletested5,https://twitter.com/nickjordanJMJ/status/986230342980792320,1523970611
"You had me at “Hannity is asking for privacy”. Maybe if he scurries back under the fridge, no one will notice.",jptamblyn,"battletested5,StephenBright",https://twitter.com/jptamblyn/status/986210491730145280,1523965878
I hope this indignation will coalesce into a unified effort to expose the hypocrisy and eliminate the tolerance for his daily egregious assaults on truth and the core principles of our society. He’s had a platform for too long. Time for a mass boycott of his sponsors.,Polyesther123,"battletested5,Steel_Donkey",https://twitter.com/Polyesther123/status/986200282009866240,1523963444
"@,StormieJenny,  I just remembered that ,#,SeanHannity, several months back was tweeting that he might be wire-tapped. I'm too tired to look it up but he was peeved.",Rubytea53,"battletested5,JuddApatow",https://twitter.com/Rubytea53/status/986101130718597120,1523939805
Maybe there is a reason FOX is banned in England and Canada .. if only ,ddeeb61,battletested5,https://twitter.com/ddeeb61/status/986087151539453955,1523936472
He can have his privacy next to Trump in their prison cells next to each other. That would be awesomely fine. Lols.,HoodgeShane,"battletested5,ProudResister",https://twitter.com/HoodgeShane/status/986079630405746688,1523934679
He karma is just beginning,scarf1974,battletested5,https://twitter.com/scarf1974/status/986069977349414914,1523932377
"I’m so glad I’ve lived long enough to see this butthead get his comeuppance! No one deserves it more than Sean, unless it is his president....!!!!",Msrlec,battletested5,https://twitter.com/Msrlec/status/986272191896416257,1523980589
"I can only assume ,@,seanhannity, will be going on vacation shortly.  It seems to be a rite of passage for Fox TV hosts.  ,#,karma",aseip1,battletested5,https://twitter.com/aseip1/status/986241350109679617,1523973236
"He literally said he’s ENTITLED to privacy.   No, you corrupt bastard.   That ship has sailed, and exploded.,pic.twitter.com/qA3IDWGdbz",Ronald__Rump,battletested5,https://twitter.com/Ronald__Rump/status/986191823742881792,1523961427
"4) When race baiting
5) When standing up for sheriff Joe 
6) When bullying the LGBT
7) When picking sh*tty music to begin his broadcasts",FallingDj,"battletested5,TheMominatrixx",https://twitter.com/FallingDj/status/986152693633900545,1523952098
"Privacy?  WTH?  He’s a public figure by definition & by choice. Not having much fun with that celebrity now, are we, Sean? ,@,seanhannity",LamedVav18,battletested5,https://twitter.com/LamedVav18/status/986140833865924613,1523949271
"Nor was he asking for privacy when he declared his relationship with Cohen was just “advisory,” or “de minimis.” Yet Trump’s own lawyer disclosed in federal court that such constituted “representation.” Let that sink in.",CodeMonkeyB,"battletested5,borrinet",https://twitter.com/CodeMonkeyB/status/986119822361608193,1523944261
Can the Hann,cobbdewayne_80,"battletested5,bohemianserver",https://twitter.com/cobbdewayne_80/status/986105285239623681,1523940795
How about Solitary Confinement?,SchmoopyWoopy,battletested5,https://twitter.com/SchmoopyWoopy/status/986104189041328128,1523940534
"Could not happen to a worse person. ,seannitty.",eowynsister,battletested5,https://twitter.com/eowynsister/status/986099007184257025,1523939298
Have Micheal Cohen Fix It. Apparently nothing is too low to be employed by Fox,tascorp111,battletested5,https://twitter.com/tascorp111/status/986092079095926784,1523937647
He’s a pos,badhombretpm,"battletested5,TheBluFalcon",https://twitter.com/badhombretpm/status/986082293167964160,1523935313
"#,fireHannity",iRun4Jules,"battletested5,yarnsandmusings",https://twitter.com/iRun4Jules/status/986070458813632512,1523932492
"#,FireHannity, ",Tootsie_Snyder,battletested5,https://twitter.com/Tootsie_Snyder/status/986067249952894977,1523931727
I believe you are correct!!!  and then some.,jlittleboy,battletested5,https://twitter.com/jlittleboy/status/986064471385878528,1523931064
" , ",june_tsunami,"ASHKE013,battletested5",https://twitter.com/june_tsunami/status/986104206435250176,1523940538
"Think I am not alone here when I say ,#,FuckHannity,.",Kuku_Sabzi,"battletested5,101loltoday",https://twitter.com/Kuku_Sabzi/status/986345454471282688,1523998056
pic.twitter.com/ty0oahALpL,VillagePanda777,battletested5,https://twitter.com/VillagePanda777/status/986283220319612928,1523983218
Tell Sean he can have privacy if he resigns. Until then he is part of the problem.,scrimshankpotus,"battletested5,Mschade2020",https://twitter.com/scrimshankpotus/status/986263037756624896,1523978406
"not to mention the murder of Seth Rich, or the shooting at the pizzeria. they need to held accountable for that. Freedom of speech doesn't mean it can cost the life of someone else.",badrider71,battletested5,https://twitter.com/badrider71/status/986262403972255744,1523978255
The right conveniently forgets this lesson.,glover_ceo,"dis_1gurlrocks,battletested5",https://twitter.com/glover_ceo/status/986257654770089984,1523977123
"This POS forfeited whatever right to privacy he had when he chose to become a ""celebrity.""  By his own egregious attacks on others, he completely lays himself open for the same.",sgcharles53,battletested5,https://twitter.com/sgcharles53/status/986219866813272065,1523968113
Sean Hannity didn’t think about Seth Rich’s family wanting privacy as he exploited his death for political gain. So reprehensible to do that to a grieving family.,3ChicsPolitico,battletested5,https://twitter.com/3ChicsPolitico/status/986123589421281280,1523945159
We wouldn't want to bother a man that has so much respect others privacy and has never lied to soil anothers reputation.We should really bother the sponsor's that continue to support this human cesspool.,LatchemRick,battletested5,https://twitter.com/LatchemRick/status/986110102888476672,1523941944
"Let’s respect him, and ask that  they give him solitary confinement in prison. Nice and private.",cwisme,"battletested5,nastylibtard",https://twitter.com/cwisme/status/986085767884754944,1523936142
pic.twitter.com/rjz8cEvCRd,Redskin_girlnm,"battletested5,ProudResister",https://twitter.com/Redskin_girlnm/status/986083270231179266,1523935546
"Thoughts and prayers are all I've got for him and the onslaught, and I'm running awful low on thoughts.",thatsmemissC,battletested5,https://twitter.com/thatsmemissC/status/986080497016205312,1523934885
