username,date,retweets,favorites,text,geo,mentions,hashtags,tweetid,conversationid,replyto,permalink,imagelink
"transfag666","2017-07-19-03:21",0,1,"I too am a boy and his lion *cuddles my screaming cat*","","","","887573149692424194","","","https://twitter.com/transfag666/status/887573149692424194",""
"Maceythemexican","2017-07-14-00:52",0,1,"I love how one minute my cat cuddles with me and the next minute she thinks she is a ferocious lion","","","","885723532696494080","","","https://twitter.com/Maceythemexican/status/885723532696494080",""
"RustyRambles","2017-07-09-16:36",0,0,"Look at my wee lion # cuddles # cat # catlover # catfamily # catstagram # catsofinstagram https://www.instagram.com/p/BWVuavoFklB/","","","# cuddles # cat # catlover # catfamily # catstagram # catsofinstagram","884149310635606017","","","https://twitter.com/RustyRambles/status/884149310635606017","https://abs.twimg.com/emoji/v2/72x72/1f63b.png"
"Mr_Bailey_Cat","2017-07-05-11:46",0,5,"I like cuddles","","","","882626871275421696","882567217451343872","yongmaylingjen1 LittleMaineCoon","https://twitter.com/Mr_Bailey_Cat/status/882626871275421696","https://abs.twimg.com/emoji/v2/72x72/1f63a.png"
"yongmaylingjen1","2017-07-05-10:26",0,1,"I want to give u a cuddle, Bailey","","","","882606720177938432","882567217451343872","Mr_Bailey_Cat LittleMaineCoon","https://twitter.com/yongmaylingjen1/status/882606720177938432","https://abs.twimg.com/emoji/v2/72x72/1f63b.png"
"fuzzyelephant7","2017-07-02-02:14",0,0,"lion king 1 1/2 and cuddles.. with my cat # livingluxurious # hakunamatatapic.twitter.com/mqlEq15wuV","","","# livingluxurious # hakunamatatapic","881395532538576896","","","https://twitter.com/fuzzyelephant7/status/881395532538576896","https://abs.twimg.com/emoji/v2/72x72/1f431.png"
"MrsShipsThemAll","2017-06-26-05:44",0,0,"Sadly im allergic to cats ;-; So i cant cuddle i wonder if i'd be allergic to lions and stuff too lol","","","","879274053885984768","879270657967747072","KaptainKappa","https://twitter.com/MrsShipsThemAll/status/879274053885984768",""
"ShelleDione","2017-06-19-22:23",0,0,"I love furry cats they are great for winter cuddles, fun to watch them pretend to be lions lol. Mine isn't too furry now with the heat. pic.twitter.com/t78W1UULSb","","","","876988888987729921","","","https://twitter.com/ShelleDione/status/876988888987729921","https://pbs.twimg.com/media/DCuwvpWVYAAoF78.jpg"
"WolfieGaming121","2017-06-19-03:00",0,0,"@safarilive_fan does lions make that sound the cat does when u cuddle with them","","","","876696213474750464","","","https://twitter.com/WolfieGaming121/status/876696213474750464",""
"adlesirg_ocnalb","2017-06-13-11:51",0,0,"I really believe that if I ever came across a lion they'd recognize I'm a cat lover and just let me cuddle them","","","","874655574033616896","","","https://twitter.com/adlesirg_ocnalb/status/874655574033616896",""
"sandyjoc","2017-06-12-01:37",0,4,"I wish my cat Bella was the size of a mountain lion, we'd cuddle so hard","","","","874138574257401857","874138459941740544","sandyjoc","https://twitter.com/sandyjoc/status/874138574257401857",""
"Allan_Hammett","2017-06-02-00:56",0,0,"Me ha gustado un vídeo de @ YouTube (http://youtu.be/B72Krbb9t-U?a - Tigers, Lions And Cheetahs Love To Cuddle - Big Cats Compilation).","","@ YouTube","","870504292536303617","","","https://twitter.com/Allan_Hammett/status/870504292536303617",""
"MrChad","2017-06-01-05:51",0,5,"14. My cat's name is Aslan, Turkish for Lion (yes!). I love him and we cuddle together at night and he grooms my hair in the morning pic.twitter.com/ZHmNxGELiZ","","","","870216118073413633","870186913059094528","MrChad","https://twitter.com/MrChad/status/870216118073413633","https://abs.twimg.com/emoji/v2/72x72/2764.png"
"WelcomeMachine1","2017-05-30-16:08",0,0,"South African 'Lion Whisperer' who has been accepted as part of a pride cuddles his big cats as he condemns lion... http://fb.me/1UPW7u7c9","","","","869646642538065920","","","https://twitter.com/WelcomeMachine1/status/869646642538065920",""
"teamwang247","2017-05-19-04:58",0,0,"I liked a @ YouTube video http://youtu.be/B72Krbb9t-U?a Tigers, Lions And Cheetahs Love To Cuddle - Big Cats Compilation","","@ YouTube","","865491806246494209","","","https://twitter.com/teamwang247/status/865491806246494209",""
"godeeptravel","2017-05-14-09:00",2,4,"Lion cub and big cat cuddle on Safari, Africa http://godeeptravel.com pic.twitter.com/hQlJJdjtFe","","","","863740894507356161","","","https://twitter.com/godeeptravel/status/863740894507356161","https://pbs.twimg.com/media/C_yfw9tUQAAIy1i.jpg"
"Top_Funny_Video","2017-05-13-23:29",0,0,"Tôi đã thêm video vào danh sách phát http://youtu.be/B72Krbb9t-U?a Tigers, Lions And Cheetahs Love To Cuddle - Big Cats Compilation","","","","863597091075104770","","","https://twitter.com/Top_Funny_Video/status/863597091075104770",""
"TristanStCyr","2017-05-09-17:32",0,22,"Im buying rachel a cat today... she already named it honey pot cuddle face and is buying it a little lions mane.. i feel I made a mistake","","","","862057656986599424","","","https://twitter.com/TristanStCyr/status/862057656986599424",""
"powerschlumpfi","2017-04-23-12:21",0,0,"i look like i fought with a lion but no it's just my cat being extra affectionate trying to give me cuddles and licking my hair pic.twitter.com/HzB3ET8NV2","","","","856181253812482048","","","https://twitter.com/powerschlumpfi/status/856181253812482048","https://pbs.twimg.com/media/C-HETbBXsAAYxXe.jpg"
"LittleMaineCoon","2017-04-21-14:15",0,3,"Just catching up now. I the lion cut Bailey & I hope some rest & cuddles 1/2","","","","855485091207892992","855105549129658369","Mr_Bailey_Cat harlequin_van","https://twitter.com/LittleMaineCoon/status/855485091207892992","https://abs.twimg.com/emoji/v2/72x72/2764.png"
"AlettaHarrison","2017-04-17-02:00",0,2,"The most social of the big cats, lions regularly cuddle and groom each other. Here we watched five lionesses settl… http://ift.tt/2oEN5He pic.twitter.com/uSVmLkKhPT","","","","853850706926809088","","","https://twitter.com/AlettaHarrison/status/853850706926809088","https://pbs.twimg.com/media/C9l8sRVXYAIcs7z.jpg"
"Johnny_coolcat","2017-04-13-03:48",0,0,"Sounds interesting. I bet those Lions don't get anyone to give them a big cuddle at 3am though like I demand off of my dad","","","","852428365780922368","852397473884667905","Mr_Colbie_Cat","https://twitter.com/Johnny_coolcat/status/852428365780922368","https://abs.twimg.com/emoji/v2/72x72/1f60a.png"
"cjtweetstation","2017-04-12-18:28",0,0,"'Rally cat' takes cover in Miami Marlins outfield – Chicago man cuddles with lion in South Africa http://www.conservativejunction.com/2017/04/12/rally-cat-takes-cover-in-miami-marlins-outfield-chicago-man-cuddles-with-lion-in-south-africa/ …","","","","852287365108436993","","","https://twitter.com/cjtweetstation/status/852287365108436993",""
"Aerkchai_VPics","2017-04-12-16:54",0,0,"'Rally cat' takes cover in Miami Marlins outfield - Chicago man cuddles with lion in South… https://goo.gl/fb/BnWChN","","","","852263686198534144","","","https://twitter.com/Aerkchai_VPics/status/852263686198534144",""
"TheReportersLab","2017-04-12-15:22",0,0,"‘Rally cat’ takes cover in Miami Marlins outfield – Chicago man cuddles with lion in… http://www.reporterslab.com/rally-cat-takes-cover-in-miami-marlins-outfield-chicago-man-cuddles-with-lion-in-south-africa/ …pic.twitter.com/EIVKRUtXo4","","","","852240469744603136","","","https://twitter.com/TheReportersLab/status/852240469744603136","https://pbs.twimg.com/media/C9PEMHkUIAAa8eX.jpg"
"mrfffffFollow","2017-04-12-15:10",0,0,"'Rally cat' takes cover in Miami Marlins outfield - Chicago man cuddles with lion in South Africa","","","","852237471920173056","","","https://twitter.com/mrfffffFollow/status/852237471920173056",""
"szavenn","2017-04-12-10:15",1,3,"i really want a big ass fat cat so i can hug him when i sleep i dont mind having a fucking tiger or lion i just want a pet to CUDDLE WITH","","","","852163333461426177","","","https://twitter.com/szavenn/status/852163333461426177",""
"jamieblacklaw","2017-04-10-00:32",0,1,"I need a dog,penguin,cat or a baby sea lion to cuddle with","","","","851291690996559872","","","https://twitter.com/jamieblacklaw/status/851291690996559872",""
"MostfMomtz","2017-03-28-20:35",0,0,"New GIF tagged love, cute, animals, nature, cats, sweet, tiger, lion, organic, cuddle, pure, explore, big cats, sn… http://ift.tt/2nyzCQZ","","","","846883410991812608","","","https://twitter.com/MostfMomtz/status/846883410991812608",""
"adam_summers","2017-03-27-22:34",0,1,"lol, I've experienced that with my cat before. Goes from cuddle cat to derpy OCD lion huntress the moment a fly appears.","","","","846550926840225793","846548200127447040","ninazbs","https://twitter.com/adam_summers/status/846550926840225793",""
"critkumi","2017-03-26-02:58",0,2,"I love lions..... big cats........ I'd cuddle one if it was guaranteed it won't bite me","","","","845892799815794688","","","https://twitter.com/critkumi/status/845892799815794688",""
"KnightofArland","2017-03-23-22:50",0,1,"AWWWWW Cor needs someone to cuddle! This is such a lovely idea He is a cat/lion/lynx dad haha","","","","845105542305644545","845100892420431872","idegldio22","https://twitter.com/KnightofArland/status/845105542305644545","https://abs.twimg.com/emoji/v2/72x72/1f60d.png"
"GlifoMaia","2017-03-13-11:34",0,1,"New on 500px : Cuddle Cat by Rudi_Hulshof # Lion # Photography # LoveItpic.twitter.com/ggpd9WEg2J","","","# Lion # Photography # LoveItpic","841311467496452096","","","https://twitter.com/GlifoMaia/status/841311467496452096","https://pbs.twimg.com/media/C6zwUgrWsAEGZ-i.jpg"
"TakingSparks","2017-03-07-00:46",0,3,"Like I get to see giraffes and lions whenever I want here at Disney, but man sometimes I just want to pet a dog or cuddle my cat","","","","838989308157636608","","","https://twitter.com/TakingSparks/status/838989308157636608",""
"HereBeSin","2017-02-23-12:21",0,0,"yes this is good but it doesn't undo what was done to you. I hope there are healing cat cuddles <3","","","","834815492946874371","834787263645089792","if_lions_talked martha_again","https://twitter.com/HereBeSin/status/834815492946874371",""
"lion_atheart","2017-02-23-10:54",0,0,"Orange cats are the best specialists. As long as your problem is needing cuddles, that is.","","","","834793479670743045","834739731141267464","LadyT_Hat","https://twitter.com/lion_atheart/status/834793479670743045",""
"drew_lala","2017-02-11-08:40",0,0,"Noble lion (likes a cuddle) # catsofinstagram # cats # noonecanbeferociousallthetime https://www.instagram.com/p/BQX5H0Ug5mL/","","","# catsofinstagram # cats # noonecanbeferociousallthetime","830411154879037440","","","https://twitter.com/drew_lala/status/830411154879037440",""
"NiklasSarmien2","2017-02-07-01:43",0,0,"I liked a @ YouTube video http://youtu.be/B72Krbb9t-U?a Tigers, Lions And Cheetahs Love To Cuddle - Big Cats Compilation","","@ YouTube","","828856621090607105","","","https://twitter.com/NiklasSarmien2/status/828856621090607105",""
"robin_r_r","2017-02-05-13:15",0,3,"A cat would not be comfort enough; today I want to cuddle a lion.","","","","828305988851687424","","","https://twitter.com/robin_r_r/status/828305988851687424",""
"AgelessNowUSA","2017-02-04-03:44",0,0,"we adopted a cat from a sewer drain. He's as big as a lion now. Good for nothing except cuddles. Lol Vomits & poops everywhere!","","","","827799916470747137","827425653347778560","whauzen","https://twitter.com/AgelessNowUSA/status/827799916470747137","https://abs.twimg.com/emoji/v2/72x72/1f63a.png"
"ButtersDaBear","2017-02-03-03:56",0,1,"@ Twi_Lion happy birthday you fluffy cat bear ʕᵔᴥᵔʔ *super hugs and cuddles!!*","","@ Twi_Lion","","827440635040956416","","","https://twitter.com/ButtersDaBear/status/827440635040956416",""
"Pork_Lion","2017-01-22-19:20",0,3,"tfw you can't figure out what scratches are from sex and which ones are tryna cuddle stray cats","","","","823324530189795329","","","https://twitter.com/Pork_Lion/status/823324530189795329",""
"whalelookyheree","2017-01-15-15:07",0,1,"if my cat cuddles w me and I'm on my phone, he will legit try to get me to put it away unless I turn on lion videos so he can watch","","","","820724205239095302","","","https://twitter.com/whalelookyheree/status/820724205239095302","https://abs.twimg.com/emoji/v2/72x72/1f602.png"
"HappiSabi","2017-01-05-00:51",2,5,"Cody the dorky mountain lion is waking up with me but we misses the crazy kitty-daddy @ _Bilko_ *sound* # kitty # fluffy # cat # meow # cuddle pic.twitter.com/md0qjmGQdU","","@ _Bilko_","# kitty # fluffy # cat # meow # cuddle","816884907804938240","","","https://twitter.com/HappiSabi/status/816884907804938240","https://abs.twimg.com/emoji/v2/72x72/1f618.png"
"superspecialkay","2017-01-03-08:16",0,0,"Love my lil shitty lion # cat # catsofinstagram # gingerpersian # cuddles https://www.instagram.com/p/BOzbdHAhx8O/","","","# cat # catsofinstagram # gingerpersian # cuddles","816272138546003969","","","https://twitter.com/superspecialkay/status/816272138546003969","https://abs.twimg.com/emoji/v2/72x72/2764.png"
"melanneball","2016-12-30-14:04",0,2,"The lion king and cuddles with my cat","","","","814909992100831232","","","https://twitter.com/melanneball/status/814909992100831232","https://abs.twimg.com/emoji/v2/72x72/1f63b.png"
"SamHModel","2016-12-30-12:59",0,36,"Turned on the TV to see the Lion King is on and it was the scene of Mufasa's death. Now I need to cuddle my cat or I may cry.","","","","814893574097616898","","","https://twitter.com/SamHModel/status/814893574097616898",""
"Malibu_Cats","2016-12-28-04:20",0,0,"Wednesdays Cats; Rimski & Jolene; more cuddles for Rimski, he gets the Lion's share as Jolene eats slowly, he'll steal her food if poss.","","","","814038210665975808","","","https://twitter.com/Malibu_Cats/status/814038210665975808",""
"dogbedheaven","2016-12-23-07:30",0,2,"Tigers, Lions And Cheetahs Love To Cuddle - Big Cats Compilation # cutedogs http://youtu.be/B72Krbb9t-U","","","# cutedogs","812274064609935360","","","https://twitter.com/dogbedheaven/status/812274064609935360",""
"themrsbebs","2016-12-22-19:23",0,1,"Sometimes I just stare at my cat and it amazes me that God created these furry mini lions to cuddle and live with us","","","","812091326070226944","","","https://twitter.com/themrsbebs/status/812091326070226944","https://abs.twimg.com/emoji/v2/72x72/1f63b.png"
"BestAnimalLive1","2016-12-20-13:01",0,0,"Saya menambahkan video ke playlist @ YouTube http://youtu.be/B72Krbb9t-U?a Tigers, Lions And Cheetahs Love To Cuddle - Big Cats Compilation","","@ YouTube","","811270304718798848","","","https://twitter.com/BestAnimalLive1/status/811270304718798848",""
"rocstorm","2016-12-14-15:45",0,0,"DO: Cuddle with your cat or dog DON'T: Cuddle with your lion or tiger # CuffingSeasonDosAndDonts","","","# CuffingSeasonDosAndDonts","809137211971092480","","","https://twitter.com/rocstorm/status/809137211971092480",""
"gutterstarss","2016-12-08-01:06",0,0,"Stupid pet nicknames for the cat: Baby Bean, Cuddle Puppa, Baby Biscuit, Very Small Lion, Tummy Tot, Poots","","","","806741729533493248","","","https://twitter.com/gutterstarss/status/806741729533493248",""
"Elsa_Lion_Cat","2016-12-05-17:19",1,3,"SICK, SICK POS F-WIT LOSERS! WEAR CUDDLE DUDS INSTEAD! POYCOT # UNDERARMOUR! # TROPHYHUNTINGISFORLOSERSONLYhttps://twitter.com/ginachron/status/805139464767021056 …","","","# UNDERARMOUR # TROPHYHUNTINGISFORLOSERSONLYhttps","805899446227705856","","","https://twitter.com/Elsa_Lion_Cat/status/805899446227705856","https://pbs.twimg.com/media/CyxuEQQWgAA7Gd7.jpg"
"harlequin_van","2016-12-04-21:13",0,1,"Brrrr. I would have to cuddle between Deaner and Shroppy! Yum","","","","805595884331225088","805594068000657412","Elsa_Lion_Cat _thecatsays_ ItsMeDeaner","https://twitter.com/harlequin_van/status/805595884331225088",""