username,date,retweets,favorites,text,geo,mentions,hashtags,tweetid,conversationid,replyto,permalink,imagelink
"haggisbasher3","2018-03-28-02:01",0,1,"Awww so cute Amanda . Lovely pics . I would love to cuddle the lions at Monarto ,unfortunately they would rip my head off lol. Have always had a thing for big cats since I was a child. I really want to do the cage feed . That looks fun.","","","","978874668273885184","978788560638636032","akbachmann sunriseon7","https://twitter.com/haggisbasher3/status/978874668273885184",""
"B1A4_England","2018-03-25-17:29",0,1,"When lion cat wants cuddles. You give lion cat cuddles. Or it attacks pic.twitter.com/Y1IzXQV27K","","","","978021083059228673","","","https://twitter.com/B1A4_England/status/978021083059228673","https://abs.twimg.com/emoji/v2/72x72/1f602.png"
"bartonx_","2018-03-24-10:53",0,2,"all i wanna do is watch the lion king n cuddle my cat.","","","","977559153269985281","","","https://twitter.com/bartonx_/status/977559153269985281",""
"mazigerald","2018-03-23-03:55",0,0,"Lion that was sent away like a cuddle cat. https://twitter.com/paulpogba/status/976947331097681920 …","","","","977091436150689792","","","https://twitter.com/mazigerald/status/977091436150689792","https://pbs.twimg.com/ext_tw_video_thumb/976947168379629570/pu/img/wjXbW_iNOnQpNbXU.jpg"
"PenguinBooksSA","2018-03-20-15:00",2,1,"The theme for # WWD18 is BIG CATS: PREDATORS UNDER THREAT. Over the past century, we have been losing big cats, the planet’s most majestic predators, at an alarming rate. Look out for Cuddle Me Kill Me, out in May 2018: the true account of SA's captive lion breeding industry. pic.twitter.com/j7sxW4SQAe","","","# WWD18","976171519834386433","","","https://twitter.com/PenguinBooksSA/status/976171519834386433","https://pbs.twimg.com/media/DXMWh_sWkAASmgN.jpg"
"StruikNature","2018-03-20-10:00",1,1,"The theme for # WWD18 is BIG CATS: PREDATORS UNDER THREAT. Over the past century, we have been losing big cats, the planet’s most majestic predators, at an alarming rate. Look out for Cuddle Me Kill Me, out in May 2018: the true account of SA's captive lion breeding industry. pic.twitter.com/7yJHsvWi3l","","","# WWD18","976096027546546183","","","https://twitter.com/StruikNature/status/976096027546546183","https://pbs.twimg.com/media/DXMWU8SXUAEs5GE.jpg"
"Kolo117","2018-03-12-09:08",0,0,"Свиђа ми се видео http://youtu.be/B72Krbb9t-U?a Tigers, Lions And Cheetahs Love To Cuddle - Big Cats Compilation","","","","973183891031887872","","","https://twitter.com/Kolo117/status/973183891031887872",""
"ultnano","2018-03-12-06:40",0,1,"my cat demanded cuddles then came and brought me her lion and meowed in my ear pic.twitter.com/dZujr0LRDq","","","","973146607746101248","","","https://twitter.com/ultnano/status/973146607746101248","https://pbs.twimg.com/media/DYFPqsvV4AAyi6q.jpg"
"_Spirit_Lion_","2018-03-08-14:12",0,0,"PLEASE SHARE!! LULU - 22118 - SSSHH!! Healthy 11y/o LULU loves quiet houses, quiet cats and quiet people to cuddle @MACC. Lulu is an 11 year old female, silver... Follow me here for more info and status updates: http://nyccats.urgentpodr.org/lulu-22118/ pic.twitter.com/U0EQSVwmSx — URGENT POD…","","","","971825941587603456","","","https://twitter.com/_Spirit_Lion_/status/971825941587603456","https://pbs.twimg.com/media/DXyeAoMVwAEEiRE.jpg"
"iBTSKIMV","2018-03-06-05:02",0,0,"oh and cats also stands for something elegant and mysterious aren't they?. well, probably a lion or tiger hahah cos they are ones of the biggest lover of playing time and cuddles :))","","","","970962940500176897","970894607104983041","xuayiyang","https://twitter.com/iBTSKIMV/status/970962940500176897",""
"StruikNature","2018-03-06-05:00",1,1,"The theme for # WWD18 is BIG CATS: PREDATORS UNDER THREAT. Over the past century, we have been losing big cats, the planet’s most majestic predators, at an alarming rate. Look out for Cuddle Me Kill Me, out in May 2018: the true account of SA's captive lion breeding industry. pic.twitter.com/v9rPoKxm1z","","","# WWD18","970962196900573184","","","https://twitter.com/StruikNature/status/970962196900573184","https://pbs.twimg.com/media/DXMUQr-W4AASdP7.jpg"
"nadeshart","2018-03-02-18:01",0,0,"i’m sOBBING OVER THESE LIONS WHO LOVE THIS GUY AND HUG HIMA ND CUDDLE HIMA ND SLEEP NEXT TO HIM IM FOR REAL TEArs STREAMING I LOVE CATS pic.twitter.com/XCUzUdK5FY","","","","969709194206236672","","","https://twitter.com/nadeshart/status/969709194206236672","https://pbs.twimg.com/media/DXUZXh2WkAA7csw.jpg"
"hellostarbuxx","2018-03-01-14:07",1,28,"I had a dream where someone gave me this weird baby lion/tiger imaginary made up wild cat to care for and i was like heck yeah. I was about to cuddle it and I was like 'ono im definitely gonna be allergic to this' and put it down.","","","","969287955096506368","","","https://twitter.com/hellostarbuxx/status/969287955096506368",""
"LolaKittySLC","2018-02-27-11:39",0,5,"Little old Lily lion cut wakes staff to tell them the box had been used and needs prompt cleaning. It doesn't work on her regular staff or mine when she's catsitting, she just gets sleepy cuddles. Staff says I'm the better cat.","","","","968525905181077504","968399238697836547","MollyMoggy26","https://twitter.com/LolaKittySLC/status/968525905181077504",""
"PatternsPast","2018-02-27-10:22",0,0,"Vintage Simplicity Kids Animal Pillow Pattern Stuffed Owl Pillow Cat Pillow Lion Pillow Panda Pillow UNCUT Cuddle Pillows Sewing Pattern http://etsy.me/2GKL5DJ pic.twitter.com/aFR134Kfnp","","","","968506567350988801","","","https://twitter.com/PatternsPast/status/968506567350988801","https://pbs.twimg.com/media/DXDTlrkWkAAlOZE.jpg"
"MollyMoggy26","2018-02-18-10:36",0,10,"Sweetheart - sending you a virtual paw hug . I am sorry your dad is going away again. He will be back soon and you have had lots of dad cuddles. Love you my gorgeous handsome sensitive lion","","","","965248627563220992","965158134711975936","lena_valentin_ Biscuit_Meow","https://twitter.com/MollyMoggy26/status/965248627563220992","https://abs.twimg.com/emoji/v2/72x72/1f43e.png"
"soulknjins","2018-02-11-23:04",0,0,"30) Cats. I also want a tiger or a lion. THEYRE ADORABLE I WANNA CUDDLE THEM :(( # BestFanArmy # BTSARMY # iHeartAwards @ BTS_twt","","@ BTS_twt","# BestFanArmy # BTSARMY # iHeartAwards","962900165706133504","962706673876873216","","https://twitter.com/soulknjins/status/962900165706133504","https://pbs.twimg.com/profile_images/1004277705108439041/RXd67Err_normal.jpg"
"TheDblAron","2018-02-07-11:37",0,0,"They just wanna cuddle! My cat does that same thing, pawing at you. Lions are just big kittens pic.twitter.com/OfWv8ikQFu","","","","961277684729888768","961260878552289280","snark_tank talkhoops","https://twitter.com/TheDblAron/status/961277684729888768",""
"loganhitchcock1","2018-02-06-10:36",0,2,"Not a cat guy but I would totally cuddle a lion if the chance was presented to me because they just look so soft but there is the fact that it would probably kill me but you gotta risk it for the Biscut","","","","960899906201440258","","","https://twitter.com/loganhitchcock1/status/960899906201440258",""
"ffsyuji","2018-01-26-13:21",0,1,"like give me a fucking lion that's a cuddle cat right there","","","","956955292742438913","956954385996767233","regubade KeeperofLust","https://twitter.com/ffsyuji/status/956955292742438913",""
"LauraCritchley_","2018-01-25-15:13",0,0,"I cuddle my cat the way this guy cuddles lions # BigCats","","","# BigCats","956621092789112832","","","https://twitter.com/LauraCritchley_/status/956621092789112832",""
"NathanJHarrison","2018-01-18-15:18",27,254,"Lions are cool but have you ever called your pet cat from another room and it comes running in for cuddles? # BigCats @ BBCEarth @ BBCOne","","@ BBCEarth @ BBCOne","# BigCats","954085604802916354","","","https://twitter.com/NathanJHarrison/status/954085604802916354","https://abs.twimg.com/emoji/v2/72x72/1f408.png"
"tj_tjhunter","2018-01-18-08:50",0,7,"Angel Casey says don’t be sad Valli, these things happen, you are just a super sensitive little lion, big cuddles","","","","953987952471887873","953889293902151680","lena_valentin_ Holts05","https://twitter.com/tj_tjhunter/status/953987952471887873","https://abs.twimg.com/emoji/v2/72x72/1f308.png"
"TenaciousRayne","2018-01-17-19:55",0,0,"What did he say? Cuddle? Sandwich? # cats # WildlifeWednesday Lion cowers behind his paw after telling off from lioness http://dailym.ai/2EMk1TG","","","# cats # WildlifeWednesday","953793054229614592","","","https://twitter.com/TenaciousRayne/status/953793054229614592",""
"Cardifidence","2018-01-17-01:29",0,0,"I wish I was cool with wild cats so I could pet and cuddle with jaguars and lions","","","","953514521129312256","","","https://twitter.com/Cardifidence/status/953514521129312256",""
"brokedownfozzie","2018-01-16-20:44",0,0,"Statistics... The most accurate explanation of them all. Time to go cuddle with a lion now since im more likely to die, statistically, by the deadliest cat (kitten) on earth.","","","","953442811680055297","952956982117502976","BBCOne","https://twitter.com/brokedownfozzie/status/953442811680055297",""
"HunterAngelus","2018-01-11-00:58",0,0,"And what does it say about me that I instantly fall in love with the cute cat character? Speaking of Kova; Can anyone tell me where I can get merch of him? Looked on Amazon but they only have the lions available to buy. I want a plushie Kova toy to cuddle and watch Voltron with!","","","","951332486239449088","","","https://twitter.com/HunterAngelus/status/951332486239449088",""
"TobiasandJasper","2018-01-08-09:21",0,9,"It may be warmer where you are, Valentin! Your winter coat is so thick and lush, you really look like a proud lion. Be good today, please stay safe and give Lena a cuddle from us.","","","","950371806782902272","950270570142339072","lena_valentin_ MollyMoggy26","https://twitter.com/TobiasandJasper/status/950371806782902272",""
"spotted_menace","2018-01-05-11:42",0,4,"You ever just, like, look at a picture of a big cat - like a tiger or a lion - and go 'Man, if I had one wish, I'd wish for invulnerability so I can cuddle them bitches'?","","","","949320309819265026","","","https://twitter.com/spotted_menace/status/949320309819265026",""
"LVL1DLC","2018-01-05-11:42",0,0,"You ever just, like, look at a picture of a big cat - like a tiger or a lion - and go 'Man, if I had one wish, I'd wish for invulnerability so I can cuddle them bitches'?","","","","949320309710213120","","","https://twitter.com/LVL1DLC/status/949320309710213120",""
"Corporate_Mess","2017-12-28-22:32",0,3,"Killian: Kill Bill Killer Lion Lion Lion Heart Killerin Killian Apple Apple Apple Pie Apperz Bub Bubs Bubberz Bug Cuddle Bug Buggy Buggerz Fatty Kylo Ren Chubberz Fat Cat Fatty McFatterson https://twitter.com/merystic/status/943645403198754817 …","","","","946584675786608640","","","https://twitter.com/Corporate_Mess/status/946584675786608640",""
"TobiasandJasper","2017-12-27-10:09",0,5,"Hello little lion! Enjoy your day outside, we hope the sun comes out to warm you. Please give cuddles to Lena from us!","","","","946035325993922560","945917900862509056","lena_valentin_ lell_sutherland","https://twitter.com/TobiasandJasper/status/946035325993922560",""
"mk3zombie","2017-12-26-21:42",0,1,"Wow... I’m essentially a cat. I like cuddles, naps, and food. I have a somewhat uncontrollable lions mane. Strangers make me nervous and I have a 4 second attention span.","","","","945847402602356737","945838577828712449","DialNforNicole frankstickler","https://twitter.com/mk3zombie/status/945847402602356737",""
"Sophie66114116","2017-12-25-08:05",0,2,"I adopted a snow leopard and my sister adopted a Lion but the cuddle toy is in my cats bed","","","","945279283513233408","945266673313042432","wwf_uk","https://twitter.com/Sophie66114116/status/945279283513233408",""
"Autistic_Ace","2017-12-23-01:54",3,12,"Human babies look like something out of a horror movie. Cats, meanwhile, are adorable little lions that want to cuddle","","","","944461207389589504","922240341889245186","incantatricks NuclearAnthro","https://twitter.com/Autistic_Ace/status/944461207389589504","https://abs.twimg.com/emoji/v2/72x72/1f63b.png"
"MollyMoggy26","2017-12-22-04:05",0,9,"Yes just today to be on my own whilst mum at work. Then tomorrow morning she promised me a lie in and cuddle in bed . Are your M&D having time off over Christmas ? Love you so much my precious lion . Can’t wait to be in your paws .","","","","944131840721522688","944118542961709056","lena_valentin_ frisky9","https://twitter.com/MollyMoggy26/status/944131840721522688","https://abs.twimg.com/emoji/v2/72x72/1f495.png"
"lyndellmbade","2017-12-21-08:58",0,2,"Then in that case, my cat would probably bully Lusca (who sounds and looks like a sweet dear who I would love to cuddle!) He’s bullied pit bulls before. This cat. He does a full on male lion walk that scares most dogs. Honestly, it’s something to see.","","","","943843200460042240","942578729741639680","BiminiSharkGirl SharkAdvocates","https://twitter.com/lyndellmbade/status/943843200460042240","https://abs.twimg.com/emoji/v2/72x72/1f926-200d-2640-fe0f.png"
"Harley_Putzer","2017-12-19-23:52",0,4,"The last lion of three triplets at the Rosamond Gifford Zoo died today and I am sobbing because I met this lion and I’m PMsing like a bitch. I am so sad and my cat won’t cuddle me god damnit.","","","","943343341277720578","","","https://twitter.com/Harley_Putzer/status/943343341277720578",""
"geertjan98","2017-12-18-09:25",0,2,"You know how when you cuddle cats and they suddenly turn on you and bite you? Yeah, imagine that with a lion.","","","","942762824648085506","865230793731428353","Amazing_Iife PokemonIife","https://twitter.com/geertjan98/status/942762824648085506",""
"classtrology_","2017-12-16-17:52",1,1,"it definitely is! which is why I love leos so much. they act like these scary lions but they’re really just a house cat that wants cuddles and love.","","","","942165592190144514","942164818164887553","sinfulpluto","https://twitter.com/classtrology_/status/942165592190144514",""
"MollyMoggy26","2017-12-16-04:14",0,11,"Sweetheart you look so happy with your daddy. Enjoy your cuddles and enjoy a full day at home with M&D. Miss you a lot my beloved lion . Millionto you my love.","","","","941959649875677185","941936418590527488","lena_valentin_ lell_sutherland","https://twitter.com/MollyMoggy26/status/941959649875677185","https://abs.twimg.com/emoji/v2/72x72/1f981.png"
"clockways","2017-12-10-13:47",0,1,"I drew a messy pastel lion while my drawing arm was trapped under one cat and the other took up half of my seat. Cold cats mean cuddle cats! # Lions # pastel # doodlepic.twitter.com/oPiAjfy6aZ","","","# Lions # pastel # doodlepic","939929519636537344","","","https://twitter.com/clockways/status/939929519636537344","https://pbs.twimg.com/media/DQtMxTSUEAAHMnP.jpg"
"__oTae","2017-12-02-18:01",0,2,"That feeling when a cat walks up to you and rubs against you. It's even better when they have a permanent angry face so it's like seeing a little angry lion ask for cuddles.","","","","937094484663218177","","","https://twitter.com/__oTae/status/937094484663218177",""
"CaliLiliIndies","2017-11-25-12:46",0,0,"Retweeted The Cult Cat ( @ Elverojaguar): # Lion # baby # cuddle time ... pic.twitter.com/iVke9wqTpq http://fb.me/8XL4Uy4cm","","@ Elverojaguar","# Lion # baby # cuddle","934478382246408194","","","https://twitter.com/CaliLiliIndies/status/934478382246408194","https://abs.twimg.com/emoji/v2/72x72/1f388.png"
"1ClickEmojis","2017-11-24-09:46",0,0,"(ﾐΦ ౪ Φﾐ)∫ Cool Cat #9 (↺RT Emoticon) http://www.fastemoji.com/16029 # gamesplayer # business # mortal # readymoney # shrew # root # aloof # darling # buttocks # purify # lion # fortune # sock # stakes # mutt # peachy # cuddle # critter # taperoff # average # posterior # venerate","","","# gamesplayer # business # mortal # readymoney # shrew # root # aloof # darling # buttocks # purify # lion # fortune # sock # stakes # mutt # peachy # cuddle # critter # taperoff # average # posterior # venerate","934070608857616384","","","https://twitter.com/1ClickEmojis/status/934070608857616384","https://abs.twimg.com/emoji/v2/72x72/2764.png"
"rci","2017-11-21-04:51",0,1,"Basically a lion whisperer. Like the guy on youtube. Plenty of stress and worries, but also cuddles with giant cats. And my second job is to be able to go to all concerts and festivals and film my favourite bands.","","","","932909387672375296","932818671914897410","SwiftOnSecurity","https://twitter.com/rci/status/932909387672375296",""
"anuphotography","2017-11-18-11:00",0,0,"Retweeted The Cult Cat ( @ Elverojaguar): # Lion # baby # cuddle time ... pic.twitter.com/hk8kp7rfpm http://fb.me/91R81MVpP","","@ Elverojaguar","# Lion # baby # cuddle","931915102084673536","","","https://twitter.com/anuphotography/status/931915102084673536","https://abs.twimg.com/emoji/v2/72x72/1f388.png"
"kcoolwind","2017-11-18-06:32",0,0,"Retweeted The Cult Cat ( @ Elverojaguar): # Lion # baby # cuddle time ... pic.twitter.com/y5Oc17nfPL http://fb.me/8hZHwAwVV","","@ Elverojaguar","# Lion # baby # cuddle","931847460619616257","","","https://twitter.com/kcoolwind/status/931847460619616257","https://abs.twimg.com/emoji/v2/72x72/1f388.png"
"MollyMoggy26","2017-11-18-05:55",1,5,"Good morning my beautiful lion . How are you? I had a lovely sleep thank you and then cuddles with mum in bed which was lovely. How are you with all the guests? How you not too stressed. Thinking of you.","","","","931838224456183811","931646927418134529","lena_valentin_ AngelaStillwell","https://twitter.com/MollyMoggy26/status/931838224456183811","https://abs.twimg.com/emoji/v2/72x72/1f981.png"
"e_plahov","2017-11-17-08:04",0,0,"Retweeted The Cult Cat ( @ Elverojaguar): # Lion # baby # cuddle time ... pic.twitter.com/Gij3TdxiGH http://fb.me/2KS0965YP","","@ Elverojaguar","# Lion # baby # cuddle","931508281411031041","","","https://twitter.com/e_plahov/status/931508281411031041","https://abs.twimg.com/emoji/v2/72x72/1f388.png"
"diannebdee","2017-11-17-05:26",1,1,"Retweeted The Cult Cat ( @ Elverojaguar): # Lion # baby # cuddle time ... pic.twitter.com/ef6nutdz9S http://fb.me/8Pnxond1F","","@ Elverojaguar","# Lion # baby # cuddle","931468642369208321","","","https://twitter.com/diannebdee/status/931468642369208321","https://abs.twimg.com/emoji/v2/72x72/1f388.png"
"MollyMoggy26","2017-11-15-16:06",0,6,"Oh sweetie I wish you could come and stay here for a few days. I hate thinking that you are going to be stressed about visitors. And if you came here we could cuddle each other and hold paws all day. I miss you so much my gorgeous little beautiful lion","","","","930904740774535168","930826789202677765","lena_valentin_ Ollie_BigPaws","https://twitter.com/MollyMoggy26/status/930904740774535168","https://abs.twimg.com/emoji/v2/72x72/2764.png"
"MariahCollins_4","2017-11-07-02:14",0,4,"I actually wanna hangout with a lion and cuddle him because I'd love to cuddle a big cat, But I also don't wanna die","","","","927796360207851520","","","https://twitter.com/MariahCollins_4/status/927796360207851520",""
"The_Lion_Quin","2017-11-05-13:25",0,1,"Siberian forest cat. He’s more like a dog than a just loves fussed and cuddles","","","","927240407318228993","927237460182093825","michshieldsy","https://twitter.com/The_Lion_Quin/status/927240407318228993","https://abs.twimg.com/emoji/v2/72x72/1f408.png"
"ANATXMICAL","2017-10-26-16:16",0,0,"can’t wait to be done with errands so i can go home and cuddle my cat all day. turn that cone of shame into a lions mane.","","","","923644475846549504","","","https://twitter.com/ANATXMICAL/status/923644475846549504",""
"adamgipsonn","2017-10-21-14:14",0,0,"I really wish big cats weren't capable of killing us because I'd love to cuddle a tiger or a mountain lion... http://fb.me/2S6pvyO13","","","","921801963892813825","","","https://twitter.com/adamgipsonn/status/921801963892813825",""
"marisa_sanford","2017-10-21-11:50",0,0,"I have a little lion cat with his tongue out trying to cuddle","","","","921765724829442049","","","https://twitter.com/marisa_sanford/status/921765724829442049","https://abs.twimg.com/emoji/v2/72x72/1f602.png"
"MollyMoggy26","2017-10-21-06:09",0,4,"Good morning my lovely lion how are you? Have you and dad got lots of cuddles planned today? Are you Broffis still there? Love you","","","","921679762946445313","921476272232026112","lena_valentin_ lell_sutherland","https://twitter.com/MollyMoggy26/status/921679762946445313","https://abs.twimg.com/emoji/v2/72x72/1f981.png"
"Holts05","2017-10-20-13:40",0,6,"you do look so happy little lion . Daddy's cuddles are so special. Have a lovely evening little lion also paw wave to Lena","","","","921430862771752960","921429823561633792","lena_valentin_ lell_sutherland","https://twitter.com/Holts05/status/921430862771752960","https://abs.twimg.com/emoji/v2/72x72/1f981.png"
"pookleblinky","2017-10-17-17:48",88,509,"Cats, they cuddle because they remember what it was to be a lion and need comforting.","","","","920406145927393281","920404066424979458","","https://twitter.com/pookleblinky/status/920406145927393281","https://pbs.twimg.com/profile_images/511563470471720961/rJz8jTRS_normal.png"
"MollyMoggy26","2017-10-10-17:21",0,2,"My precious little lion . How sleepy you look. Wish I was there to cuddle up with you but we will just have to meet in our dreams","","","","917862721462214656","917845732903804929","lena_valentin_ Holts05","https://twitter.com/MollyMoggy26/status/917862721462214656","https://abs.twimg.com/emoji/v2/72x72/1f981.png"
"SmallholderIRL","2017-10-09-05:41",0,4,"The other cat is Leo the Lion or Leopold. He's a big cuddle monster! pic.twitter.com/7kAE16TbNq","","","","917324008500158464","","","https://twitter.com/SmallholderIRL/status/917324008500158464","https://pbs.twimg.com/media/DLr65xgWkAAvTSc.jpg"
"MollyBotts_","2017-10-06-09:08",1,2,"I wish big cats were domesticated, there’s nothing I want more than to cuddle with a lion.","","","","916289034850271232","","","https://twitter.com/MollyBotts_/status/916289034850271232",""
"Blargmarffins","2017-10-05-15:52",0,2,"I want to cuddle a big cat like a lion or tiger but I know that's not a good idea.","","","","916028451068538882","","","https://twitter.com/Blargmarffins/status/916028451068538882",""
"HallWaysKirsten","2017-09-24-08:08",2,19,"Rainbows, unicorns, swirling sea lions, cats in a cuddle, a caped caribou, a bike-riding gator...The past 12 days on Catbird's instagram. pic.twitter.com/Pt3VCzf03p","","","","911925301457965057","","","https://twitter.com/HallWaysKirsten/status/911925301457965057","https://abs.twimg.com/emoji/v2/72x72/2728.png"
"Dandy_lion_13","2017-09-18-10:10",1,2,"I just want to go home, cuddle with my cat, and read my new books # worksucks","","","# worksucks","909781798908960768","","","https://twitter.com/Dandy_lion_13/status/909781798908960768","https://abs.twimg.com/emoji/v2/72x72/1f629.png"
"knuddelzde","2017-09-17-18:33",0,3,"Wandtattoo 'Roar like a lion, cuddle like a cat.'","","","","909545919586209793","909516995376435200","karlklatsch","https://twitter.com/knuddelzde/status/909545919586209793",""
"iceygirl37","2017-09-12-01:45",0,3,"Anybody else just wanna cuddle up with a really big cat? Like a lion or a tiger or maybe a lynx? I just want to pet a big cat","","","","907480193958334469","","","https://twitter.com/iceygirl37/status/907480193958334469","https://pbs.twimg.com/profile_images/1009903432012984320/kEeg33pM_normal.jpg"
"MJMorten","2017-08-31-02:41",0,3,"My daughters & I ask this question all the time. They are mini tigers & lions who bring joy, cuddles, & love! We cats pic.twitter.com/PmJVfrK8AG","","","","903145806101962752","903139764924063744","NTrexit","https://twitter.com/MJMorten/status/903145806101962752","https://abs.twimg.com/emoji/v2/72x72/1f49c.png"
"MollyMoggy26","2017-08-30-16:29",0,17,"Oh my beloved little lion . Don't you look so so happy with your daddy . Have lovely cuddles with him. I my","","","","902991599185121281","902987742958809092","lena_valentin_ lell_sutherland","https://twitter.com/MollyMoggy26/status/902991599185121281","https://abs.twimg.com/emoji/v2/72x72/1f981.png"
"NickSugarbaker","2017-08-29-04:17",1,5,"How do I want to die? Good question. Disemboweled by a big cat (lion, tiger etc) that I've tried to kiss & cuddle.","","","","902445151355731968","","","https://twitter.com/NickSugarbaker/status/902445151355731968",""
"_krnvns","2017-08-27-18:21",0,1,"Maine Coon - The lion of domesticated cats. Floof 10/10. Big paws and toe beans. Much cuddles. Very majestic pic.twitter.com/wKADtDnOce","","","","901932616357748736","901929085882044420","_krnvns","https://twitter.com/_krnvns/status/901932616357748736",""
"geezer76","2017-08-22-13:17",0,0,"Cute! But they cuddle so hard they could easily snap her neck a cat is a cat is a cat is a lion still very cute.","","","","900044390168764416","900017232239046656","tancredipalmeri","https://twitter.com/geezer76/status/900044390168764416","https://abs.twimg.com/emoji/v2/72x72/1f62c.png"
"cheeseus_crust_","2017-08-16-14:10",1,4,"I want to cuddle the biggest cat ever but then I realized that that would probably be a lion and that doesn't seem like a wise decision.","","","","897883283161272320","","","https://twitter.com/cheeseus_crust_/status/897883283161272320",""
"TheAmyzonian","2017-08-15-15:40",0,1,"I could really use a cuddle from a large cat, like a mountain lion or a snow leopard. They seem like good cuddlers. Also predators.","","","","897543572752412672","","","https://twitter.com/TheAmyzonian/status/897543572752412672",""
"nonedere","2017-08-11-13:30",0,1,"My stepmother is taking my to the Tiny Lions Lounge and Catfe. No joke. Gonna go cuddle some cats!","","","","896061369446916096","","","https://twitter.com/nonedere/status/896061369446916096",""
