username,date,retweets,favorites,text,geo,mentions,hashtags,tweetid,conversationid,replyto,permalink,imagelink
"BrustersRaleigh","2018-08-01-12:47",0,0,"# BrustersFavs: Black Cherry,Black Raspberry,Cake Batter,Caramel Cheesecake,Chocolate Mudslide,Chocolate Raspberry Truffle,Coffee Oreo","","","# BrustersFavs","1024698224706244608","","","https://twitter.com/BrustersRaleigh/status/1024698224706244608",""
"pennys_icecream","2018-07-28-09:34",0,1,"If you could fill these cones with any flavor, what flavor would you fill them with? -- We pick... -Black Raspberry Oreo - Nutella - Olivia's Coffee - Vanilla - Salted caramel! https://ift.tt/2NSfxiQ pic.twitter.com/8AiCqtrGVt","","","","1023200106370289664","","","https://twitter.com/pennys_icecream/status/1023200106370289664","https://pbs.twimg.com/media/DjMjEwmWsAAhU3G.jpg"
"sarahhAguilar","2018-07-23-19:14",0,1,"Gunther’s flavor of the month is black raspberry Oreo what a dream","","","","1021534053453901824","","","https://twitter.com/sarahhAguilar/status/1021534053453901824","https://abs.twimg.com/emoji/v2/72x72/1f62d.png"
"BrustersMOT","2018-07-23-17:18",0,0,"Middletown : Monday's freshly made flavors Almond Divinity Black Raspberry Cherry Vanilla Chocolate Peanut Butter Buckeye Peach Peanut Butter Puddles Peppermint Oreo Sea Salt Caramel with Toffee","","","","1021504857608478722","","","https://twitter.com/BrustersMOT/status/1021504857608478722",""
"brustersetters","2018-07-23-12:04",0,0,"# BrustersFavs: Black Raspberry Chunk,Blue Pop Ice,Chocolate,Chocolate Peanut Butter Buckeye,Coffee,Coffee Oreo,Cookie Craze","","","# BrustersFavs","1021425803769335808","","","https://twitter.com/brustersetters/status/1021425803769335808",""
"Gilligans_IC","2018-07-23-08:56",1,0,"@ KROCKCNY Cookie Jam, a new flavor requested by our friends at KROCK, available at @ NYGilligans! Black raspberry ice cream with Oreo chunks and strawberry jam, this tangy treat takes our classic Black Raspberry up a notch. pic.twitter.com/WYWbOlcrIK","","@ KROCKCNY @ NYGilligans","","1021378500211675137","","","https://twitter.com/Gilligans_IC/status/1021378500211675137","https://pbs.twimg.com/media/DiyqP5bX4AA1-jM.jpg"
"NYGilligans","2018-07-23-08:51",5,17,"@ KROCKCNY Cookie Jam, a new flavor requested by our friend @ krockjosh now available!! Black raspberry ice cream with Oreo chunks and strawberry jam, this tangy treat takes our classic Black Raspberry up a notch. pic.twitter.com/4lmDSoiHlc","","@ KROCKCNY @ krockjosh","","1021377315064942593","","","https://twitter.com/NYGilligans/status/1021377315064942593","https://pbs.twimg.com/media/DiypNLzXcAIJzc0.jpg"
"brustersetters","2018-07-18-08:32",0,0,"# BrustersFavs: Black Raspberry,Chocolate,Chocolate Oreo,Chocolate Pecan,Cookie Craze,Cotton Candy Explosion,Double Chocolate Chunk","","","# BrustersFavs","1019560496826060805","","","https://twitter.com/brustersetters/status/1019560496826060805",""
"krockjosh","2018-07-17-11:18",2,17,"'Dingleberry Cookie Jam' is now a reality! My ice cream creation of black raspberry ice cream, Oreo cookie chunks & strawberry jam will be available at @ Gilligans_IC next week! pic.twitter.com/T0cj4xE6Jg","","@ Gilligans_IC","","1019239956328435714","","","https://twitter.com/krockjosh/status/1019239956328435714","https://abs.twimg.com/emoji/v2/72x72/1f366.png"
"me_hivan","2018-07-16-01:37",0,1,"So if you didn’t know, Black Raspberry Oreo is the flavor of the month at Gunther’s. Yea... go get that fast my friends","","","","1018731332690587648","","","https://twitter.com/me_hivan/status/1018731332690587648",""
"PuckMasterFlex","2018-07-13-15:15",0,0,"agree with all of this, but you have to try black raspberry with oreos","","","","1017849958274347008","1017609831681847296","keithlaw","https://twitter.com/PuckMasterFlex/status/1017849958274347008",""
"Big_Boyums","2018-07-13-08:59",0,2,"A place near my home ha Phantomberry - Black Raspberry ice cream with oreo and fudge swirls. It is objectively the best ice cream flavor.","","","","1017755356045422593","1017609831681847296","keithlaw pghsportsdad","https://twitter.com/Big_Boyums/status/1017755356045422593",""
"keithlaw","2018-07-12-23:24",0,17,"you mean black raspberry WITH OREOS","","","","1017610670630735873","1017609831681847296","pghsportsdad","https://twitter.com/keithlaw/status/1017610670630735873",""
"erinebal29","2018-07-10-00:14",0,0,"Black Raspberry and Oreo cookie frappes. Sometimes it's too hot to cook!","","","","1016536045423349766","1016532616621842432","kelis","https://twitter.com/erinebal29/status/1016536045423349766","https://abs.twimg.com/emoji/v2/72x72/1f495.png"
"JamesKaniarz","2018-07-08-20:16",0,0,"@ Oreo please please please make some variation of a black raspberry Oreo.. please... I’d buy all of them.","","@ Oreo","","1016113854718402560","","","https://twitter.com/JamesKaniarz/status/1016113854718402560",""
"sunset_sweets","2018-07-08-18:53",0,0,"Black Raspberry Oreo this flavor is top 5 all time! Try it for yourself # icecream # gunthers # oreo https://ift.tt/2m0UOxa pic.twitter.com/Ah6DqVG5Po","","","# icecream # gunthers # oreo","1016093000320024576","","","https://twitter.com/sunset_sweets/status/1016093000320024576","https://abs.twimg.com/emoji/v2/72x72/1f366.png"
"BRENNANBIGCHILL","2018-07-08-12:57",0,0,"New Arrivals: Jack O ' ( pumpkin with Oreo), Cotton Candy, Birthday Surprise, Black Raspberry, Butter Pecan, O' Fudge, Bear Paws, Mom's Cookie Dough, Peanut Butter, Chocolate Marshmallow and Cookies & Cream!","","","","1016003395373682692","","","https://twitter.com/BRENNANBIGCHILL/status/1016003395373682692",""
"brustersetters","2018-07-07-10:36",0,0,"# BrustersFavs: Black Raspberry,Black Raspberry Chunk,Butter Brickle,Chocolate,Cookie Craze,Espresso Yourself,Oreo,Strawberry,Vanilla","","","# BrustersFavs","1015605528133849088","","","https://twitter.com/brustersetters/status/1015605528133849088",""
"Brusters_HBurg","2018-07-06-17:30",0,0,"# BrustersFavs: Black Raspberry,Chocolate Raspberry Truffle,Coffee Oreo,Cookie Craze,Espresso Yourself,Mint Chocolate Chip,Oreo,Pistachio","","","# BrustersFavs","1015347288565219331","","","https://twitter.com/Brusters_HBurg/status/1015347288565219331",""
"brustersetters","2018-07-05-12:11",0,0,"# BrustersFavs: Black Raspberry,Cherry Ice,Chocolate,Chocolate Peanut Butter Buckeye,Coffee,Coffee Oreo,Cookie Craze,Espresso Yourself","","","# BrustersFavs","1014904621045821441","","","https://twitter.com/brustersetters/status/1014904621045821441",""
"K_low33","2018-07-05-01:07",0,0,"Black raspberry ice cream with Oreos","","","","1014737508754747394","","","https://twitter.com/K_low33/status/1014737508754747394","https://abs.twimg.com/emoji/v2/72x72/1f924.png"
"rawksongs","2018-07-03-23:22",0,0,"|| 11 Desserts in 10 Days || Day 6, Dessert 6, Bruster’s Ice Cream - Black Raspberry & Triple Chocolate Oreo: 8/10 Made a quick stop at Brusters on the way to… https://www.instagram.com/p/Bky2NKzgeq_4z9RDgn2RlYF95MIWSu2t-khA7c0/?utm_source=ig_twitter_share&igshid=shxor97ssjmc …","","","","1014348624698806273","","","https://twitter.com/rawksongs/status/1014348624698806273",""
"KaitLouiseWalsh","2018-07-01-21:03",0,12,"QUESTION... @ JulianneLimaTV clearly got the 'cool' assignment today. She went to my FAVORITE ice cream place: Somerset Creamery. SO the loaded question tonight is: What's your fav flavor? Mine is black raspberry chip froyo! If it must be actual ice cream, coffee oreo.","","@ JulianneLimaTV","","1013588831159939072","","","https://twitter.com/KaitLouiseWalsh/status/1013588831159939072",""
"delady49","2018-07-01-16:20",0,0,"For the brave folks willing to come out in this nutty heat, here’s your ice cream availability Vanilla Bean Strawberry Chocolate Toasted Coconut Black Raspberry Oreo Cookie Dough Midnight Espresso Choc PB... https://www.facebook.com/124527530897457/posts/2175880152428841/ …","","","","1013517597109817344","","","https://twitter.com/delady49/status/1013517597109817344",""
"StefanieDoveRDN","2018-07-01-14:48",0,1,"Did you know July is # nationalicecreammonth? The great ice cream debate is always real. What is your favorite flavor? Mine foolproof is always vanilla, but LOVE black raspberry from @ KlinesDairyBar and my mom makes killer homemade @ Oreo ice cream! # undeniablydairy # rdchatpic.twitter.com/oF9ZdPbR0A","","@ KlinesDairyBar @ Oreo","# nationalicecreammonth # undeniablydairy # rdchatpic","1013494496221417474","","","https://twitter.com/StefanieDoveRDN/status/1013494496221417474","https://pbs.twimg.com/media/DhCn3iOW0AE633X.jpg"
"Brusters_HBurg","2018-06-30-19:06",0,0,"# BrustersFavs: Banana Chocolate Chip,Black Raspberry,Butter Pecan,Chocolate,Chocolate Chip Cookie Dough,Chocolate Oreo","","","# BrustersFavs","1013197200531259393","","","https://twitter.com/Brusters_HBurg/status/1013197200531259393",""
"MerwinAlexandra","2018-06-29-23:32",0,0,"Just had the most amazing ice cream to start my weekend off right black raspberry w/ oreo!! # summertime # weekendtime @Martel's Ice Cream https://www.instagram.com/p/BkokOHZj3H4fso5TekoImM7GutVyEmOnPR1rNI0/?utm_source=ig_twitter_share&igshid=1aons7jcg2ynu …","","","# summertime # weekendtime","1012901697897758720","","","https://twitter.com/MerwinAlexandra/status/1012901697897758720",""
"brustersetters","2018-06-26-13:08",0,0,"# BrustersFavs: Black Raspberry,Black Raspberry Chunk,Caramel Cashew,Chocolate,Chocolate Cake Batter,Chocolate Oreo","","","# BrustersFavs","1011657425471049729","","","https://twitter.com/brustersetters/status/1011657425471049729",""
"Brusters_HBurg","2018-06-25-16:27",0,0,"# BrustersFavs: Almond Chocolate Coconut,Banana,Black Raspberry,Butter Pecan Yogurt,Chocolate Oreo,Strawberry,Vanilla","","","# BrustersFavs","1011345116085223424","","","https://twitter.com/Brusters_HBurg/status/1011345116085223424",""
"Brusters_HBurg","2018-06-22-15:53",0,0,"# BrustersFavs: Black Raspberry,Chocolate,Oreo,Peach,Peach Melba,Strawberry,Triple Chocolate Oreo,Vanilla","","","# BrustersFavs","1010249384330752000","","","https://twitter.com/Brusters_HBurg/status/1010249384330752000",""
"sarahhx47","2018-06-18-22:00",0,1,"Black raspberry Oreo ice cream is by far the best ice cream flavor pls tell me otherwise","","","","1008892194533662725","","","https://twitter.com/sarahhx47/status/1008892194533662725",""
"weberscustard","2018-06-17-16:35",1,1,"We’ve got FRESH vanilla, frosted malt, lemon, strawberry, black raspberry and peanut butter oreo and FRESH black walnut modern ice cream! It’s definitely a DELICIOUS time to stop by!!","","","","1008448025218486277","","","https://twitter.com/weberscustard/status/1008448025218486277","https://abs.twimg.com/emoji/v2/72x72/1f366.png"
"ChuckleBerries_","2018-06-11-12:46",0,0,"Our current flavors include TAHITIAN VANILLA, ORANGE SORBET, BLACK RASPBERRY, RED RASPBERRY SHERBET, VANILLA AND CHOCOLATE ICE CREAM, OREO, GREEN MINT, PEANUT BUTTER, TRIPLE CHOCOLATE, CHERRY AMARETTO AND SEA SALT CARAMEL PRETZEL.","","","","1006216157748178945","","","https://twitter.com/ChuckleBerries_/status/1006216157748178945",""
"Brusters_HBurg","2018-06-10-13:48",0,0,"# BrustersFavs: Black Raspberry,Chocolate,Chocolate Cake Batter,Chocolate Oreo,Coffee Chocolate Chip,Graham Central Station,Oreo","","","# BrustersFavs","1005869310760374272","","","https://twitter.com/Brusters_HBurg/status/1005869310760374272",""
"Daculabrusters","2018-06-09-11:00",0,0,"# BrustersFavs: Birthday Cake,Black Raspberry,Blue Pop Ice,Cake Batter,Chocolate,Chocolate Chip Cookie Dough,Chocolate Oreo Yogurt","","","# BrustersFavs","1005464598567415808","","","https://twitter.com/Daculabrusters/status/1005464598567415808",""
"mlbarris25","2018-06-06-06:53",0,1,"Recommended 2 me by my sister from another mother ... buy a half gallon of black raspberry icecream, scoop some in2 ur favorite icecream bowl, take some thin oreos, crumble them on top of the icecream, mix & enjoy ..... 2 say yummy does not give this combo justice pic.twitter.com/Y8MsrhxsSV","","","","1004315411217870848","1004172221475180545","jessicamreyes","https://twitter.com/mlbarris25/status/1004315411217870848",""
"Brusters_HBurg","2018-06-05-14:08",0,0,"# BrustersFavs: Black Raspberry Sorbet,Cake Batter,Chocolate,Chocolate Chip Cookie Dough,Chocolate Oreo,Cotton Candy Explosion","","","# BrustersFavs","1004062344169828354","","","https://twitter.com/Brusters_HBurg/status/1004062344169828354",""
"Brusters_HBurg","2018-06-04-16:38",0,0,"# BrustersFavs: Almond Chocolate Coconut,Black Raspberry,Chocolate,Chocolate with Hershey's Special Dark,Oreo,Strawberry,Vanilla","","","# BrustersFavs","1003737700611035137","","","https://twitter.com/Brusters_HBurg/status/1003737700611035137",""
"ScootersCustard","2018-06-02-15:09",0,0,"It may feel like Fall, but we are still making STRAWBERRY OREO Frozen Custard today and BLACK RASPBERRY ITALIAN ICE. Reminder....just 6 month until we close for the season, so get your custard while you can! :-) pic.twitter.com/UWbVQKfRwK","","","","1002990725800349696","","","https://twitter.com/ScootersCustard/status/1002990725800349696","https://pbs.twimg.com/media/DetWtt_VAAArtaW.jpg"
"fishboy1986","2018-06-01-23:07",0,0,"Wegmans berry crunch or Oreo o’s. Ice cream mix heavenly hash with black raspberry","","","","1002748589016264705","1002747203839057920","ashleyb121384 SWistner","https://twitter.com/fishboy1986/status/1002748589016264705",""
"Brusters_HBurg","2018-05-30-14:55",0,0,"# BrustersFavs: Cake Batter,Chocolate,Cotton Candy Explosion,Mint Chocolate Chip,Oreo, Vanilla, Black Raspberry Yogurt,Peach Sorbet","","","# BrustersFavs","1001899906783727617","","","https://twitter.com/Brusters_HBurg/status/1001899906783727617",""
"Ritas_of_Sparta","2018-05-29-12:48",0,0,"Here are Today's Ice Flavors: Juicy Pear, Key Lime, Green Apple, Chocolate, Pina Colada, Raspberry, Raspberry Lemonade, Mint Oreo, Cookies n' Cream, Sour Patch Kids Red, Wild Black Cherry, and Sugar-Free Cherry. Our Flavored Custard is Cake Batter and Black Raspberry.","","","","1001505535127105537","","","https://twitter.com/Ritas_of_Sparta/status/1001505535127105537",""
"Ritas_of_Sparta","2018-05-28-13:46",0,0,"Here are the flavors for today: Sugar Free Cherry, Chocolate, Juicy Pear, Key Lime, Wild Black Cherry, Sour Patch Kids Red, Tropical Daiquiri, Mint Oreo, Cookies n Cream, Raspberry Lemonade, Raspberry and Mango. Additional custard flavors are Black Raspberry and Cake Batter.","","","","1001157738871906304","","","https://twitter.com/Ritas_of_Sparta/status/1001157738871906304",""
"Ritas_of_Sparta","2018-05-27-14:11",0,0,"Here are today's flavors: Sugar Free Cherry, Chocolate, Juicy Pear, Key Lime, Wild Black Cherry, Sour Patch Kids Red, Tropical Daiquiri, Mint Oreo, S'mores, Raspberry Lemonade, Raspberry, and Mango. The custard flavors for today are Cake Batter and Black Raspberry.","","","","1000801780014428160","","","https://twitter.com/Ritas_of_Sparta/status/1000801780014428160",""
"BrustersMOT","2018-05-27-11:24",0,0,"# BrustersFavs: Birthday Cake,Black Raspberry Chunk,Blueberry Cobbler,Chocolate Oreo,Coffee Toffee,Peach,Peanut Butter Crunch","","","# BrustersFavs","1000759634666442752","","","https://twitter.com/BrustersMOT/status/1000759634666442752",""
"BrustersMOT","2018-05-27-11:24",0,0,"Middletown : Sunday's freshly made flavors Birthday Cake Black Raspberry Chunk Blueberry Cobbler Chocolate Oreo Coffee Toffee Peach Peanut Butter Crunch Sea Salt Caramel","","","","1000759605574676481","","","https://twitter.com/BrustersMOT/status/1000759605574676481",""
"IceCreamGracies","2018-05-23-09:40",1,2,"CRITical Mass, our black raspberry ice cream with chocolate chips, Oreos, chocolate covered chocolate donuts, chocolate covered graham crackers, and a chocolate Oreo brittle is AVAILABLE TODAY! Sorry for the confusion on Sunday. This is a flavor created… https://ift.tt/2IXsGZb pic.twitter.com/O4UOiU88u4","","","","999283992179298306","","","https://twitter.com/IceCreamGracies/status/999283992179298306","https://pbs.twimg.com/media/Dd4rfsmVwAM0pv6.jpg"
"BrustersMOT","2018-05-22-14:16",0,0,"# BrustersFavs: Banana Cream Pie,Black Raspberry Chunk,Caramel Explosion with Twix,Chocolate Peanut Butter Chip,Coffee Oreo,Nutty Coconut","","","# BrustersFavs","998990935319965697","","","https://twitter.com/BrustersMOT/status/998990935319965697",""
"BrustersMOT","2018-05-22-14:15",0,0,"Middletown : Tuesday's freshly made flavors Banana Cream Pie Black Raspberry Chunk Caramel Explosion with Twix Chocolate Peanut Butter Chip Coffee Oreo Nutty Coconut Peanut Butter Puddles Sea Salt Caramel with Toffee White Almond Fudge","","","","998990865044525057","","","https://twitter.com/BrustersMOT/status/998990865044525057",""
"IceCreamGracies","2018-05-20-14:40",0,6,"Our friend @ crit had a birthday ice cream making class this morning and we made CRITical Mass, which is black raspberry ice cream with chocolate chips, Oreos, chocolate covered graham crackers, chocolate doughnuts, and a chocolate Oreo “brittle” pictured… https://ift.tt/2k8QDOS pic.twitter.com/NrViA6uSTL","","@ crit","","998272297143296000","","","https://twitter.com/IceCreamGracies/status/998272297143296000","https://pbs.twimg.com/media/DdqTXQxWAAA6aCs.jpg"
"RittersBCreek","2018-05-18-10:37",0,2,"Happy Friday! The flavors for today are Brownie Fudge Ripple. Black Raspberry, and Peanut Butter Oreo!","","","","997486366484238339","","","https://twitter.com/RittersBCreek/status/997486366484238339",""
"BrustersMOT","2018-05-11-19:11",0,0,"# BrustersFavs: Banana Peanut Butter Ripple,Birthday Cake,Black Raspberry,Blue Pop Ice,Cherry Cobbler,Cherry Vanilla,Chocolate Oreo","","","# BrustersFavs","995078912651743232","","","https://twitter.com/BrustersMOT/status/995078912651743232",""
"BrustersMOT","2018-05-11-19:11",0,0,"Middletown : Friday's freshly made flavors Banana Peanut Butter Ripple Birthday Cake Black Raspberry Blue Pop Ice Cherry Cobbler Cherry Vanilla Chocolate Oreo Chocolate Raspberry Truffle Coffee Chocolate... https://www.facebook.com/middletownbrusters/posts/10156321936529481 …","","","","995078879395053570","","","https://twitter.com/BrustersMOT/status/995078879395053570",""
"BrustersMOT","2018-05-09-19:03",0,0,"# BrustersFavs: Black Raspberry,Chocolate Oreo,Coffee Chocolate Chip,Peanut Butter Parfait","","","# BrustersFavs","994352301870649346","","","https://twitter.com/BrustersMOT/status/994352301870649346",""
"BrustersMOT","2018-05-09-19:03",0,0,"Middletown : Wednesday's freshly made flavors Black Raspberry Chocolate Oreo Coffee Chocolate Chip Peanut Butter Parfait","","","","994352276583182336","","","https://twitter.com/BrustersMOT/status/994352276583182336",""
"pennys_icecream","2018-05-07-17:22",0,1,"The flavor of the week is Black-raspberry Oreo! — It’s one of our most popular flavors, combining America’s favorite cookie, the Oreo and black raspberry it literally can’t be beat! https://ift.tt/2wi0H0U pic.twitter.com/t4vKN7pGBh","","","","993601951437918210","","","https://twitter.com/pennys_icecream/status/993601951437918210","https://abs.twimg.com/emoji/v2/72x72/1f366.png"
"Brusters_HBurg","2018-05-04-19:19",0,0,"# BrustersFavs: Black Raspberry Chunk,Blue Pop Ice,Butter Brickle,Cake Batter,Chocolate,Chocolate Chip Cookie Dough,Chocolate Oreo,Coffee","","","# BrustersFavs","992544251283165184","","","https://twitter.com/Brusters_HBurg/status/992544251283165184",""
"UnlikelyWords","2018-05-03-22:38",0,0,"My employee was pushing black raspberry Oreo but is was pushing the far superior black raspberry chip.","","","","992231905914433536","992111726312206336","nicolefonsh","https://twitter.com/UnlikelyWords/status/992231905914433536",""
"brustersnh","2018-05-03-12:20",0,0,"Flavors Now Available: Black Raspberry Cheesecake Cake Batter Coffee Oreo","","","","992076319159652352","","","https://twitter.com/brustersnh/status/992076319159652352",""
"beautifullyvgn","2018-04-22-09:02",0,1,"We had a quick day trip back to NH yesterday, and we had to stop at @ lagosicecream and try their vegan flavors of the week! I got Black Raspberry Oreo, and it was SO good! pic.twitter.com/DYfFzMHBVR","","@ lagosicecream","","988040305147555846","","","https://twitter.com/beautifullyvgn/status/988040305147555846","https://abs.twimg.com/emoji/v2/72x72/1f60b.png"
"delady49","2018-04-21-18:15",0,0,"Happy Spring Ice Cream Fans, The list of handmade hard flavors made especially for you are...( insert drum roll )... Vanilla Bean Chocolate Strawberry Toasted Coconut Mint Chip Black Raspberry Oreo Coffee Caramel Pecan Chocolate Dirtball Hope you love them","","","","987817074838900736","","","https://twitter.com/delady49/status/987817074838900736",""
"ACreamery","2018-04-05-13:01",3,14,"Purple Cow: black raspberry with Oreos pic.twitter.com/tJVZ1I7ehk","","","","981940012475396096","","","https://twitter.com/ACreamery/status/981940012475396096","https://abs.twimg.com/emoji/v2/72x72/1f42e.png"
"jessfoleylmhc","2018-04-01-19:50",0,0,"This is ridiculous; happened to me last year and no one seemed to know what I was talking about when I approached the town with my tire bill. but also? I really enjoyed my black raspberry Oreo today; thank you!!","","","","980593182735060999","980555701629145088","PFIceCream CityofWaltham","https://twitter.com/jessfoleylmhc/status/980593182735060999","https://abs.twimg.com/emoji/v2/72x72/1f644.png"
"RotaSpringFarm","2018-04-01-17:16",0,0,"We are very happy to announce that our Flavor for the month of April is... BLACK-RASPBERRY OREO! Wow! It is Delicious! Make sure to say 'Hello' to the cows!","","","","980554569334902789","","","https://twitter.com/RotaSpringFarm/status/980554569334902789",""
"ScootersCustard","2018-03-25-21:02",0,0,"Flavors this week: After Dinner Mint, Coconut, Banana Oreo, Royal Cake Batter, Black Raspberry Truffle. Pick up Pints, Quarts, Pies for Easter. (Closed Easter Sunday) pic.twitter.com/gRbkvK7zT7","","","","978074802589184000","","","https://twitter.com/ScootersCustard/status/978074802589184000","https://pbs.twimg.com/media/DZLRsgbWkAEbRDC.jpg"
"BrustersRaleigh","2018-03-23-15:39",0,0,"# BrustersFavs: Black Raspberry,Cotton Candy Explosion,Home Run,Oreo Cheesecake,White Turtle","","","# BrustersFavs","977268701866143745","","","https://twitter.com/BrustersRaleigh/status/977268701866143745",""
"3amshadows","2018-03-23-14:08",0,0,"jules and mint oreo or black raspberry https://twitter.com/fanhausers/status/977241829753077760 …","","","","977245688378613760","","","https://twitter.com/3amshadows/status/977245688378613760",""
"BrustersRaleigh","2018-03-01-21:53",0,0,"# BrustersFavs: Birthday Cake,Black Raspberry,Butter Pecan,Chocolate,Chocolate Chip,Chocolate Chip Cookie Dough,Chocolate Oreo,Coffee","","","# BrustersFavs","969405419826368513","","","https://twitter.com/BrustersRaleigh/status/969405419826368513",""
"BrustersRaleigh","2018-02-23-18:34",0,0,"# BrustersFavs: Birthday Cake,Black Raspberry Cheesecake,Blue Pop Ice,Chocolate,Chocolate Chip Cookie Dough,Coffee Oreo","","","# BrustersFavs","967180810439876609","","","https://twitter.com/BrustersRaleigh/status/967180810439876609",""
"pattmommy","2018-02-07-03:20",0,0,"Favorite ice cream? Black Raspberry Chip or Black Raspberry Oreo...tough choice!","","","","961152801811456000","960558816751505415","bflay graeters","https://twitter.com/pattmommy/status/961152801811456000",""
"RittersBCreek","2018-01-29-10:41",0,0,"Hello Ritter's friends! Today's flavors are Caramel Snicker Swirl, Mint Oreo, and Black Raspberry Chip. Start your week off right and treat yo self!","","","","958002244938534912","","","https://twitter.com/RittersBCreek/status/958002244938534912",""
"bt2012abt2012","2018-01-20-13:49",0,0,"I got Black Raspberry Oreo Ice Cream at Penny's. @Park City Center https://www.instagram.com/p/BeLpLH4hsBT/","","","","954788016404533248","","","https://twitter.com/bt2012abt2012/status/954788016404533248",""
"LouisvilleCream","2018-01-20-11:12",1,15,"Black Raspberry Cookies & Cream: sweet, tart, black raspberry ice cream w/ bits of bittersweet chocolate & a shit ton of Oreos. Come get it at the shop 12-10pm # keepitcreamypic.twitter.com/ZEgsPye4PR","","","# keepitcreamypic","954748397814247425","","","https://twitter.com/LouisvilleCream/status/954748397814247425","https://pbs.twimg.com/media/DT_ymbmX0AAK1OD.jpg"
"DCLead","2017-12-31-13:04",0,0,"Great. Now I'm craving Black Raspberry Oreo ice cream.","","","","947528832168345600","947153506582126593","JoeTrippi","https://twitter.com/DCLead/status/947528832168345600",""
"leadinglatte","2017-12-30-11:57",1,11,"P.S. Here’s a picture of said Black Raspberry Oreo icecream in a waffle cone with sprinkles! Go eat at @ JustinesSM, everyone! (4/3)pic.twitter.com/HBkiIVvoxe","","@ JustinesSM","","947149756404518913","947147876467175424","","https://twitter.com/leadinglatte/status/947149756404518913","https://pbs.twimg.com/media/DSTzrakWsAEmX-3.jpg"
"ryanprociuk","2017-12-30-11:54",0,1,"Making notes. To stay on Rossi's good side, send Justine's, preferably Black Raspberry Oreo, and wine.","","","","947148865353924608","947147876467175424","leadinglatte","https://twitter.com/ryanprociuk/status/947148865353924608",""
"KatherineBScott","2017-12-30-11:53",0,2,"Did you say black raspberry Oreo","","","","947148657320710145","947147876467175424","leadinglatte","https://twitter.com/KatherineBScott/status/947148657320710145",""
"leadinglatte","2017-12-30-11:52",0,5,"I begin gushing about my love of Justine’s and their Black Raspberry Oreo icecream and now we’re basically BFFs (ok, not really, but she was so lovely and this is my story). The End.","","","","947148412616617985","947147876467175424","","https://twitter.com/leadinglatte/status/947148412616617985","https://pbs.twimg.com/profile_images/665299523892195328/F-ygMUHp_normal.jpg"
