username,date,retweets,favorites,text,geo,mentions,hashtags,tweetid,conversationid,replyto,permalink,imagelink
"COLETFAZ","2018-04-30-01:17",0,0,"Trump was right about Obamas faked photoshopped Birth Certificate. It was proven to be a forgery by two or three different unbiassed prfessional labs and hand wriging experts. Which makes Obana an illegitimate President as well!!! Perhaps you may want to start watching Fox news?","","","","990822515659431936","990200773232529413","davematt88 realDonaldTrump","https://twitter.com/COLETFAZ/status/990822515659431936",""
"kremlinsfiddle","2018-04-27-19:33",0,1,"This has to be photoshopped. No way Donald Trump uses only one hand to hold a glass. pic.twitter.com/0yBFOcUlhv","","","","990011066892484608","990006406358208512","MollyJongFast pacelattin","https://twitter.com/kremlinsfiddle/status/990011066892484608","https://pbs.twimg.com/media/Db05zbiU0AA8Vnx.jpg"
"michaelk520","2018-04-25-18:54",0,0,"That's all I've used. You, on the other hand, go with photoshopped stuff. Nice try though. My condolences to your children. Hoping they don't turn out a sheeple as well.","","","","989276596761542656","989252420294336512","LovingMommy24 nzhippygirl","https://twitter.com/michaelk520/status/989276596761542656",""
"DawnMurphy_","2018-04-25-11:05",0,1,"The hand holding pic wasn't photoshopped? OMG. I thought it was supposed to be a joke. I need a tv! I'm missing all the dandruff brushing and him making more of a fool of himself.","","","","989158469772218369","989134248010502146","Sweetling realDonaldTrump","https://twitter.com/DawnMurphy_/status/989158469772218369",""
"TheLastBaron","2018-04-25-03:21",0,0,"Portraits of Trump kissing Putin and Hitler (Photoshopped as needed), a Bitcoin, the film clip of Mrlania batting away Trump’s hand, accounts of the Chatlottesville parade and events and Fatso’s reactions... it would have to be a “yuge” time capsule... https://www.theatlantic.com/magazine/archive/2018/05/what-item-would-you-put-in-a-time-capsule-to-help-the-next-century-understand-our-current-moment/556904/ …","","","","989041784222298112","","","https://twitter.com/TheLastBaron/status/989041784222298112",""
"hazeleyesana","2018-04-18-17:56",0,0,"May I add 'badly photoshopped'? The hand is missing.","","","","986725228381392896","986711015630036992","EvanLHarris2 juliebr46437069","https://twitter.com/hazeleyesana/status/986725228381392896",""
"EileenKnapik","2018-04-14-09:17",0,0,"Aww that is sweet. Photoshopped movie stuff showing the FLOTUS and FMOTUS looking close. No real pics like that exist. She didn't even want him holding her hand BEFORE the stormy thing came out. Keep Photoshopping your dream.","","","","985144913007345665","985133017256660995","NewRightNetwork realDonaldTrump","https://twitter.com/EileenKnapik/status/985144913007345665",""
"brixen","2018-04-11-20:07",0,1,"Was this photoshopped? Paul Ryan’s thumb looks 3 times the size of @ realDonaldTrump’s smallish one. Imagine how much bigger Ryan’s whole hand is. https://twitter.com/realdonaldtrump/status/984204373105442816 …","","@ realDonaldTrump","","984221504022904832","","","https://twitter.com/brixen/status/984221504022904832","https://pbs.twimg.com/media/DaiYqCEWAAAJ2Kn.jpg"
"p_m_douglas","2018-04-09-21:41",0,0,"Is that really @ realDonaldTrump’s hand, or is it photoshopped?! It looks disproportionately small compared to his head. https://twitter.com/jaasongreg/status/983516230349811712 …","","@ realDonaldTrump","","983520324967976960","","","https://twitter.com/p_m_douglas/status/983520324967976960",""
"jasonbaum","2018-04-09-19:02",4,36,"You can tell it’s photoshopped because his hand looks normal sized.","","","","983480402760302599","981981434247335943","katstails sairs_anne realDonaldTrump","https://twitter.com/jasonbaum/status/983480402760302599",""
"rwmercer","2018-04-05-21:24",0,2,"No it isn’t photoshopped. It’s been cropped is all. Melania’s holding his hand. If you enlarge you can see a bit of her dress.","","","","982066428441395200","981992052786425856","soosique Fuzzy_Fuzzbutt","https://twitter.com/rwmercer/status/982066428441395200",""
"soosique","2018-04-05-19:01",0,0,"I despise him with every fiber of my being, however, this photo is obviously photoshopped. Look at his left hand; it’s holding someone else’s hand. Let’s keep it real. Our environment, wildlife and freedoms are being destroyed. Focus and fight.","","","","982030481825787904","981992052786425856","Fuzzy_Fuzzbutt PVArkol","https://twitter.com/soosique/status/982030481825787904",""
"Steveoboogie","2018-04-02-17:08",0,0,"That’s defiantly photoshopped. You can tell because his hand is too big. Good thing he has got money because with his tiny hands I am sure he has little else to offer.","","","","980914937429098497","980846943130746881","lrpwolf stopthenutjob realDonaldTrump","https://twitter.com/Steveoboogie/status/980914937429098497",""
"DeeF11","2018-04-01-14:25",0,5,"The words on the piece of paper photoshopped into President Trump’s hand are the words in a post Q posted a few days back. By placing it in President Trump’s hand, I took that as a clue given to us of Q’s identity.","","","","980511583917965314","980504719536934912","Veritas_Invictu prayingmedic","https://twitter.com/DeeF11/status/980511583917965314",""
"SteveHockney67","2018-04-01-10:38",0,1,"I know this is photoshopped because @ realDonaldTrump is only drinking with one hand. https://twitter.com/rvawonk/status/979924675529723904 …","","@ realDonaldTrump","","980454367424860164","","","https://twitter.com/SteveHockney67/status/980454367424860164","https://pbs.twimg.com/media/DZlkGiQXUAYS6J_.jpg"
"jonathansviewon","2018-03-31-20:17",0,0,"Please tell me you photoshopped that image. It's not real surely. Easter joke post. They've photoshopped in toddlers hand step aside USA, Trumps hand size irrelevant now","","","","980237610596499456","979708532877504512","TishaCM PHLTrustDuterte","https://twitter.com/jonathansviewon/status/980237610596499456","https://abs.twimg.com/emoji/v2/72x72/1f606.png"
"shazza137","2018-03-31-04:01",0,0,"All these people going by bonkers over a photoshopped picture of Jeremy next to Hitler were probably cheering # CathyGriffith with trump's fake dicapitated head in her hand. That's why your outrage is so faux. Fed up of the double standards right across the board! https://twitter.com/WarmongerHodges/status/979851228195811329 …","","","# CathyGriffith","979992167593766912","","","https://twitter.com/shazza137/status/979992167593766912",""
"SuSmbp99","2018-03-24-00:36",0,6,"And I’ve seen proof that upper-right hand corner one is photoshopped which I’m sure you could find too if you tried. Somehow I doubt you will.","","","","977403694282100736","976765417908776963","nflcars28 realDonaldTrump","https://twitter.com/SuSmbp99/status/977403694282100736","https://abs.twimg.com/emoji/v2/72x72/1f937-1f3fb-200d-2640-fe0f.png"
"deedee33955","2018-03-23-18:21",2,2,"Is his small hand really on his daughter's butt - or is this photoshopped???","","","","977309276363509763","977221676697079808","layla_hanlon realDonaldTrump","https://twitter.com/deedee33955/status/977309276363509763",""
"Newarkguy1973","2018-03-23-00:18",1,1,"That's it, Carmen Yulin Cruz.... great CNN crowned 'hero of Puerto Rico'...the 'anti-Trump & Governor Rosello' CNN darling....you rode around safe and dry on a truck with a media Entourage and then Photoshopped yourself in water supposedly shaking the hand of a guy on a boat. pic.twitter.com/IYAUgasI3j","","","","977036903869493248","","","https://twitter.com/Newarkguy1973/status/977036903869493248","https://pbs.twimg.com/media/DY8h3ANX4AAQmbv.jpg"
"aquarian23","2018-03-22-13:17",1,8,"yeah and that lower left hand picture is totally photoshopped. Guess you don't care about the pussy grabbing president? # ImpeachmentNow # resist","","","# ImpeachmentNow # resist","976870481147187201","976765417908776963","Kektobots KellenHeller3","https://twitter.com/aquarian23/status/976870481147187201",""
"Quaristic","2018-03-22-10:50",0,0,"Who photoshopped this picture because I want to shake their hand. # Trump # Putinhttps://wonkette.com/631512/why-why-why-is-trump-such-a-beta-cuck-every-time-he-talks-to-vladimir-putin …","","","# Trump # Putinhttps","976833606734766080","","","https://twitter.com/Quaristic/status/976833606734766080",""
"TJFixman","2018-03-22-00:09",0,1,"Oh my god I replied with a photoshopped gif of trump walking away all sad and then I realized he was holding a KKK mask in his hand. Deleted so fast.","","","","976672190656479232","976671094802386944","SarahSoWitty","https://twitter.com/TJFixman/status/976672190656479232",""
"NotGuiltyFPD","2018-03-21-23:13",0,0,"Is Trump’s hand photoshopped? It can’t really be that small.","","","","976658018254376960","976143594997338112","EsotericCD","https://twitter.com/NotGuiltyFPD/status/976658018254376960",""
"AricToler","2018-03-21-02:59",1,6,"Barron Trump's face being photoshopped onto his dad with his nasty hand is really unsettling pic.twitter.com/j0wOczV2Bj","","","","976352663351775233","","","https://twitter.com/AricToler/status/976352663351775233","https://pbs.twimg.com/media/DYyzjSZUQAE9fp5.jpg"
"properlads2016","2018-03-20-13:44",0,0,"Also hand clearly photoshopped to be bigger","","","","976152408593223682","821407332957560833","EricTrump GolfDigest realDonaldTrump","https://twitter.com/properlads2016/status/976152408593223682",""
"flafaloon","2018-03-13-13:34",0,0,"OH, more Hllary news, since there is nothing of substance for you to say, go with a typical Hillary story as follows: 'HILLARY grabs hand rail while climbing steps in India' (insert unflattering portrait of Hillary photoshopped with a mean looking Obama)","","","","973613272330113025","973598701510905857","JudgeJeanine realDonaldTrump","https://twitter.com/flafaloon/status/973613272330113025",""
"WhirledPeas4Kay","2018-03-02-06:37",0,0,"I'm waiting for the photoshopped pic of what should be in tRump's left hand (because of placement)","","","","969537194107977728","968932340947853312","stonecold2050","https://twitter.com/WhirledPeas4Kay/status/969537194107977728",""
"george27587","2018-02-28-15:06",0,0,"No caption but... is Trumps left hand photoshopped? Look at that little claw!","","","","968940599758946304","968932340947853312","stonecold2050","https://twitter.com/george27587/status/968940599758946304",""
"LoreneK08571093","2018-02-28-03:34",0,1,"That is photoshopped and his hand is as large as the fake hand on his new portrait!","","","","968766414155902977","968704442110545923","LoreneK08571093 Edible3Ball","https://twitter.com/LoreneK08571093/status/968766414155902977",""
"TheWrightWingv2","2018-02-27-10:17",0,0,"# tcot # UniteBlue Boeing # flipitblue # NRA # TheResistance # BosBizWomen WITCH HUNT # TuesdayThoughts # NoBrainerWayToHappinessIs # MAGA Trump's Tax Cuts in Hand All idiot liberals have is fantasy. Not photoshopped: pic.twitter.com/bNkUOwJsua","","","# tcot # UniteBlue # flipitblue # NRA # TheResistance # BosBizWomen # TuesdayThoughts # NoBrainerWayToHappinessIs # MAGA","968505446339371008","968468176639004672","LynnNotes2018 realDonaldTrump","https://twitter.com/TheWrightWingv2/status/968505446339371008","https://pbs.twimg.com/media/DXDSiXAX4AExun8.jpg"
"ManbabyandChief","2018-02-24-11:49",0,0,"Unless they are photoshopped all those pics are real. So I have no idea what your point is. Sometimes Trump knows to put his hand over his heart and sometimes he doesn't? But either way he is still terrible.","","","","967441248599474182","966117265426001920","Agent99Firm realDonaldTrump","https://twitter.com/ManbabyandChief/status/967441248599474182",""
"CrushingPodcast","2018-02-22-11:22",0,0,"Russians know exactly how to appeal to Trump's base. All that's missing is a poorly photoshopped gun in her hand. That hat is priceless though. Laughed my a$$ off!","","","","966709737667678208","966681883206668289","MariaBrownMAGA1 MariaBrownMAGA realDonaldTrump","https://twitter.com/CrushingPodcast/status/966709737667678208",""
"CarleneRummery","2018-02-20-23:53",0,0,"Clearly photoshopped—that hand is way too big to belong to Trump.","","","","966173979659636740","","","https://twitter.com/CarleneRummery/status/966173979659636740",""
"JWillette1805","2018-02-17-19:47",0,3,"Hey Joey! Why does your profile pic look photoshopped? Just a little, maybe around the chin? And your head looks kinda big, especially compared to your hand. pic.twitter.com/KXSmHZ0713","","","","965025029217046528","965009332042596352","JTMYVA realDonaldTrump","https://twitter.com/JWillette1805/status/965025029217046528","https://pbs.twimg.com/media/DWR1JIrWAAU6Quz.jpg"
"BlueStateBabe1","2018-02-14-02:01",0,0,"Is it me, or is that a disembodied hand floating in front of Trump? Like it was photoshopped in. pic.twitter.com/Ul24K3zMWe","","","","963669482211299328","","","https://twitter.com/BlueStateBabe1/status/963669482211299328","https://pbs.twimg.com/media/DV-kQCuXUAIG7QQ.jpg"
"seminolerogers1","2018-02-11-13:34",0,1,"What you don't see is how she photoshopped trumps hand on her puss.","","","","962756643204288513","962330457886076928","mrkrkrs neb63 realDonaldTrump","https://twitter.com/seminolerogers1/status/962756643204288513",""
"wotchers","2018-02-06-03:30",0,3,"Been squinting at Donald Trump's new Twitter banner photo for a good 5 minutes now - has his hand been photoshopped to look bigger, or are the fingers just weirdly short? pic.twitter.com/XUs8raQzY8","","","","960792713359757312","","","https://twitter.com/wotchers/status/960792713359757312","https://pbs.twimg.com/media/DVVr26oX4AEyHNY.jpg"
"Phornt4reelz","2018-02-05-15:55",0,0,"Know that's photoshopped, Melania hates Trump, they don't sleep in the same room, they don't travel together, shoot she wouldn't even let him hold his hand. However there are a ton of photos with Barack and Michelle because they actually love each other","","","","960617924905095177","960614513224667136","r_little_finger realDonaldTrump","https://twitter.com/Phornt4reelz/status/960617924905095177",""
"SpaceDuster","2018-02-05-12:35",0,0,"INB4 all the Republicants come in here and start talking about how he looks photoshopped and the FBI is doing this to discredit Trump so we can get RENEWALS of warrants to then just basically hand the election to Trump and ...ok I lost track of my crazy, what do they think again?","","","","960567495668088832","960539835600584704","Mikel_Jollett","https://twitter.com/SpaceDuster/status/960567495668088832",""
"dom_solo","2018-02-05-09:31",1,5,"obviously photoshopped since Trump can't hold a water bottle with just one tiny hand","","","","960521366473789440","960475766055165952","mamakin72 Tombx7M","https://twitter.com/dom_solo/status/960521366473789440",""
"rogerlis","2018-02-04-22:07",0,0,"@ DLoesch got banned from twitter for correcting a fake photo of President Trump along side others. President Trump doesn’t have his hand on his heart the others do. The picture was photoshopped and viral. I posted the snopes proof. They banned me for 11 hours.","","@ DLoesch","","960349152214470656","","","https://twitter.com/rogerlis/status/960349152214470656",""
"mistercenzo","2018-01-27-20:20",0,0,"Impressive how they photoshopped out @ piersmorgan ‘s hand wanking @ realDonaldTrump in this picture!!! # cgihttps://twitter.com/piersmorgan/status/957389820397084672 …","","@ piersmorgan @ realDonaldTrump","# cgihttps","957423123464380419","","","https://twitter.com/mistercenzo/status/957423123464380419","https://pbs.twimg.com/media/DUlU2-NWkAU-EvB.jpg"
"R8derMike","2018-01-27-13:38",0,4,"Now this is funny. Someone photoshopped a large middle finger protruding from trumps tiny hand. Thanks for the laugh.","","","","957321867265654789","957256078026211328","JudeDeplora KWnFX","https://twitter.com/R8derMike/status/957321867265654789",""
"InstigatorRules","2018-01-26-10:54",0,0,"I don't see 3 legs, I see 2 and a shadow of her dress? I do not see a 3rd hand either? Even if there was, whats the big deal, EVERYONE knows magazine covers are photo shopped. This ain't 'breaking news' of any sort. Pretty certain ALL of Trump and Trump family # photoshopped","","","# photoshopped","956918274339540992","956913475451871237","BreitbartNews","https://twitter.com/InstigatorRules/status/956918274339540992",""
"JediSpiceGissia","2018-01-21-06:47",0,0,"Does that phone have 2 hand sets, or is that a photoshopped pic of trump 'working', talking on the phone, with nothing else on the desk??","","","","955044268359540736","954885116085579777","MEPFuller","https://twitter.com/JediSpiceGissia/status/955044268359540736",""
"boxdog1031","2018-01-20-07:15",0,1,"Look, they photoshopped an adult sized hand into the photo.","","","","954688751300698112","954541219970977793","Vicky4Trump StokedToLive","https://twitter.com/boxdog1031/status/954688751300698112",""
"Theyregoingdown","2018-01-20-06:13",0,0,"That is clearly photoshopped. zoom in, there’s a black outline around his nose and why would his hand be positioned like that. Also the podesta art is important, he was Hillary’s top aide and a registered foreign lobbyist on behalf of the CORRUPT SAUDIS. pic.twitter.com/XByIsK4y4B","","","","954673235827687424","954439167949377538","JonnMontata NPR realDonaldTrump","https://twitter.com/Theyregoingdown/status/954673235827687424","https://pbs.twimg.com/media/DT-uO1vVwAAVhTk.jpg"
"kwsapphire","2018-01-17-12:45",0,0,"It's like when people take pictures or videos of Trump out of context. Like when he supposedly ignored a kid in a wheelchair (he didn't, he paid special attention to him), or didn't put his hand over his heart during the anthem (photoshopped). Fake news doesn't help either side.","","","","953684599363854336","953679400003874816","kwsapphire MikeJayEss PJMedia_com","https://twitter.com/kwsapphire/status/953684599363854336",""
"lisamikol1969","2018-01-15-09:38",0,0,"Of which I am one (the previous wave, that is). I started getting disgusted when they tried pulling that shit on 90+ year old Bush 1 touching butts; then destroyed Al Franken’s career over Trump jr friend’s photoshopped pic, 3 claims of his hand in the wrong place for >5 secs /1","","","","952912868932046848","952547277322817536","WottaBadKat IrAntecedent heatherwilhelm","https://twitter.com/lisamikol1969/status/952912868932046848",""
"IjustHadToDoIt","2018-01-14-08:40",0,1,"You still tweeting this poorly photoshopped picture, I told you weeks ago to fix his right hand holding the placard. Can any Trump supporter listen?","","","","952535884456439808","952530515894169601","The_Trump_Train realDonaldTrump","https://twitter.com/IjustHadToDoIt/status/952535884456439808",""
"Sunshinetgo","2018-01-10-12:31",0,2,"That has to be photoshopped His hand is about half that size.","","","","951144462348103680","951106475254059008","randomgirlx107 garyd552 realDonaldTrump","https://twitter.com/Sunshinetgo/status/951144462348103680",""
"DEV_STA","2018-01-10-07:32",0,1,"You can tell that's photoshopped, his hand is too big....","","","","951069320158810112","950884128379035650","USA_Patriot_556 realDonaldTrump","https://twitter.com/DEV_STA/status/951069320158810112","https://abs.twimg.com/emoji/v2/72x72/1f602.png"
"JacquelineGault","2018-01-08-13:32",0,4,"It doesn't require any knowledge of graphic design to see that this is clearly a photoshopped image. Just look at her left hand...","","","","950435018567950337","950371619247153154","JacobAWohl realDonaldTrump foxandfriends","https://twitter.com/JacquelineGault/status/950435018567950337",""
"RealityGov","2018-01-07-08:46",0,0,"Obviously photoshopped. His hand is NOT bigger than his heart. Try again.","","","","950000682064662528","","","https://twitter.com/RealityGov/status/950000682064662528",""
"KlonnieChron","2018-01-05-10:50",0,0,"totally photoshopped that hand is way too big","","","","949307222705586176","949303089416294401","TraitorsHang realDonaldTrump","https://twitter.com/KlonnieChron/status/949307222705586176",""
"IjustHadToDoIt","2017-12-31-14:14",0,0,"I told you before, you silly photoshopping droid. I told you earlier that the right hand seems a bit off in your photoshopped image here. All you do is post these silly gifs. You must have a HDD loaded with these to keep you busy and happy. Such talent. Amazing. Impressive.","","","","947546452150104064","947536951464333318","IsraelUSAforevr realDonaldTrump","https://twitter.com/IjustHadToDoIt/status/947546452150104064",""
"IjustHadToDoIt","2017-12-31-00:34",0,0,"Seems to be an issue with the photoshopped part of his right hand. Believe me. Nice try though.","","","","947340203487891456","947328044821336070","IsraelUSAforevr realDonaldTrump","https://twitter.com/IjustHadToDoIt/status/947340203487891456",""
"good_wifey","2017-12-29-17:24",0,0,"(Although the # OrangeOverlord's cult will just make excuses for it, claim it was photoshopped) Report: White House intern appears to flash 'white power' hand gesture in PHOTO with # Trump: http://aol.it/2DxCRgx # TheTruthIsOutThere","","","# OrangeOverlord # Trump # TheTruthIsOutThere","946869498463780871","","","https://twitter.com/good_wifey/status/946869498463780871",""
"dallaszayne1","2017-12-28-22:12",0,1,"Horribly photoshopped picture, that's just sad. On the other hand, naked Trump is a real statue, in fact there are two of them, NYC and San Francisco. Your profile photo also sucks pic.twitter.com/LAxoDyVvSj","","","","946579751413649408","946531657229701120","Willyb11071 DanaJo114","https://twitter.com/dallaszayne1/status/946579751413649408","https://abs.twimg.com/emoji/v2/72x72/1f60f.png"
"shane25873","2017-12-28-21:57",0,0,"Also has Trump's hand been photoshopped to look larger? Seems quite a lot bigger than usual! https://twitter.com/thehill/status/946572244066717701 …","","","","946575813213798400","","","https://twitter.com/shane25873/status/946575813213798400","https://pbs.twimg.com/media/DSLmcDqW4AAK26v.jpg"
"rhoar_baitch","2017-12-26-17:54",0,1,"HA. Somebody photoshopped a man hand in there to make tRUmp look like a tough guy. Revising history a major tactic for the fashies pic.twitter.com/PeyddcuxnR","","","","945789873834803200","","","https://twitter.com/rhoar_baitch/status/945789873834803200","https://pbs.twimg.com/media/DSAeJdrU8AE_zaw.jpg"
"TheAofQ1","2017-12-24-07:22",0,0,"Doing exactly what she’s told by the pussy-grabbing @ realDonaldTrump? I see they photoshopped the marionette string on her hand out of the picture. How empowering!","","@ realDonaldTrump","","944906188495511552","943931856533295105","conservmillen","https://twitter.com/TheAofQ1/status/944906188495511552",""
"brownduckfood","2017-12-21-16:22",0,0,"Holy s*** I thought that was photoshopped at first. There's so much wrong with this incredibly stupid picture. Paul Ryan's hand on Trump's shoulder. Maybe he should grab him between-the-legs the way he treats women","","","","943954924378951681","943708505491456005","danpfeiffer","https://twitter.com/brownduckfood/status/943954924378951681",""
"JoeVenturelli","2017-12-21-11:32",0,0,"The hand you photoshopped in looked a little small, did you get that from a Trump photo?","","","","943881899386294272","941081039073611777","RadioBizBody bdomenech","https://twitter.com/JoeVenturelli/status/943881899386294272",""
"UnicornVendetta","2017-12-15-00:31",0,0,"Uchhhh no. Everything. Has to be photoshopped a bit, right? I thought his hand was on her butt in original which is sick . But her nipple? Uchhh. Donald and Ivanka have some kind of sickness and it originates from DONALD TRUMP for sure.","","","","941541134945230849","941528460161200128","BiglyPrez","https://twitter.com/UnicornVendetta/status/941541134945230849",""
"Meowso12XU","2017-12-14-17:47",0,13,"Or photoshopped him in there. They made Trump's hand larger...they could have added Baron. lol!","","","","941439445886218243","941402322072145920","DiannaMalak ABC","https://twitter.com/Meowso12XU/status/941439445886218243",""
"PDX_DianeS","2017-12-14-17:01",0,0,"Is nobody else noticing that his hand was photoshopped/enlarged in this photo? Whoever did this is BIGLY trolling Trump! LOL! Trump is gonna be pissed! pic.twitter.com/2fNlMorWx1","","","","941428053439266816","941383170917838848","fawfulfan","https://twitter.com/PDX_DianeS/status/941428053439266816","https://pbs.twimg.com/media/DRCfzv6XcAIeH3P.jpg"
"WMegna","2017-12-14-11:52",0,0,"That must be a mistake. In your delusional mind, I thought 100% of fake news was negative and only those lies you spin are real. Those photos of you with your harassment accusers must be photoshopped. The juice you hand out at your rallies must be the alternative to opioids.","","","","941350100047196161","940930017365778432","realDonaldTrump foxandfriends","https://twitter.com/WMegna/status/941350100047196161",""
"fillthefear","2017-12-12-19:08",0,0,"Obviously you can’t tell a photoshopped photo since when does he have a woman’s right hand? Fool be fooled","","","","940735199054143488","940567812053053441","DestinyandBruce dogman_2 realDonaldTrump","https://twitter.com/fillthefear/status/940735199054143488",""
"Chair_Humper","2017-12-09-15:53",0,0,"Gotta give them credit, it's a lot more clever than I thought they'd come up with... If someone told me there was a shirt that said this, I would assume it'd just be a badly photoshopped picture of Trump with his hand inside a vagina.","","","","939598854156009472","939326516760141824","marcushjohnson","https://twitter.com/Chair_Humper/status/939598854156009472",""
"tidedenahoe","2017-12-08-19:13",0,1,"I Can Tell This Is Photoshopped Cause MY President Would NEVER Shake Trumps Hand https://twitter.com/rjsanchez15/status/939285401038094338 …","","","","939286964037128193","","","https://twitter.com/tidedenahoe/status/939286964037128193","https://pbs.twimg.com/media/DQkDFwNXcAA1HnR.jpg"
