username,date,retweets,favorites,text,geo,mentions,hashtags,tweetid,conversationid,replyto,permalink,imagelink
"LomaahhMore","2017-12-07-10:22",0,0,"He said he was sorry that it upset them, but he remembered things differently. There's a lot of weird on this one. Menz photo looks like hand on shoulder photoshopped out. Tweeden has wrong day, & people remember if Christmas eve. Others anonymous on job worries over tush grab?","","","","938790820882386946","938499292859420673","LUpthegrove meechebucco","https://twitter.com/LomaahhMore/status/938790820882386946",""
"LomaahhMore","2017-12-07-09:33",0,0,"Except Franken may have been setup. Menz photo looks hand on shoulder photoshopped out. Tweenden has wrong date. Claims skit written for her, that was done inUSO2003. Too many inconsistencies. So investigate. Don't let railroading work, it cheapens all the brave other women.","","","","938778488705830913","938499292859420673","mamajeanab EdanClay realDonaldTrump","https://twitter.com/LomaahhMore/status/938778488705830913",""
"wombaticus76","2017-12-07-01:16",0,0,"Definitely photoshopped, that hand is way to big to be his.","","","","938653452686598144","938422792080457731","deeluttrell1960 realDonaldTrump","https://twitter.com/wombaticus76/status/938653452686598144",""
"lisamikol1969","2017-12-06-22:48",0,2,"2) Lindsay Menz: Trump supporter, her husband photographed standing 4 feet away. Hundreds of people around and nobody saw a thing. Weird hand shaped bunch up in her shirt in picture that was photoshopped. pic.twitter.com/QT1xFKkaGT","","","","938616296803045376","938568560426864640","lisamikol1969 sphericaltime","https://twitter.com/lisamikol1969/status/938616296803045376","https://pbs.twimg.com/media/DQaiiruUEAAzTsL.jpg"
"lisamikol1969","2017-12-06-21:57",1,1,"2) Lindsay Menz: Trump supporter, her husband photographed standing 4 feet away. Hundreds of people around and nobody saw a thing. Weird hand shaped bunch up in her shirt in picture that was photoshopped. pic.twitter.com/pWg3lG6FvC","","","","938603275942842369","938602063147053056","lisamikol1969 TitusNation","https://twitter.com/lisamikol1969/status/938603275942842369","https://pbs.twimg.com/media/DQaWsmMVoAAerSi.jpg"
"magnvsantonivs","2017-12-06-12:18",0,1,"Tweedens name is to the right of the flag and looks hand drawn. Guy on the rights name is under the flag. 2 different vests? Really? Those shadows mean a lot. The whole pic is photoshopped.","","","","938457752300654592","938446514514464769","TheRealDuramax Overthewhether","https://twitter.com/magnvsantonivs/status/938457752300654592",""
"itspetebc","2017-12-03-05:34",0,3,"Did you save the original I photoshopped version too? The one where his hand is on her shoulder? Or is this what Sarah Sanders was talking about - doesn’t need to be true as long as it fits the narrative?","","","","937268841096282112","937142713211813889","dbw1776 JacobAWohl","https://twitter.com/itspetebc/status/937268841096282112",""
"SchoolBus411","2017-12-02-22:16",0,0,"That hand is photoshopped, and poorly so. So you're either an idiot or a liar to post it. Which one is it, Comrade Wohl?","","","","937158632528998402","937145025359761408","JacobAWohl realDonaldTrump ABC","https://twitter.com/SchoolBus411/status/937158632528998402",""
"KarenPoshmark","2017-12-02-21:59",0,11,"That is one shitty photoshopped hand.","","","","937154351986102273","937145025359761408","JacobAWohl realDonaldTrump ABC","https://twitter.com/KarenPoshmark/status/937154351986102273",""
"sandiedennis","2017-12-02-21:43",0,0,"Biden's right hand isn't that tiny. I believe it's trump's itsy bitty hand or this photo has been photoshopped. Keep grasping Jacob. You need all the help you can get.","","","","937150340708864000","937145025359761408","JacobAWohl realDonaldTrump ABC","https://twitter.com/sandiedennis/status/937150340708864000",""
"cirras_bane","2017-12-02-10:04",0,2,"I'm on a three day suspension for this picture. Princess Leia had a lightsaber in her hand, and tRUMPS head was photoshopped on the table. No blood, no gore. Was there since Halloween. Until a Trump minion didn't like what I had to say. Three days. pic.twitter.com/M03IPl0Cch","","","","936974431959863296","936972610046431235","ColMorrisDavis facebook","https://twitter.com/cirras_bane/status/936974431959863296","https://pbs.twimg.com/media/DQDM_ydUMAA6SLb.jpg"
"GreenleafEditor","2017-11-30-00:13",0,3,"Is that your hand you photoshopped in?","","","","936100971343577088","936052257392676864","JacobAWohl realDonaldTrump","https://twitter.com/GreenleafEditor/status/936100971343577088",""
"CycloneGU","2017-11-29-21:06",0,1,"I'd want to see the video. 9/10 chance that hand is Photoshopped. Damning otherwise.","","","","936053815580561408","936052257392676864","FiatSpeculator JacobAWohl realDonaldTrump","https://twitter.com/CycloneGU/status/936053815580561408",""
"couch_charles","2017-11-29-18:51",0,6,"I believe that photo of Biden is photoshopped... the right hand is not actually there","","","","936019788530249733","936005585019002887","JacobAWohl GDBlackmon realDonaldTrump","https://twitter.com/couch_charles/status/936019788530249733",""
"externaljew","2017-11-29-18:16",0,0,"Trump has had to be reminded multiple times to put his had over his heart during the anthem. Once by Melania. During a debate he forgot the whole time and it’s rumored the WH photoshopped his hand afterwards on some Superman Justice League shit pic.twitter.com/FCmbD8IBu7","","","","936010985445269504","","","https://twitter.com/externaljew/status/936010985445269504","https://pbs.twimg.com/media/DP1hByeUEAAepho.jpg"
"Sinixstar","2017-11-27-20:22",0,1,"Is his hand photoshopped to be smaller? or is.... nevermind","","","","935318028123889664","935317821273333760","justinhendrix realDonaldTrump","https://twitter.com/Sinixstar/status/935318028123889664",""
"PerS1ster","2017-11-27-11:28",1,2,"Is it just me or is she starting to *look* like her pig of a husband? First glance I thought that was his face photoshopped onto her hair ... Also, photog who snapped those tiny hand reflections deserves an award","","","","935183676836528130","935145222551560192","Alt_Spicerlies FLOTUS","https://twitter.com/PerS1ster/status/935183676836528130","https://abs.twimg.com/emoji/v2/72x72/1f602.png"
"kusk1111","2017-11-26-14:17",0,0,"Trump’s hand photoshopped into this pic.","","","","934863814662668288","934562051464216576","Fiona_Forde_Irl RTERayDarcyShow","https://twitter.com/kusk1111/status/934863814662668288",""
"boog2346","2017-11-26-09:42",0,0,"I agree, but your pictures are photoshopped. Check out the hand on Loretta Lynch's shoulder. Does it belong to Cousin It?","","","","934794460684316674","934781939088629761","JackPosobiec realDonaldTrump","https://twitter.com/boog2346/status/934794460684316674",""
"AbhainnWilliams","2017-11-25-13:11",0,0,"I don’t know. The arm with the gun seems a bit off. And the hand tinier than normal. Maybe it was originally trump and they photoshopped the Russian spy (his name is russian for gods sake!) in because, well trump is a weeny. Only partial weenies allowed on the gun mag cover.","","","","934484631226793984","934466906601459712","curlytopnola jessesingal","https://twitter.com/AbhainnWilliams/status/934484631226793984",""
"ChicagoMT","2017-11-24-19:33",0,0,"On the other hand, you could finally replace the FAKE NEWS 'Time Magazine' covers you had photoshopped for your pathetic golf clubs! # Trump","","","# Trump","934218498989019136","934189999045693441","realDonaldTrump","https://twitter.com/ChicagoMT/status/934218498989019136",""
"sonny_roark16","2017-11-23-15:20",0,0,"Ok but that picture is obviously photoshopped.","","","","933792488984375297","933777573233950720","To_The_Hand realDonaldTrump POTUS","https://twitter.com/sonny_roark16/status/933792488984375297",""
"Mezzoid","2017-11-22-18:28",1,2,"This is photoshopped. I’m totally against this man, but we have to be honest. His hand was on her hip.","","","","933477254922981382","933147495085039616","sammypolsen12 IngrahamAngle realDonaldTrump","https://twitter.com/Mezzoid/status/933477254922981382",""
"MyTruthiness","2017-11-21-03:23",0,0,"“You liberals” have seen the posts and pics posted by the Trump boys...that’s not a photoshopped elephant tail in his hand. Try google, or Jrs posts or non-Fox news if you’d like something other than fake news.","","","","932887189138149377","932397369655808001","CnjranchS altNOAA realDonaldTrump","https://twitter.com/MyTruthiness/status/932887189138149377",""
"GypsyCowboy75","2017-11-20-05:01",0,0,"Wow! That hand really is small! Come on, that hand had to be photoshopped. Teeny tiny young child hand!","","","","932549387024306176","932245995412426752","CREWcrew uo_duck99 realDonaldTrump","https://twitter.com/GypsyCowboy75/status/932549387024306176",""
"DodgesHodge","2017-11-17-20:10",0,0,"Obviously photoshopped. The hand in this pic is a normal sized man hand.","","","","931690979710574592","931685146415255552","155places realDonaldTrump","https://twitter.com/DodgesHodge/status/931690979710574592",""
"JWCbuster","2017-11-17-17:14",0,0,"Uh, concerning those photos. Did you know one in particular was shot in 2006, further Photoshopped in 2009? FAKE! Your accusations on the other hand, have real witnesses and your own confession on tape. Beware @ FLOTUS , this man is sickpic.twitter.com/GJ1EXZvbx4","","@ FLOTUS","","931646785591939073","931357870024687616","realDonaldTrump","https://twitter.com/JWCbuster/status/931646785591939073","https://pbs.twimg.com/media/DO3fz0uVoAAyOPn.jpg"
"Germanicus011","2017-11-17-16:41",0,1,"No its photoshopped. Take a closer look at his hand.","","","","931638358966718466","931384992424452096","prtytilcowscmh1 TomGarron","https://twitter.com/Germanicus011/status/931638358966718466",""
"Retta519","2017-11-17-16:17",0,0,"Lol you know that hand is photoshopped in there right?","","","","931632392309223430","931360196554821632","RealEagleBites realDonaldTrump","https://twitter.com/Retta519/status/931632392309223430",""
"mark7041","2017-11-17-14:08",0,0,"WHen will the right quit posting FAKE photos! Like this one, very photoshopped you see that is a small hand , probably trumps!","","","","931600071421960193","931538234169069568","JacobAWohl realDonaldTrump","https://twitter.com/mark7041/status/931600071421960193",""
"sammypolsen12","2017-11-17-10:38",2,7,"Totally photoshopped by the unholy dishonest right, as usual. look at the pants or lack of pants biden is wearing, PHOTOSHOPPED!! and his hand was nowhere near her tit in the actual footage The Right and trump lacky butt lickers have no shame, they never have & they never will","","","","931547073400336385","931538234169069568","PainSyndicate 3rdtimewalter","https://twitter.com/sammypolsen12/status/931547073400336385",""
"sammypolsen12","2017-11-17-10:38",2,7,"Totally photoshopped by the unholy dishonest right, as usual. look at the pants or lack of pants biden is wearing, PHOTOSHOPPED!! and his hand was nowhere near her tit in the actual footage The Right and trump lacky butt lickers have no shame, they never have & they never will","","","","931547042152718336","931538234169069568","JacobAWohl realDonaldTrump","https://twitter.com/sammypolsen12/status/931547042152718336",""
"_Carlos_Danger","2017-11-17-10:13",0,9,"Even though a hand is definitely photoshopped in","","","","931540885539557376","931538234169069568","JacobAWohl realDonaldTrump","https://twitter.com/_Carlos_Danger/status/931540885539557376",""
"recycle4u2","2017-11-17-05:07",0,1,"So obvious this was Photoshopped fingers are cut off on the right-hand , Sicko liars","","","","931463774799843329","931357870024687616","MLKvDJT realDonaldTrump","https://twitter.com/recycle4u2/status/931463774799843329",""
"BrendaJeanCDN","2017-11-16-22:52",0,0,"There's enough crap going around, that pic is photoshopped. Trump's hand is closer to her waist in the original.","","","","931369426703867904","931360196554821632","martin_kj realDonaldTrump","https://twitter.com/BrendaJeanCDN/status/931369426703867904",""
"Mezzoid","2017-11-16-22:34",0,1,"As much as I dislike him, that is photoshopped. His hand was much lower.....","","","","931364818384310274","931357870024687616","leon_beaumont realDonaldTrump","https://twitter.com/Mezzoid/status/931364818384310274",""
"MLJ107","2017-11-16-02:56",0,0,"Trump's hand is photoshopped in here, who has this many joints in their arm? pic.twitter.com/rV114uvKdw","","","","931068544296644608","","","https://twitter.com/MLJ107/status/931068544296644608","https://pbs.twimg.com/media/DOvRzg8X0AA97I2.jpg"
"FilmJen","2017-11-15-12:54",0,0,"All of this Joe Biden crap is debunked. Right wingers badly photoshopped another image of his hand on a woman's breast. Meanwhile 30 sources have come out against Moore and Trump admitted to assault.","","","","930856429535105024","930320191699017730","SLandinSoCal realDonaldTrump WhiteHouse","https://twitter.com/FilmJen/status/930856429535105024",""
"Grannygiggles2","2017-11-14-20:17",0,0,"While you were airbrushing this photo of yourself, you should have photoshopped a bigger hand.","","","","930605763441188865","930346433177378817","realDonaldTrump","https://twitter.com/Grannygiggles2/status/930605763441188865",""
"faery_fancy","2017-11-14-03:32",0,0,"This is badly photoshopped. Badly. How pathetic to have to go through all of that effort to manipulate the images because you cannot actually find one where they are truly happy- or where her hand is not a balled- up fist-in his. # TrumpCrimeFamily","","","# TrumpCrimeFamily","930352730966757376","930346433177378817","ColumbiaBugle realDonaldTrump","https://twitter.com/faery_fancy/status/930352730966757376",""
"Winger770","2017-11-13-18:50",0,0,"Bro, that's a fake photoshopped image of Harvey's head on a much skinnier man's body. On the other hand, plenty of pictures of Harvey with Trump. Nice try.","","","","930221426073849856","930211220048760832","moekamerow latimes","https://twitter.com/Winger770/status/930221426073849856",""
"ChristinePThoma","2017-11-13-15:52",0,0,"That looks like Trump’s tiny hand photoshopped in there","","","","930176637752303617","930174545448890368","IgnoredNews_com washingtonpost","https://twitter.com/ChristinePThoma/status/930176637752303617","https://abs.twimg.com/emoji/v2/72x72/1f602.png"
"j_p_stroud","2017-11-12-20:41",0,0,"Trumps hand is photoshopped.","","","","929886936851816450","929868108394766336","NaphiSoc theGOPstoppers","https://twitter.com/j_p_stroud/status/929886936851816450",""
"CorenaGardner","2017-11-12-16:39",0,0,"Oops photoshopped, nail polish on her left hand and none on her right.","","","","929826102998175745","929769238319026176","iPOscreatejobs POTUS","https://twitter.com/CorenaGardner/status/929826102998175745",""
"wallerman88","2017-11-12-09:46",1,2,"Your picture of Obama and Putin is proven to be photoshopped. Oh not to mention Obama told Putin left hand man he could help more after Elec","","","","929722117465178112","929705320477265920","zenithguy Scavino45","https://twitter.com/wallerman88/status/929722117465178112",""
"GraceRieck","2017-11-10-14:19",0,4,"not only is there a little hand, but someone meticulously photoshopped Trump’s reflection onto the faucet. # dedicationhttps://twitter.com/nicedonaidtrump/status/926540141858091011 …","","","# dedicationhttps","929066006332526593","","","https://twitter.com/GraceRieck/status/929066006332526593","https://abs.twimg.com/emoji/v2/72x72/1f602.png"
"Hermitage1832","2017-11-08-23:05",0,1,"Someone else on Twitter photoshopped pink dildos into everyone’s hand. (And why DOES Jared still have a security clearance?","","","","928473509306781696","928365025349263366","tedlieu TwumpFaschion realDonaldTrump","https://twitter.com/Hermitage1832/status/928473509306781696",""
"mustacheman95","2017-11-08-22:42",0,1,"He really looks photoshopped into this picture, Why is the light shining on the outer part of his hand if the window is facing his inner palm? Also he just looks tiny af for some reason","","","","928467891011424256","928325667556548608","realDonaldTrump","https://twitter.com/mustacheman95/status/928467891011424256","https://abs.twimg.com/emoji/v2/72x72/1f914.png"
"medic854","2017-11-03-22:53",0,0,"That's not his real hand, right? You guys, like, Photoshopped that, right? Because, I'm seeing @ realDonaldTrump in reverse...","","@ realDonaldTrump","","926643601349767168","926641415697858560","thinkprogress","https://twitter.com/medic854/status/926643601349767168",""
"FlaHarlock","2017-11-03-15:17",0,1,"That photo is photoshopped. Trump's hand is too big.","","","","926528766112870400","926492915626663939","jamacia813 realDonaldTrump","https://twitter.com/FlaHarlock/status/926528766112870400",""