content,username,replyto,permalink,time
"On this special day in 1931, the Star Spangled Banner became our National Anthem. As a proud Nation, we must always respect our great American flag & our National Anthem in order to honor those brave Americans who defend & protect the United States of America.,pic.twitter.com/58fViLAoO4",VP,,https://twitter.com/VP/status/970043192593866753,1520111294
pic.twitter.com/esYINYFY5a,TheRealMrAleem,VP,https://twitter.com/TheRealMrAleem/status/970043649273843713,1520111403
Run along and go cry.,TheRealMrAleem,"reneboricua,VP",https://twitter.com/TheRealMrAleem/status/971601646500438016,1520482858
And we must remember that kneeling during it is a legally acceptable way to protest against systemic racism in the USA. Thanks for the reminder!,Kimi_Walsh,VP,https://twitter.com/Kimi_Walsh/status/970043702176567297,1520111415
Racism???? I thought it was for police brutality....probably should get your facts right and stop throwing the race card,JanOlso37667146,"Kimi_Walsh,VP",https://twitter.com/JanOlso37667146/status/970260960509181952,1520163214
Racism is not just about anyone or a group of people! What you said about our police is wrong! I hope some day your not left needing one!,JANELLEDALSTRA,"JanOlso37667146,Kimi_Walsh,VP",https://twitter.com/JANELLEDALSTRA/status/971521644597600257,1520463784
"Because what goes around comes around. The day your in danger and need a policeman to protect you, I doubt you’ll be served. Narrow minded!",JANELLEDALSTRA,"JANELLEDALSTRA,JanOlso37667146",https://twitter.com/JANELLEDALSTRA/status/971522149834948609,1520463905
I was pointing out wht Colin K chose to sit. I totally disagree with him. There is a place and time to protest but its not the football field,JanOlso37667146,"JANELLEDALSTRA,Kimi_Walsh,VP",https://twitter.com/JanOlso37667146/status/972549677856927744,1520708886
Really? So where should a pro football player make his silent statement? In his kitchen? The whole point was to draw attention to the issue.,Kimi_Walsh,"JanOlso37667146,JANELLEDALSTRA,VP",https://twitter.com/Kimi_Walsh/status/974345708714319872,1521137094
"Values, principles, ethics and morals define a nation. They define our great nation. Anthems, flags and pledges are merely symbolic. Stand, kneel, sing, don’t sing, pledge or don’t pledge. Those choices are the freedom I fought for and they are the choices many died for. Rack off",MichaelSpellavy,VP,https://twitter.com/MichaelSpellavy/status/970171386982408193,1520141858
"Mike quit now, maybe you can cut a deal with ,#,MuellerInvestigation, ,@,AARP, ,#,25thAmendment, ,#,NeverEverTrustaRepublican",Abes_chin,VP,https://twitter.com/Abes_chin/status/970050844153581574,1520113118
"@,VP, ,@,realDonaldTrump,pic.twitter.com/YeKxr85EVM",TnGovern,"Abes_chin,VP,AARP",https://twitter.com/TnGovern/status/974268515636207616,1521118689
"Your father and son served in the military, not you. You don't respect descent, the cornerstone of a democracy. You oppose gay rights and attempted to pass laws allowing discrimination against all gay people. You voted against the No Child Left Behind Act. Sing away brother!",noradunn,VP,https://twitter.com/noradunn/status/971429257917341696,1520441758
"@,realDonaldTrump, ,@,CNN, ,@,CBSNews, ,@,NBCNews, Save it ,#,Pence,. ,#,Trump, is so far ,#,UnAmerican, it’s ridiculous. Heard that Paulie picked you for VP. ,#,Complicit,. ,#,Mueller, is coming. Game over. ,#,TrumpRussia, is real. When did you know ,#,Pence,?,pic.twitter.com/STJBkm3Y3o",proudmaryc,VP,https://twitter.com/proudmaryc/status/970047815274516480,1520112396
"God. You picked Carter??? But NOW we have a prez who doesn't even take a salary. He left HIS businesses to ,#,MAGA,. So...your point is...? Despite it all, Cater kept his salary AND his pension. I BET Trump will NOT take his. ,http://,springboardblog.blogspot.com/2018/03/racism,-is-not-conservatism.html, ,…",JimBauer601,"proudmaryc,VP",https://twitter.com/JimBauer601/status/970055720266817536,1520114281
No sense trying to reason with these libs. They don't care about anything except spreading their hatred,IamGilligan8,"JimBauer601,proudmaryc",https://twitter.com/IamGilligan8/status/970309960709083141,1520174896
"I have come to realize that, and find it pretty sad. But what can you do? ,http://,springboardblog.blogspot.com/2018/03/a-bloc,king-we-will-go.html, ,…",JimBauer601,"IamGilligan8,proudmaryc",https://twitter.com/JimBauer601/status/970312414104301568,1520175481
"Expecting someone to actually hold up their word, the one given several times during campaign, isn't hated. Only people like you refuse to see what a pathological liar 45 is and would rather be willfully ignorant than face facts. The Pres is bad for the country and needs to go.",TaviaBaldwin,"JimBauer601,IamGilligan8",https://twitter.com/TaviaBaldwin/status/970355745903427584,1520185812
"He has upheld more campaign promises so far than any other president in history in the short time he has been in office. If nothing else, that is worth something whether or not you agree with his promises. But even CNN had to admit this. ,http://,springboardblog.blogspot.com/2018/02/steel-,and-aluminum-tariffs-right-for.html, ,…",JimBauer601,"TaviaBaldwin,IamGilligan8",https://twitter.com/JimBauer601/status/970396162867056641,1520195448
What promises has he upheld?,TaviaBaldwin,"JimBauer601,IamGilligan8",https://twitter.com/TaviaBaldwin/status/975882024979521536,1521503380
"Cut taxes. Removed the penalty fir not being able to afford ACA. Added jobs. Appointed a good qualified judge to the supreme court. We are still waiting on prosecuting criminals like Holder, Rice and Lerner. Also waiting for the wall but illegal immigration is going down.",IamGilligan8,"TaviaBaldwin,JimBauer601",https://twitter.com/IamGilligan8/status/975921194229817347,1521512719
pic.twitter.com/UWgXG7WeSF,TheRealMrAleem,VP,https://twitter.com/TheRealMrAleem/status/970043557926068225,1520111381
"It’s his dollar and he donates his time to America. So Play away Mr, Trump, it’s your break. Working overtime for America for nothing in return except Dems search for anything to complain about. They search for complaints...while there are none. Get busy Dems, you need a job!",KathleenNewhou6,"TheRealMrAleem,MisterAleem,VP",https://twitter.com/KathleenNewhou6/status/971617516773502976,1520486642
All the faithful and patriotic Americans must love the American Flag and American National Anthem. Amen.,youngskim39,VP,https://twitter.com/youngskim39/status/970148596984307712,1520136424
Amen.,youngskim39,"youngskim39,VP",https://twitter.com/youngskim39/status/972492058488393728,1520695149
"Pence, you are so proud of our flag that you have impeded any investigation into Russian interference into our election. You make me sick",CountryFirst50,VP,https://twitter.com/CountryFirst50/status/970084343287709698,1520121105
"Eugene, I’m going to say this once for your benefit. Every US Intel Agency has said the Russians interfered in our elections. That’s a fact. So far Trump and the GOP have gone out of their way to derail any investigation into Russian interference. This is easy",CountryFirst50,"Eugene_prestimo,VP",https://twitter.com/CountryFirst50/status/970389687796838400,1520193905
Yes Russians interfere in every election along with many other things.  Example: they sponsored both pro and Anti Trump rallies in NYC.  No one is disputing this.  But the question is did Trump collide with Russia.  The answer is no!,Eugene_prestimo,"CountryFirst50,VP",https://twitter.com/Eugene_prestimo/status/982652594676994048,1523117610
"Respect the flag (but use the Presidential seal as golf tees).

Is that what you mean ,@,VP, 

,@,realDonaldTrump, ,@,GOP, ,@,WhiteHouse, ,@,TrumpGolf,https://www.,propublica.org/article/trump-,inc-podcast-extra-the-trump-organization-ordered-golf-course-markers-with-the-presidential-seal-that-may-be-illegal?utm_campaign=sprout&utm_medium=social&utm_source=twitter&utm_content=1520248858, ,…",ldnmgmt,VP,https://twitter.com/ldnmgmt/status/970659507977236480,1520258235
"We are but a reflection of the company we keep. History written by the victors & though ,@,smithsonian, full floor after floor with enough books you could pile & stack til built yourself ladder to sky, never compare all people forgotten & nobody even remembered long enough know why.,pic.twitter.com/ng9H0PDfGC",NathanialBlaine,VP,https://twitter.com/NathanialBlaine/status/970552339416334336,1520232684
"I'm glad to sit on the back row, for I would rather be a servant in the House of the Lord than to sit in the seats of the mighty. -Alben Barkley ,@,VP,pic.twitter.com/E8wPnlRMr1",NathanialBlaine,"NathanialBlaine,VP,smithsonian",https://twitter.com/NathanialBlaine/status/970556948364984321,1520233783
"""If history repeats itself, women will needlessly die because of people like Mike Pence.""

Mike Pence says making abortion illegal saves lives. History proves the opposite.,https://www.,nbcnews.com/think/opinion/,mike-pence-says-making-abortion-illegal-saves-lives-history-proves-ncna853031, ,…",NikalKatha,VP,https://twitter.com/NikalKatha/status/970445780782845952,1520207278
"""His monologues are studies in insincerity, overcoming his personal belief in faith & family to project pride standing next to a man who embodies almost everything he disdains.""

The Oscar for Best Supporting Actor Should Go To Mike Pence,https://www.,thedailybeast.com/the-oscar-for-,best-supporting-actor-should-go-to-mike-pence, ,…",NikalKatha,"NikalKatha,VP",https://twitter.com/NikalKatha/status/970446333894168576,1520207410
"LIAR! McConnell shelved gun regulation debate, NRA says they still own you & Trump.

School safety 'the top priority of the Trump administration,' Pence says in Michigan,http://www.,mlive.com/news/index.ssf,/2018/03/school_safety_the_top_priority.html, ,…",NikalKatha,"NikalKatha,VP",https://twitter.com/NikalKatha/status/970446939845218304,1520207555
Best VP ever in my lifetime.  Praise God for this man.,Ridinandlookin,VP,https://twitter.com/Ridinandlookin/status/971967735046352896,1520570140
Please don’t sing. Your teeth might fall out!  Gross,Melissadobbins7,VP,https://twitter.com/Melissadobbins7/status/973773727195385856,1521000723
"#,StopAfrinGenocide",FarmanXoshnaw3,VP,https://twitter.com/FarmanXoshnaw3/status/973295963292033025,1520886815
When will this Congress and leadership begin acting as true Americans and stand up against the Russians?  Many of us are ready to fight the Russians and those who protect them!,Harley4Pax,VP,https://twitter.com/Harley4Pax/status/973321916957233153,1520893003
,TheRealEricL,VP,https://twitter.com/TheRealEricL/status/971718958159138818,1520510827
Hello Sr. Let me tell you all that I am one of those guys you talk about Sr. and right now I really need your help I have never receive any penny here at Honduras my Spin two rips were broken from last missions my phones 504 - 96898966 - 87511544 help me please,YaharcY,VP,https://twitter.com/YaharcY/status/972589616523087872,1520718409
Then tell our fake president to stop disrespecting the United States then,DonnyMcCaleb,VP,https://twitter.com/DonnyMcCaleb/status/973736469436170240,1520991840
As much as I love pro football I will stop watching because of the disrespect to our flag our country and our military.,MarkRFlick1,VP,https://twitter.com/MarkRFlick1/status/971741851920236544,1520516286
Love this picture!  ,RealKevinTheEmu,VP,https://twitter.com/RealKevinTheEmu/status/983491657042681857,1523317658
"Pay tribute to your patriotism even in Korea, but I hope you like and try the leaders of the many",roseydj6700,VP,https://twitter.com/roseydj6700/status/972645925687472128,1520731834
Your president doesn't even know the words. You're both frauds..,marlowjones,VP,https://twitter.com/marlowjones/status/971893355792781314,1520552407
And kneeling during the anthem is absolutely fine! Catholics kneel for the ultimate respect!,IrensHubbard,VP,https://twitter.com/IrensHubbard/status/977689784310169601,1521934383
"The star spangled banner yet wave. Boy Bye as soon as you and the TODARD took office, the damn stars stopped waving,",JAMEZSTAR,VP,https://twitter.com/JAMEZSTAR/status/972575729585094666,1520715098
Mr VP I JUST KNOW YOU THINK TRUMP IS AN IDIOT. I can tell,loner1958,VP,https://twitter.com/loner1958/status/972155913518964736,1520615006
pic.twitter.com/eppTzuh7rd,AaharSk,VP,https://twitter.com/AaharSk/status/971860065547202560,1520544470
Shut up Cunt,wiganator,"VP,JohnMol80079412",https://twitter.com/wiganator/status/976226920248631296,1521585609
"That’s  a bit contrived you maybe the president soon and the buck will stop with you. You have a Whitehouse to rebuild, a nation to run week or not and the whole planet looking on to put a spin on the aftermath I pray your up to it.,pic.twitter.com/eLZw1672Oa",KeithFo74800227,VP,https://twitter.com/KeithFo74800227/status/983620235558379520,1523348313
"You don't. If you did, you would be an honest man",CalvinLary,VP,https://twitter.com/CalvinLary/status/976903826832855040,1521746996
Start by teaching Trump the words to the national anthem or does this only apply to Americans who look and have different beliefs than yours.  Ugh! Irritating.,iggybeartmb,VP,https://twitter.com/iggybeartmb/status/972997489690382336,1520815653
علام جميل ونجاح واقعي,kKQOTdgrU2ebyWz,VP,https://twitter.com/kKQOTdgrU2ebyWz/status/971732119620935680,1520513965
"Respect your flag. But that is all there is to respect about USA today. A narcissistic president, totally nuts. How can you support him? School shootings. Ban ,#,NRA,. Extremely class-divided sosiety. Thank you for the tax reforms ,@,realDonaldTrump, ,, ,#,Obamacare, ,#,dictatorship",Villbring,VP,https://twitter.com/Villbring/status/970081428661768192,1520120410
"No one died for a flag or national anthem people served and died to protect what makes USA great, diversity, inclusion, civil rights for all, equality,the same ideals that this administration is trampling on a daily basis.  Without those ideals the flag and anthem are meaningless",sandraquinones,VP,https://twitter.com/sandraquinones/status/973406254407221250,1520913110
Absolutely. Proud to be an American under the Red White and Blue. My hand on my heart with love and pride. Remembrance for those who gave everything for our Country and Freedom. Never forget from where you came...,KathleenNewhou6,VP,https://twitter.com/KathleenNewhou6/status/971585747110146049,1520479067
"So please tell me when are you going to start beliving, and living the words that come out of your mouth?",ZpPitts,VP,https://twitter.com/ZpPitts/status/971461212939735040,1520449376
Pence you hypocrite.  You should be doing something about the craziness of the government instead of sitting back waiting to be president.,sharonarlie,VP,https://twitter.com/sharonarlie/status/971423548592893952,1520440396
Thank You for loving this country the way you do. And Football millionaire crybabies need to learn The meaning of Respect.,sheriBeard15,VP,https://twitter.com/sheriBeard15/status/971422660684021762,1520440185
"https://www.,fiverr.com/nurulhudalasko,r/do-web-design-and, ,…",NIT_SOFT_SYL,VP,https://twitter.com/NIT_SOFT_SYL/status/971342134191079424,1520420986
"https://www.,fiverr.com/nurulhudalasko,r/do-web-design-with-using-adobe-photoshop-html-css, ,…",NIT_SOFT_SYL,VP,https://twitter.com/NIT_SOFT_SYL/status/971342109243396096,1520420980
Where is Mother? Are you allowed to be alone in a room with a flag without her?,barriebates,VP,https://twitter.com/barriebates/status/971338363465854976,1520420087
"Robert F Westerman went to schoo in Indiana for two years andcDiscovere and Song "" God Bless America "" Song performed byvSenator From Hoosier State N I E i enjoyef Casa Grande Dispatch for Fur trader and American Publisher Larry Flynt",ROBERTFWESTERM1,VP,https://twitter.com/ROBERTFWESTERM1/status/971289815298736128,1520408512
"love it so much you'll pull a media stunt that cost American taxpayers hundreds of thousands of dollars. disgusting.,http://www.,businessinsider.com/how-much-did-p,ence-trip-cost-colts-49ers-2017-10, ,…",SJNoffsinger,VP,https://twitter.com/SJNoffsinger/status/971249603684306944,1520398925
God bless America!,mgazette,VP,https://twitter.com/mgazette/status/971247923731337217,1520398524
"God bless America and the Patriots♡
Bless you, Pence!  ^^",TegukiArmy,VP,https://twitter.com/TegukiArmy/status/971197690049540096,1520386547
Why don't you start respecting the Constitution?,Tomtomcov37,VP,https://twitter.com/Tomtomcov37/status/971159258891980801,1520377385
"Why do we have to respect the flag to honor veterans?  Doesn't the flag belong to all of us?  Surely, you don't have to be willing to take up arms to be a true patriot (note that the current President is not a veteran).",jtphalen,VP,https://twitter.com/jtphalen/status/971146583285862401,1520374363
God bless you Mr vice president keep doing great things !,js94087,VP,https://twitter.com/js94087/status/971097207679193088,1520362591
I always talk to Jesus,JenniferKShaff1,VP,https://twitter.com/JenniferKShaff1/status/971094851994480640,1520362029
"I agree with you Mr. VPOTUS, but please don’t ignore those brave Americans who risk their wellbeing and lives to stand up to the atrocities perpetrated upon them by certain sectors of our own society!",uclakix,VP,https://twitter.com/uclakix/status/971070373612740608,1520356193
"https://www.,cnn.com/2018/03/05/pol,itics/michael-cohen-stormy-daniels/index.html, ,…",Raptor_100milem,VP,https://twitter.com/Raptor_100milem/status/971025885943009282,1520345586
"Respect is earned.,pic.twitter.com/RVUYi1y9Af",angieesslinger,VP,https://twitter.com/angieesslinger/status/971014602296348672,1520342896
"Many of those Americans fighting for your freedom happen to be gay and fought as ,#,LGBTQ, ,#,ProudAmericans, ,#,StopTheHate, yet your bigotry shows you are everything but grateful to them. ,#,DoSomething, ,#,StopSpeakingHate, ,#,WeAreAllAmericans",BeBrave4Life,VP,https://twitter.com/BeBrave4Life/status/971002075910955008,1520339909
God bless America.,JudyBalderston,VP,https://twitter.com/JudyBalderston/status/970995119339003904,1520338251
"https://www.,fiverr.com/nurulhudalasko,r/do-web-design-and, ,…",NIT_SOFT_SYL,VP,https://twitter.com/NIT_SOFT_SYL/status/970980787297312768,1520334834
"https://www.,fiverr.com/nurulhudalasko,r/do-web-design-with-using-adobe-photoshop-html-css, ,…",NIT_SOFT_SYL,VP,https://twitter.com/NIT_SOFT_SYL/status/970980183934029824,1520334690
Teach POTUS the words,Poodlemom4ever,VP,https://twitter.com/Poodlemom4ever/status/970855148108091394,1520304879
Thank you for bringing this to our attention Mr. Vice President! God Bless you and family Sir!,Pcnw45Mike,VP,https://twitter.com/Pcnw45Mike/status/970843297798172673,1520302054
"That the havoc of war and the battle’s confusion
A home and a Country should leave us no more?Their blood has wash’d out their foul footstep’s pollution.
No refuge could save the hireling and slave from the terror of flight or the gloom of the grave,
And the star-spangled banner",tonygunz266,VP,https://twitter.com/tonygunz266/status/970824389745836033,1520297546
pic.twitter.com/qmkqSGWTXI,Rauthschild,VP,https://twitter.com/Rauthschild/status/970821322015166464,1520296814
Amen,kevin_musgrove3,"VP,ConserValidity",https://twitter.com/kevin_musgrove3/status/970808437130125312,1520293742
"The word, “nation,” requires no capitalization. Just a quick lesson.  

I believe that honoring our great nation does not require knee-jerk, thoughtless lip service to a song but commitment to the values we have always stood for - freedom, justice, compassion, equality and truth.",Mjankaus,VP,https://twitter.com/Mjankaus/status/970808078542262272,1520293657
"The Nuremberg people paraded the flag quite effectively in the 30’s.  Remember that humbling fact, when the jokers parade the American flag in sports arenas",johnsan62332459,VP,https://twitter.com/johnsan62332459/status/970802817303592960,1520292402
"Yay, more self aggrandising and posturing, paying lip service to totems and symbols, your words fall like ash from your mouth, there is no substance, just more vacuous meanderings from an unquiet mind.",Kara_Jane_Adams,VP,https://twitter.com/Kara_Jane_Adams/status/970794617783439360,1520290448
"Agree.  Jimi Hendrix rendition, still my favorite.",momgrom,VP,https://twitter.com/momgrom/status/970794458240315398,1520290409
you do not make me proud.  you're kinda creepy,ginawynn2,VP,https://twitter.com/ginawynn2/status/970793013021691909,1520290065
"Let’s honor the Kurds’s sacrifices in defending freedom and fighting ISIS on behalf of humanity/world. Turkey is launching an attack against Kurds in Afrin, Northwest Syria.Let’s not turn our back on the Kurds - Kurds have been betrayed too many times. ,#,Afrin, ,#,FoxNews",Kurds_Syria,VP,https://twitter.com/Kurds_Syria/status/970789194258792448,1520289154
I wish you would respect women's rights as much as you do your claim to the flag.,DBublak,VP,https://twitter.com/DBublak/status/970786128373612544,1520288423
"... patriotic Pence should not be enabling ,@,realDonaldTrump, if his patriatism is truly purposeful!",Kccmbl,VP,https://twitter.com/Kccmbl/status/970784663844384771,1520288074
"@,mike_pence, we protect our flag more than our people. Where are the Christians?,https://,features.propublica.org/drug-prices/hi,gh-cost-drugs-the-price-they-pay/, ,…",FirstLadyDrumpf,VP,https://twitter.com/FirstLadyDrumpf/status/970784340014784513,1520287997
Absolutely and all y'all in the NFL should be the first to stand and honor our flag look what they make for a living and couldn't in no other country..who the hell they think they are disgracing our flag.... unbelievable....Trump campaign keep up the great work...i am so proud,mckai03,VP,https://twitter.com/mckai03/status/970778137767436289,1520286518
"#,USA, PROUD...Great job VP PENCE",pepie56,VP,https://twitter.com/pepie56/status/970769924049301506,1520284560
This was composed by racist just like u & trump,Josephg44217147,VP,https://twitter.com/Josephg44217147/status/970767960238309376,1520284092
"Sometimes I think you old-timers prefer this preening idolatry to the flag over proper veneration and reverence to the actual Law of Our Constitution.  No, not sometimes, not even often; it's a constant vice you present as virtue.",ForestAflame,VP,https://twitter.com/ForestAflame/status/970762868189777921,1520282878
AMEN,jenarson57joy,VP,https://twitter.com/jenarson57joy/status/970755821972967424,1520281198
"A great story about our anthem is ready to be told. ,@,glennbeck, 
,@,MarkBurnettTV, (script available)",ChipLane,VP,https://twitter.com/ChipLane/status/970749754350202880,1520279751
Yes respect it by embracing our poor immigrants and our DREAMERS!!!,roybal_elaine,VP,https://twitter.com/roybal_elaine/status/970739166341300224,1520277227
Just your being in office is disrespect to the flag.,Mysticdiva,VP,https://twitter.com/Mysticdiva/status/970735178963353600,1520276276
pic.twitter.com/3yCx140kDl,TrefaultPaulina,VP,https://twitter.com/TrefaultPaulina/status/970733742938456064,1520275934
I was surprised you were so close to.NK sister and said nothing or looked at her.  Leader Moon had a good handshake with her. ,usvtoday,VP,https://twitter.com/usvtoday/status/970728673794981889,1520274725
"You would do far better to respect the Constitution, the will of the majority, truth, science, and ethics.  Pandering over symbols while trampling the underlying principles is painfully hypocritical. ,@,realDonaldTrump,  ,#,UnPresidented",perfman,VP,https://twitter.com/perfman/status/970723921757638657,1520273592
LOL like we respect the guy in the WH? ,Gixxer1ryderJr,VP,https://twitter.com/Gixxer1ryderJr/status/970721327870038016,1520272974
"We need to remain the land of the free...
,#,NoBordersCCW, ,#,2A, ,#,2AShallNotBeInfringed",NoBordersCCW,VP,https://twitter.com/NoBordersCCW/status/970720206346571776,1520272706
"https://,tanyagranicallen.com,/, ",drago_ostojic,VP,https://twitter.com/drago_ostojic/status/970718126462652416,1520272211
Hypocrite,miamihigh09,VP,https://twitter.com/miamihigh09/status/970714833485262849,1520271425
Amen,lightning_grl,"VP,CarlCLBInsure1",https://twitter.com/lightning_grl/status/970710367629402112,1520270361
"Time for a change.  The flag has the Pkedge of Allugence.  The anthem should be for the land and the people.  America the Beautiful gets my vote.  Its not about war, its about brotherhood.",Bridge1125,VP,https://twitter.com/Bridge1125/status/970700754372759557,1520268069
How great can iy be??? only took 100+ years for republicants to agree to it,MasterKa2,VP,https://twitter.com/MasterKa2/status/970687416221782017,1520264889
We don’ t need your lecture on the Flag. We all know its except those who wear it. Find that disgusting.,foreveringrid,VP,https://twitter.com/foreveringrid/status/970687275402190849,1520264855
"Would really like to have schools teach kids how to respect the flag, many Americans don’t know the rules!",Aungiexyz,VP,https://twitter.com/Aungiexyz/status/970674436952219648,1520261794
"To Be Honest? ,@,VP, 
YOU scare Me More than My Brother because 
YOU could FOOL anyone with this Picture because 
NOBODY CAN BE THAT PERFECT ,@,realDonaldTrump, 
You Remind Me of My Mother ,@,marthamaccallum, 
She LOOKS PERFECT On the Outside ,@,Aphrodite_Jones, 
but My Mom is a KILLER ,@,VP,pic.twitter.com/lBX7aPXN0y",crampington,VP,https://twitter.com/crampington/status/970671643038121984,1520261128
"To be Honest ,@,VP, ? 
All You Need Now? is Some kind of Political Scandal Like 
""Getting Caught having Illicit Sex with a
 Crack Queen""
and America would ""Get Over It"" ,@,GigiGraciette, 
and Think of YOU as a HUMAN ,@,glenwalkerktla, 
because ""Right Now"" ,@,VP, U R Just 2 ""Squeeky Clean"",pic.twitter.com/kgvc2xEGoc",crampington,VP,https://twitter.com/crampington/status/970670011063836672,1520260739
