content,username,replyto,permalink,time
"https://www.,yahoo.com/news/229-repub,licans-voted-last-night-200506946.html, ,…",TammyDignan1,VP,https://twitter.com/TammyDignan1/status/970659430491672576,1520258216
That filthy picture of Trump feeling you up is completely offensive. What is wrong with you.,HaroldChasen1,VP,https://twitter.com/HaroldChasen1/status/970658656877535235,1520258032
I agree VP Pence! Thank you for bringing Christianity back to the White House!,pamlay9,VP,https://twitter.com/pamlay9/status/970653375124697089,1520256773
God Bless you VP Pence! It’s wonderful to have leaders who believe in Jesus!,pamlay9,VP,https://twitter.com/pamlay9/status/970652663829409792,1520256603
"https://,twitter.com/AmericanMex067,/status/970114136876052481?s=19, ,…",peinadojair1,VP,https://twitter.com/peinadojair1/status/970649416838328320,1520255829
My family has done more good fighting for this country then you will ever accomplish in the White House.,Sowolu,VP,https://twitter.com/Sowolu/status/970647243157065729,1520255311
"I love this snapshot, Sir",MargaretMcgui16,VP,https://twitter.com/MargaretMcgui16/status/970630505363275776,1520251320
And now it's our nation's embarrassment with the regime what's in office now,normanbjacobs,VP,https://twitter.com/normanbjacobs/status/970626917278932994,1520250465
good,Cherinor2,VP,https://twitter.com/Cherinor2/status/970623060113018880,1520249545
"You have no heart, so not sure what you are putting your hand over...possibly “mother’s” granny panties? Putin’s Phone #?  Bribe money for a porn star%? Oh well. Maybe it’s you clutching it before u kick off. ",runglo13,VP,https://twitter.com/runglo13/status/970616622703669253,1520248010
"Also on this Special Day in 2017.  Manafort took out a loan against the Manhattan property he bought with funds from an offshore account, effectively giving him over $3 million in tax-free liquid income.",ProudArican18,VP,https://twitter.com/ProudArican18/status/970614895237574657,1520247598
You tweet this while your are second in command of a regime that hates the constitution.,ProudArican18,VP,https://twitter.com/ProudArican18/status/970613961786908672,1520247376
"Isn't this idolatry? ,@,VP, ,#,Evangelicals",HenrietteLevy,"VP,kambiz5",https://twitter.com/HenrietteLevy/status/970578221203943424,1520238855
pic.twitter.com/6FfECVWNdv,11mrmike,VP,https://twitter.com/11mrmike/status/970571923510956035,1520237353
pic.twitter.com/nHFRNblSu9,11mrmike,VP,https://twitter.com/11mrmike/status/970567492170022912,1520236297
You are truly disgusting.,MikeFinnesagula,VP,https://twitter.com/MikeFinnesagula/status/970564022683815936,1520235469
"God Jeová bless América,God Jeová bless the world,in God Jeová we trust,God Jeová bless you all brothers and sisters true believers and all the children of the world.
God Jeová bless and Godspeed!
Have a nice week!",DavidFe57873696,VP,https://twitter.com/DavidFe57873696/status/970559964501696512,1520234502
".,@,VP, Where exactly do you think your heart is? I mean, I  know human anatomy must be confusing for you and all, but your aim is bit off.",MayraMM,VP,https://twitter.com/MayraMM/status/970557970953089024,1520234027
And honoring veterans,Mohamme40188744,VP,https://twitter.com/Mohamme40188744/status/970556689631113216,1520233721
"unless you are a Democrat, in which case you get urge to reach for lighter when see US flag....",statisticsphd,"VP,geopolytica",https://twitter.com/statisticsphd/status/970554020724183040,1520233085
"The VA Clinic at Camp Atterbury, Indiana needs additional staffing in all areas, but especially Additional Mental Health Staff. A Sleep Medicine Clinic and Dermatology Clinic is also needed.",Indymatt25,VP,https://twitter.com/Indymatt25/status/970548428500619264,1520231751
I agree with VP Pence. Americans should respect our country's flag. I am a proud American again because of our President Trump and VP Pence.,oakleaf51,VP,https://twitter.com/oakleaf51/status/970540348090052608,1520229825
"Hey, speaking of respecting our nation, ,@,vp, why were you handpicked by Manafort?  We all know Manafort wasn’t working for the US. So when Trump was on the plane and got swayed from Christie to you by Manafort, what was that about?  ",InWrongTimeline,VP,https://twitter.com/InWrongTimeline/status/970531979958603776,1520227830
I love this humble man !,cynthiagunkle,VP,https://twitter.com/cynthiagunkle/status/970529189752385536,1520227165
Errrr no. That's how it works in dictatorships not democracies.,stewartmandy,VP,https://twitter.com/stewartmandy/status/970527602170650634,1520226786
Stick a sock in it mikie the woman hater.,hikerpal,VP,https://twitter.com/hikerpal/status/970524204142612480,1520225976
,Limliefung1,VP,https://twitter.com/Limliefung1/status/970521985833824256,1520225447
Hey 47,DGritty2,VP,https://twitter.com/DGritty2/status/970518211740479489,1520224547
You are great Vice President mike pence ,SDitosto,VP,https://twitter.com/SDitosto/status/970510423522009088,1520222690
"Knock, Knock, Who's There? Just a little subpoena for you, Mike Pence. Bad boy, aligned with Trump. Not going so well. Not going to heaven, going to jail instead.",dogswuvwabbits,VP,https://twitter.com/dogswuvwabbits/status/970505666765799424,1520221556
"What about veterans suffering from homelessness, depression, PTSD? How about staying to the Pledge.....ONE NATION UNDER GOD INDIVISIBLE WITH LIBERTY AND JUSTICE FOR ALL!",revtlhart,VP,https://twitter.com/revtlhart/status/970500664215384064,1520220364
God bless America! M.A.G.A.,bgrrn63,VP,https://twitter.com/bgrrn63/status/970497566218620928,1520219625
"Well, start doing that instead of helping the Russians and the Koch brothers.",Jack20915898,VP,https://twitter.com/Jack20915898/status/970492917730062337,1520218517
God bless you Pence,TerryErwin6,VP,https://twitter.com/TerryErwin6/status/970490465819746304,1520217932
You are a disgraceful weasel,deborahwoodpub1,VP,https://twitter.com/deborahwoodpub1/status/970489480175128577,1520217697
"Why don't all you unhappy people leave? I promise we won't hinder you. 
President Trump, VP Pence, you are appreciated by many. God bless!!!",Miller4Janice,VP,https://twitter.com/Miller4Janice/status/970486342353412101,1520216949
"right on, my dad saw to wars in the navy",HooverBart,VP,https://twitter.com/HooverBart/status/970484473983848448,1520216503
"""We don't make films like 'Call Me By Your Name' for money. We make them to upset Mike Pence.""",CLEGoBigBLUE,VP,https://twitter.com/CLEGoBigBLUE/status/970479747284205568,1520215377
pic.twitter.com/PB74zdjL8M,manoaislander,VP,https://twitter.com/manoaislander/status/970477964159676416,1520214951
pic.twitter.com/jegyXwk0WO,manoaislander,VP,https://twitter.com/manoaislander/status/970477816247590912,1520214916
pic.twitter.com/7PqiXS6PhR,manoaislander,VP,https://twitter.com/manoaislander/status/970477755895726080,1520214902
"..,https://,twitter.com/Tattoobear/sta,tus/970453462138998784, ,…",Tattoobear,"VP,Sweethonezty07",https://twitter.com/Tattoobear/status/970473791666249728,1520213957
"Let us also not forget what we fought for...all our rights, not just the ones that you like!",SSlaski,VP,https://twitter.com/SSlaski/status/970473249367908352,1520213827
"This tells us the following:

-Mueller knows a lot we don't know
-Investigation is not ending anytime soon
-Flynn, Papadopoulos and Gates interacted with many of the people listed & those 3 are cooperating with Mueller
-Perhaps there is another reason Hope Hicks suddenly resigned",DougFre18701244,VP,https://twitter.com/DougFre18701244/status/970472939349884929,1520213753
How much time did you or Trump spend in the military? Talk is cheap.,FenderBenderTN,VP,https://twitter.com/FenderBenderTN/status/970470079862312961,1520213072
Then why do we still not say this in school daily,ruda981,VP,https://twitter.com/ruda981/status/970469740413161472,1520212991
"Amen, Mr. Vice President, and God bless you and yours",SCOTTBr71265098,VP,https://twitter.com/SCOTTBr71265098/status/970467430693818369,1520212440
"Salute,pic.twitter.com/yq19l0oKD2",Commonsenseterr,VP,https://twitter.com/Commonsenseterr/status/970465350272897024,1520211944
you & trump lead the USA to destroy,Sortex126,VP,https://twitter.com/Sortex126/status/970463990458417153,1520211620
"No, seriously  ...,pic.twitter.com/CLIq5MqfNu",yonagzi,VP,https://twitter.com/yonagzi/status/970463144110886912,1520211418
Like the trade act,dianamoon67,VP,https://twitter.com/dianamoon67/status/970462104728883210,1520211170
"Something you want to tell us?,pic.twitter.com/VXDBDSIgly",kim_knerl,VP,https://twitter.com/kim_knerl/status/970460334061371393,1520210748
"https://,youtu.be/qQruDaf7bKs, ",kim_knerl,VP,https://twitter.com/kim_knerl/status/970460193514405888,1520210715
Your boss doesn’t know the words to it.,ChristenSolberg,VP,https://twitter.com/ChristenSolberg/status/970456408175996928,1520209812
Great song if you are a racist.,ChristenSolberg,VP,https://twitter.com/ChristenSolberg/status/970456063043686406,1520209730
Why don’t you take you Star Spreckled Banana and shove it!,JohnAStewart7,VP,https://twitter.com/JohnAStewart7/status/970451587326926849,1520208663
Love your leadership and your loyal support to our President Thank you Mr Pence!,EllenDeeBrown,VP,https://twitter.com/EllenDeeBrown/status/970450013624197120,1520208287
To God be the glory for our great nation. It's not called old glory for no reason. We are a nation blessed of and by God our Creator,TanyaMi02767208,VP,https://twitter.com/TanyaMi02767208/status/970447579694682112,1520207707
The Dems are certainly a bunch of sour name callers. Interesting theme for the left this year is guilty until proven innocent.,cvpadre,VP,https://twitter.com/cvpadre/status/970446400877047808,1520207426
