content,username,replyto,permalink,time
I don't care how complicated the taxes are. That's what I hire a professional tax preparer for. At the end of the day my taxes are going up under your plan. The only thing historic is how greedy you are,jaymills2541,VP,https://twitter.com/jaymills2541/status/986635070193594368,1524067106
"If you really want to cut taxes, cut the IRS. We don’t need them. Corporations don’t pay taxes on top of the taxes they already pay through tax loopholes and incentive plans why should the people not be awarded the same luxury & if I pay for insurance I should be able to claim it",RenewableKyle,VP,https://twitter.com/RenewableKyle/status/986633486902726656,1524066728
OK...,josemenezeselv1,VP,https://twitter.com/josemenezeselv1/status/986624965905707008,1524064697
Who is the YOU?  are you speaking only to the rich?  You culpable human. Your blind trust in this POTUS is just incredible.,itsmark74,"VP,realDonaldTrump",https://twitter.com/itsmark74/status/986615073148829697,1524062338
"jail for you pence, fake, a  judas of christianity",wilwhite1,"VP,realDonaldTrump",https://twitter.com/wilwhite1/status/986614459656531969,1524062192
I bet you want to thank Donnie! Don’t ya Mikey? The rich get richer! Sick to my stomach! Hey Mikey! Get Donnie to release his taxes. That would make me happy ,readbrown,"VP,realDonaldTrump",https://twitter.com/readbrown/status/986609557722906625,1524061023
"I cannot wait until 2025 when my taxes go up again while corporations that do not invest in their employees continue to benefit. ,#,MAGA, ,#,TAXES",96itsallforyou,VP,https://twitter.com/96itsallforyou/status/986605901879693312,1524060151
"BY NEXT YEAR USA Will be BANKRUPT under traditional Republicant Economic Policies, trade wars, pandering to Spank Me's Lover Vlad and paying Trump Enterprises for Trump travel to Margo Samonella to meet porn stars for sex",MasterKa2,VP,https://twitter.com/MasterKa2/status/986600314437537793,1524058819
"Exactly 8 years since obamas fake making home affordable program lost me a home the Trump/Pence economy allowed us to buy our forever home. Even with my insurance raising from 172 a month to now over 1300.,pic.twitter.com/VDnTRnpelo",Bptuneman1,"VP,POTUS",https://twitter.com/Bptuneman1/status/986598744916480001,1524058445
Putting words in CAPS doesn't make them FACTS,JediRex13,VP,https://twitter.com/JediRex13/status/986591601655975936,1524056742
"Pennies for most Americans, billions for the wealthy. Turns into a tax hike for the middle class in a few of years. The only question: will it be paid for by slashing social security, or will it stay on the credit card and burden future generations?",realTakeADump,"VP,POTUS",https://twitter.com/realTakeADump/status/986590407676104704,1524056457
Have enjoyed showing clients the figures and tax rates. So far I’ve had no one say they don’t want to pay less taxes.,MidKidSteward,VP,https://twitter.com/MidKidSteward/status/986589434178162688,1524056225
Can you prove this?  Run your 2017 taxes using the ‘new ‘ tax filing system and share the results. I think you will find you might be wrong,SJB6162,"VP,realDonaldTrump",https://twitter.com/SJB6162/status/986587078556205057,1524055664
"Yes, and then my kids will have to work two jobs to pay back China for the money USA borrowed to pay for the cuts.",DarthKinger1971,"VP,realDonaldTrump",https://twitter.com/DarthKinger1971/status/986579041787392001,1524053747
The withholding rates have changed based upon what you claim as deductions. Carry on.,AgtSmith2,VP,https://twitter.com/AgtSmith2/status/986578173390413829,1524053540
"I pray you make wise decisions. I hope you really are the true Christian you say. People who know you said, you are a good man. Please don’t sell us out. I would be disappointed.",Debbie38986427,"VP,realDonaldTrump",https://twitter.com/Debbie38986427/status/986563911674748928,1524050140
"#,TaxationIsTheft",KetoSpeculator,"VP,realDonaldTrump",https://twitter.com/KetoSpeculator/status/986563110621405185,1524049949
Creates more jobs because many have to work two jobs to support a family. More low paying jobs does not equate to quality jobs that allow a family to support themselves.,koleary940,"VP,realDonaldTrump",https://twitter.com/koleary940/status/986555865091026944,1524048222
pic.twitter.com/NSW0iCe99K,RealDysert,VP,https://twitter.com/RealDysert/status/986534973095133184,1524043241
"$1.T Omnibus :-(
Unthinkable
Tragic",patriotmom2911,"VP,Doodisgirl",https://twitter.com/patriotmom2911/status/986519065702424577,1524039448
Thanks you Mr Vice President,VarnieSonny,VP,https://twitter.com/VarnieSonny/status/986518337625710593,1524039274
Thank you,ofekorgad,"VP,realDonaldTrump",https://twitter.com/ofekorgad/status/986493586098311168,1524033373
"But if you simplify the tax code, people won't need H&R Block or Turbo Tax and those workers will lose their jobs. Think about that.",BPMcNe,"VP,realDonaldTrump",https://twitter.com/BPMcNe/status/986485991866339328,1524031563
It makes the baby Jesus sad when you lie ,jeremygaffer,"VP,realDonaldTrump",https://twitter.com/jeremygaffer/status/986453860645351424,1524023902
Then why have I been unemployed for four months?,Ellahbie,VP,https://twitter.com/Ellahbie/status/986448588136906753,1524022645
Bravo ! Veniți și la noi să le arătați adevarata democrație!,PopescuMARGARE2,VP,https://twitter.com/PopescuMARGARE2/status/986439458353500166,1524020468
"I also lose 5k per year in extra taxes u now have to pay as a middle class citizen.

The break is for the top 1% which proves why senator Cruz is retiring. Cruz finally got his huge tax cut and now can retire with all of that extra money he keeps each year.

,#,taxscam",Benchcrew114,"VP,realDonaldTrump",https://twitter.com/Benchcrew114/status/986437526075379712,1524020007
"Great! Another liar! I hope all of you get voted out! Talk about draining the pond, all that's left is the big fish eating the little fish!",RobertALopez137,"VP,realDonaldTrump",https://twitter.com/RobertALopez137/status/986433769304412160,1524019112
"Not really IRS had to extend deadlines and then there are all the folks and Corps that file for extensions.  ,#,detaisDetails",kmaertzig,"VP,realDonaldTrump",https://twitter.com/kmaertzig/status/986431482142117888,1524018567
Bull Shit and we all know it,harlowjean10,"VP,realDonaldTrump",https://twitter.com/harlowjean10/status/986430619721777152,1524018361
"I call bullshit. ,#,TAXATIONISTHEFT",PrepperCarolina,VP,https://twitter.com/PrepperCarolina/status/986428086941036544,1524017757
pic.twitter.com/fCbUpPAz1t,Bonnievee2017,"VP,Telitabobita",https://twitter.com/Bonnievee2017/status/986424620604690434,1524016931
And the Demo rats are trying to use it to for campaigning,happy_daystt,VP,https://twitter.com/happy_daystt/status/986424259433017344,1524016844
"#,Blocking, our voices to help ,#,CrookedHillaryGang, follow- 20 trillion leads to the cans they been kicking as they rob America blind debt is a crime to your kids ,#,ZeroTaxes, consumer only tax Sin taxes 
,#,NoTaxIsFair, on the poor 50% of America has no money ,#,zero, in bank broken ,#,kag,pic.twitter.com/x68R5QjUb4",MadeInAmericaO,"VP,realDonaldTrump",https://twitter.com/MadeInAmericaO/status/986424184774578182,1524016827
"#,lyingtrump",MitchMullins6,VP,https://twitter.com/MitchMullins6/status/1012867857917587456,1530321490
Liar!  Just like T(rump).,gray_place,VP,https://twitter.com/gray_place/status/1008113681220161536,1529188006
"Are you sure about that, its actually benefit you rich folks, how sad",ArebiBassey,VP,https://twitter.com/ArebiBassey/status/1005599200313307137,1528588507
:),Nomistakestoday,VP,https://twitter.com/Nomistakestoday/status/1004009566353403904,1528209508
I have more respect for President Trump & Vice-President Pence than the past 30 presidents. This game of promising Americans the moon and not delivering on campaign promises does something to the hearts of trusting Americans. President Trump has done more to show true integrity.,SimontonMarcia,"VP,realDonaldTrump",https://twitter.com/SimontonMarcia/status/1003482460158558209,1528083836
pic.twitter.com/UGekQMExs6,adamwhite78,VP,https://twitter.com/adamwhite78/status/1001907036219621378,1527708226
Bullcrap!,BarbaraWalsh12,VP,https://twitter.com/BarbaraWalsh12/status/1001453809107984386,1527600168
"It’s still complicated and out dated, needs lots of fixes.  What happened to single card for most? ,#,rushedtaxlawbotched",yiatroscoeus,VP,https://twitter.com/yiatroscoeus/status/1000738939676717056,1527429730
"How long do I have to wait for these ""tax cuts"" to take me from the poverty level to the lower middle class level. I will not see any kind of increase in my take home pay because, the cuts only help the upper middle class and the rich.",Squirre60177170,"VP,realDonaldTrump",https://twitter.com/Squirre60177170/status/1000396873318981633,1527348175
Bull,davidfancher11,VP,https://twitter.com/davidfancher11/status/998742270265438208,1526953687
Won’t have to file there won’t be anything to get back due to your giveaway to your rich cronies,davidfancher11,VP,https://twitter.com/davidfancher11/status/998742069865779205,1526953639
"Liar. Not historic. Most importantly, not permanent for the working class. Our taxes will start going back up immediately while the super wealthy and corporations will reap benefits for years to come. Thanks for nothing, you sycophant!",rennerdavis,VP,https://twitter.com/rennerdavis/status/998424600324157445,1526877949
Nope. It won’t do any of those things for the average American.,byrnelax13,"VP,realDonaldTrump",https://twitter.com/byrnelax13/status/997515951187865603,1526661310
Why is it that with all our technology we can’t build cars that get more then 25 miles to a gallon?   Except for money.  Gouging at the pump right before payday.  Your sucking the life out of us. My 2010 gets 15 mpg pathetic.  My 68 got better then that !,uneasyrider62,VP,https://twitter.com/uneasyrider62/status/994908963417346049,1526039756
"The ones of us who protect your rights as Americans and voted you in ! You need to do something that makes a real difference in our and our children’s lives , not tomorrow or next year. We need help now ! Now we can’t fill up for under 100 bucks!",uneasyrider62,VP,https://twitter.com/uneasyrider62/status/994907632925331458,1526039438
Tax cuts helped some   But 2000 bucks doesn’t help you put your child thru college! It won’t even pay for books. We make less them 100k and barely scrap buy. I’m a disabled vet. And can’t work. You wanna make a real difference! Veterans children college should be free!,uneasyrider62,VP,https://twitter.com/uneasyrider62/status/994905786110369794,1526038998
Why in the he'll do you think this bitch boss some great man you and this spy time Is running out did you say leader that BS,Waynewe29192888,VP,https://twitter.com/Waynewe29192888/status/994786123674157057,1526010468
Praise the Lord,TinaGarland7,VP,https://twitter.com/TinaGarland7/status/994726133106139139,1525996165
Please wake me up from this nightmaree!,ElvaMiranda1948,VP,https://twitter.com/ElvaMiranda1948/status/994424949417758720,1525924358
"Thanks to Trump, I'm paying $150 more in taxes this year than last, as a single retired taxpayer.Paid into the system for 50 yrs, and this yr is the most I've ever had to pay & I'm a retired 70 year old.I should be paying no taxes (had my share of paying out to taxes thru work.",ElvaMiranda1948,VP,https://twitter.com/ElvaMiranda1948/status/994424727912439808,1525924305
Thank you.,KarenV092477,VP,https://twitter.com/KarenV092477/status/994355933886246913,1525907903
"I Thank God everyday for this admin! You, Trump, Carson etc! ,#,MAGA",Tanna616,VP,https://twitter.com/Tanna616/status/994038802938253313,1525832293
simple the rich will make alot more money,hogan_edward,VP,https://twitter.com/hogan_edward/status/993745888408289281,1525762457
This is what we get as seniors we receive no help due to no funding as I am told here in ocala fl.,jane_duvjane,VP,https://twitter.com/jane_duvjane/status/993628847500414976,1525734552
pic.twitter.com/6V01GZwt1P,lachlan_leach,VP,https://twitter.com/lachlan_leach/status/993313571424690176,1525659384
You are an embarrassment.,lachlan_leach,VP,https://twitter.com/lachlan_leach/status/993313297461112832,1525659319
Deficit much?,doeghouse1,"VP,WhiteHouse",https://twitter.com/doeghouse1/status/993178816116871170,1525627256
"What tax cuts, Pence?? This was a middle-class tax HOAX!! You made sure all of your rich and greedy cronies made more money. The hell with the rest of the population! You and Liar-in-Chief are 2 peas in a pod. You say you’re a Catholic? Good ones would NEVER DO WHAT YOU DO! Shame",supernurse3085,VP,https://twitter.com/supernurse3085/status/992935847497519104,1525569328
"Only flat tax meets that criteria ,#,we, are NOT there yet! Learn something’s from Scandinavian countries! But politicians are there for the next election and NOT to simplify stuff!",Kardioking,VP,https://twitter.com/Kardioking/status/992894857340489733,1525559555
What a scam!!  The rich get richer and the middle class get screwed,gailbreitenfeld,VP,https://twitter.com/gailbreitenfeld/status/992730201661558786,1525520298
