content,username,replyto,permalink,time
"@,Jsilago, omg I'll be stopping by soon for the third book!!",sb135,,https://twitter.com/sb135/status/355583108805967873,1373612594
"@,Jsilago, I pay friends with hugs & my presence!",sb135,sb135,https://twitter.com/sb135/status/355584110783242241,1373612833
"@,sb135, this isn't candyland lol",Jsilago,sb135,https://twitter.com/Jsilago/status/355584273585143809,1373612871
"@,Jsilago, yes it is! The clouds are made of cotton candy & unicorns prance around ,#,dontcrushmyvibebro",sb135,Jsilago,https://twitter.com/sb135/status/355584558982365184,1373612939
"@,sb135, a day in the life if Shawn.......you high?",Jsilago,sb135,https://twitter.com/Jsilago/status/355584744576126977,1373612984
"@,Jsilago, Dick! No been getting off super early, early dinners mixed with my insomnia isn't a great combo & Only on Fridays! Haha jk",sb135,Jsilago,https://twitter.com/sb135/status/355585150991597569,1373613081
"@,sb135, lame. Off early is good!",Jsilago,sb135,https://twitter.com/Jsilago/status/355586006239551489,1373613285
"@,sb135, Roger that. That'll be one bottle of Dr pepper  for the third. Lol",Jsilago,sb135,https://twitter.com/Jsilago/status/355583883300974592,1373612778
