content,username,replyto,permalink,time
"Had a fallout tonight with acting German ambassador to UK. If your embassy hadn’t told Mrs Merkel we’d vote to Remain, she would have given Mr Cameron more concessions and we might well have voted to Remain. What’s your source for that, she asked. Your embassy, I replied.",afneil,,https://twitter.com/afneil/status/966454271800692736,1519255628
"Never thought I'd see the day a British Prime Minister would go around Europe with a begging bowl, but seen it twice now with Cameron and now Theresa May. Most Brexiteers have wanted out the EU for a long time it was never about little trinkets it was about WHO GOVERNS BRITAIN.",falgal,afneil,https://twitter.com/falgal/status/966465568672018432,1519258322
"The rich and shady? That's not likely to change, in or out of the EU.",fakenewsjunkie,"falgal,afneil",https://twitter.com/fakenewsjunkie/status/966474901271011328,1519260547
"When you can't change your own benefit laws or immigration laws without asking permission from a foreign entity you do not govern yourselves anymore ,what is the point of GEs when the people you vote for don't have the power & the people who have the power don't need your vote.",falgal,"fakenewsjunkie,afneil",https://twitter.com/falgal/status/966557531664519168,1519280247
"Benefits were a national competence, not an EU one.  The requirements were only to treat EU citizens the same whilst lawfully resident.",semaphorist,"falgal,fakenewsjunkie,afneil",https://twitter.com/semaphorist/status/966595839681531904,1519289381
"#,Clueless,pic.twitter.com/JbW9DgXp7J",falgal,"semaphorist,fakenewsjunkie,afneil",https://twitter.com/falgal/status/966601943853527040,1519290836
"We are farmers and I can tell you now we are not 100% controlled by the EU. Brexit is a disaster for farming,https://www.,theguardian.com/uk-news/2018/f,eb/18/farming-businesses-could-be-wiped-out-after-brexit-transition, ,…",abcpoppins,"falgal,semaphorist",https://twitter.com/abcpoppins/status/966730479427817473,1519321481
This was so avoidable. Why why why did Farmers not speak up before ref and why did they vote Leave? Surely even the most basic businessplan would have shown  the huge risks. And they could SEE at the time how Tories operate when it comes to public (non) funding.,Shieldmaid8,"abcpoppins,LePlanRex",https://twitter.com/Shieldmaid8/status/969344582495457281,1519944732
Many farmers wrongly believe tories will look after them. Don’t forget farmers are outside working not reading. They were tricked,abcpoppins,"Shieldmaid8,LePlanRex",https://twitter.com/abcpoppins/status/969350248639451136,1519946083
"Forgive me, but this seems to fall in with the ""Germany runs the EU"" trope. Is that a view to which you subscribe?",th3Derek,afneil,https://twitter.com/th3Derek/status/966454679487025152,1519255726
"He who pays the piper, calls the tune. Which nation is the EUs largest contributor? ",marwilk,"th3Derek,afneil",https://twitter.com/marwilk/status/966455023055048706,1519255808
I would still have voted Leave ,jjcwow,"afneil,GiftedNutter",https://twitter.com/jjcwow/status/966482864647954437,1519262445
"Agree. There was no way we would be offered anything other than token gestures, otherwise, all EU members would start demanding concessions.",DianaHarding7,"jjcwow,afneil,GiftedNutter",https://twitter.com/DianaHarding7/status/966540331822059520,1519276147
Dear God in Heaven! Is that true?,truemagic68,afneil,https://twitter.com/truemagic68/status/966633914604417025,1519298459
But but but I thought this vote was all about the mighty principal of sovereignty and not about Merkel & Co agreeing to caping the number of EU people migrating to UK?,whoputthishere,"truemagic68,afneil",https://twitter.com/whoputthishere/status/966634888748257280,1519298691
Makes no difference to me apart from the disingenuous behaviour of Germany & its politicians!,truemagic68,"whoputthishere,afneil",https://twitter.com/truemagic68/status/966637520242069505,1519299318
"Luckily disingenuous behaviour is something totally alien to UK politicians. Especially principled backstabbers like BoJo or Gove just to name a few. This childish finger pointing of ""you are all bad"" and ""we are all good"" is just pathetic and unworthy.",whoputthishere,"truemagic68,afneil",https://twitter.com/whoputthishere/status/966651573752430592,1519302669
Of course you are the paragon of virtue!,truemagic68,"whoputthishere,afneil",https://twitter.com/truemagic68/status/966711067614302210,1519316853
"Oh yes, of course, I am the virtue signalling snow flake for pointing out your hypocritical BS. Classic playbook. And I am sure George Sorros paid me to do it to betray this great country?",whoputthishere,"truemagic68,afneil",https://twitter.com/whoputthishere/status/966935189380251648,1519370288
Got it off your chest!  Well done you! Now on your bike and go and bully someone else!,truemagic68,"whoputthishere,afneil",https://twitter.com/truemagic68/status/966943332474769408,1519372230
"Nothing is ever our fault - blame the Germans! Pull the other one. Merkel conceded ""ever closer union"" would not apply to the UK. Massive. Cameron never celebrated it or sold it to voters. It was his call not to be positive about EU in *any* way & run Project Fear",AnthonyBarnett,afneil,https://twitter.com/AnthonyBarnett/status/966795462677270528,1519336975
Yeah that's just nonsense. Merkel/Germany could have offered a half way decent deal and Cameron could have sold it in the referendum campaign. But she/it didn't. So he couldn't. And here we are. Yet to the Remoaners Germany can do no wrong.,hrmp69,"AnthonyBarnett,afneil",https://twitter.com/hrmp69/status/966803032552984576,1519338779
"People forget that the Referendum was about accepting or rejecting the offer of changes that the EU gave to Cameron. The country decide that the EU was taking the pi**. The choices were - accept what the EU/Cameron wanted - or - Leave. The vote was close, but the consensus left.",johnatloynepark,afneil,https://twitter.com/johnatloynepark/status/966456736646352897,1519256216
The referendum was not about any changes Tony Cameron got. It was about a project the the public recognised but the elite were blind to. I suggest the remain group start waking up or admit they want NWO globalism. The public do not ,RayCornish2,"johnatloynepark,afneil",https://twitter.com/RayCornish2/status/966482331249754112,1519262318
"Tony who? - Whatever you think the referendum was about the simple fact is that David Cameron thought, wrongly, that he had negotiated a package that would persuade the public that staying in the EU would be a good deal.  He was wrong",johnatloynepark,"RayCornish2,afneil",https://twitter.com/johnatloynepark/status/966636685516787712,1519299119
"Frankly, I’d still have voted Leave as nothing Cameron might have achieved, theoretically in an ideal world with pan-sexual unicorns running wild, would have changed my mind. In real world, it’s anti-democratic ... so end of!",RoryMaw,afneil,https://twitter.com/RoryMaw/status/966480895917031429,1519261976
"Whatever Cameron came back with, i was always for leaving. Like many people I know. Cameron touring Europe begging for scraps just showed how far this country has fallen since we've been in the eu.",paul_boo6880,afneil,https://twitter.com/paul_boo6880/status/966456163477934080,1519256079
"I doubt Merkel would have moved much. Also, despite its influence, Germany could not have given concessions on its own. And on the UK‘s key demands regarding freedom of movement for workers there would have been substantial opposition in several member states.",RagnarWeilandt,afneil,https://twitter.com/RagnarWeilandt/status/966586806702657536,1519287227
"It’s not freedom of movement for workers - it’s freedom of movement for anyone, whether they have a job offer or not. That’s the problem!",MeadowsPhil,"RagnarWeilandt,afneil",https://twitter.com/MeadowsPhil/status/966588287795322880,1519287580
Sorry Phil but you are wrong. Should be sent back after 3 months if not in work as EU allows. Blame TM as H/sec for not doing her job.,DaveSmall46,"MeadowsPhil,RagnarWeilandt,afneil",https://twitter.com/DaveSmall46/status/966595433068933120,1519289284
Again you miss the point. Someone comes here and gets a job as a waiter 2 years and 364 days after arriving. In the meantime they are using resources such as NHS etc. I never minded if someone had a job offer to move to.,MeadowsPhil,"DaveSmall46,RagnarWeilandt,afneil",https://twitter.com/MeadowsPhil/status/966597048324837376,1519289669
I genuinely don't understand. I quote after 3 months and you talk about after 3 years?,DaveSmall46,"MeadowsPhil,RagnarWeilandt,afneil",https://twitter.com/DaveSmall46/status/966600273018966017,1519290438
Sorry misread. Nut I don't think you can be deported after just 3 months. Point me in the direction of where that is written,MeadowsPhil,"DaveSmall46,RagnarWeilandt,afneil",https://twitter.com/MeadowsPhil/status/966608651485175808,1519292435
"Phil, as I understand it Belgium enforces this rule and has done for some time. Also while I lived and worked in Holland I had to register and then report to the ""Aliens"" office every 6 mnths to confirm employment. Had we enforced this rule perception would be better.",DaveSmall46,"MeadowsPhil,RagnarWeilandt,afneil",https://twitter.com/DaveSmall46/status/966615499810500608,1519294068
Diane Abbott would never allow that here! Nor would “Liberal” element.,MeadowsPhil,"DaveSmall46,RagnarWeilandt,afneil",https://twitter.com/MeadowsPhil/status/966621519416905728,1519295503
I cannot think of any likely concessions that would have made any difference to my views and this has simply reinforced them. Clearly treated Cameron and the UK with contempt.,srimpey,afneil,https://twitter.com/srimpey/status/966458079633080320,1519256536
"Andrew, Germany is not the only country in the EU! Germany cannot alone give concessions. Also, where is your evidence this is why ,#,britain, voted to leave?",soechristian,afneil,https://twitter.com/soechristian/status/966455171059417090,1519255843
Germany clearly have the most power & influence in the EU,original_jaj,"soechristian,afneil",https://twitter.com/original_jaj/status/966457143128928263,1519256313
"Obama telling us we'd be ""at the back of the queue"" was a pivotal moment in the polls – with Cameron smirking like an idiot as he said it. Merkel's ""refugees welcome"" moment of madness and the immigration figures also conspired to tip the balance to Leave.",British_Ideas,"original_jaj,soechristian,afneil",https://twitter.com/British_Ideas/status/966457418828918785,1519256379
"Agree re Obama, had completely the opposite effect to which Cameron wanted, pretty sure he wrote line for Obama too, as Americans don't use the word 'queue' they use the word 'line'",original_jaj,"British_Ideas,soechristian,afneil",https://twitter.com/original_jaj/status/966457991192104961,1519256515
"Yes indeedy. Dave Cameron was ""too clever by half"", as my great aunt used to say!",British_Ideas,"original_jaj,soechristian,afneil",https://twitter.com/British_Ideas/status/966458502372839424,1519256637
"Yep Cameron has a lot to answer for. He should of remained impartial & he should then of remained pm, instead of running away & living us with this lame government",original_jaj,"British_Ideas,soechristian,afneil",https://twitter.com/original_jaj/status/966460280724213760,1519257061
"The German ambassador was hardly alone. The betting markets, currency markets, forecasting models, and most of the commentariat all expected a Remain. The opinion polls had it neck and neck until the very end, but were ignored",simonjhix,afneil,https://twitter.com/simonjhix/status/966577381321379840,1519284980
For once I agree Andrew. I spoke to several EU Ambassadors to ask UK during campaign and they all were incredulous at my statements there was a chance of a Leave Referendum outcome and were clearly briefing thrir governments that Remain was a sure thing sadly,CharlesTannock,afneil,https://twitter.com/CharlesTannock/status/966569849169367040,1519283184
"Why was it in Merkel’s gift to give concessions? Shouldn’t that have had to be agreed by all the other nations together?   
Doesn’t seem like much of a ‘Union’",NicholasRees1,afneil,https://twitter.com/NicholasRees1/status/966463226543185920,1519257763
Nothing in Brussels has to be accepted by the other 27. The commission do whatever suits Germany and then Germany with the poodle French tell the rest what is in their interest,RayCornish2,"NicholasRees1,afneil",https://twitter.com/RayCornish2/status/966483410817466368,1519262576
"Sure. Blame the Germans for our national act of self harm. Not deep rooted xenophobia, decades of tabloid lies about the EU and having one of the most politically misinformed populace in the OECD.",arabin_patson,afneil,https://twitter.com/arabin_patson/status/966459302692110336,1519256828
"Translation: Anyone who doesn't think the way I do are xenophobic racists who are too dumb to think for themselves. 

Who don't you think over statement again whilst taking a long walk on a short pier. ",Jane0brien,"arabin_patson,afneil",https://twitter.com/Jane0brien/status/966460976118689792,1519257227
"""taking a long walk on a short pier. ,""

Who said wit was a dying art?",arabin_patson,"Jane0brien,afneil",https://twitter.com/arabin_patson/status/966520627715715072,1519271449
"Interesting that it is Germany, not the EU, that is the real player here. The EU is essentially a German plaything, a cover for its well established historic desire to rule Europe. Anything that happens in the EU must be approved by Berlin.",Lemonyglemony,afneil,https://twitter.com/Lemonyglemony/status/966456897858662400,1519256255
Ridiculous. The brexit cult and the fixated anti-EU press would have considered even the moon too little if Cameron had brought it back from Brussels.,andyrome64,afneil,https://twitter.com/andyrome64/status/966481318044426242,1519262077
"You’re probably right.
I will always be against centralised taxation, defence & judiciary. Against closer integration & a United States of Europe.",sandieshoes,"andyrome64,afneil",https://twitter.com/sandieshoes/status/966568328461352961,1519282822
Of course I disagree but I am 100% sure that Andrew Neil agrees with you so his swipe at the German embassy is dishonest (as usual).,andyrome64,"sandieshoes,afneil",https://twitter.com/andyrome64/status/966606267757355009,1519291867
I'm glad that the Germans are so incompetent. At least we now get to leave rather than remaining in some  some half arsed Cameron deal dictated by the Germans.,UKOutOfEU1,"afneil,BungFuPanda",https://twitter.com/UKOutOfEU1/status/966486863639973893,1519263399
Sorry but when did Germany get voted the country in charge of the EU?,PrisonerPolitic,afneil,https://twitter.com/PrisonerPolitic/status/966475911062261760,1519260788
The moment they lost the war ,HIP_Energy,"PrisonerPolitic,afneil",https://twitter.com/HIP_Energy/status/966477299368554496,1519261119
"*this!*

And to think that the cost to Germany of keeping Greece in the zone is going to be €xxxbn lost behind the sofa.

(Oh and a generation of Greeks suffering near 50% unemployment or a decade working as waiters in Palmers Green.)",gary_worden,afneil,https://twitter.com/gary_worden/status/966462796295786496,1519257661
"#,BlackOpsKing,. And pray tell, how well were Greeks doing BEFORE they joined the EU? Historical context is important my friend.,pic.twitter.com/iK6Pv0Tg10",carlton_king,"gary_worden,afneil",https://twitter.com/carlton_king/status/966472505148964864,1519259976
"Your image appears to have no relevant connection. It's not easy to deduce & frankly - its a chore too far.

I'm pretty sure the Greeks were, on the whole, in less of a pickle than they are presently. Notwithstanding all the nice Olympic infrastructure the EU taxpayets paid for.",gary_worden,carlton_king,https://twitter.com/gary_worden/status/966474197349404672,1519260379
"Yep looks good to me, money well spent,pic.twitter.com/KGWNU0Vd8C",adamfletcher03,"gary_worden,carlton_king",https://twitter.com/adamfletcher03/status/966587981791465472,1519287507
You don't implement the rules that already there Andrew. Other countries do it successfully.,RobFitzgerald5,afneil,https://twitter.com/RobFitzgerald5/status/966485010126704641,1519262957
Ah! The devils in the detail... those EU rules.,sandieshoes,"RobFitzgerald5,afneil",https://twitter.com/sandieshoes/status/966566409684897792,1519282364
So tell us why Belgium ejects EU nationals who can’t support themselves after three months and the U.K. doesn’t.,martin_lowe,"sandieshoes,RobFitzgerald5,afneil",https://twitter.com/martin_lowe/status/966583650677673984,1519286475
"We wouldn't though, would we? The 'people' who 'spoke' in the 2016 referendum had made up their minds that the EU was bad. They paid no attention to arguments or evidence to the contrary. Nor do they, apparently, even now.",sandypuke,afneil,https://twitter.com/sandypuke/status/966576763378786304,1519284833
I like how you type ‘people’ and ‘spoke’. So condescending. No wonder both sides still fail to get on with each other.,DaddyIbbo,"sandypuke,afneil",https://twitter.com/DaddyIbbo/status/966577729100447747,1519285063
Especially when you are so desperate to play the victim and find ‘condescension’ where there was none.,martin_lowe,"DaddyIbbo,sandypuke",https://twitter.com/martin_lowe/status/966585644129685504,1519286950
Germans never give the Brits what they ask for. . . Remember the weeks before Black Wednesday?,Eintrachtrob,afneil,https://twitter.com/Eintrachtrob/status/966454947930886144,1519255790
So now it’s Germany and Merkel calling the shots not the flatulent autocrats in Brussels - well she got that wrong re Cameron & she got her own position wrong with the voting public of Germany she’s beginning to feel like political brown bread,AcceptBrexit,afneil,https://twitter.com/AcceptBrexit/status/966486688968134657,1519263357
"Someone told me that the EU offered Cameron more concessions but he turned them down. ,#,toomucheton",davidgmwilson,afneil,https://twitter.com/davidgmwilson/status/966456572149944320,1519256177
For what reason? he came back with nothing & looked stupid,original_jaj,"davidgmwilson,afneil",https://twitter.com/original_jaj/status/966457431495708673,1519256382
"As I said, too much Eton....",davidgmwilson,"original_jaj,afneil",https://twitter.com/davidgmwilson/status/966461830620205058,1519257431
Eton Mess?,simonmount1,"davidgmwilson,original_jaj,afneil",https://twitter.com/simonmount1/status/966466272685969411,1519258490
What position does Mrs Merkel hold within the EU that it is within her power to grant such concessions?,gazcon,afneil,https://twitter.com/gazcon/status/966609723779887104,1519292691
"Compared to the might of Luxembourg...,pic.twitter.com/t8j3yYWn7H",Bronowskiite,"gazcon,afneil",https://twitter.com/Bronowskiite/status/966614295567065089,1519293781
"And there it is...the UK was (and still is, for now) subordinate to and dependent upon German chancellor political largesse, but we kind of knew that already. Nice to see it set out in such undeniably stark terms though.",Cheshire__red,afneil,https://twitter.com/Cheshire__red/status/966455366241398784,1519255889
Even Bonnie Greer thought Remain would win and she knows everything.,The13Men,afneil,https://twitter.com/The13Men/status/966454806226153474,1519255756
And WHAT consessions did & does Britain want ? ? ? From Germany? What are your issues with Germans coming to your super-special island at free will ? To work...?,tempora_magda,afneil,https://twitter.com/tempora_magda/status/966492567402635264,1519264759
"Reform from the EU rather than concessions.
Less EU rather than a United States of Europe.
No objection to any nationality coming to our super special island as long as they work with us.",sandieshoes,"tempora_magda,afneil",https://twitter.com/sandieshoes/status/966566087604269061,1519282287
"How well put Sandieshoes, the most sensible statements I’ve heard since the referendum.",goldendbrown,"sandieshoes,tempora_magda,afneil",https://twitter.com/goldendbrown/status/966569010044301312,1519282984
"In concrete you three mean WHAT, what did our ex-PM discuss with EU27 then and wasn't successful which lead to a Leave win ?",tempora_magda,"goldendbrown,sandieshoes,afneil",https://twitter.com/tempora_magda/status/966622355454820352,1519295703
"I can only speak for myself, which I did.
Referendum week Juncker made a statement, he said there would be no further concessions for UK. I think Remain lost a lot of votes then.
I’ve always been anti EU so you’re probably asking the wrong one.",sandieshoes,"tempora_magda,goldendbrown,afneil",https://twitter.com/sandieshoes/status/966624896041316352,1519296308
"Well what consessions were you, as in UK after? Be concrete.",tempora_magda,"sandieshoes,goldendbrown,afneil",https://twitter.com/tempora_magda/status/966796175465680898,1519337145
"Is that question for me?

I thought I explained, no concessions for me. I always wanted out.",sandieshoes,tempora_magda,https://twitter.com/sandieshoes/status/966796820893618176,1519337298
"The very fact that people talk about what the EU or Germany will agree to give Britain reflects the cowardly and submissive attitude of our pathetic political class.

In negotiations, you TELL the other side what YOU are prepared to accept.",FXdestination,"afneil,astro_trader",https://twitter.com/FXdestination/status/966481025055432704,1519262007
Especially if you have been told by your electors to leave. We are leaving so what's the point of us asking them for their terms on us leaving.,LucieH20,"FXdestination,afneil,astro_trader",https://twitter.com/LucieH20/status/966483428295225344,1519262580
You've been in rare form today.,AMGarvey,afneil,https://twitter.com/AMGarvey/status/966455041484820480,1519255812
"Rare form in comparison to most, maybe.  Good form I would say, as fortunately it is not that rare.  Glorious slap down of unneeded support, just at the crucial uncomfortable point.",lossadjusted,"AMGarvey,afneil",https://twitter.com/lossadjusted/status/966476062971621377,1519260824
a huge strategic mistake. Cameron and Merkel had been from my reading of the dynamic between them on policy issues very much aligned. She went MIA when Cameron was lobbying Europe. Still think Cameron has been vilified for offering the UK a vote because EU did the opposite.,CurrencyWar1,"afneil,vetrissimo",https://twitter.com/CurrencyWar1/status/966625471004725248,1519296445
My memory must be wrong. I could have sworn that Cameron met with Merkel at least once at that time.,vetrissimo,"CurrencyWar1,afneil",https://twitter.com/vetrissimo/status/966631862344015872,1519297969
She didn’t back him with the rest of the Eu and opted for migration instead,CurrencyWar1,"vetrissimo,afneil",https://twitter.com/CurrencyWar1/status/966686602335371265,1519311020
"Brextremists still believe that the EU is a zero-sum game and that ""They need us more than we need them""
But it hasn't occurred to them that many polititiams in the continent actually wanted the UK out of the EU for good ",IoiTherealnacho,afneil,https://twitter.com/IoiTherealnacho/status/966578699834482688,1519285294
We have done them a big favour then.,awayfishing,"IoiTherealnacho,afneil",https://twitter.com/awayfishing/status/966590190650318848,1519288034
"Basically yes, ,#,brexitshambles, allows the EU to press ahead with the ever closer union project and, as ,@,Jacob_Rees_Mogg, rightly points out, it will turn the UK into a vassal state with little influence. What's not to like?",IoiTherealnacho,"awayfishing,afneil",https://twitter.com/IoiTherealnacho/status/966599316931563520,1519290210
Nothing.,awayfishing,"IoiTherealnacho,afneil,Jacob_Rees_Mogg",https://twitter.com/awayfishing/status/966604085892911106,1519291347
"So long as your pension is safe and nobody starts regulating your shark fishing exploits, right? ",IoiTherealnacho,"awayfishing,afneil,Jacob_Rees_Mogg",https://twitter.com/IoiTherealnacho/status/966614028213776384,1519293717
"I don't have a pension. I work full time. If you believe what everybody writes in their bios, you're a very gullible person.",awayfishing,"IoiTherealnacho,afneil,Jacob_Rees_Mogg",https://twitter.com/awayfishing/status/966617352245833728,1519294510
"Of course, that well known Brextremist trait; misreprenting how you portray yourself in public. Forgive me for taking you at face value",IoiTherealnacho,"awayfishing,afneil,Jacob_Rees_Mogg",https://twitter.com/IoiTherealnacho/status/966622506969952256,1519295739
That's absolutely hilarious coming from somebody who doesn't even have the balls to use his or her proper name. ,awayfishing,"IoiTherealnacho,afneil,Jacob_Rees_Mogg",https://twitter.com/awayfishing/status/966629007394525184,1519297289
"Britain, the vessel state of Germany.  Anyone who reckons otherwise is deluded.",gilwernjon,afneil,https://twitter.com/gilwernjon/status/966455534865043456,1519255930
Vassal,GroveHillBoy,"gilwernjon,afneil",https://twitter.com/GroveHillBoy/status/966459171137781760,1519256796
Expect all embassy staffers to be asked who leaked that to you. She has ways of making them talk....,PaddyJManning,afneil,https://twitter.com/PaddyJManning/status/966666228969496576,1519306163
"I read this as a journalist having a row with an ambassador over his own personal opinion. 
The German ambassador is accountable to the German state, ,@,afneil, is only accountable to himself and the BBC. This is a non-story by a nobody.",kevinpbreslin,"PaddyJManning,afneil",https://twitter.com/kevinpbreslin/status/969524506296508417,1519987629
I think you rather missed the point of the original story. Deeply embarrassing for the embassy to be caught out so badly,PaddyJManning,"kevinpbreslin,afneil",https://twitter.com/PaddyJManning/status/969526692455776256,1519988151
