content,username,replyto,permalink,time
"Hey ,@,tedcruz, if you need a stand in against ,@,jimmykimmel, I know a guy,https://,twitter.com/jimmykimmel/st,atus/1004804714041507840, ,…",GraysonJAllen,,https://twitter.com/GraysonJAllen/status/1004866652650070016,1528413854
That your tripping people dirty antics self would stick up for Ted Cruz says a lot about you,robbartz,"GraysonJAllen,allahpundit",https://twitter.com/robbartz/status/1004893779780923393,1528420321
Boo this man,dltunk01,"robbartz,GraysonJAllen",https://twitter.com/dltunk01/status/1004896821636947968,1528421047
"I agree, Booo Grayson! ",robbartz,"dltunk01,GraysonJAllen",https://twitter.com/robbartz/status/1004908718029524992,1528423883
He’s looks like him who’s “standing up” for Ted Cruz? He didn’t mention any politics at all take a joke you must be real fun at parties,bigwhiteinva,"robbartz,dltunk01",https://twitter.com/bigwhiteinva/status/1004918646572048384,1528426250
"The Libs are always ready to jump in and destroy a humorous moment... No Joy Is Allowed in Leftist Land, eh Comrades?",TheBigSkadoosh,"bigwhiteinva,robbartz",https://twitter.com/TheBigSkadoosh/status/1005021423293816832,1528450754
"Who would you rather smack in the face one time, really really freaking hard:",804sugardaddy,"GraysonJAllen,tedcruz,jimmykimmel",https://twitter.com/804sugardaddy/status/1004868145805496320,1528414210
"Who would you rather smack in the face one time, really really freaking hard:",Pants287,"804sugardaddy,GraysonJAllen",https://twitter.com/Pants287/status/1004868942752514048,1528414400
"Yea, we can’t include Jimmy Kimmel on this poll. He has used up his allotted amount of times he can cry on television!",DawsonMcCurlee,"Pants287,804sugardaddy",https://twitter.com/DawsonMcCurlee/status/1004882695141326848,1528417678
Ha! I get it. Because Jimmy Kimmel cried on TV when he found out his infant son had an incredibly scary heart problem. Nice joke.,realoddthomas,"DawsonMcCurlee,Pants287",https://twitter.com/realoddthomas/status/1004885841800548353,1528418429
I appreciate it. I forgot that was the only time he cried. Just remember he only cries before he pushes a political issue. Weird how that works,DawsonMcCurlee,"realoddthomas,Pants287",https://twitter.com/DawsonMcCurlee/status/1004889257121665028,1528419243
"You’re doing great work for mother Russia, comrade",steadytrollin,"DawsonMcCurlee,realoddthomas",https://twitter.com/steadytrollin/status/1004890796242489345,1528419610
Original!,DawsonMcCurlee,"steadytrollin,realoddthomas",https://twitter.com/DawsonMcCurlee/status/1004891664404578304,1528419817
"I should throw a snowflake in here, just to keep things new and fresh.",DawsonMcCurlee,"DawsonMcCurlee,steadytrollin",https://twitter.com/DawsonMcCurlee/status/1004892601026273280,1528420040
"I'm guessing Jimmy also know ,@,KDTrey5, ,@,KingJames, and ,@,StephenCurry30,  you know, good basketball players.",PutinFluffer,"GraysonJAllen,tedcruz,jimmykimmel",https://twitter.com/PutinFluffer/status/1004882051022114817,1528417525
pic.twitter.com/ou0XNu16et,domiNATEing,"PutinFluffer,GraysonJAllen",https://twitter.com/domiNATEing/status/1004900796201398272,1528421994
"The joke is on you, thanks to ,@,tedcruz, y'all will be paying off the 20 trillion dollars in debt without getting social security.   HAHAHA  Thank you!",PutinFluffer,"domiNATEing,GraysonJAllen",https://twitter.com/PutinFluffer/status/1005032875799011328,1528453484
The joke is Grayson Allen looks like Ted Cruz.... it’s not that hard to understand ,domiNATEing,"PutinFluffer,GraysonJAllen",https://twitter.com/domiNATEing/status/1005123832368238592,1528475170
"Regardless, thank you for paying into social security and paying off the debt, us older people don't say that enough",PutinFluffer,"domiNATEing,GraysonJAllen",https://twitter.com/PutinFluffer/status/1005131266713407495,1528476943
pic.twitter.com/aU2XITaBW9,domiNATEing,"PutinFluffer,GraysonJAllen",https://twitter.com/domiNATEing/status/1005132842723102720,1528477318
Ahh the infamous tripper/cheater in basketball would support Ted Cruz ,JessRenae94,"GraysonJAllen,tedcruz,jimmykimmel",https://twitter.com/JessRenae94/status/1005082207399096322,1528465246
"It’s because they look alike! Stop reaching! It isn’t political!,pic.twitter.com/c977JfhX0c",TravisSkol,"JessRenae94,GraysonJAllen",https://twitter.com/TravisSkol/status/1005820088115716096,1528641170
"The resemblance is striking.,pic.twitter.com/IpG2JK1nUA",DanAlcorn3,"GraysonJAllen,tedcruz,jimmykimmel",https://twitter.com/DanAlcorn3/status/1005132715862167552,1528477288
"It's funny reading these comments and people saying Grayson supports him. The joke is people they say he looks like him!! Looks like him!! This was not a political tweet. Good god people. Stand in... never mind you wouldn't get it if we explained it ,#,RIPComedy",CbGoBLUE20,"GraysonJAllen,BeileinWeTrust",https://twitter.com/CbGoBLUE20/status/1005130271937753095,1528476705
Why would someone want to stand in and provide Ted Cruz a better chance at winning if they don't support them?,notnowthankyou2,"CbGoBLUE20,GraysonJAllen",https://twitter.com/notnowthankyou2/status/1010591485392310272,1529778760
"Like I said ,#,RIPComedy,. He has always been a look alike and he was playing it up. Plus he loves to ball, so he took his shot and all you political ass wads took it and ran with it. It's not always political.",CbGoBLUE20,"notnowthankyou2,GraysonJAllen",https://twitter.com/CbGoBLUE20/status/1010648632608149504,1529792385
It's kind of political when you start backing Ted Cruz. And you never actually addressed the point I made,notnowthankyou2,"CbGoBLUE20,GraysonJAllen",https://twitter.com/notnowthankyou2/status/1010664263361400832,1529796112
"Clearly your political take has blinded that there are things in this world that are FUNNY!!! Funny!!  Damn man, the kid loves to ball and they look alike and compare their looks. What part of this don't you understand man. Christ. Im done trying to explain things",CbGoBLUE20,"notnowthankyou2,GraysonJAllen",https://twitter.com/CbGoBLUE20/status/1010673906972323841,1529798411
Are you purposefully avoiding the point of the question or just not keen on comprehension?,notnowthankyou2,"CbGoBLUE20,GraysonJAllen",https://twitter.com/notnowthankyou2/status/1010674956496199685,1529798661
You asked why someone would want to stand in if they didn't support him?? There is a Joke in his tweet man. They are look a likes !!!! Look alikes you idiot! He was making a joke to stand in for him because they look alike and no one would notice! Do you get the joke now?,CbGoBLUE20,"notnowthankyou2,GraysonJAllen",https://twitter.com/CbGoBLUE20/status/1010676807127982080,1529799102
Stop making me feel things that aren't raw hatred for Duke please. K thanks,Jonathan_Packer,"GraysonJAllen,tedcruz,jimmykimmel",https://twitter.com/Jonathan_Packer/status/1004913136648978433,1528424936
"Sadly ,@,tedcruz, couldn’t even defend his wife against Donnie’s attacks, now he’s his lapdog. He has no balls, he doesn’t stand against anything. You’re not needed.",ImpeachMoronDon,"GraysonJAllen,tedcruz,jimmykimmel",https://twitter.com/ImpeachMoronDon/status/1004890243009523712,1528419478
I was disappointed when Cruz endorsed Trump but he did what he thought was best for America & it resulted in his having considerable influence on the WH towards conservative goals & doubly so on judicial appointments.,Lynn_Rose1,"ImpeachMoronDon,GraysonJAllen",https://twitter.com/Lynn_Rose1/status/1004972158379003905,1528439008
Deadddddddd ,brianna_leneave,"GraysonJAllen,tedcruz,jimmykimmel",https://twitter.com/brianna_leneave/status/1004873489906532352,1528415484
"Daaaaaaaad!,pic.twitter.com/uNNcqV4Kzp",repurposd,"brianna_leneave,GraysonJAllen",https://twitter.com/repurposd/status/1004944001374486529,1528432295
,brianna_leneave,"repurposd,GraysonJAllen",https://twitter.com/brianna_leneave/status/1005992590762762242,1528682298
oh my god of course you’re ted cruz fan,catpoopburglar,"GraysonJAllen,tedcruz,jimmykimmel",https://twitter.com/catpoopburglar/status/1004888623945166848,1528419092
pic.twitter.com/a55eHAE8Sq,aoakley33,"catpoopburglar,GraysonJAllen",https://twitter.com/aoakley33/status/1004898189789540355,1528421373
That college basketball’s cuntiest player wants to be a stand in for America’s cuntiest senator?,catpoopburglar,"aoakley33,GraysonJAllen",https://twitter.com/catpoopburglar/status/1004919943723302912,1528426559
"Joke is that they look alike.  That’s it.  Stop thinking too much into it, you look crazy.",JustHaveToSayyy,"catpoopburglar,aoakley33",https://twitter.com/JustHaveToSayyy/status/1005323062810697734,1528522670
Why’s everyone trippin’ over this?,AntDavis07Horn,"GraysonJAllen,Gabe_TFB",https://twitter.com/AntDavis07Horn/status/1004946163437592577,1528432811
LOL,ErnieMillsJr,"ZoeJane76528591,GraysonJAllen",https://twitter.com/ErnieMillsJr/status/1005018998948409344,1528450176
its always the people with no profile picture who don't understand jokes.,Indynetwork2846,"ErnieMillsJr,ZoeJane76528591",https://twitter.com/Indynetwork2846/status/1005813370648449024,1528639569
probably the Russian bots I've been hearing about.  LOL,ErnieMillsJr,"Indynetwork2846,ZoeJane76528591",https://twitter.com/ErnieMillsJr/status/1005947291835002880,1528671498
"Two assholes ,#,dukeyakubiandevils, ,@,THEKIDMERO",rockingRobby80,"GraysonJAllen,tedcruz,jimmykimmel",https://twitter.com/rockingRobby80/status/1004882765731336192,1528417695
pic.twitter.com/54UbAsAPZa,BlueDevilPharmD,"rockingRobby80,GraysonJAllen",https://twitter.com/BlueDevilPharmD/status/1004887940747747332,1528418929
pic.twitter.com/H8K30rpguh,BlueDevilPharmD,"rockingRobby80,GraysonJAllen",https://twitter.com/BlueDevilPharmD/status/1005081881199759360,1528465168
You are a Bron got that same hairline...,BlueDevilPharmD,"BlueDevilPharmD,rockingRobby80",https://twitter.com/BlueDevilPharmD/status/1005081998870958080,1528465196
You’re a fan boy for duke.,rockingRobby80,"BlueDevilPharmD,GraysonJAllen",https://twitter.com/rockingRobby80/status/1005092589534511104,1528467721
Looks like we both have excellent observational skills.,BlueDevilPharmD,"rockingRobby80,GraysonJAllen",https://twitter.com/BlueDevilPharmD/status/1005095023795458049,1528468302
No tripping is rule #1,beachwahoo,"GraysonJAllen,tedcruz,jimmykimmel",https://twitter.com/beachwahoo/status/1004888008968081411,1528418945
"@,GraysonJAllen, just went up a notch in my book",toes1983,"GraysonJAllen,benshapiro",https://twitter.com/toes1983/status/1005993307623841793,1528682469
He'd probably try to trip Kimmel and then whine and pout when someone called him out on it.,crewfanwi,"toes1983,GraysonJAllen",https://twitter.com/crewfanwi/status/1006007337344172032,1528685814
Guaranteed,toes1983,"crewfanwi,GraysonJAllen",https://twitter.com/toes1983/status/1006020959969710081,1528689062
"I’m i the only one that wants ,@,SenTedCruz, to stomp Kimmel?",GraysonDockery,"GraysonJAllen,benshapiro",https://twitter.com/GraysonDockery/status/1005849473925427200,1528648177
Also you stole my cool name.,GraysonDockery,"GraysonDockery,GraysonJAllen",https://twitter.com/GraysonDockery/status/1005849695640522753,1528648229
"So it's okay 4 the left too maKe jokes bout a wHite man lookin like a fisH, but racist for ,@,therealroseanne, to make same joke about a bLack woman? Both jokes were preTTy accurate anyways  ;p  lighTen up peps",G_Rome42,"GraysonJAllen,benshapiro",https://twitter.com/G_Rome42/status/1005827206214402049,1528642867
You should just take a little time to educate and inform yourself on history. Maybe then you’ll understand the difference.,Hafwell,"G_Rome42,GraysonJAllen",https://twitter.com/Hafwell/status/1005912461059354624,1528663194
Yeh so you just lost my respect.,Jimmyspolitics,"GraysonJAllen,tedcruz,jimmykimmel",https://twitter.com/Jimmyspolitics/status/1005803948991811584,1528637323
Because he looks like ted Cruz? Cause that was the joke.,jackranksfort,"Jimmyspolitics,GraysonJAllen",https://twitter.com/jackranksfort/status/1005819157533904899,1528640949
Got to love the hate Grayson gets and also the political idiots that can’t tell a joke and take everything so serious lol,bigwhiteinva,"GraysonJAllen,tedcruz,jimmykimmel",https://twitter.com/bigwhiteinva/status/1004919705793126400,1528426503
I’m crying,mrs_jackwhite,"GraysonJAllen,tedcruz,jimmykimmel",https://twitter.com/mrs_jackwhite/status/1004870724664819713,1528414825
"Grayson Allen subbing in for Ted Cruz,pic.twitter.com/5Z3x02mUHM",Alex__Gehm,"GraysonJAllen,tedcruz,jimmykimmel",https://twitter.com/Alex__Gehm/status/1005196049957388289,1528492388
"Grayson Allen just won the Internet, ,@,tedcruz, ,#,HereComesDuke",Reaganslaysem,"GraysonJAllen,tedcruz,jimmykimmel",https://twitter.com/Reaganslaysem/status/1004870447555637249,1528414758
,DukeAlumni,"GraysonJAllen,mattgrossman92",https://twitter.com/DukeAlumni/status/1004896412021112832,1528420949
pic.twitter.com/ZlHt8yd1h6,BecomeATexan,"GraysonJAllen,josh_hammer",https://twitter.com/BecomeATexan/status/1004892394268053504,1528419991
Some people are so simple minded. It's ok for humor every now and then.  Everyone needs to relax.,MattZoop,"GraysonJAllen,tedcruz,jimmykimmel",https://twitter.com/MattZoop/status/1005285136978579456,1528513628
Grayson Allen's Twitter is actually Ted Cruz burner account,lilbaketho,"GraysonJAllen,tedcruz,jimmykimmel",https://twitter.com/lilbaketho/status/1004972011754541056,1528438973
pic.twitter.com/P9yBvrfNiB,mr_crabbypants,"GraysonJAllen,SBSportsDiva",https://twitter.com/mr_crabbypants/status/1004924139856187393,1528427560
Yes ,Nrhooah,"GraysonJAllen,JohnnyUtah27",https://twitter.com/Nrhooah/status/1004877465188257793,1528416432
"I’m sorry, but the old ,@,GraysonJAllen, can’t come to the phone right now. Why? Oh, because he’s filling in for ,@,tedcruz, in a basketball game",taylorquery12,"GraysonJAllen,tedcruz,jimmykimmel",https://twitter.com/taylorquery12/status/1004868496860352517,1528414293
"This just made my night! , G is the best!",khemory,"GraysonJAllen,tedcruz,jimmykimmel",https://twitter.com/khemory/status/1004934071569518592,1528429928
Kimmel got almost as many gasps and boos as he did laughs.  Leftist comedians have fallen,tmshrout,"GraysonJAllen,tedcruz,jimmykimmel",https://twitter.com/tmshrout/status/1004880423141306368,1528417137
Well played. ,bcjaynes37,"GraysonJAllen,tedcruz,jimmykimmel",https://twitter.com/bcjaynes37/status/1004903118918770688,1528422548
Tweet of the day. ,beamandaniel,"GraysonJAllen,tedcruz,jimmykimmel",https://twitter.com/beamandaniel/status/1004898587648540672,1528421468
Grayson is the GOAT.,CincinnatiKid80,"GraysonJAllen,tedcruz,jimmykimmel",https://twitter.com/CincinnatiKid80/status/1004872319339257857,1528415205
wow boy you really went there ,MsRissaDan,"GraysonJAllen,tedcruz,jimmykimmel",https://twitter.com/MsRissaDan/status/1004866869197725696,1528413905
"I guess many people responding to this tweet forgot about Cruz owning Deadspin,pic.twitter.com/KzWzRhVf9c",ZBeeblebrox42nc,"GraysonJAllen,tedcruz,jimmykimmel",https://twitter.com/ZBeeblebrox42nc/status/1005090781265264640,1528467290
Grayson is the man for this!!!!!!!,jarradjames12,"GraysonJAllen,tedcruz,jimmykimmel",https://twitter.com/jarradjames12/status/1005071628005462016,1528462724
"So do I....,@,StephenCurry30",Millsap2,"GraysonJAllen,tedcruz,jimmykimmel",https://twitter.com/Millsap2/status/1004928176311734273,1528428522
"Wow, yet another reason to dislike you and all your fellow Dookies, smh...I really hope that this is a joke, and you're not really backing a clown like Cruz? ",ClarionCoachAl,"GraysonJAllen,tedcruz,jimmykimmel",https://twitter.com/ClarionCoachAl/status/1004916872335253505,1528425827
Noooooooo ,chrisalyss,"GraysonJAllen,tedcruz,jimmykimmel",https://twitter.com/chrisalyss/status/1004913245969317888,1528424962
You'd trip and fall back in your own shit.,kanel76,"GraysonJAllen,TylerJonesLive",https://twitter.com/kanel76/status/1004906087689093121,1528423256
"Gosh dang it, Grayson, don’t make me like you!",LadyLNorth,"GraysonJAllen,tedcruz,jimmykimmel",https://twitter.com/LadyLNorth/status/1004886689427357696,1528418631
This so so awesome!,ryandfloyd,"GraysonJAllen,benshapiro",https://twitter.com/ryandfloyd/status/1005884946420862976,1528656634
Hats off to your sense of humor! Nice one. And you smile a ton more than Sen Cruz! Good luck in the draft (Spurs!?),mtg1158,"GraysonJAllen,tedcruz,jimmykimmel",https://twitter.com/mtg1158/status/1005514688870969344,1528568358
Please make this happen.,SumErgoMonstro,"GraysonJAllen,BNicholsLiberty",https://twitter.com/SumErgoMonstro/status/1005259166204735488,1528507436
"Lol,pic.twitter.com/RklVcv6te9",Robostop10,"GraysonJAllen,fleoten",https://twitter.com/Robostop10/status/1005171961159446528,1528486645
Grayson kinda looks like Ted Cruz tho,jason_rea,"GraysonJAllen,tedcruz,jimmykimmel",https://twitter.com/jason_rea/status/1005171486888472577,1528486532
Go gettem Grayson!,NC_Zero,"GraysonJAllen,4ever2runval96",https://twitter.com/NC_Zero/status/1005120634551242752,1528474408
"I’d say ,@,jimmykimmel, should be excited about this “opportunity”, ,@,GraysonJAllen,, but the guy’s got kids — I’m sure he’s already used to being hit and cried to all the time.",lander,"GraysonJAllen,KennyAndCrash",https://twitter.com/lander/status/1005097283942170624,1528468840
Wish I could like this more than once,TennesseeDanny,"GraysonJAllen,senatorshoshana",https://twitter.com/TennesseeDanny/status/1005055626710585344,1528458909
pic.twitter.com/tA4yRsVFBA,JonClem310,"GraysonJAllen,tedcruz,jimmykimmel",https://twitter.com/JonClem310/status/1004987566360125441,1528442682
"@,BetoORourke, for the win, ,@,jimmykimmel, for place and ,@,Tedcruz, for nothing but show.",DonnaBe03019349,"GraysonJAllen,tedcruz,jimmykimmel",https://twitter.com/DonnaBe03019349/status/1004938501010481159,1528430984
Doo eet.,phelony_jones,"GraysonJAllen,tedcruz,jimmykimmel",https://twitter.com/phelony_jones/status/1004925787697319936,1528427953
"Texas deserves a senator who doesn't lie: ,http://www.,politifact.com/truth-o-meter/,statements/2018/jun/06/ted-cruz/dinesh-dsouza-and-rosie-odonnell-fec-violations-di/, ,…, Vote ,@,BetoORourke, in November",Hi_Yo__Silver,"GraysonJAllen,tedcruz,jimmykimmel",https://twitter.com/Hi_Yo__Silver/status/1004920097033588737,1528426596
No shit you’re a ted Cruz guy,Cee_Bus,"GraysonJAllen,tedcruz,jimmykimmel",https://twitter.com/Cee_Bus/status/1004915943472955392,1528425606
Will you trip him?,thatdudeclow,"GraysonJAllen,tedcruz,jimmykimmel",https://twitter.com/thatdudeclow/status/1004900959259119621,1528422033
Why you trippin’ dog?,mackattack80,"GraysonJAllen,peterjhasson",https://twitter.com/mackattack80/status/1004896657253728256,1528421007
"@,mrob105, ,@,WClarkRichards",Bruceski22,"GraysonJAllen,tedcruz,jimmykimmel",https://twitter.com/Bruceski22/status/1004896109439934470,1528420877
"Are you going to teach him how to trip ,@,jimmykimmel, ?",J4Years,"GraysonJAllen,tedcruz,jimmykimmel",https://twitter.com/J4Years/status/1004892173303599104,1528419938
Heck yeah Grayson beat Kimmel’s ass,cottleboy94,"GraysonJAllen,tedcruz,jimmykimmel",https://twitter.com/cottleboy94/status/1004891678493368321,1528419820
Why? You plan on tripping him during the game?,mrhortywho,"GraysonJAllen,tedcruz,jimmykimmel",https://twitter.com/mrhortywho/status/1004888390083497985,1528419036
Oh yes please!,bdr1960,"GraysonJAllen,tedcruz,jimmykimmel",https://twitter.com/bdr1960/status/1004887867586498560,1528418912
That’s effing great!  Please do this.,Tatudjt1,"GraysonJAllen,WilsonWPA",https://twitter.com/Tatudjt1/status/1004886050437849089,1528418478
"@,JHanson19",Benjakopp,"GraysonJAllen,tedcruz,jimmykimmel",https://twitter.com/Benjakopp/status/1004884093153116160,1528418012
He's tripping.  Or would be if he could get a chance to play Kimmel,myschieff,"GraysonJAllen,tedcruz,jimmykimmel",https://twitter.com/myschieff/status/1004880771079856129,1528417220
Love it!!!,BethMcKamy,"GraysonJAllen,tedcruz,jimmykimmel",https://twitter.com/BethMcKamy/status/1004869432638926850,1528414516
Would you kick him like you do black kids on the court?,doyoulikehaikus,"GraysonJAllen,SarahAnnRhoades",https://twitter.com/doyoulikehaikus/status/1005981754598010881,1528679715
Would you trip him too?,WebbChad,"GraysonJAllen,RobbieSeyler",https://twitter.com/WebbChad/status/1005976180456067073,1528678386
Are you implying that you know the Zodiac Killer?,MikeBerman26,"GraysonJAllen,tedcruz,jimmykimmel",https://twitter.com/MikeBerman26/status/1005971454146568194,1528677259
"You gonna trip him while you guys okay or something?

Literally shouldn’t be allowed to play at any level you giant D-bag...

,#,iloveidiots",fantasyland_Gus,"GraysonJAllen,KyleKashuv",https://twitter.com/fantasyland_Gus/status/1005939748173701121,1528669700
Maybe you could referee? ,onemoore,"GraysonJAllen,tedcruz,jimmykimmel",https://twitter.com/onemoore/status/1005936481721077761,1528668921
Omg yessss,SarahWilliamsTX,"GraysonJAllen,tedcruz,jimmykimmel",https://twitter.com/SarahWilliamsTX/status/1005914500271427585,1528663680
YES! ,proa24,"GraysonJAllen,KyleKashuv",https://twitter.com/proa24/status/1005911488240840704,1528662962
Lol...  lebron ain't busy... lmao,OhB1kenoB,"GraysonJAllen,KyleKashuv",https://twitter.com/OhB1kenoB/status/1005886198726975493,1528656932
"let me guess ,@,jimmykimmel,, you want Ted to be blindfolded and both hands behind his back?",emilied50,"GraysonJAllen,KyleKashuv",https://twitter.com/emilied50/status/1005883653891686401,1528656326
yazzzzzzzz,tgo_theHammeR,"GraysonJAllen,TobyTinelli",https://twitter.com/tgo_theHammeR/status/1005880418921603073,1528655554
"Ass wipe like the rest of the liptarts,pic.twitter.com/1yOucW6vdm",ronald_Reagon__,"GraysonJAllen,benshapiro",https://twitter.com/ronald_Reagon__/status/1005873846430371840,1528653987
"I'm all for it! ,#,getyourlambieron",jasonpboz,"GraysonJAllen,KyleKashuv",https://twitter.com/jasonpboz/status/1005873113337356288,1528653813
Little jimmy who???,777stryperfan1,"GraysonJAllen,KyleKashuv",https://twitter.com/777stryperfan1/status/1005870911298396161,1528653288
No tripping.,AdamNewman913,"GraysonJAllen,tedcruz,jimmykimmel",https://twitter.com/AdamNewman913/status/1005866681045082112,1528652279
pic.twitter.com/4IEBxZFmR9,gsteiner16,"GraysonJAllen,KyleKashuv",https://twitter.com/gsteiner16/status/1005866085718151169,1528652137
"When, where?",HauberBilly,"GraysonJAllen,benshapiro",https://twitter.com/HauberBilly/status/1005852017485582336,1528648783
So you can trip Jimmy?,quantizedphoton,"GraysonJAllen,benshapiro",https://twitter.com/quantizedphoton/status/1005847286910472194,1528647655
"Hey Jimbo, i noticed the audience wasn’t that impressed or you laugh-can is broken. Your just not funny. You’ll never be a Johnny Carson, Jack Parr or Jay Leno.",DonParks01,"GraysonJAllen,benshapiro",https://twitter.com/DonParks01/status/1005835441088626688,1528644831
"Jimmy Kimmel’s sub,pic.twitter.com/crmZjFCM4D",JimReynolds1313,"GraysonJAllen,benshapiro",https://twitter.com/JimReynolds1313/status/1005833131834925056,1528644280
This douche canoe used to be funny. Now only insults,ddknudson,"GraysonJAllen,benshapiro",https://twitter.com/ddknudson/status/1005831793226813440,1528643961
You’re just the guy to trip him up,plewis1956,"GraysonJAllen,SethAMandel",https://twitter.com/plewis1956/status/1005831010280407040,1528643774
Awesome,Maupsh,"GraysonJAllen,benshapiro",https://twitter.com/Maupsh/status/1005827218923114496,1528642871
Grayson I swear to god if you trip Jimmy Kimmel I will lose the two shreds of respect I have for you,ricamende,"GraysonJAllen,benshapiro",https://twitter.com/ricamende/status/1005821473909608448,1528641501
I’d like to see Ted give him a permanent harelip with a hard elbow under the net.,tgrdn64,"GraysonJAllen,benshapiro",https://twitter.com/tgrdn64/status/1005817523693084672,1528640559
"What, are you gonna trip him?",realfondue,"GraysonJAllen,benshapiro",https://twitter.com/realfondue/status/1005817110038286337,1528640460
Jimmie ain't crap,eddie9691,"GraysonJAllen,benshapiro",https://twitter.com/eddie9691/status/1005815484581908481,1528640073
Jimmy Kimmel is an irrelevant ignoramus that rejoices inour country’s failings. We don’t need or want trators like him. His show will never grace my tv screen again.,CaptainBString,"GraysonJAllen,benshapiro",https://twitter.com/CaptainBString/status/1005813400088309772,1528639576
Why?  Are you planning on tripping Jimmy Kimmel too?,tdnx42,"GraysonJAllen,SethAMandel",https://twitter.com/tdnx42/status/1005813103001591808,1528639505
"2 on 2. ,@,GraysonJAllen, & ,@,tedcruz, vs ,@,jimmykimmel, & ,@,davidhogg111",sasncsheri,"GraysonJAllen,SethAMandel",https://twitter.com/sasncsheri/status/1005807111467565056,1528638077
"You the man Grayson, love it. All world tweet!",ChadRJones12,"GraysonJAllen,tedcruz,jimmykimmel",https://twitter.com/ChadRJones12/status/1005678160933863424,1528607332
"A Duke basketball player AND a Republican?

Christian Laettner:,pic.twitter.com/IhaannbpiF",BrutallyRandom,"GraysonJAllen,tedcruz,jimmykimmel",https://twitter.com/BrutallyRandom/status/1005630511128154112,1528595972
"@,MaggHann",MattZoop,"GraysonJAllen,tedcruz,jimmykimmel",https://twitter.com/MattZoop/status/1005284694315892737,1528513523
,livonista,"GraysonJAllen,tedcruz,jimmykimmel",https://twitter.com/livonista/status/1005227533690957826,1528499894
"@,TragikAllDay",stopatyellow,"GraysonJAllen,josh_hammer",https://twitter.com/stopatyellow/status/1005206362052349953,1528494847
"Of course he needs a stand in, but that wouldn’t really be fair. The Kimmel will get one so on n so on.",angelharthun,"GraysonJAllen,tedcruz,jimmykimmel",https://twitter.com/angelharthun/status/1005179706726080512,1528488492
DGAF Grayson is the best Grayson.,tarakraft,"GraysonJAllen,tedcruz,jimmykimmel",https://twitter.com/tarakraft/status/1005137046732541952,1528478321
