content,username,replyto,permalink,time
There are a lot of pronouns in this tweet that makes it unclear,insomniac2017,cnnbrk,https://twitter.com/insomniac2017/status/980221799244935168,1522538063
Sad,mangaranon921,cnnbrk,https://twitter.com/mangaranon921/status/980221489344602112,1522537989
Only in Merica can a guy with a student visa buy guns,guymandude1,cnnbrk,https://twitter.com/guymandude1/status/980219945077239808,1522537621
Well good isnt that what the children want,carni_joe,cnnbrk,https://twitter.com/carni_joe/status/980219822192685056,1522537591
Oh the system worked? Darn?,loricox1971,cnnbrk,https://twitter.com/loricox1971/status/980219432634109954,1522537498
How the hell was this guy able to buy a gun in the first place,guymandude1,cnnbrk,https://twitter.com/guymandude1/status/980219413382115328,1522537494
Cnn do your research before you go to print. That is why you produce FAKE NEWS,spatel16333289,cnnbrk,https://twitter.com/spatel16333289/status/980218166390423552,1522537197
hysteria is dangerous.,offupinthere,cnnbrk,https://twitter.com/offupinthere/status/980217611983101952,1522537064
Better safe than super sorry. Buh-bye Sun,janettismyname,cnnbrk,https://twitter.com/janettismyname/status/980216938675785728,1522536904
"Peace , Life ",MasudpParvez,cnnbrk,https://twitter.com/MasudpParvez/status/980216740553555972,1522536857
YEAH!!!!!!!!!!!!!!!!!!!!!!!!!!!!!!!!!!!!!!!!!!!!!!!!!!!!!!! ....AND THERE'S A PROBLEM WITH WHAT????? LEAVE IT TO FAKE NEWS CNN TO MAKE THIS GUY SOUND SYMPATHETIC.,DanConzemius,cnnbrk,https://twitter.com/DanConzemius/status/980216677265747968,1522536842
"Was it HE who bought the guns? If so, wtf? Why???",katstj,cnnbrk,https://twitter.com/katstj/status/980216470050394112,1522536792
"You gotta be legal to be here. Plain and simple.,pic.twitter.com/HsX6cHRAFd",luckystars00,cnnbrk,https://twitter.com/luckystars00/status/980215214984581130,1522536493
Sometimes the system works.,nebo314,cnnbrk,https://twitter.com/nebo314/status/980214706387505154,1522536372
Sounds good!,DanielCMarvin1,cnnbrk,https://twitter.com/DanielCMarvin1/status/980214645238583296,1522536357
Uhhh! What Wall did he....oh! Uh?,WillieRWilliam1,cnnbrk,https://twitter.com/WillieRWilliam1/status/980213721497788417,1522536137
Terrible,Chybuddys,cnnbrk,https://twitter.com/Chybuddys/status/980213567336210434,1522536100
See ya .. don’t let the door hit ya in the ass on the way out .,heelz972,cnnbrk,https://twitter.com/heelz972/status/980212766379257857,1522535909
"He who? The alarmed roommate bought two guns or the one with the alarming non-threatening behavior? ,#,journalismisgonetohell",average_joester,cnnbrk,https://twitter.com/average_joester/status/980211999673081857,1522535726
"Wait, how does a inteenational@student buy a rifle?",KennethJack14,cnnbrk,https://twitter.com/KennethJack14/status/980211991221501952,1522535724
"Do not question the police they are very correct, please award the room mate.",UdayaKumarShet5,cnnbrk,https://twitter.com/UdayaKumarShet5/status/980211574961995776,1522535625
Bye bye.,MikeDiAngelis,cnnbrk,https://twitter.com/MikeDiAngelis/status/980211171822366721,1522535529
Your twitter writing skills is beautiful. So why did he buy two rifles and the other guy got deported?,PotatoSauc3,cnnbrk,https://twitter.com/PotatoSauc3/status/980211053350064129,1522535501
"An ""international"" student? Is that like an international man of mystery?",SemanticFanatic,cnnbrk,https://twitter.com/SemanticFanatic/status/980210925306249217,1522535470
"Ah yes, Asian Racist, the last condoned racist.",JrSpackler,cnnbrk,https://twitter.com/JrSpackler/status/980210673291587584,1522535410
pic.twitter.com/wej8vXjNGv,jtkola,cnnbrk,https://twitter.com/jtkola/status/980209148548800512,1522535047
Good,merharj,cnnbrk,https://twitter.com/merharj/status/980208913986580480,1522534991
"#,fakenews, ,#,cnn, ,#,cnnfakenews, ,#,brianstelter, ,#,brianstelterlies, ,#,cnnlies, ,#,millennials, ,#,democrats, ,#,liberals, ,#,neverhillary, ,#,studentsstandup, ,#,stonemandouglas, ,#,neveragain, ,#,guncontrol, ,#,parklandstudents, ,#,parkland, ,#,nra, ,#,guncontrol, ,#,libtardlogic, ,#,davidhogg, ,#,makeamericagreatagain, ,#,maga, ,#,USA,pic.twitter.com/ek5dSTLGLd",JoePatriotUSA,cnnbrk,https://twitter.com/JoePatriotUSA/status/980208352171970560,1522534857
He'll probably play the Race Card in order to get out of trouble like everyone else does.,Twidder_Rob,cnnbrk,https://twitter.com/Twidder_Rob/status/980208110538080257,1522534799
"That show how easy anybody can purchases high power assault rifles like AR-15 without even leaving his or her room,,you dont need to arm teachers but get the F universal check in place,those on the NRA's payroll GOP  lawmakers need to be kicked out of house& Senate.",PalangJay,cnnbrk,https://twitter.com/PalangJay/status/980206750782562305,1522534475
"See something, say something.",Dblgg5,cnnbrk,https://twitter.com/Dblgg5/status/980206270345920513,1522534360
Can foreigners buy guns in this country legally?,Coffeecurd,cnnbrk,https://twitter.com/Coffeecurd/status/980205950316539905,1522534284
Good!,italian_mn,cnnbrk,https://twitter.com/italian_mn/status/980205830409736193,1522534255
"It might not be correct to look into these events on a individual basis. The comprehensive way to view these incidences would be: persons who are bilingual & one of their languages is a feudal language, there are much more non-tangible issues at work. ,https://,archive.org/details/March_,20131012, ,…",STFScho,cnnbrk,https://twitter.com/STFScho/status/980205441366945792,1522534163
Really great news.   Get em home.,dillon_bill,cnnbrk,https://twitter.com/dillon_bill/status/980204970711633920,1522534051
"There’s your gun control, CNN.  Reap what you sow.",DurkaRippy,cnnbrk,https://twitter.com/DurkaRippy/status/980204390354182144,1522533912
"What, now 2nd Ammendment also applies to non-citizens?",YusufElVikingo,cnnbrk,https://twitter.com/YusufElVikingo/status/980204320502288384,1522533895
Goodbye.,DurkaRippy,cnnbrk,https://twitter.com/DurkaRippy/status/980204246716035072,1522533878
Good,david_j_martino,cnnbrk,https://twitter.com/david_j_martino/status/980203875205570561,1522533789
pic.twitter.com/n3ePuyOH1l,LupercioRF,cnnbrk,https://twitter.com/LupercioRF/status/980203609815097344,1522533726
pic.twitter.com/wF5MvlfoyM,LupercioRF,cnnbrk,https://twitter.com/LupercioRF/status/980203581423759360,1522533719
"What about that White Male in Austin? He killed people, shut down a major city..,pic.twitter.com/Hc8W1DbiTT",LupercioRF,cnnbrk,https://twitter.com/LupercioRF/status/980203417430761472,1522533680
Can’t tell If CNN is crying that this kid was done dirty... CNN can shove it sideways.,Chernobolsbie84,cnnbrk,https://twitter.com/Chernobolsbie84/status/980203369846530051,1522533669
"****Congresswoman who kept on top aide after learning of abuse allegations not resigning.***

,#,ILUMINATI, is real..we knew it. ,#,MKUltra, ,#,wheresTonyP,
If thats not disgraceful enough ,#,evilibs, won't ,#,standwither,
Patriots will protect our women and children.,#,MeToo,pic.twitter.com/InqVnqCrES",WIZARDNECK2112,cnnbrk,https://twitter.com/WIZARDNECK2112/status/980202010027769856,1522533345
"Really not surprised.  He's not a ""White Man w/Guns"".",pon1ponder1,cnnbrk,https://twitter.com/pon1ponder1/status/980201966780469248,1522533334
"YES YES YES. IF YOU SEE SOMETHING, SAY SOMETHING IMMEDIATELY!!",GR_4lyfe,cnnbrk,https://twitter.com/GR_4lyfe/status/980201753168830464,1522533283
"See you later, All are safe",theRandyPaulin,cnnbrk,https://twitter.com/theRandyPaulin/status/980201618925907969,1522533251
pic.twitter.com/9RZCrMSXpl,jlink_79,cnnbrk,https://twitter.com/jlink_79/status/980201422632443904,1522533205
"Can this please be splashed all over the news?

Or does this not follow your narrative of “only thing we can do is gun control”",andrew_goeckel,cnnbrk,https://twitter.com/andrew_goeckel/status/980201372447641600,1522533193
why is this breaking news,lucasmzanella,cnnbrk,https://twitter.com/lucasmzanella/status/980201236740878336,1522533160
they said  a person in DISTRESS with a high powered rifle can’t go unnoticed! So how did the guy that shot up the church go unnoticed now we will remember this the next time a white boy shoot up a school this year.,LaKetriaBrown,cnnbrk,https://twitter.com/LaKetriaBrown/status/980201208668442626,1522533154
"Great, throw his ass out ",WontGetFooled1,cnnbrk,https://twitter.com/WontGetFooled1/status/980200647713804290,1522533020
Good!  I agree that the system worked as intended in this case.,dgPickles,cnnbrk,https://twitter.com/dgPickles/status/980200468344291328,1522532977
Who bought the rifles??? The roommate? This is third grade grammar.,MomBookseller,cnnbrk,https://twitter.com/MomBookseller/status/980200392783990784,1522532959
Better safe than sorry.,fp1670,cnnbrk,https://twitter.com/fp1670/status/980200214492516352,1522532917
Good,DancemumSwiftie,cnnbrk,https://twitter.com/DancemumSwiftie/status/980200138844098560,1522532898
This is so wrong!!,TheresaKeating2,cnnbrk,https://twitter.com/TheresaKeating2/status/980200066840276992,1522532881
"Thank you ,@,NeverAgainMSD, ,#,MSDStrong",DyMSP,cnnbrk,https://twitter.com/DyMSP/status/980199936917737472,1522532850
"They have enforced the immigration laws?
What a scandal. ;)",TillBenz,cnnbrk,https://twitter.com/TillBenz/status/980199825772830720,1522532824
"His behavior?
  Was he running down a hallway screaming that his mother was a hamster and his father smells of elderberries?",chuckvant58,cnnbrk,https://twitter.com/chuckvant58/status/980199241573429248,1522532685
Good do your job law enforcement.,MpM46343799,cnnbrk,https://twitter.com/MpM46343799/status/980199233721634817,1522532683
"White guy makes several threats and police are informed... they do nothing.  
Asian dude makes no threats...gets deported.",mattliebau,cnnbrk,https://twitter.com/mattliebau/status/980199205724663809,1522532676
"How come this "" unrelated visa issue"" did not come up until the roommate got alarmed for something???",PalangJay,cnnbrk,https://twitter.com/PalangJay/status/980198826056196096,1522532586
"https://,twitter.com/nedimsener2010,/status/979593860518219776?s=19, ,…",devam00_01,cnnbrk,https://twitter.com/devam00_01/status/980198592425136128,1522532530
So why is this news?,ScottyXCANCER,cnnbrk,https://twitter.com/ScottyXCANCER/status/980198497629671438,1522532507
"See something, Say something! ",adevlin30,cnnbrk,https://twitter.com/adevlin30/status/980198277474856966,1522532455
Depends on what their concerns are and how serious the threat was...,GabrielBass03,cnnbrk,https://twitter.com/GabrielBass03/status/980198079793188865,1522532408
"He bought two rifles, but we don't need stricter gun laws.....",BillyJenkins,cnnbrk,https://twitter.com/BillyJenkins/status/980198075917590529,1522532407
"It's simple! No civilian shall own any form of firearm(s) 
Protection you say? How about using your limbs for protecting yourself? People scared to fist fight these days",JCTheMetalHead,cnnbrk,https://twitter.com/JCTheMetalHead/status/980197926344409091,1522532371
"FOR IMMEDIATE RELEASE DOJ
Thursday, March 29, 2018
Hancock County man admits to child pornography charge
WHEELING, WEST VIRGINIA – Michael Dziatkowicz, of Weirton, West Virginia, admitted today to possessing child pornography, United States Attorney Bill Powell announced.,pic.twitter.com/pRajGRKi3a",WIZARDNECK2112,cnnbrk,https://twitter.com/WIZARDNECK2112/status/980197657124614144,1522532307
