content,username,replyto,permalink,time
"They'll gladly suffer to the death...that's truly ridiculous. I'd understand saying this about a friend or a family member. But to think that way for a complete stranger who has no real vested interest in whether you live or die ..

Trumpism is a mental disorder",threepeaksexp,TeaPainUSA,https://twitter.com/threepeaksexp/status/1024096523754393604,1532998612
I hope every one of them loses their farms.,TrueBlue2018,TeaPainUSA,https://twitter.com/TrueBlue2018/status/1024095636860350464,1532998401
pic.twitter.com/T0wKkhkzCC,jennifer_peed_,TeaPainUSA,https://twitter.com/jennifer_peed_/status/1024095322040152065,1532998326
Made me think of the Jim Jones cultist who gladly sold their homes and left their jobs to follow him to Jonestown for some warm Kool-Aid.,RealTwitish,TeaPainUSA,https://twitter.com/RealTwitish/status/1024094911967031302,1532998228
"Well, they’ll have their pride. Earthly belongings, not so much",deepst8ftw,TeaPainUSA,https://twitter.com/deepst8ftw/status/1024094389973512197,1532998103
"The racist are all in on Trump's Make America White Again agenda. MAGA ,pic.twitter.com/p80cxCoxHM",DatBandWagon,TeaPainUSA,https://twitter.com/DatBandWagon/status/1024093779442196485,1532997958
Good. F ‘em if they are that god damn stupid.,must_resist,TeaPainUSA,https://twitter.com/must_resist/status/1024093400126054400,1532997867
Colluding with the Russians to hack the elections and own the libs.,SeaQuestMDR,TeaPainUSA,https://twitter.com/SeaQuestMDR/status/1024093372728786945,1532997861
They fully deserve ruination.,Cynethryth5,TeaPainUSA,https://twitter.com/Cynethryth5/status/1024092764596666369,1532997716
"Now there's the first welfare queen....I mean farmer for Trump that should be subjected to drug testing.,https://www.,youtube.com/watch?v=T7Orqk,KzMII, ,…",tinyfingresist,TeaPainUSA,https://twitter.com/tinyfingresist/status/1024092617930203137,1532997681
How does one “suffer to the death” while banking a generous subsidy?,pnelson207,"TeaPainUSA,BrianPaulStuart",https://twitter.com/pnelson207/status/1024260330178793472,1533037667
"I saw a news segment prior to the government assistance that was just given to these guys; they were singing a completely different tune. Now that trump bribed them w/ taxpayer $$ they’re talking tough about “fighting to the death.”,pic.twitter.com/Jr8iHPiTnP",Henderson31Tara,"TeaPainUSA,Geurtie",https://twitter.com/Henderson31Tara/status/1024191136351444992,1533021170
"As usual, Republicans cause the problem, and the rest of us pick up the tab. Fu$k Trump voters.",SonicNationSTL,"TeaPainUSA,RealTwitish",https://twitter.com/SonicNationSTL/status/1024138716275728385,1533008672
Well at least there will be fewer of them to contend with.,TracyCoon3,TeaPainUSA,https://twitter.com/TracyCoon3/status/1024138108231708672,1533008527
Nobody wants their GMO soybeans anyway. It’s a tragedy really,ResistorUSA,TeaPainUSA,https://twitter.com/ResistorUSA/status/1024135943282937857,1533008011
One more example of how these people work against their own best interest. Sheesh.,StephanieEric17,TeaPainUSA,https://twitter.com/StephanieEric17/status/1024135547965456384,1533007916
Let them.,JohnPansini,"TeaPainUSA,InDecades",https://twitter.com/JohnPansini/status/1024133646939111424,1533007463
Their old Racist White Men too stubborn or ignorant that this country is brown and will always be shades of beautiful color. They hated Obama and then Hillary. Trump is their last great white hope and they can all suffer together. Buh bye,mssenator,TeaPainUSA,https://twitter.com/mssenator/status/1024128804183334914,1533006308
Pretty much same mentality of farmers diring the Dustbowl era. And that turned out so well for them. You’d think Ag schools would make that history lesson mandatory,Kingwoman,TeaPainUSA,https://twitter.com/Kingwoman/status/1024127530868137986,1533006005
"Deplorable? It’s Worse. These kind of people are unthinking cult followers. Trump is their Jim Jones. If he asked them to sacrifice their kids, they would. They care nothing for the Constitution, law, human rights. America cannot be held hostage by these ,#,Trumpuppets,
Expel them.",EricJGreenberg1,"TeaPainUSA,dialogician",https://twitter.com/EricJGreenberg1/status/1024125589886783489,1533005542
When do they realize that Trump has screwed them and is now placating them with 12Billion.,yaldi00,TeaPainUSA,https://twitter.com/yaldi00/status/1024118104299720704,1533003757
Let the sufferin’ commence. When these idiots are done self flagellating maybe they can get back to their day jobs of growing shit.,ArtCFartsy,"TeaPainUSA,QAEngnrg",https://twitter.com/ArtCFartsy/status/1024118074906214401,1533003750
"Trump,pic.twitter.com/1bctJai1FA",baalat1,TeaPainUSA,https://twitter.com/baalat1/status/1024115099085287424,1533003041
Good luck with that.  The rip tide will take them.  In the meantime the rest of us will be riding that Blue wave.,MissWendy39,TeaPainUSA,https://twitter.com/MissWendy39/status/1024111399973384192,1533002159
I’ll be sorry to see them lose everything just to own me.  Such a shame.,LisaSwarm,TeaPainUSA,https://twitter.com/LisaSwarm/status/1024110261957943296,1533001888
"Well ok, if they insist.",NoraAmmirati,TeaPainUSA,https://twitter.com/NoraAmmirati/status/1024109461517033472,1533001697
"@,Newsweek, As a small family farmer, its utterly inconceivable to me. It's a cult. These folks are completely unreachable ,#,Cult45",JennySampson16,TeaPainUSA,https://twitter.com/JennySampson16/status/1024107998766161920,1533001348
Idiots,WayneSlaven1,TeaPainUSA,https://twitter.com/WayneSlaven1/status/1024106128962187264,1533000902
I didn't know 'owning' my emotions was so waluable.  Good to know.,Lololupus,TeaPainUSA,https://twitter.com/Lololupus/status/1024101846644916227,1532999881
I'm OK with that.,patterpat4,TeaPainUSA,https://twitter.com/patterpat4/status/1024100370065371136,1532999529
F*cking idiots! Let them go down w/the Trumptanic. ,simplysous,TeaPainUSA,https://twitter.com/simplysous/status/1024098762522800128,1532999146
Trump is nothing if not accommodating.,DamnitJasonRoy,"TeaPainUSA,glwoods3377",https://twitter.com/DamnitJasonRoy/status/1024098584654950400,1532999104
Omg. Stooooopid.,Allen11Cynthia,TeaPainUSA,https://twitter.com/Allen11Cynthia/status/1024098409979039745,1532999062
"Good for them, I don’t care , do you?",Resistance65,TeaPainUSA,https://twitter.com/Resistance65/status/1024096913057112064,1532998705
Something Darwinian about it,nowell_ben,"TeaPainUSA,MsMariaT",https://twitter.com/nowell_ben/status/1024095393741766657,1532998343
I would like to know how many farmers actually turn down the money. These are merely words.,politicallynuts,TeaPainUSA,https://twitter.com/politicallynuts/status/1024095110458429440,1532998275
Be careful what you wish for.,lominska,TeaPainUSA,https://twitter.com/lominska/status/1024094233471270912,1532998066
"It’s interesting. I grew up in corn and soy bean farming region and none of them believe this. Sure, there’s likely some. But collectively, we’ve seen a lot of SE Hoosiers vastly disappointed (not enough to vote Dem I’m betting)",Momathree,TeaPainUSA,https://twitter.com/Momathree/status/1024093802913509376,1532997964
They will be doing it it to themselves so good luck with that guys.,JessieFlagg1,TeaPainUSA,https://twitter.com/JessieFlagg1/status/1024093562449870848,1532997906
"like a cult, they have stockholm sydrome",Lumiere_Pacific,TeaPainUSA,https://twitter.com/Lumiere_Pacific/status/1024093089944690689,1532997794
"Good for them, less Trump supporters once they're gone! ",emmaline1221,TeaPainUSA,https://twitter.com/emmaline1221/status/1024092473738579968,1532997647
WHY???,everyhumanknows,TeaPainUSA,https://twitter.com/everyhumanknows/status/1024092337025179648,1532997614
Talking tough is easy when you just found out Trump is giving out $12 billion in farm welfare to pay the bills while he fights his trade war.,MeUnloveable,TeaPainUSA,https://twitter.com/MeUnloveable/status/1024818637830541312,1533170778
